appid,title,contents,date,tags
2807960,"Battlefield 6 Season 1 Free Trial - Details, Tips & Tricks","Experience the Best Selling Shooter of 2025 during the Battlefield 6 Season 1 Free Trial, scheduled to be available from November 25 at 4 a.m. PT (12 p.m. UTC) to December 2 at 4 a.m. PT (12 p.m. UTC)*.This Free Trial includes three playlists, including a casual Multiplayer experience, across three maps, including the two most recently released maps Eastwood and Blackwell Fields. To access the Free Trial, simply download the free-to-play Battlefield: REDSEC experience on your preferred gaming platform. If you already play REDSEC, all your progress - Career Rank, Hardware Unlocks and Levels, Customization items, etc. - carries over to this Free Trial. All that progress also carries over to the full Battlefield 6 experience upon purchase; this Free Trial is your opportunity to try before you buy and keep everything you earn when it’s over.If you already own Battlefield 6, now is the time to convince those friends who haven’t experienced Battlefield to squad up during the long weekend.Here’s everything the Free Trial has to offer, including some tips & tricks to ensure you’re on the winning team:Initiation Breakthrough - An Introduction to Battlefield 6Held on Siege of Cairo, this playlist is a recommended entry point for those new to the Battlefield franchise, or who want a slightly more casual experience against both players and Bots.Initiation Breakthrough is a 48 player and Bot Multiplayer experience where teams go head-to-head in an intense frontline battle.One team of players and Bots are the Attackers, while the other team are the Defenders. The Attackers must capture objectives in a Combat Zone sector before they run out of lives. Whenever the Attackers capture all objectives in a sector, the battle moves to a new sector up until they reach the final sector at the Defender’s true headquarters. The game ends when the Attackers claim victory by capturing all sectors or when the Defenders reduce Attacker lives to zero (and winning the game).To secure a sector, Attackers must control all of the Defenders’ owned objectives at the same time. An objective is a small area labelled on the map with a letter (A or B); standing in - or sitting in a vehicle within - the zone fills up a progress meter which, when full, claims the objective for a team. Initiation Breakthrough, like Initiation Battle Royale in REDSEC, is a great way to familiarize yourself with online Battlefield Multiplayer. While the Firing Range (available via the Loadouts section of the main menu) is great for testing weapons against targets, Initiation Breakthrough can be a great warm-up for learning your Class benefits - passive abilities and Gadgets, for example - and how your weapons fare in actual engagements. Don’t worry about wins and losses here; Initiation is for learning purposes and rallying the squad together before venturing into other Multiplayer playlists.With that in mind, here are five tips specific to the Breakthrough mode for those focused on winning:Five Tips for Initiation BreakthroughTHE MORE THE MERRIER. The more teammates are on an objective, the faster its progress meter fills. Work with your squad - and across the entire team - to collectively capture objectives to advance (as an Attacker) or deny progress (as a Defender).IT’S BEST TO CONTEST. When both teams are on an objective, progress stalls. Especially as a defender, be a nuisance and attempt to remain on objectives as long as possible until they are under your team’s control.ON DEFENSE? HOLD A UNITED FRONT. The Defending team wins Breakthrough by creating an unbreakable, undivided line of defense that the Attackers cannot advance through to get to objectives. Using environmental cover pieces, suppressing fire, and clear communication, work together with fellow Defenders to quickly reduce Attacker lives before they can make significant objective progress.ON ATTACK? FIND A WEAKNESS, GET CREATIVE. Attackers succeed by finding holes in the enemy’s defense. Perhaps a flank route is uncovered, or all defenders are focused on a single objective when two are available. Learn the map, then use Gadgets and Vehicles to find new paths to victory: a wall or building between objectives can be gone over with an Assault Ladder or toppled with sledgehammers and rocket launchers, a Recon Drone can scout ahead and explode enemy mines, or sometimes, the best offense is an army of defibrillator-wielding Supports bringing back reinforcements every few seconds. OVERTIME MEANS IT AIN’T’ OVER TIL’ IT’S OVER. So long as progress is being made on a zone, Attackers can still advance to the next sector - or win - even when all their lives are expired. Don’t give up until the last zone is captured or the last Attacker is off an objective!Team Tactical Modes Infused with Battlefield DNA - Sabotage and Team DeathmatchFeel more familiar with smaller, team tactical modes? Then this Free Trial has Team Deathmatch and Sabotage, a new limited-time mode with the California Resistance update, to show wha...",1764001558,
2807960,"""Это катастрофа"": Call of Duty: Black Ops 7 стартовала в Европе сильно хуже Battlefield 6","Подоспели первые региональные данные о продажах<strong> Call of Duty: Black Ops 7 </strong> — в Европе новый шутер <strong>Activision</strong> <strong>стартовал на 66% хуже Battlefield 6</strong> . Точные цифры не раскрываются, но главный редактор <strong>The Game Business Кристофер Дринг</strong> назвал их ""<strong>катастрофическими</strong>"" по меркам знаменитой серии. При подсчёте учитывались данные на дисках и во всех цифровых магазинах. ",1763780100,
2807960,Battlefield 6,"Lock and load, Soldier. Get up to 15% off Battlefield 6 Standard and Phantom Edition. Plus, from Nov 25 - Dec 2, ultimate all-out warfare is free for everyone during our Battlefield 6 Free Trial.Fight in intense urban combat on the streets of Cairo. Drop into iconic SoCal landscapes turned into battlegrounds on Eastwood and Blackwell Fields. Enter Battlefield’s iconic massive scale war in Conquest or Breakthrough, or go head-to-head destroying enemy cargo in Sabotage. Download Battlefield REDSEC to access the Free Trial, squad up, and make an unforgettable Only in Battlefield moment.Requires Battlefield REDSEC on applicable platform (available separately) and all game updates. Limited time free trial. Trial time is subject to change. Internet connection, EA account, acceptance of EA User Agreement (terms.ea.com) and Privacy & Cookie Policy (privacy.ea.com) required to play. Trial can be played once per EA account.Offers may vary or change. See retailer for details.",1763734793,
2807960,Battlefield 6 may have actually done it: beaten Call of Duty,"If you’ve been paying any attention to the shooter market these past few months, you won’t be surprised to learn that <a href=""https://www.vg247.com/games/battlefield-2025"">Battlefield 6</a> has been an unprecedented success for EA, and the <a href=""https://www.vg247.com/video-game-franchises/battlefield"">Battlefield</a> series as a whole. <a href=""https://www.vg247.com/battlefield-6-us-game-launch-sales-record-circana"">Read more</a> ",1763715968,
2807960,"Circana: Battlefield 6 — самая успешная игра 2025 года, Ghost of Yotei хорошо держится, Nintendo Switch 2 — консоль номер один",<strong>Battlefield 6</strong> дебютировала 10 октября и уже <strong>по итогам первого месяца стала самой успешной игрой всего 2025 года на рынке США</strong> . Об этом говорится в октябрьском отчёте аналитического агентства <strong>Circana</strong>. Учитывались продажи на физических носителях и в цифровом формате. ,1763679840,
2807960,Introducing Competitive Battlefield REDSEC: Elite Series and Open Series,"The greatest Battlefield moments happen when squads are pushed to their limits – when the path to victory demands ingenuity, teamplay, and gunplay. We want to create and support an ecosystem that champions unforgettable squad gameplay, one that empowers players to push the limits of what a squad can do. When we showcase the greatest players in our franchise, we want that action to be as intense - and fun - for them to play as it is exciting for our community to watch. Our journey to providing a better competitive Battlefield environment, in partnership with our community, starts with today’s announcement:The Battlefield REDSEC Elite Series, launching on Wednesday, December 10, 2025.Designed to introduce more competitive play to the franchise while also giving our community a new way to rise through the ranks, the Elite Series is the premiere destination of Battlefield competition, showcasing the absolute best competitive Battlefield REDSEC has to offer on the global stage through Battle Royale and Gauntlet.Competitive Battlefield shouldn’t just be for professional players: we want it to be open to everyone. Alongside our Elite Series, we are also proud to announce our Open Series as the official REDSEC community competition, which begins on Friday, December 12, 2025.The Open Series gives players of all skill levels the opportunity to compete; it’s your squad’s chance to hone and showcase your skills. With the right amount of practice and dedication in the Open Series, your squad can advance to the Elite Series to battle with the best in the world.All competitions will take place in a cross-platform and cross-input environment - whether you play on controller or mouse & keyboard, PC or console, we are calling all players to prove themselves in both the REDSEC Elite and Open Series.Both the Elite and Open Series are our first steps into an official competitive experience for Battlefield, and we plan on collaborating with the community to develop future competitions in our core Multiplayer modes.Ahead of the first competition days on December 10 and 12, here’s what you need to know about the Elite Series and Open Series for Battlefield REDSEC, with more details to follow closer to the first competition dates in December:REDSEC Elite Series - Format and How to WatchThe Elite Series is a weekly series of competitive cash cups split across three regions - The Americas, Europe / Middle East / Africa (EMEA) and Asia-Pacific (APAC) - and features over $1 million USD in prize money during its first season from December 10 to January 18.For this inaugural REDSEC Elite Series, we’re inviting 50 team captains from each region to handpick their dream squad of 4. These 600 total competitors not only represent the best Battlefield players in our community, but also the top FPS talent in the world. Each region’s 50 squads will compete in a unique competitive format: A series of six REDSEC Battle Royale matches, culminating in the top eight squads fighting head-to-head in a final showdown in the cutthroat, knockout-style elimination mode known as Gauntlet. This format is repeated over three Qualifying Match Days, with squads earning Elite Series Points for their performance. Compared to a regular, non-Elite Series Gauntlet that can be played in REDSEC, the competitive version of Gauntlet hones in on specific map and mode combinations, along with an extended round timer. Over time, we look forward to community feedback on how we can continue iterating on Gauntlet to create the most competitive experience possible.After three Qualifying Match Days, the top-25 squads with the most Elite Series Points will advance to the regional Season Finals.All competitions will be held online. Elite Series Qualifying Match Days will be streamed by all competitors, with Battlefield Studios hosting the Season Finals broadcast for each region.To ensure both entertainment and competitive integrity, we pre-vetted all 150 team captains for compliance, and will run all Elite Series competitions on official high-performance game servers in strategically placed data centers protected by our Javelin anti-cheat system.The Season 1 Prize Pool features over $1 million USD across all three regional finals, as well as tens of thousands of dollars for the top four teams of each match across all three Qualifying Match Days and the Season Finals.Specifically, the Americas region will have a $50,000 USD prize pool for each Qualifying Match Day, as well as a $500,000 USD prize pool split across all participating squads in the Finals Gauntlet. The APAC and EMEA regions will feature a $20,000 USD prize pool for each Qualifying Match Day, as well as a $285,000 USD prize pool for the Finals Gauntlet.And of course, Twitch Drops will be enabled for each Qualifying Match Day - and the season finals - to celebrate our new competitive initiative.Elite Series Season 1 ScheduleExact start times for all regions will be announced closer to the first Qualifying Match Day on ...",1763660106,
2807960,"Battlefield 6 streamlines some of the most annoying Challenges yet again, takes out a few of them entirely","The work to continue streamlining Challenges in <a href=""https://www.vg247.com/games/battlefield-2025"">Battlefield 6</a> is clearly not done. Having <a href=""https://www.vg247.com/battlefield-6-patch-1-1-2-0-new-map-new-weapons-aim-assist-bloom-fixes"">just released a new patch</a> - which already included several updates to Challenges and Assignments - Battlefield Studios has gone in and made <em>even</em> more changes. <a href=""https://www.vg247.com/battlefield-6-more-challenge-assignment-changes"">Read more</a> ",1763632477,
2807960,В Battlefield 6 дадут поиграть бесплатно,<strong>Electronic Arts</strong> анонсировала <strong>неделю бесплатной игры в Battlefield 6</strong> . Акция пройдёт <strong>с 25 ноября по 2 декабря</strong> и откроет желающим доступ к нескольким многопользовательским режимам. ,1763607300,
2807960,Call of Duty повержена? Electronic Arts объявила Battlefield 6 самым продаваемым шутером 2025 года,<strong>Electronic Arts </strong>официально объявила <strong>Battlefield 6</strong> <strong>самым продаваемым шутером 2025 года</strong> . Игра дебютировала 10 октября и <strong>за первые три дня разошлась тиражом более 7 миллионов копий</strong> . ,1763605800,
2807960,"Battlefield 6 is getting a free trial next week with... a questionable selection of maps, but at least the modes are good","Presumably as a way of marching ever forward towards its (alleged) 100 million player goal for <a href=""https://www.vg247.com/games/battlefield-2025"">Battlefield 6</a>, EA has announced that the multiplayer shooter will be getting its first free trial later this month. <a href=""https://www.vg247.com/battlefield-6-free-multiplayer-trial-november-25"">Read more</a> ",1763543450,
2807960,"Battlefield 6 is going free-to-play for one week only, just in time for you to try its new map and mode","The shooter space is now the most competitive I've seen it in a long time, with huge competition from the likes of Black Ops 7, Arc Raiders, and Delta Force jostling alongside <strong>Battlefield 6</strong> for your precious gaming hours. Clearly keen to strike while the iron of its California Resistance update is still hot and drum up some extra players, Battlefield Studios has announced that a new week-long free trial for BF6 will be taking place later this month. <a href=""https://www.pcgamesn.com/battlefield-6/free-trial-california-resistance"">Read the rest of the story...</a> RELATED LINKS: <a href=""https://www.pcgamesn.com/battlefield-6/new-season"">Battlefield 6 Season 1 release date and seasonal content</a> <a href=""https://www.pcgamesn.com/battlefield-6/portal-codes"">Best Battlefield 6 Portal codes - XP farm and bot lobby</a> <a href=""https://www.pcgamesn.com/battlefield-6/map-update"">Battlefield 6 is taking a big swing with its Eastwood map, and it could help salve the game's biggest complaint</a> ",1763485492,
2807960,Battlefield 6 | REDSEC Season 1 - California Resistance,"The secrets of Fort Lyndon begin to unravel. Several highly-armed Prepper Stashes containing classified information are traced back to a militant SoCal prepper group known as “The 323.” Their supplier is Ironshore Logistics, a mysterious entity with possible connections to Pax Armata. One elite squad is dispatched to follow the trail and find some answers. California Resistance brings all-out warfare to Southern California with a new map, a new mode, new weapons, Portal Sandbox, and Battle Pickups: Weapons of unprecedented power only discoverable in hidden stashes. NEW MAP: EASTWOOD* War has come to an idyllic villa in Southern California. The luxurious pools and private golf courses of Eastwood have become a battleground. High-intensity action threatens the calm and serenity of this suburban landscape. NEW MODE: SABOTAGE* Protect and Destroy. Two teams fight to attack or defend high-priority cargo in multiple areas across the map. Cargo takes damage from grenades, gadgets, explosives, gunfire–whatever it takes to get the job done. The team that destroys the most cargo wins. NEW HARDWARE Battle Pickup stashes contain weapons of unprecedented power that can turn the tides of battle. These weapons are rare and can only be found in hidden caches on the map. Secure a Battle Pickup to gain a major tactical advantage for your squad. Rorsch Mk-2 SMRW: A chargeable Railgun inflicting massive damage to soldiers, vehicles, and structures. MP-RMG: An armor-piercing Minigun with a fast rate of fire, effective against all enemy types. NEW WEAPONS DB-12 - Shotgun A dual barrel pump-action shotgun that feeds from two different tubes. One trigger pull shoots the cartridge from one barrel, a second trigger pull shoots the other, then the pump action rechambers both barrels. M357 Trait - SidearmHigh damage with a low rate of fire, this eight-round revolver is strong up close with a considerable damage drop-off compared to the .44 Magnum. NEW REDSEC GAUNTLET MISSION: RODEO Saddle up for a tank-centered addition to the Gauntlet mission rotation. In Rodeo, squads must earn eliminations while occupying heavily armored tanks scattered throughout the playable area. The two squads with the least amount of points are removed from the Gauntlet match. PORTAL SANDBOX Build Battlefield 6 from the ground up. Portal is now available as a sandbox, a blank canvas giving creators more freedom than ever to craft and customize unforgettable experiences. *Requires Battlefield 6 (sold separately) & all game updates. Applicable platform account and platform subscription (sold separately) may be required. Persistent internet connection and EA account required.""",1763481899,"['mod_reviewed', 'ModAct_1301790999_1763482595_0', 'mod_require_rereview']"
2807960,"Battlefield 6 gets a new map today alongside major changes to controller aim assist, and even more weapon dispersion tweaks","<a href=""https://www.vg247.com/games/battlefield-2025"">Battlefield 6</a>’s first season has entered its second phase. The game received a major update earlier today, version 1.1.2.0, which delivers a host of changes to the game, many of which have been expected. <a href=""https://www.vg247.com/battlefield-6-patch-1-1-2-0-new-map-new-weapons-aim-assist-bloom-fixes"">Read more</a> ",1763459350,
2807960,Steam Global Top Sellers for week of 11 Nov — 18 November 2025,"<a href=""https://steamdb.info/topsellers/2025W47/?utm_source=Steam&utm_medium=Steam&utm_campaign=SteamRSS""> </a> * <a href=""https://steamdb.info/app/1808500/charts/?utm_source=Steam&utm_medium=Steam&utm_campaign=SteamRSS"">ARC Raiders</a>; * <a href=""https://steamdb.info/app/3274580/charts/?utm_source=Steam&utm_medium=Steam&utm_campaign=SteamRSS"">Anno 117: Pax Romana</a>; * <a href=""https://steamdb.info/app/3606480/charts/?utm_source=Steam&utm_medium=Steam&utm_campaign=SteamRSS"">Call of Duty®: Black Ops 7</a>; * <a href=""https://steamdb.info/app/2807960/charts/?utm_source=Steam&utm_medium=Steam&utm_campaign=SteamRSS"">Battlefield™ 6</a>; * <a href=""https://steamdb.info/app/1675200/charts/?utm_source=Steam&utm_medium=Steam&utm_campaign=SteamRSS"">Steam Deck</a>; * <a href=""https://steamdb.info/app/2592160/charts/?utm_source=Steam&utm_medium=Steam&utm_campaign=SteamRSS"">Dispatch</a>; * <a href=""https://steamdb.info/app/3932890/charts/?utm_source=Steam&utm_medium=Steam&utm_campaign=SteamRSS"">Escape from Tarkov</a>; * <a href=""https://steamdb.info/app/2799860/charts/?utm_source=Steam&utm_medium=Steam&utm_campaign=SteamRSS"">INAZUMA ELEVEN: Victory Road</a>; * <a href=""https://steamdb.info/app/3917090/charts/?utm_source=Steam&utm_medium=Steam&utm_campaign=SteamRSS"">Assetto Corsa Rally</a>; * <a href=""https://steamdb.info/app/3405690/charts/?utm_source=Steam&utm_medium=Steam&utm_campaign=SteamRSS"">EA SPORTS FC™ 26</a>; <i>* excluding free to play games</i> <a href=""https://steamdb.info/topsellers/2025W47/?utm_source=Steam&utm_medium=Steam&utm_campaign=SteamRSS"">View top 100 on SteamDB</a>",1763456400,
