appid,title,contents,date,tags
2807960,Community Update – Changes to Challenges & Assignments,"Recently, we introduced updates that increase the XP earned in official matches and reduce the XP needed for the first 20 attachment ranks. As we continue to build on the improvements we mentioned previously, we are also delivering a major overhaul of Challenges and Assignments, guided by gameplay data and your feedback. Some of the adjustments in this update are substantial, and we wanted to share more context on how we arrived at them. This update makes significant reductions to challenge requirements, cutting down on time investment while maintaining a focus on skill-driven progression that rewards consistent play. Challenges and Assignments are tuned around defined playtime targets, and these changes bring their requirements in line with those goals to make them more achievable within a reasonable session length. Assignments will continue to range from goals you can complete through regular play to a few that reward true mastery, particularly those tied to cosmetic items. Some of the original criteria did not fully reflect that intent, and we have updated them to make their difficulty and purpose clearer. The first set of changes went live today through a server-side update and are available immediately. Any progress you’ve already made will automatically be applied when you enter a match, unlocking any challenges or assignments you now meet based on the updated criteria. As previously indicated, the scale of our plans for Challenges and Assignments are large and will take place over multiple server-side and client-side updates, expect additional updates in the future. We wanted to get the first set of changes into your hands as soon as possible while we prepare further game updates. We’ll follow-up with more details on the rollout in the future. In this first set of changes we made a total of 90+ adjustments to Challenges and Assignments. Below we’ve highlighted a few examples. Class ChallengesAssault, Engineer, Support, and Recon challenges now complete much faster.Assault 2: Have Squadmates deploy on your Spawn Beacon.Reduced from 50 deploys to 5.Support 2: Revive teammates as Support.Reduced from 200 revives to 60.Weapon AssignmentsAll weapon-type assignments (ARs, SMGs, LMGs, Shotguns, DMRs, Snipers, Carbines) have been significantly simplified.Rapid Fire 1/Assault Rifle: Inflict damage with Assault Rifles.Reduced from requiring 10000 inflicted damage to 3000.Mode & Unit AssignmentsThe majority of our mode-specific assignments (Conquest, Rush, Breakthrough, Domination, and others) have been standardized to require two wins per tier. This change makes it easier to pursue these challenges with clear intent.Conquest 2: Wins in Conquest.Reduced from 5 wins to 2.Conquest 3: Objective kills in a round of Conquest.Reduced from 30 objective kills in a round to 10.Gameplay & MasteryGeneral “Expert” and “Master” assignments that require multi-kills, headshots, kill streaks, or revives have been adjusted to better match the natural rhythm of gameplay. For example, multi-kill and streak goals now align with average round performance rather than rare, outlier achievements.Explosives Expert 2: Get Multi Kills (2+ Kills Onwards) with explosives.Reduced from 20 Multi Kills to 5.Adaptable 2: Repair damaged Vehicles in a life.Reduced from requiring 3000 damage to 500. REROLL CHALLENGES SYSTEMWe have also made adjustments to the reroll challenges system. When rerolling a challenge, it will prevent Battlefield 6 players from receiving a challenge that can only be completed in REDSEC. REDSEC players will continue to receive additional challenges that can be completed in REDSEC when rerolling. Which challenge you gain after rerolling will still be random. Our intent is to have clear and achievable goals where reward meets challenge. These challenges and assignments are meant to be achievable without significant time commitment, while some will require a bit of mastery and reward you for that. These changes are rooted in your feedback, so we hope that you’ll continue to share your constructive thoughts and concerns. You can report bugs on our EA Forums and join the community on the Battlefield Discord server. See you on the Battlefield. //The Battlefield Team This announcement may change as we listen to community feedback and continue developing and evolving our Live Service & Content. We will always strive to keep our community as informed as possible.",1762349841,['patchnotes']
2807960,"Игроки сравнили карты Battlefield 6 с прошлыми частями — и они оказались меньше, чем обещали разработчики","Разработчики из <strong>DICE </strong>обещали «&lrm; масштабные сражения на огромных картах » в<strong> Battlefield 6</strong>, но что интересно — в конечном итоге эти карты заметно уступают по размерам боевым локациям из предыдущих частей серии. Сравнения провели пользователи <strong>Reddit</strong>. ",1762289700,
2807960,Steam Global Top Sellers for week of 28 Oct — 4 November 2025,"<a href=""https://steamdb.info/topsellers/2025W45/?utm_source=Steam&utm_medium=Steam&utm_campaign=SteamRSS""> </a> * <a href=""https://steamdb.info/app/1808500/charts/?utm_source=Steam&utm_medium=Steam&utm_campaign=SteamRSS"">ARC Raiders</a>; * <a href=""https://steamdb.info/app/2807960/charts/?utm_source=Steam&utm_medium=Steam&utm_campaign=SteamRSS"">Battlefield™ 6</a>; * <a href=""https://steamdb.info/app/2592160/charts/?utm_source=Steam&utm_medium=Steam&utm_campaign=SteamRSS"">Dispatch</a>; * <a href=""https://steamdb.info/app/1675200/charts/?utm_source=Steam&utm_medium=Steam&utm_campaign=SteamRSS"">Steam Deck</a>; * <a href=""https://steamdb.info/app/3880840/charts/?utm_source=Steam&utm_medium=Steam&utm_campaign=SteamRSS"">Season 1 Battlefield Pro - Battlefield™ 6 and REDSEC</a>; * <a href=""https://steamdb.info/app/1449110/charts/?utm_source=Steam&utm_medium=Steam&utm_campaign=SteamRSS"">The Outer Worlds 2</a>; * <a href=""https://steamdb.info/app/3949040/charts/?utm_source=Steam&utm_medium=Steam&utm_campaign=SteamRSS"">RV There Yet?</a>; * <a href=""https://steamdb.info/app/1158310/charts/?utm_source=Steam&utm_medium=Steam&utm_campaign=SteamRSS"">Crusader Kings III</a>; * <a href=""https://steamdb.info/app/3167020/charts/?utm_source=Steam&utm_medium=Steam&utm_campaign=SteamRSS"">Escape From Duckov</a>; * <a href=""https://steamdb.info/app/3405690/charts/?utm_source=Steam&utm_medium=Steam&utm_campaign=SteamRSS"">EA SPORTS FC™ 26</a>; <i>* excluding free to play games</i> <a href=""https://steamdb.info/topsellers/2025W45/?utm_source=Steam&utm_medium=Steam&utm_campaign=SteamRSS"">View top 100 on SteamDB</a>",1762246800,
2807960,Rogue Operators inbound,"An explosion rattles Fort Lyndon, a government testing ground hiding secrets to die for. An armada of Rogue Operators, veiled by the chaos, seize this moment to descend and wreak havoc. It’s up to your squad to stop them.Find out what Fort Lyndon is hiding in Battlefield 6 Season 1.",1762244116,
2807960,Battlefield 6 tweaks Challenge rerolls so you don't get ones you can't - or don't want to - complete,"It’s been clear since the launch of <a href=""https://www.vg247.com/games/battlefield-redsec"">Battlefield Redsec</a>, the free-to-play component of <a href=""https://www.vg247.com/games/battlefield-2025"">Battlefield 6</a> that <a href=""https://www.vg247.com/battlefield-redsec-explainer-battle-royale-gauntlet-portal-full-guide"">includes battle royale and Gauntlet</a>, that there are players who only really care about one of the game’s two sides and not the other. <a href=""https://www.vg247.com/battlefield-6-challenges-reroll-more-relevant-changes"">Read more</a> ",1762171678,
2807960,«Способ размяться без стресса»: В Battlefield 6 появился режим Casual Breakthrough — упрощённый вариант мультиплеера с ботами,"Студия <strong>DICE</strong> выпустила обновление для <strong>Battlefield 6</strong>, добавив в него новый режим <strong>Casual Breakthrough</strong>, доступный из основного меню мультиплеера. <strong>Этот формат предназначен для новичков и игроков, предпочитающих менее напряжённые геймплейные сессии</strong> — сражения проходят против ботов, но при этом позволяют зарабатывать опыт и выполнять внутриигровые задания. ",1762126620,
2807960,"A new Battlefield 6 ""casual"" mode aims to find middle ground as dev continues fightback against XP farming","A new <strong>Battlefield 6</strong> Casual Breakthrough mode has just been launched as Battlefield Studios continues to find a middle ground between XP farmers and those just looking to have a more relaxing time in one of this year's <a href=""https://www.pcgamesn.com/best-multiplayer-games"">best multiplayer games</a>. The new format strikes a balance between PvP competition against real humans and bots, allowing challenge completion but with experience gains balanced around the enemies you interact with. <a href=""https://www.pcgamesn.com/battlefield-6/casual-breakthrough-mode"">Read the rest of the story...</a> RELATED LINKS: <a href=""https://www.pcgamesn.com/battlefield-6/update-challenge-rerolls-redsec"">New Battlefield 6 update will stop pushing you into battle royale spinoff Redsec if you don't play it</a> <a href=""https://www.pcgamesn.com/nvidia/geforce-rtx-5090-fe-battlefield-6-competition"">Grab a free Battlefield 6 GeForce RTX 5090 FE worth $2,000, thanks to Nvidia</a> <a href=""https://www.pcgamesn.com/battlefield-6/battle-pass-rewards"">All Battlefield 6 battle pass rewards</a> ",1762082435,
2807960,New Battlefield 6 update will stop pushing you into battle royale spinoff Redsec if you don't play it,"<strong>Battlefield 6</strong> has been a real triumph so far; a return to bombastic brilliance for a series that has brought us some of the <a href=""https://www.pcgamesn.com/15-best-pc-first-person-shooters"">best FPS games</a> of all time. To supplement this, its developer has deployed its contender to Call of Duty Warzone. Battlefield Redsec is a free-to-play companion to BF6 that includes a <a href=""https://www.pcgamesn.com/best-battle-royale-game"">battle royale</a> and a gauntlet mode where teams race to complete challenges, and it's largely a good twist on the formula, even if its Steam reviews might tell you otherwise. But it's not for everyone, and Battlefield Studios has just responded to complaints that challenges were pushing the mode on them with a very welcome change. <a href=""https://www.pcgamesn.com/battlefield-6/update-challenge-rerolls-redsec"">Read the rest of the story...</a> RELATED LINKS: <a href=""https://www.pcgamesn.com/battlefield-6/casual-breakthrough-mode"">A new Battlefield 6 ""casual"" mode aims to find middle ground as dev continues fightback against XP farming</a> <a href=""https://www.pcgamesn.com/nvidia/geforce-rtx-5090-fe-battlefield-6-competition"">Grab a free Battlefield 6 GeForce RTX 5090 FE worth $2,000, thanks to Nvidia</a> <a href=""https://www.pcgamesn.com/battlefield-6/battle-pass-rewards"">All Battlefield 6 battle pass rewards</a> ",1761994969,
2807960,EA в кольце огня: Игроки громят королевскую битву Battlefield REDSEC в Steam,На этой неделе компания<strong> EA </strong>выпустила королевскую битву <strong>Battlefield REDSEC</strong>. Однако далеко не все оценили игру положительно. ,1761949385,
2807960,Battlefield REDSEC Official Live-Action Trailer,"Grab the squad and drop in today. Drop into Fort Lyndon with massive destruction and the deadliest Battle Royale ring. Squad up for Gauntlet to hack and flip objectives, then dive into Portal. Play free now. https://store.steampowered.com/app/3028330/Battlefield_REDSEC/ ",1761927091,
2807960,Battlefield REDSEC - Gauntlet 101,"Survive and advance in Gauntlet: an all-new cutthroat, knockout-style elimination mode where squads race to complete missions.In Gauntlet, eight squads go head-to-head in a series of special missions that push every squad to their limit. Decryption, extraction, territory domination, target protection, explosive transport and more–only squads with the complete package will come out on top in this Gauntlet of elimination ending in a squad vs. squad showdown.Ready to run the Gauntlet? Assemble your squad and claim glory in this competitive experience.Gauntlet at its CoreGauntlet is a competitive, round-based mode based on a four-mission sequence :FIRST MISSION - Eight SquadsSECOND MISSION - Six SquadsTHIRD MISSION - Four SquadsFINAL MISSION - Two SquadsThe Combat Zone for each mission is based on sections of Fort Lyndon and is custom fit to the number of remaining squads, so that the First Mission has the largest Combat Zone and the Final Mission has the smallest. Its order of mission - namely the Second and Third Missions - can be skipped in specific circumstances, such as Multiple squads forfeiting the Gauntlet by leaving early.At the start of Season 1, there are eight mission types; one additional mission - Rodeo - will be added during Season 1, with more to follow in additional seasonal updates. Unlike Battle Royale, Classes in Gauntlet are the same as those in Battlefield 6 Multiplayer; if you are coming in from Battlefield 6 Multiplayer, your loadouts will carry over into Gauntlet.Specific missions may benefit from unconventional Class choices across the squad; rather than choosing the standard “Assault, Engineer, Support and Recon” balanced composition, you may find more success on double, tripling, or quadrupling up on a Class.ReassignmentNobody likes a quitter, especially if you are performing well in a Gauntlet despite them. When your Gauntlet team is eliminated due to teammates leaving, there is a chance that you will be assigned to a new Gauntlet team rather than be eliminated. Reassignment ensures all teams have four active players throughout the Gauntlet match, rewarding top performers from squads with teammates who leave mid-operation. At the end of each mission (save for the Final Mission), all squads, including eliminated squads, will be checked for open spots. If there is an open spot on a surviving squad, or if there is a unique scenario with open spots across multiple eliminated and surviving squads, then a Reassignment will occur, guaranteeing the next mission will have the correct number of squads. Full squads of four who advance to the next mission will not be reassigned.Gauntlet MissionsEvery Gauntlet “round” is a different mode or “mission” - with eight mission types and numerous Combat Zones, it is incredibly rare to have the exact same Gauntlet mission sequence in back-to-back matches with over 70,000 different possible combinations. However, prior to each mission, a miniature briefing takes place that details the rules of engagement and how points are scored.Every mission offers one point for every kill and revive. This means reviving a squadmate is technically a two point play, as it earns your squad one point while denying a point from the enemy. Keep this in mind when determining your strategy for success as well as Class choice, since the Support Class has multiple tools to help with revives.True to Battlefield’s core principles, however, the most effective point scoring method across all but one mission is to play the objective. Whether it is destroying M-COMS, holding consoles, or remaining on designated zones, objective play will rack up score faster than playing for a K/D ratio.Across all missions, points are doubled in the last minute of that mission. For example, if a mission normally rewards a squad one point per kill, then a squad will receive two points per kill during the last minute of the mission.Some missions will only appear in specific Gauntlet rounds. For example, “Heist” is only played as a Final mission between two squads and does not show up as a First, Second or Third mission.The eight available Gauntlet missions, as well as when they can appear in a Gauntlet, are as follows:Name1st Mission (8 Teams)2nd Mission (6 Teams)3rd Mission (4 Teams)Final Mission (2 Teams)Circuit✓✓✓✓Contract✓✓✓Deadlock✓✓✓✓Decryption✓✓✓✓Extraction✓✓✓Heist✓Vendetta✓✓✓Wreckage✓✓✓✓CircuitSquads earn points by simultaneously capturing and holding as many control consoles as possible. Think Domination, except you must actively capture each control console, the number of which varies by stage:FIRST MISSION - Up to 36 Control ConsolesSECOND MISSION - Up to 24 Control ConsolesTHIRD MISSION - Up to 12 Control ConsolesFINAL MISSION - Up to 5 Control ConsolesOne point is earned every 20 seconds for each console controlled.The Support Class and its wealth of revival and defensive Gadgets could be great to lean on in this fast-paced mission, or the Assault Class can shine through its abilities to c...",1761905525,
2807960,Battlefield REDSEC - Battle Royale 101,"Prepare to drop into Fort Lyndon.This massive, redacted military facility hidden in plain sight between pristine beaches and a sleepy residential community is home to some of the most advanced military projects in the world. Rogue operators are racing against time and hostiles to keep each other out and the secrets in.Your mission? Survive the Battle Royale between NATO and Pax Armata squads fighting for control of Fort Lyndon. Consider this your briefing:Before You Drop - Sidearms and ClassesBattle Royale is the only non-Portal mode with different Loadouts than any other official Battlefield experience. In other words, instead of a Primary Weapon, Sidearm, customizable Gadgets and more, you are limited to the following items:Your Class, which comes with a Class Signature Set - Two Gadgets, a Signature Weapon Proficiency and a Signature Trait - and a four-trait Training Path, which is different from normal (Multiplayer and Gauntlet) Training Paths (with only one available as of Season 1 launch).A SidearmA Melee ToolYour Battle Royale loadout choice - the Class, Sidearm and Melee Tool - is only editable after joining a match and before dropping out of the infiltration plane.Each Class gets its default Gadgets, Signature Weapon Proficiency and Signature Trait by default. Their additional Passive Abilities, including their final Level 4 ability shared between all classes, are unlocked by earning score through eliminating enemies, completing Contracts and surviving deep into the match. Every soldier also gets Thermite Sabotage, an improved sabotage device which slowly damages a tank and its crew. Meant to be a last resort anti-tank tool against those unaware of a soldier right next to their tank, the Thermite Sabotage can be directly planted onto vehicles.Assault Class - PointmanGain the high ground and eliminate enemies from defilade.FEATURENameIn-Game DescriptionGADGET 1Assault LadderThis equipment provides access to higher vantage points. Depending on the angle of placement, it can act as a bridge between buildings, or a ramp to help traverse obstacles on the battlefield.GADGET 2High Explosive LauncherFires impact-trigger grenades designed for damaging structures and targeting infantry behind cover.SIGNATURE WEAPONAssault RifleFaster draw times with Assault Rifles. Fire sooner when exiting a sprint.SIGNATURE TRAITMission FocusedNearby squadmates get faster progress with objectives, including arming and disarming M-COM explosives. In Battle Royale, respawn towers will capture quicker…LEVEL 1 PASSIVE ABILITYQuick PlatingArmor replating is 33% faster.LEVEL 2 PASSIVE ABILITYGrenadierHigh Explosive Launcher carrying capacity increased to 5 rounds.LEVEL 3 PASSIVE ABILITYCluster MunitionsHigh Explosive Launcher explosions generate 5 fused submunitions.LEVEL 4 PASSIVE ABILITYStockpileClass gadget resupply rate increases by 10% with each improvement. Effect resets upon death.Engineer Class - Field MechanicDisable incoming armored threats and maintain combat vehicles to keep them mission-ready.FEATURENameIn-Game DescriptionGADGET 1Repair ToolA blow torch to repair friendly vehicles and equipment. Can also damage enemy assets. Extended use will temporarily overheat the tool.GADGET 2Aim-Guided LauncherAn anti-vehicle launcher that can be upgraded to enable missile guidance to the target via the weapon's crosshairs. Inflicts greater damage on the sides, top, and rear of vehicles where armor is thinner.SIGNATURE WEAPONSMGImproved hip-fire control when using SMGs.SIGNATURE TRAITMechanized InfantryTake less explosives damage when near friendly vehicles and prevent them from being occupied by hostiles in the event that all vehicle crew exit. Repair vehicle health to keep both effects active.LEVEL 1 PASSIVE ABILITYEnhanced TargetingLauncher is now aim-guided via magnified optic.LEVEL 2 PASSIVE ABILITYDevastating ImpactDamaging enemy vehicles reduces their repair effectiveness for a short period of time.LEVEL 3 PASSIVE ABILITYMobility-Kill WarheadAim-Guided Launcher hits temporarily immobilize vehicles for a short period of time.LEVEL 4 PASSIVE ABILITYStockpileClass gadget resupply rate increases by 10% with each improvement. Effect resets upon death.Support Class - ProvisionerIncrease squad endurance with more armor and ammo, enhanced healing, and gadgets that compromise enemy sight.FEATURENameIn-Game DescriptionGADGET 1Supply BagOnce dropped, the bag resupplies all nearby infantry with ammo for weapons and regenerates health more efficiently, even when under fire.GADGET 2Smoke Grenade LauncherFires impact-triggered grenades designed to create temporary smoke screens. Blocks ability to spot targets and clears spotted markers from all infantry inside the smoke radius. Can be carried standalone or underslung on weapons with a Gadget Mount attachment for faster access.SIGNATURE WEAPONLMGFaster transition to aim down sights (ADS) and no sprint speed penalty while carrying LMGs.SIGNATURE TRAITField SustainmentDistribute health pac...",1761815378,
2807960,"Grab a free Battlefield 6 GeForce RTX 5090 FE worth $2,000, thanks to Nvidia","Nvidia has just announced an incredible opportunity for you to win an RTX 5090 Founders Edition graphics card, worth $2,000. In celebration of the launch of Battlefield 6, and the game's support for <strong>Nvidia</strong> DLSS upscaling and multi-frame gen tech, the company is giving away a special Battlefield 6 edition of its flagship gaming GPU. This <a href=""https://www.pcgamesn.com/nvidia"">Nvidia</a> giveaway is the perfect opportunity to not only bag yourself the <a href=""https://www.pcgamesn.com/best-graphics-card"">best graphics card</a> on the planet right now, but also to show off your Battlefield 6 skills, which will have to be considerable to win this competition. With only two days before the competition closes, though, you'll have to be quick. <a href=""https://www.pcgamesn.com/nvidia/geforce-rtx-5090-fe-battlefield-6-competition"">Read the rest of the story...</a> RELATED LINKS: <a href=""https://www.pcgamesn.com/battlefield-6/update-challenge-rerolls-redsec"">New Battlefield 6 update will stop pushing you into battle royale spinoff Redsec if you don't play it</a> <a href=""https://www.pcgamesn.com/battlefield-6/battle-pass-rewards"">All Battlefield 6 battle pass rewards</a> <a href=""https://www.pcgamesn.com/battlefield-6/best-settings-for-pc-steam-deck"">Best Battlefield 6 settings for optimized PC performance</a> ",1761755554,
