appid,title,contents,date,tags
2807960,REDSEC New Player Guide,"You are now entering Battlefield: REDSEC.This free-to-play Battlefield* experience is open to all those who are not only interested in FPS Battle Royale games, but who also want to explore the high-octane team tactical competitive mode known as Gauntlet.If you are already familiar with Battle Royale and FPS games, then we advise reading the Battle Royale 101 and Gauntlet 101 guides, as they speak to core game mechanics, including differences that sets Battlefield REDSEC apart from the rest, and finer details. However, if you are unfamiliar with these video game genres and are completely new to Battlefield, then consider this your bootcamp:Battlefield in SummaryBefore understanding what REDSEC is, what is Battlefield?Since 2002, the Battlefield franchise is known for producing iconic all-out warfare FPS experiences, built on the concepts of tactical destruction - environments that react to your in-game actions and may help you gain an advantage - and high-intensity team-based combat. REDSEC is Battlefield’s first-ever “free-to-play Battle Royale” game, but it’s not just Battle Royale: this experience includes Gauntlet, a round-based elimination mode that samples from the franchise’s rich Multiplayer history, as well as REDSEC’s Portal Community Creations, an ever-evolving sandbox from our community developers.However, your first steps into REDSEC - or rather, your Initiation - will more than likely come in the form of the Battle Royale Initiation playlist:Battle Royale InitiationIn BR Duos, eliminate hostels, track intel, and dodge the chemical ring on a condensed map.Battle Royale Initiation is built for new players: in this Battle Royale variant, you and a squadmate can drop into a match with the following key differences:This version of Fort Lyndon is significantly smaller than its full version. Specifically, only the southeast portion of the map is accessible, with the Marina, Fleetview Ridge and Golf Course serving as the northern border, and the Defense Nexus as the western border.Players who can access this mode are limited to newer players.A 48 player maximum, inclusive of Bots.Essentially, this is a low-stakes learning environment to learn how Battle Royale is done the Battlefield way. Specifically, your path towards victory will involve the following:Dropping InChoose your Class, which comes with its own benefits such as Gadgets and a “Training Path” that grants passive traits as you and your squad perform in-game actions.ASSAULT - The ultimate frontline fighter, skilled at punching through enemy defenses. Dominate close to mid-range encounters and limit the enemy’s ability to fight.ENGINEER - The battlefield’s leading vehicle and equipment technician. Execute repairs to keep allies combat effective, or strike hostile armor with force to break their attack.SUPPORT - The backbone of any combat unit for defense and sustained fighting. Heal and resupply friendly forces, while fortifying defensive positions to keep them protected.RECON - The perfect intelligence and counterintelligence operative. Neutralize targets from a distance, or infiltrate, gathering intel and disrupting hostile forces.You also get to choose a Sidearm, a small personal defense weapon that is great in a pinch, but is not meant to carry you through an entire match. Next, get ready to parachute into Fort Lyndon! Either you or your duo will be labelled as the “Squad Leader;” when the Squad Leader calls for a jump, both of you will leap out of the infiltration plane.At any point, the non-Leader can “break away” from the formation and continue dropping on their own. However, we highly recommend that new players stay in formation. Your parachute will automatically deploy when you get close to the ground (unless you switch this Setting off, which we don’t recommend to new players). Alternatively, you can manually deploy the parachute to delay landing in favor of a more intentional landing spot, but remember that every second off the ground is another second for every enemy to start getting better weapons.Securing Better Weapons, Ammo and ArmorYour sidearm can only get you so far. That’s where scavenging for weapons, ammo and armor become the tools for survival.These are all available through a variety of crates found in the map; look for giant rectangular boxes that are green (Common), red-and-black (Rare), or red with Class symbols (Class Chests). Class Chests are the rarest of the trio, but often contain rewards that fit your chosen Class. Look for vehicles that can be opened to contain more items, as well as locked vaults that the Engineer Class can open with their Repair Tool.Crates can also contain Ammo, which is shared between all weapons in a given weapon category. For example, picking up Assault Rifle ammo will grant ammo to any and all Assault Rifles you use. While there are other ways to gain more ammo like picking it off eliminated enemies or getting an Ammo Resupply Call-In, the easiest way to restock is to use the Support Cl...",1761753583,
2807960,"Battlefield Redsec boosts Battlefield 6's Steam numbers, but not enough to get anywhere close to those launch heights","<a href=""https://www.vg247.com/games/battlefield-redsec"">Battlefield Redsec</a>, the free-to-play battle royale mode inside of <a href=""https://www.vg247.com/games/battlefield-2025"">Battlefield 6</a>, <a href=""https://www.vg247.com/battlefield-6-redsec-battle-royale-mode-launch"">went live yesterday across all platforms</a>, right alongside the game’s first season. This is the Battlefield series’ second attempt at a battle royale mode, after <a href=""https://www.vg247.com/games/battlefield-v"">Battlefield 5</a>’s ill-fated <a href=""https://www.vg247.com/battlefield-5-firestorm-battle-royale"">Firestorm</a>. <a href=""https://www.vg247.com/battlefield-redsec-steam-numbers-battlefield-6"">Read more</a> ",1761729953,
2807960,California Love: Состоялся релиз королевской битвы Battlefield REDSEC,Параллельно старту первого сезона контента в <strong>Battlefield 6</strong> издательство <strong>EA </strong>объявило о релизе условно‑бесплатной игры <strong>Battlefield REDSEC</strong>. В честь этого был представлен новый трейлер. ,1761685558,
2807960,"Community Update - Introducing REDSEC: Battle Royale, Gauntlet, and Portal","Hey everyone,We are stoked to finally pull the curtain back on what we have been working on for a while. Word has spread about our version of Battle Royale, and players have been anticipating when they will be able to ride around in a golf cart. We’re excited to announce that Battlefield REDSEC is now live, alongside Battlefield 6 Season 1.Battlefield REDSEC is Battlefield’s free-to-play experience that you can drop into without owning the base game. Already own Battlefield 6? Squad up in REDSEC with your friends, whether they have Battlefield 6 or not.REDSEC delivers three ways to play:The Battle Royale Mode - The Battlefield WayGauntlet - An all-new, round-based elimination modePortal - Make and play custom experiences based on elements available in REDSECFort Lyndon: The Biggest Battlefield Map EverWelcome to Fort Lyndon - part SoCal beach community, part military blacksite, all battlefield. You’ll fight through urban city centers, dense military compounds, and once-idyllic suburban neighborhoods. This is our largest Battlefield map ever created, with secrets and intel waiting to be discovered.The Battle Royale Mode - The Battlefield WayHere’s a quick rundown of what you’ll need to know.Player count: 100 per match - 25 squads of 4 or 50 duos.Battlefield DNA, tuned for the Battle Royale mode:Core Battlefield classes are in play, but altered from Battlefield 6 to work within the context of Battle Royale. For example:Assault class retains the use of the ladder for vertical flanks from Battlefield 6. Their traits have been tweaked with benefits, including faster armor recharge, faster gadget regen, and more.Support class spawns with the ability to carry extra armor plates and ammo. They can rank up to providing full-health revives and boost the regen rate of nearby squadmates.Training Paths give each class unique abilities that unlock or upgrade gear.Locating hidden intel caches and completing missions are an efficient way to level up your training path. The higher the risk, the higher the rewards, including caches and access to combat vehicles.We evolved destruction to tactical destruction, turning it into a tool you can use to reshape the environment to your advantage. Breach walls, destroy buildings, and use rubble as cover.Battlefield isn’t Battlefield without vehicles capable of wreaking havoc on land, water, and air. Scattered across the map, you can find helicopters, boats, and even golf carts to ride to war in.Looting is a key part of any Battle Royale, and it’s no different here. Navigate throughout the map to find crates holding weapons, armor plates, ammo, and more. Search for your favorite loadout that will lead your squad to victory.Oh, and did we mention that we have the deadliest ring in BR already? We advise against testing how dangerous it actually is unless you’re willing to risk it all.We’ve already implemented player-driven changes and outlined what changes players can expect at launch from our Battlefield Labs play sessions. Read the details here and please keep the feedback coming as we continue to shape the game with you. If you want to learn more about the Battle Royale mode in detail, read up on our Battle Royale 101 blog here.GauntletWe wanted to bring something to the table that no one’s played in Battlefield before, so we built Gauntlet. It is structured as an elimination series where squads work together to score points by completing objectives, getting kills, and supporting one another across 4 randomized missions of vital importance to the operation in Fort Lyndon. Eight squads of four soldiers each enter, but only one will make it through all four missions. After every mission, the squads with the fewest points are eliminated from the match, with the top 3 earning bonus progress on their training paths to gain the upper hand in the next mission. Intensity rises as staying above the cut line becomes more and more difficult until the two best squads finally face off in one last mission to determine who will claim victory. If your squad is eliminated because teammates leave mid-operation, top performers can be reassigned to a surviving squad instead of leaving the game. At the end of each mission (except the Final Mission), reassignments may take place. The game will check for open slots and fill them so squads stay full and you can get back to gaming. There will be 8 different types of mission varieties at launch. Here’s a taste of what some of these missions will entail:Decryption: Squads compete to pick up and protect locator beacons while they transmit dataWreckage: Your squad needs to find, transport, and detonate bombs at hostile M-COMs scattered across the combat zone.Vendetta: Your squad needs to eliminate marked hostile High Value Targets and protect a High Value Target of your own.Circuit: Your squad earns points by capturing and defending control terminals; the larger the network, the more points you earn.Every Gauntlet match is different - mission draws, locations, an...",1761672669,
2807960,Drop Into REDSEC and Battlefield 6 Season 1,"Redacted no more - Battlefield REDSEC is here with the launch of Battlefield 6 Season 1.In Battlefield 6 Season 1, All-Out Warfare strikes the sprawling badlands of Southern California. These landscapes are jam-packed with secrets to die for: Classified military hardware, weapons of unprecedented power, cutting-edge gadgets, and a brand new way to put them all to the test in Strikepoint, a new high-intensity elimination mode. Storm into combat, or enhance and customize your experience with the power of Portal.All Season 1 hardware is also at your disposal in REDSEC, a free-to-play destination built on Battlefield’s iconic DNA. Drop into Fort Lyndon for a Battle Royale only Battlefield can deliver, featuring massive-scale destruction, fast-paced squad play, and the deadliest ring in BR. Survive and advance in Gauntlet: an all-new cutthroat, knockout-style elimination mode where squads race to complete missions. Then redraw the lines of battle with Portal, which will be free-to-create with all REDSEC assets - its map, modes and more - also available in the full experience.Building off our preview roadmap back in September, this is everything you need to know about REDSEC and Battlefield 6 Season 1:Rogue Ops - REDSECAn explosion rattles Fort Lyndon, a government testing ground hiding secrets to die for. An armada of Rogue Operators, veiled by the chaos, seize this moment to descend and wreak havoc. It’s up to your squad to stop them.At launch, the free-to-play REDSEC experience will feature a Battle Royale mode built on Battlefield DNA, as well as an all-new Multiplayer-inspired special operations mode in Gauntlet, all built around one core map.Welcome to Fort LyndonWar has erupted in Fort Lyndon. This massive battleground is loaded with endless Tactical Destruction possibilities \. Featuring an arsenal of unique combat zones: From pristine beaches, to wartorn military complexes, and everything in between, there are endless paths to victory for every squad on Battlefield’s biggest map ever.Carefully designed to accommodate all engagements - close-quarters to long-range, gunfights to vehicle combat, including on transport boats along the coastline - Fort Lyndon includes nine major points of interest (POIs) spanning across its coastal desert combat zone, ranging from the long-abandoned Marina and Main Street to the desolate blacksite remains at the Military Storage and R&D complexes. Tying these areas together are 16 additional POIs - Oil Pumps, a Lighthouse, Jewel Beach, and more - that weave together an immersive Southern California landscape designed as a tactical layout.Intel on the Fort Lyndon blacksite is invaluable, yet currently incomprehensive, for both Pax Armata and NATO: the most classified intelligence and equipment, let alone advantageous positions and where to find valuable loadout caches, is up to you to discover and share among your squad.REDSEC: Battle RoyaleA fast-paced squad vs. squad battle in Southern California, ending in a sudden death showdown inside the deadliest ring of fire in the history of Battle Royale. This is BR that can only happen in Battlefield.REDSEC’s Battle Royale experience is built on Battlefield’s foundation of iconic all-out warfare, tactical destruction, and squad-based gameplay defined by its Class System. The standard Battle Royale match holds up to 100 players in either four-player squad or duo formats at launch.Choose your class and Sidearm before dropping in, then work with your squad (or duo) to earn and unlock additional abilities, gadgets, call-ins and more to gain a tactical advantage. Scour the map to find loadout items, including weapons of various rarities and Upgrade Kits, or complete squad missions to unlock powerful rewards. You may even find a vehicle keycard that grants access to a heavy armored tank.We detail everything you need to know about Battle Royale in this guide here.REDSEC: GauntletReady to run the Gauntlet? This all-new cutthroat, knockout-style, fast-paced elimination experience pits squads against each other in a series of high-octane missions, some of which will be familiar to Battlefield Multiplayer veterans.In Gauntlet, eight squads go head-to-head in a series of special missions that push every squad to their limit. Decryption, extraction, territory domination, target protection, explosive transport and more–only squads with the complete package will come out on top in this Gauntlet of elimination ending in a squad vs. squad showdown.Every Gauntlet “round” is a different mode or “missions,” such as Deadlock, a multi-team variant of King of the Hill, or Wreckage, which is similar to Rush. With eight mission types and numerous Combat Zones, it is incredibly rare to have the exact same Gauntlet mission sequence in back-to-back matches. However, prior to each mission, a miniature briefing takes place that details the rules of engagement and how points are scored.At the end of each round, the bottom two teams in that mission are eliminated ...",1761669063,"['mod_reviewed', 'ModAct_487176015_1761671128_0', 'mod_require_rereview']"
2807960,Зов долга не слышен на поле битвы: Обзор Battlefield 6,"Релиз <strong>Battlefield 2042 </strong>оказался из разряда «<a href=""https://gamemag.ru/reviews/battlefield-2042-review""><strong><em>со дна постучали</em></strong></a>». После столь эпичного позора даже в <strong>EA</strong> поняли, что дела так дальше идти не могут. Поэтому <strong>DICE </strong>понизили до рядовой студии, входящей в состав подразделения <strong>Battlefield Studios</strong>, которым руководят отец <strong>Call of Duty</strong> <em>Винс Зампелла </em>и продюсер<strong> Warzone </strong><em>Байрон Бид</em>. И они совершили немыслимое – заставили ленивых шведов РАБОТАТЬ. ",1761656400,
2807960,Steam Global Top Sellers for week of 21 Oct — 28 October 2025,"<a href=""https://steamdb.info/topsellers/2025W44/?utm_source=Steam&utm_medium=Steam&utm_campaign=SteamRSS""> </a> * <a href=""https://steamdb.info/app/2807960/charts/?utm_source=Steam&utm_medium=Steam&utm_campaign=SteamRSS"">Battlefield™ 6</a>; * <a href=""https://steamdb.info/app/2592160/charts/?utm_source=Steam&utm_medium=Steam&utm_campaign=SteamRSS"">Dispatch</a>; * <a href=""https://steamdb.info/app/3949040/charts/?utm_source=Steam&utm_medium=Steam&utm_campaign=SteamRSS"">RV There Yet?</a>; * <a href=""https://steamdb.info/app/3167020/charts/?utm_source=Steam&utm_medium=Steam&utm_campaign=SteamRSS"">Escape From Duckov</a>; * <a href=""https://steamdb.info/app/1808500/charts/?utm_source=Steam&utm_medium=Steam&utm_campaign=SteamRSS"">ARC Raiders</a>; * <a href=""https://steamdb.info/app/1675200/charts/?utm_source=Steam&utm_medium=Steam&utm_campaign=SteamRSS"">Steam Deck</a>; * <a href=""https://steamdb.info/app/3551340/charts/?utm_source=Steam&utm_medium=Steam&utm_campaign=SteamRSS"">Football Manager 26</a>; * <a href=""https://steamdb.info/app/2958130/charts/?utm_source=Steam&utm_medium=Steam&utm_campaign=SteamRSS"">Jurassic World Evolution 3</a>; * <a href=""https://steamdb.info/app/1449110/charts/?utm_source=Steam&utm_medium=Steam&utm_campaign=SteamRSS"">The Outer Worlds 2</a>; * <a href=""https://steamdb.info/app/3405690/charts/?utm_source=Steam&utm_medium=Steam&utm_campaign=SteamRSS"">EA SPORTS FC™ 26</a>; <i>* excluding free to play games</i> <a href=""https://steamdb.info/topsellers/2025W44/?utm_source=Steam&utm_medium=Steam&utm_campaign=SteamRSS"">View top 100 on SteamDB</a>",1761642000,
2807960,Battlefield 6’s battle royale mode is called… Redsec and it’s coming out today,"For weeks now, <a href=""https://www.vg247.com/games/battlefield-2025"">Battlefield 6</a> insiders have been saying that the game’s battle royale mode - which hadn’t been given a proper name yet - would be shadow-dropping with the game’s then-upcoming Season 1. <a href=""https://www.vg247.com/battlefield-6-redsec-battle-royale-mode-launch"">Read more</a> ",1761640317,
2807960,Eyes up. Plates on,#REDSEC arrives tomorrow at 8:00 PT / 15:00 UTC.,1761577899,
2807960,"Battlefield 6’s Season 1 patch will address weapon bloom, tweak movement, improve visibility, and change (some of) those miserable challenges","The <a href=""https://www.vg247.com/games/battlefield-2025"">Battlefield 6</a> honeymoon phase is nearing its end. While the game remains popular and incredibly well received, a few issues have lingered around since launch and they’re starting to turn into a problem. <a href=""https://www.vg247.com/battlefield-6-season-1-update-1-1-1-0-all-details"">Read more</a> ",1761555579,
2807960,BATTLEFIELD 6 UPDATE 1.1.1.0,"We are deploying Update 1.1.1.0 on Tuesday, October 28, followed by the Season 1 launch later that day at the following times:09:00 UTC: Update 1.1.1.0 goes live on all platforms. Players will be prompted to download and install the update, which includes all technical and gameplay changes.15:00 UTC: Season 1 content, including the Battle Pass and new seasonal features, becomes available for all players.Between these times, players can continue to play Battlefield 6 as normal after updating, but Season 1 content and progression will unlock at 15:00 UTC. The Season 1 Update marks the next step in our ongoing journey to evolve and expand the Battlefield 6 experience. This includes fixes, balance changes, and quality-of-life improvements focused on polish, performance, and player feedback to deliver an even smoother experience moving forward.Major Updates for 1.1.1.0:Improved core movement and animations, including smoother landings, faster stance transitions, better vaulting behavior, and reduced “bouncing” issues on landing or spawning.Reworked weapon dispersion to better align accuracy and handling with each weapon’s intended design and performance over range. These changes address cases where accuracy behaved inconsistently, such as dispersion not properly settling after sprinting, and bring overall firing behavior closer to the intended balance between precision, control, and weapon power.Significant visibility and lighting improvements, with better exposure transitions, interior lighting, and reduced fog and smoke persistence.Audio overhaul, adding new projectile flybys, destruction and explosion sounds, refined vehicle and weapon mixes, and improved haptic feedback across multiple interactions.UI and HUD updates for clarity and consistency, including overtime indicators, end-of-round fixes, and new unlock markers for weapons and gadgets.Map fixes across multiple locations, resolving spawn animations, out-of-bounds issues, misaligned assets, and general stability across Conquest, Breakthrough, and Rush modes.CHANGELOGPLAYER:Fixed an issue where combat dive could break when diving uphill.Fixed an issue where players would detach from ziplines when entering at high speed.Improved steady aim and sight centering for more consistent precision.Fixed an issue where movement could interrupt steady aim.Adjusted misaligned character hitboxes for upper body and head to better match the visual models.Fixed an issue where the jump animation could play twice when aiming down sights.Landing animations now have their animation path properly centered, instead of shifting to the side when landing.Fixed an issue where jump inaccuracy could linger too long after landing.Fixed a visual issue causing weapons to appear rotated incorrectly after spawning.Fixed an issue where throwing grenades from prone could make players appear standing in third-person view.Fixed an animation delay when opening doors while sliding.Fixed an issue where players could get stuck while vaulting over certain objects.Fixed a visual issue where dead players appeared alive while swimming.Fixed an issue where quick meleeing with a gadget would swap back to the primary weapon instead of the gadget.Fixed an issue where getting killed by a mine would highlight it in the killcam.Fixed a camera jitter that could occur when entering ladders and looking down.Fixed an issue where camera and weapon sway behaved incorrectly after entering or exiting vehicles.Fixed an issue where weapons of other soldiers could clip through walls when they entered your view.Fixed an issue where pistols disappeared while swimming.Improved lighting precision for visibility while hip-firing and aiming down sights.Reduced occurrences of bouncing or landing issues when dropping onto certain objects.Fixed an issue where the killer snapshot sometimes did not display in the killcam.Small improvements to weapon and camera sway for smoother movement.Fixed an issue where enemies could take melee damage in protected vehicle seats.Fixed an issue where vaulting could fail if triggered right as the player hit an obstacle.Fixed an animation issue where repeated vaulting could cause incorrect hand placement.Fixed an issue where simultaneous melee hits could make an enemy briefly invisibleFixed an issue where soldier heads briefly disappeared during redeploy transitions.Improved training path progression display to better match actual unlocks.Fixed an issue where friendly players could clip into each other when climbing ladders.Fixed an issue preventing vaulting directly from a slide.Fixed an issue causing the camera to rotate abruptly after a takedown.Fixed an issue where hands briefly disappeared after using the AJ-03 COAG Med Pen.Improved stab animations when reviving with drag and revive.Fixed issues affecting peeking and prone transitions, ensuring both actions function correctly.Fixed a camera clipping issue when going prone while strafing.Fixed a missing third-person animation when transitio...",1761318005,
