appid,title,contents,date,tags
1046930,Season One is Nigh,"Hello! In 5 days, Dota Underlords is coming out of Early Access and shipping Season 1. Ahead of the big release we wanted to share a few things about what’s coming. Launch Party To celebrate the launch day and share what’s new with the community, join some of your favorite personalities for our Launch Party on Twitch. The day will be full of Underlords matches, City Crawling, and general shenanigans with guests and players from the community. {STEAM_CLAN_IMAGE}/35233241/7c35430888eef41baf57df94418cf2154f8083f0.png What’s staying from the Beta Season? First off, thank you all for being part of the beta – we couldn’t have gotten here without you! Players who participated in the Beta Season will keep the following things: Major Rank We are doing a soft reset of Underlords Rank. Players will keep their Major Rank (eg. Outlaw, Smuggler, Boss) and will be reset to Minor Rank 1. This shift applies to Standard, Duos, and Knockout ranks. The only exceptions are Lords of White Spire, who will be reset to Big Boss III. Boards On Tuesday, we are shipping a brand new default board and five new unlockable boards. For players who reached Level 5 in the Protopass, the two Beta Season boards (below) will be available as well. {STEAM_CLAN_IMAGE}/35233241/e7c40845780ae9cbef0349ac6fdd63e8c72e6985.png The Path to Sunbreeze and Streets of White Spire boards will also be available to Level 5+ Beta Season players. Additional Rewards for Beta Players If you reached Level 5 in the Beta Season, you’ll also get a golden Ricky Ravenhook board prop and a Beta Season wanted poster title. Wait, board props? Titles? We’ve added a bunch of new features and content to the game for launch, including new ways to customize your Loadout and Underlords game. Board props and Titles are just a couple of examples of this: {STEAM_CLAN_IMAGE}/35233241/16406ced79e40a6158ae525a8ad7deefb228f90f.png Gold Ricky will be granted to Beta players who reached Level 5 in the Beta Season, and Stone Ricky will be available for anyone who purchases the Battlepass (yes, you can get both) {STEAM_CLAN_IMAGE}/35233241/cbcdfd0228686f8acfd8e556464ad7ac6534d518.png Boards are now customizable – level up your Battlepass and earn additional props to place on your board. {STEAM_CLAN_IMAGE}/35233241/7b4698ea3331d943b0feaa542fc8c31173aebb74.png Wanted posters are now customizable as well – players can earn Achievements to unlock more titles. Custom poster artwork by Botjira and J.R. Doyle - these and more are unlockable in the Battlepass and City Crawl. See you Tuesday! We’re launching Season 1 of Dota Underlords on the morning of Tuesday, February 25th. This will ship simultaneously on Steam, iOS, and Android (normal caveats about propagation on mobile app stores still apply). That’s it for today. The team is looking forward to shipping this next week and playing Season 1 of Underlords with you all! ",1582250482,
1046930,Yoink! We Stole Some Healing From Enno,HOTFIXES Enno - Dr. Enno's Soothing Balm: changed initial heal from to Fixed an issue where the sell unit button could be hidden when you select a unit on the board after combat. Note: The gameplay change will take effect immediately for multiplayer games. The client-side UI change will roll out to mobile clients as it is approved by Google and Apple.,1581386688,['patchnotes']
1046930,Rabid Update,"GENERAL Fixed Sand King Burrowstrike not visually lifting enemies other than the last one. UNDERLORD CHANGES Enno Death Spin: Damage changed from to All Out Attack: now reads: Enno launches an All Out Attack against all enemies, applying 5 stacks of Poison, dealing 50-175 physical damage and stunning them for 2 seconds. ",1581014427,['patchnotes']
1046930,Dr. Enno's Hotfix,ENNO CHANGES Death Spin: Damage changed from to Dr. Enno's Soothing Balm: Initial Healing changed from to All Out Attack!: Cooldown changed from 12 to 10 Fixed bugs with draws. ,1580849272,['patchnotes']
1046930,Ennouncing A Small Tweak,"HOTFIXES Added poison stack count FX. Fixed a pathfinding bug that caused units to try to move to a beneficial cell even if they had no path to it. This fixes a case of units standing still instead of attacking. Fixed Tiny chasing after an enemy after tossing them only to change his mind a few steps in. Added indicator on the UI to show what item Enno has stolen. Fixed new 4-Underlord picker not fully fitting on 4:3 aspect ratio on PC. Fixed healthbar icons for Enno and Jull. UNDERLORD CHANGES Anessix: Enthrall: Cooldown changed from 15 to 10 Enno: When spinning, Enno now prefers targets that already have poison on them to keep the poison from wearing off. Escape Artist: Enno now Purges his debuffs as well when he escapes. Healin' n Stealin': Dr. Enno's Soothing Balm: Target Count changed from to Healing changed from to Now reads: Enno leaps into the air and shoots a poison dart at up to (Target Count) enemies that are within 3 cells applying a stack of Poison. Dr. Enno triages and heals all allies, healing the most injured one first for (Healing) and successively halving the amount on each additional ally. Rabid Furball: Death Spin: Target Count changed from to Damage changed from to All Out Attack!: Cooldown changed from 15 to 12 Now reads: Enno launches an All Out Attack against all enemies within 2 cells, applying 5 stacks of Poison and displacing the victims onto a random cell. Enemies not involved just watch their crewmates get torn to pieces. ITEM CHANGES Refresher Orb: No longer stealable. ALLIANCE CHANGES Spirits: Fixed an issue where units not on the ground could be counted for Delta Slam targeting. ",1580778532,['patchnotes']
1046930,Now we know the exact date Dota Underlords will be freed from early access,"<a href=""https://assets.rockpapershotgun.com/images/2019/07/DotaUnderlordsbigwarlock.jpg""> </a> After almost eight months in early access, Valve have revealed the full release date for <a href=""http://rockpapershotgun.com/game/dota-underlords/"">Dota Underlords</a> &#8211; February 25th. This will mark the start of the game&#8217;s first season, introduce a full battle pass, a new meta, and brand new content. Oh, and a new Underlord was added to the game like, last night. <a href=""https://www.rockpapershotgun.com/2020/01/31/now-we-know-the-exact-date-dota-underlords-will-be-freed-from-early-access/#more-784913"" class=""more-link""> (more&hellip;) </a> ",1580473635,
1046930,"Hey, it's Ennother Underlord","Hello White Spire! We have someone to introduce - but before we get to that, a couple words. As mentioned a few weeks ago, this will be our last major update before we come out of Early Access and ship Season 1. The team is now heads down adding features, creating content, and polishing UI. With Season 1, Underlords will introduce new content with City Crawl, new rewards with a full Battlepass, and a new meta with a Hero / Item rotation. Oh, and we have a date - Dota Underlords Season 1 is shipping February 25th. Also, keep an eye out for February's PC Gamer. They're running a cover story on the upcoming Underlords release and will have more information about Season 1 (as well as some behind the scenes info about the game's development). {STEAM_CLAN_IMAGE}/35233241/4a987f8c927bea4fdf9d11c3bb2e4b172e99219c.jpg Apart from that, things will be pretty quiet on the update front until we ship. We'll be sharing more about Season 1 in the coming weeks though, so stay tuned. And now, we'd like you to meet our little friend: INTRODUCING ENNO Most visitors to White Spire see the refuse-filled alleyways that make up The Warrens as merely slums...but to Enno, it is a Kingdom. Today, his people live in the margins of White Spire; scavenging and stealing to get by, but Enno has bigger aspirations. He believes it’s his destiny to lead his people out of the shadows into greatness, and he will employ every underhanded tactic he can think of in order to make that dream a reality. {STEAM_CLAN_IMAGE}/35233241/87802210e9f5415f366c352d1739b74ad57cb9f7.png Enno is always on the move - darting around and poisoning enemies with ranged attacks. If he's ever in a pinch he pulls the ripcord and escapes the board for a breather, before coming back and stunning adjacent enemies. Depending on what mood you catch him in Enno employs different ""tactics"". Sometimes Enno will steal items from the enemy crew, while healing his own crew. Other times he'll amp up his own damage and pull the enemy crew in for an all out attack. For more on Enno, check out this Enno sized website we made just for him. PATCH NOTES: Added Enno A ranged menace, Enno leaps around the board poisoning enemies and generally wreaking havoc. Enno will be one of the four Underlord options available at the end of Round 1 in Knockout and at the end of Round 9 in Standard and Duos game modes. One of two Enno builds (detailed below) will be randomly presented. Passive Skill - Escape Artist Once per combat, when dropping below 25/50/75% health, Enno escapes in a cloud of smoke, reappearing elsewhere on the board, stunning adjacent enemies for 1.5 seconds. Build 1 - Healin' n' Stealin'! Dr. Enno's Soothing Balm: Enno leaps into the air and shoots a poison dart at up to 2-5 enemies that are within 3 cells, applying a stack of Poison and healing adjacent allies for 15-60 per stack. Yoink!: Enno steals the lowest tier item from the enemy crew at the start of combat. Whenever an enemy dies in Enno's attack range, he loots them if they have a better item equipped. All items return to their original owners at the end of combat. Build 2 - Rabid Furball Death Spin: Enno leaps into the air and shoots a poison dart at up to 2-5 enemies that are within 3 cells, applying a stack of Poison and dealing 20-55 physical damage per stack. All Out Attack!: Enno lassos the enemy team and launches an All Out Attack! dealing 50-225 physical damage, applying 5 stacks of Poison and displacing them into a random cell. POISON Added a new status effect, Poisoned. Poisoned units take 15 physical damage per second and healing is reduced by 10% for 5 seconds. Poison effects can stack up to 5 times. GENERAL CHANGES Improved lighting used by the Underlords. Fixed issues with low resolution textures on the Underlords on mobile. Further fixes to the map not loading when starting a match. Fixed an issue where a dead unit on a cell could prevent a live unit from being selected. Fixed wrong rank icon sometimes being displayed on the post-match screen. Fixed more places where an Underlord's base ability icon or name would be shown, rather than the version of that ability used by the Underlord build. Added more pizzazz to the Underlord picker. Target Buddy has begrudgingly put away his holiday hat, since it's apparently ""not the season"" anymore. UNDERLORD CHANGES Jull: fixed Barrels of Fun barrels hitting Spiderlings. Hobgen: fixed enemy Spiderlings causing other enemies to take decreased damage from Implosion and Shockwave. UNIT CHANGES Venomancer: Venomous Gale: Now applies poison to its targets. ITEM CHANGES Blade Mail: Fixed bonus armor error in description. Orb of Venom: Instead of applying damage, Orb of Venom now applies poison. ALLIANCE CHANGES Brute: Fixed an issue where Brutes could switch targets mid-swing. ",1580421863,
1046930,We Delta Slammed Some Bugs With Bugs,"GENERAL CHANGES Improved board-loads-black bug. There are still some rough edges here that have been hard to track down, though, and we're still working on it. Fixed an issue where tapping on an Underlord ability in the unit status panel during preparing/combat, rather than on the ability icon in the lower corner Underlord displays, would trigger the wrong popup description. Fixed an issue with Underlord ability tooltips/popups that showed numbers from one level higher than the current player level, if the number was level dependent. UNDERLORD CHANGES Anessix: Damage Support: Enthrall: Duration of Enthrall targeting changed from 5.0 to 6.0 The End of Medicine: Attack Damage Bonus changed from 30% to 35% Hobgen: High Damage Dealer: Implosion: Damage changed from to Friendly Fire: Damage changed from to HERO CHANGES Batrider: Sticky Napalm: Change minimum damage threshold for Sticky Napalm damage to proc from 25 to 5. Fixed a bug where Radiance and Orb of Venom could trigger Sticky Napalm damage. Dragon Knight: Maximum Health changed from to Attack Damage Minimum changed from to Attack Damage Maximum changed from to Breathe Fire: Enemy Attack Damage Reduction changed from % to % Damage changed from to Gyrocopter: Attack Damage Minimum changed from to Attack Damage Maximum changed from to Ace Effect: Pierce percent changed from 100 to 75 Io: Relocate: Fixed a bug where Refresher Orb would not refresh Relocate Legion Commander: Attack Damage Minimum changed from to Attack Damage Maximum changed from to Duel: Bonus Damage per duel win changed from to Slark: Attack Damage Minimum changed from to Attack Damage Maximum changed from to Essence Shift: Bonus Damage gain per attack changed from to Attack Speed gain per attack changed from to Sven: Maximum Mana changed from 200 to 150 God's Strength: Mana Cost changed from 200 to 150 ITEM CHANGES Barricade: Number of Barricades changed from 2 to 3 Tier changed from 2 to 3 Maximum Health per Barricade changed from to Blade Mail: Bonus armor now shows during preparing phase on unit status panel. Claymore: Bonus Attack Damage changed from 30 to 33 Desolator: Added missing FX. Hand of Midas: Percent Chance to gain gold on kill changed from 30% to 25% Horn of the Alpha - Thunderhide: Attack Damage Minimum changed from 100 to 120 Attack Damage Maximum changed from 150 to 160 Attack Rate changed from 0.935 to 1.0 Maximum Health changed from 3750 to 4500 Mekansm: Tier changed from 3 to 4 Morbid Mask: Lifesteal percent changed from 20% to 30% Orb of Venom: Damage Per Second changed from 30 to 35 Pipe of Insight: Tier changed from 4 to 3 Satanic: Bonus Health changed from 750 to 850 Tombstone - Zombie: Attack Rate changed from 0.833 to 1.0 ALLIANCE CHANGES Primordial: Eidolon: Attack Rate changed from 0.667 to Armor changed from to Spirit: Fixed Delta Slam targeting to not count spiderlings when computing which triangle damaged the most enemies. Fixed Delta Slam no longer killing spiderlings. ",1579891878,
1046930,Anti-Tank Guided Hotfix,"HOTFIXES Now that we have a fully operational beef-station in Jull, it looks like the tanky fellow is a bit too hard to kill. Changes below. Crystal Maiden will no longer cast Frostbite on a target that is currently frostbitten. Fixed an issue where Void Spirit could Dissimilate on top of another unit. Jull: Armor changed from to Maximum Health changed from to Magic Resistance changed from 25 to 15 To Your Health and Roundhouse: Damage reduction changed from 70% to 50%. To Your Health: changed friendly healing from 200% to 100%. ",1579305361,['patchnotes']
1046930,To Your Health! Here's an Update,"GENERAL CHANGES Fixed an issue with assassin pathfinding that led to them standing still or ignoring forced targets. Improved pathfinding performance, leading to better local bot game performance. Fixed an issue with a Batrider voice line. We failed you and we're sorry. Fixed Anessix's Golem using the upgraded model all the time. UNDERLORD CHANGES Jull: Maximum Health changed from to Added base Magic Resistance of 25% Aggressive Tank: fixed Barrels of Fun giving enemies damage resistance rather than taking increased damage. Aggressive Tank: replaced Slow Burn with Roundhouse: Jull gains 70% damage reduction, 200 Attack Speed, and 50% lifesteal for 5 seconds. Healing Tank: replaced Righteous Healing with To Your Health: Jull gains 70% damage reduction for 5 seconds. Adjacent allies are healed for 200% of damage taken by Jull during this time. HERO CHANGES Alchemist: Acid Spray: Armor Reduction changed from to Crystal Maiden: Frostbite: Damage changed from to Duration changed from to Dragon Knight: Maximum Health changed from to Earth Spirit: Tier changed from 3 to 2 Ember Spirit: Tier changed from 2 to 3 Morphling: Waveform: Damage changed from to Cooldown changed from to 6 Omniknight: Maximum Health changed from to Razor: Plasma Field: Minimum Damage changed from 25 to 40 Maximum Damage changed from to Shadow Shaman: Voodoo: Will not hex the same target twice unless all other targets have been hexed already. Sniper: Assassinate: Cooldown changed from 10 to 12 If no units are alive on the enemy side except the Underlord, Sniper will be able to cast Assassinate on the Underlord after all. In all other circumstances Sniper will still not cast on the enemy Underlord. Storm Spirit: Ball Lightning: Base Damage changed from to Extra Damage (per cell traveled) changed from to Tiny: Maximum Health changed from to Attack Damage Minimum changed from to Attack Damage Maximum changed from to Treant Protector: Leech Seed: Cooldown changed from 7 to 10 Viper: Nethertoxin: Damage changed from to ITEM CHANGES Diffusal Blade: Clarified tooltip to mention the damage it does per hit. Damage per hit changed from 20 to 30 Horn of the Alpha: Fixed an issue where a unit with Horn of the Alpha, if revived by Io, would summon another Thunderhide. Mask of Madness: Fixed an issue where Mask of Madness would not get credit for healing on the Healing unit meters tooltip. Vladmir's Offering: Damage percent increase changed from 10% to 8% ALLIANCE CHANGES Heartless: Armor debuff to enemies changed from to Hunter: Extra Shot Chance changed from to Insect: Fixed a bug where spiderlings won't be summoned if Insects are boxed in and can't move at the start of the round. Knight: Damage reduction changed from to base, or to total if standing next to another Knight and attacked from the front. Mage: Extra Magic Damage changed from to Spirit: Damage per Spirit during Delta Slam changed from 200 to 225 ",1579234228,
1046930,Dota Underlords and the autobattler genre is struggling to keep players,"Few realised at the time, but last January we witnessed the birth of a genre. <a href=""https://www.rockpapershotgun.com/game/dota-auto-chess/"">Dota Auto Chess</a> shot to the top of Dota 2&#8217;s custom games, enticing MOBA players with wizarding army management. The big names took notice. By June we had Riot&#8217;s <a href=""https://www.rockpapershotgun.com/game/teamfight-tactics/"">Teamfight Tactics</a> and Valve&#8217;s <a href=""https://www.rockpapershotgun.com/game/dota-underlords/"">Dota Underlords</a>, squaring off against each other. An unknown number of millions flocked to TFT, while Dunderlords hit 200,000 peak concurrent players. Six months later, Teamfight Tactics seems relatively stable, while Dota Underlords is dropping fast. We normally don&#8217;t pay player numbers much heed, but given autobattlers were last year&#8217;s big new genre and Dota and League Of Legends are both long-term titans, it&#8217;s hard not to ask the question: how come? <a href=""https://www.rockpapershotgun.com/2020/01/15/dota-underlords-and-the-autobattler-genre-is-struggling-to-keep-players/#more-774823"" class=""more-link""> (more&hellip;) </a> ",1579095009,
1046930,Dota Underlords tunnels out of early access in February,"The undertown is nearly ready. Its <a href=""https://www.rockpapershotgun.com/game/dota-underlords/"">Dota Underlords</a> are chomping at the bit, a mere month away from the point where Valve go &#8216;yep, that&#8217;s version 1.0&#8217; and bury the early access label on their wizarding general simulator. They say all this in <a href=""https://steamcommunity.com/games/underlords/announcements/detail/1696102156440335798"">their post about yesterday&#8217;s update</a>, a smaller affair aimed at reducing misclicks, fixing bugs, and delivering the usual round of balance tweaks. <a href=""https://www.rockpapershotgun.com/2020/01/10/dota-underlords-tunnels-out-of-early-access-in-february/#more-773933"" class=""more-link""> (more&hellip;) </a> ",1578661012,
1046930,Dota Underlords is leaving Early Access in February,"This week&apos;s <a href=""https://www.pcgamer.com/dota-underlords/"" target=""_blank"">Dota Underlords</a> update was accompanied by the news that it&apos;s almost broken free of Early Access and will soon hit 1.0. It launched on Steam back in June, and in February the first season will officially kick off.&#xA0; It&apos;s not a moment too soon, as Valve&apos;s auto battler has been <a href=""https://www.pcgamer.com/dota-underlords-peak-player-count-has-dropped-by-more-than-90-percent/"" target=""_blank"">losing traction</a>. Initially it boasted a player count that was double Artifact&apos;s at its peak, but it&apos;s steadily been declining, now down by around 90 percent, and so far has shown no signs of plateauing. No update has managed to move the needle significantly, but the 1.0 update should get a bit more attention.&#xA0; There&apos;s only one more update to go before the milestone, along with some balance tweaks and fixes, and one more Underlord. The 1.0 patch that follows will include the battle pass, hero/item rotation, a UI update and more.&#xA0; Check out this week&apos;s patch notes <a href=""https://steamcommunity.com/games/underlords/announcements/detail/1696102156440335798"">here</a>.&#xA0; ",1578655506,
1046930,"Happy New Year, White Spire!","Hello Underlords, happy new year! Before we get to today's Update, some words: New year, new you, and coming soon – new season. That’s right, the Beta Season is nearing its end, and Underlords Season 1 will ship by the end of February. In addition to our standard bug / balance patches, we’ll probably have one more update before the big ship date - one more Underlord to round the game out. Otherwise the team will be heads down working on Season 1. This includes work on the Battlepass, City Crawl, Hero / Item rotation, and UI updates. We’ve said it before, but we want to thank you all again for playing with us during this beta / early access period. The community’s support and feedback has been invaluable to getting the game to where it is. We’re in the home stretch and are excited to ship Underlords 1.0 soon - and get the word out to a wider audience. And now, this week's update: GENERAL To prevent misclicks/mistaps, block input for 1 second when the Underlord-chooser UI appears during the game. Fixed an issue with Freestyle item list where items assigned to enemy units would be highlighted as if they were unassigned. More FX improvement and optimization. Enthralled units now get full healthbars, not summon-unit healthbars. Fixed an issue where ranked mode could stay locked when returning to the main menu after completing your last required unranked game. UNDERLORD CHANGES Anessix: Damage Support: The End of Medicine: Self damage on cast changed from 20% to 0. Enthrall: armor reduction changed from 5 to 10. When Anessix casts Enthrall and targets an enemy unit, and friendly units run to attack it, if a friendly unit must move more than 2 cells to attack the new target, it will disregard the new target and keep its old target. Healing Support: Rejuvenating Ritual: Self damage on cast changed from 20% to 5%. Summon Demonic Golem: The golem will now stun nearby enemies 0.25 seconds after it lands. This will prevent one golem disrupting the summoning of the opponent's golem. Anessix's Golem: Fixed a bug with the attack damage stats, they were not converted over properly from the old base-plus-talent version of Golem to the new scaling system in the Jull update when the Golem's health was. Attack Damage Minimum changed from to Attack Damage Maximum changed from to Hobgen: Support Damage Dealer: Let's Go Crazy: Attack Speed Bonus changed from to Jull: Aggressive Tank: Barrels of Fun: the barrels now ignore Spiderlings. HERO CHANGES Clockwerk: Battery Assault: Delay between damage procs changed from to 0.7 Ember Spirit: Sleight of Fist: Bonus Damage changed from to Kunkka: Maximum Health changed from to Attack Damage Minimum changed from to Attack Damage Maximum changed from to Sniper: Assassinate: Will no longer target Underlords. Viper: Maximum Mana changed from 50 to 70 Nethertoxin: Cooldown changed from 5 to 6 Mana Cost changed from 50 to 70 ITEM CHANGES Battle Fury: Bonus Attack Damage changed from 35 to 50 Fixed an interaction with Ember Spirit's ability Sleight of Fist where Battle Fury could cleave damage to 4 additional targets, rather than 2, on each Fist hit. Scythe of Vyse: Fixed an issue where Scythe could waste its charge on an un-piggable enemy. Vesture of the Tyrant: Duration of the Undying effect changed from 4.0 to 6.0 ALLIANCE CHANGES Assassin: Critical Hit bonus damage changed from to Hunter: Bonus Attack Chance changed from to . Number of Bonus Attacks changed from 2 to . Scrappy: Bonus Armor changed from 8/16 to 7/14. HP Regen unchanged at 8/16. Warrior: Bonus Armor changed from to ",1578596240,
1046930,The Fix In Which Happy Hour Is No Longer Unhappy,"HOTFIXES Jull - Healing Tank - Happy Hour now no longer increases damage taken by friendly units. Black King Bar can now trigger while the unit which has it equipped is casting its own ability. Fixed some cases where magic-immune units could still be stunned or damaged (Hobgen - Explosivo stun, Delta Slam - affecting magic-immune and invulnerable units). Fixed a pathfinding issue where a unit would want to move to an adjacent beneficial cell, but the cell was not free, so the unit ended up not doing anything. As these are server-side fixes, they will take effect immediately on iOS and Android without needing a client update.",1578361898,['patchnotes']
