appid,title,contents,date,tags
1046930,Dota Underlords' peak player count has dropped by more than 90 percent,"<a href=""https://www.pcgamer.com/dota-underlords/"" target=""_blank"">Dota Underlords</a>, Valve&apos;s Early Access auto battler, has shed most of its players in the six months since it launched on Steam. In June, it peaked with more than 200,000 people playing concurrently, according to <a href=""https://steamcharts.com/app/1046930#48h"" target=""_blank"">Steam Charts</a>, but in the last day it&apos;s had fewer than 15,000.&#xA0; Spotted by Reddit user <a href=""https://www.reddit.com/r/Games/comments/ekfmay/half_a_year_after_its_release_daily_peaks_for/"" target=""_blank"">SharkyIzrod</a>, the average player number has dwindled to just over 11,000, with peak players below 20,000. When Underlords launched, auto battlers seemed like the thing to watch, but interest in the genre as a whole seems to have sunk considerably since.&#xA0; The number has been dropping consistently every month, so it doesn&apos;t look like updates have tempted players to return yet. Recent Steam reviews are still mostly positive, however, so it doesn&apos;t look like widespread dissatisfaction is the cause.&#xA0; It calls to mind Artifact&apos;s troubles, unfortunately, which Valve ended up pausing and now averages around 100 players. In that case, however, the exodus was more immediate and severe, and Underlords isn&apos;t quite there yet&#x2014;the player count hasn&apos;t settled, though. Riot&apos;s auto battler bid, Teamfight Tactics, seemed to be doing a lot better the last time the company announced figures. In September, it apparently had a monthly player base of 33 million. It seems here to stay, then, but the future of the genre itself seems a lot less certain.&#xA0; Though the dip is less pronounced, Dota 2 also had a relatively saggy month. The first half of 2019 saw it get close to returning of the highs of 2015 and 2016, but over the last 30 days it&apos;s dropped to the lowest its been since 2014, with an average of 393,589 players and a peak of 627,790.&#xA0; ",1578324751,
1046930,The Update In Which Friendly Fire Gets Even Less Friendly,"GENERAL Draws no longer grant a free reroll. Fixed Assassins being stuck trying to attack a target they can't reach. Fixed an issue where being interrupted during an attack could result in starting a new attack without waiting for the old attack to finish its swing timer. Fixed units with high attack speed waiting too long for their next attack if they switched targets. Fixed incorrect cooldown display causing some Ultimates to look ready when they were not (e.g. Friendly Fire). UNDERLORD CHANGES Anessix Summon Golem: Sped up spawn animation now that the Golem can only crash into the battlefield. Hobgen: Friendly Fire: Fixed an issue where Friendly Fire could cause no damage. Damage changed from to Jull: Fixed Aggressive Tank Jull healing enemies. Happy Hour: Fixed not properly reducing damage. Duration changed from 7.0 to 10.0 Instant damage taken changed from 30 to 50 HERO CHANGES Shadow Demon: Demonic Purge: Fixed not having a cast animation. ITEM CHANGES Round 1 Item Tier Odds now 100% Tier 1. Round 10 Item Tier Odds now 100% Tier 2. Aeon Disk: Tier changed from 4 to 3. Eul's Scepter: Fixed the Sceptered unit not reserving its cell. That could cause another unit to spawn in or occupy the cell while the Sceptered unit was still in the air. Maelstrom Damage now reduced by 20% each lightning leap, so only the first target hit each cast takes full damage. Vladmir's Offering: Tier changed from 3 to 4. ALLIANCE CHANGES Champion: Damage bonus per active alliance changed from 8% to 3%. Health bonus remains 8%. Scrappy: Armor bonus changed from 9 to 8 and disadvantaged armor bonus changed from 18 to 16. Warrior: Armor bonus changed from to Warlock: Lifesteal changed from to . Link duration changed from to ",1577577117,['patchnotes']
1046930,Let's Go Have an Update,NOTE: Please quit (force-close on mobile) your clients and restart them to receive this update. ITEMS Vladmir's Offering - Multiple of this item no longer stack. UNDERLORDS Hobgen (Support Damage Dealer): Explosivo! damage changed: OLD: . NEW: . Let's Go Crazy Attack Speed Bonus changed: OLD: . NEW: . ,1577145858,['patchnotes']
1046930,Jull Want This Hotfix,"NOTE: This patch is live on PC and on servers now, but will roll out to Android and iOS clients once approved. If you're playing multiplayer games, or proto-pass bot games, you'll get the new balance changes even with an old client. ITEMS For Standard and Duos modes, item odds have been shifted so that higher tier items become available earlier in the match. For full details see the Glossary section of the Rulebook. Vesture of the Tyrant - item reworked. OLD: ""Allies within 1 cell can't die until the equipped hero dies."" NEW: ""Whenever an ally within 1 cell of the equipped hero receives a killing blow, that ally survives for 4.0 seconds."" Stonehall Pike - bonus damage from kills changed from +4 to +3. (+16 to +12 in Knockout) Talisman of Evasion - evasion bonus increased from +20% to +25%. Black King Bar - magic immunity duration increased from 5 seconds to 10 seconds. ALLIANCES Savage: attack damage bonus per attack increased from to Insect: Changed from a 3-unit Alliance to a 2/4 unit Alliance. Number of insects changed from 12 to Insect debuff miss chance changed from 30% to %. UNDERLORDS Anessix (Healing Support): Martyr's Boon - increased regeneration. OLD: immediate heal amount: , regeneration amount: NEW: immediate heal amount: , regeneration amount: Anessix (Damage Support): Enthrall - now targets the nearest enemy. Hobgen (High Damage Dealer): Explosivo - fixed a bug that was preventing this ability from dealing damage. ACHIEVEMENTS The Achievement for defeating a set number of Neutral Rounds has been replaced with an Achievement to Obtain a set number of items.",1576807581,['patchnotes']
1046930,Jull-tide Greetings,"Happy Holidays Underlords! Some big changes and updates for you all today - we're introducing a new Underlord, bringing in a new rotation of items, and making some significant gameplay changes. There is a bunch to cover, so let's get into it. As always, if you prefer your updates in bullet point form, go check out the patch notes. INTRODUCING JULL The proprietor of the infamous “Sundered Moon”, Jull is a businessman first and a criminal second. Did he break a few legs to get to where he is? Yes. Does he run a massive smuggling operation to ensure that his bar is stocked with the fine beverages that Icewrack is renowned for? Of course. But while Jull has little interest in following the law, he takes great pride in honoring his word. In the wake of Mama Eeb’s death, he feels like he alone has the temperament and strength to restore order to the criminal underworld of White Spire. {STEAM_CLAN_IMAGE}/35233241/e4ee6798e8586e81e31f584f1843d0ce66cd34ec.png Jull leads by example, and prefers to get his paws dirty with powerful melee attacks on the front line. When things get tough Jull uses his bootlegged wares to gain an edge… either by rolling barrels into enemies, or by raising his glass to inspire his crew. UPDATED ITEMS With this update, the item roster has also been revamped. Many old standbys have been shelved (though you may be seeing them again in the future) while others have been pulled out of storage. New items like Crystalys, Butterfly, and Horn of the Alpha can now be equipped to buff your crew and defeat your opponents. {STEAM_CLAN_IMAGE}/35233241/027ef74ccdb0503f4dd96f92b91995b60682c0e7.png GAMEPLAY UPDATES Over the course of our Beta season, we’ve worked to continuously experiment, learn, iterate, and improve the game. The time since our last Big Update has been no different, and with this update we have made some significant changes based on community feedback, as well as what we've internally learned and tested. NEW UNDERLORD SELECTION FLOW Underlords are now picked at Round 10 instead of the beginning of the match, and Talents have been converted into fighting styles. Each Underlord has two builds, and one will be shown at random for each Underlord during this pick phase. For example, you may have a choice between Anessix - Healing Support, Hobgen - Support Damage Dealer, and Jull - Aggressive Tank. Full build info can be found in-game and in the patch notes. {STEAM_CLAN_IMAGE}/35233241/232c031b9eb43a0d099c5be5afc71e15f4024e4a.png In Standard and Duos, Underlords are chosen at Round 10, while in Knockout this happens at Round 2. JAILBREAK The Jail system was introduced to solve a few problems - namely to make it easier to combine units with our ever-expanding roster of heroes. While this was accomplished, there were a bunch of unintended side effects. It wreaked havoc on some of our balance tweaks, kept players from playing their favorite heroes and alliances, and many players didn’t enjoy having to check it every day. That's why we've decided to shut down the Rookery and release all of the inmates indefinitely. The heroes that are in the game will always be hire-able in the shop, and players won't have to worry about their favorite Alliances being crippled because of a bad Jail day. That said... UPDATED HERO ROSTER White Spire does still have an overpopulation problem. To solve this, a few heroes have been booted from White Spire (for now...). As we mentioned at the very beginning of our Beta Season, we intend to have a hero rotation every season, and we're getting ready for Season 1 with our first rotation. After plenty of testing and feedback we came up with a slimmed down set of heroes to build your crew with. Not to worry though, you may still be seeing some new and familiar faces when Season 1 ships. For a full list of there heroes taking a break, check out the patch notes. SHORTER STANDARD & DUOS MATCHES We've also made major changes to the Standard and Duos game flows to make the overall games shorter. We've taken what we've learned from Knockout, internal testing, and from our community at large to make games shorter and more fun. To accomplish this, matches are now jump-started with all players at Level 3 with 5 gold. We've removed creeps from the loot rounds and reduced hero HP by 25%. Loot rounds now happen during normal PvP rounds, but your item choices won't be affected by whether you won / lost. The team has been having a great time playing the updated Standard mode, and we've seen a significant decrease in match time - down to an average of thirty minutes. POLISH Last and most definitely not least, the team has put a bunch of time into polishing UI, fixing crashes, optimizing effects, and squishing bugs. For a full breakdown of these changes and all of the other changes listed above, check out the patch notes. That's it for today! Happy holidays, and see you in White Spire! ",1576696071,
1046930,Jull-tide Changelog,"ROUND LENGTH All units have had their health lowered by 25%. Health values are now 1.5x the original values that we shipped with the game initially. Dev Note: We wanted to find a balance between early game and late game survability for our units. Doubling the health was too much, and we think we found a good balance with the new health values. STANDARD / DUOS MODE FLOW CHANGES Starting Unit Cap changed from 1 to 3. Players start with 5 gold. Interest is now capped at 3 (rewarded at a maximum of 30 gold) Round Gold increased from 5 to 7. Creep rounds have been removed. Items are granted every 5 rounds. Item quality does not change if you win or lose the round. Underlords are no longer selected before the game and are now pickable in a new phase later into the match (Round 10 for Standard/Duos, Round 2 for Knockout). Higher tier units now deal more damage to enemy players at the end of a round. Unit damage is now = 1 + (Power Level / 3) 1 star unit Power Level = Tier 2 star unit Power Level = Tier + 2 3 star unit Power Level = Tier + 4 GENERAL CHANGES The Lords of White Spire leaderboard has been updated to support Ranked Knockout and Ranked Duos. https://underlords.com/leaderboard You can now view stats from previous rounds in the post-game scoreboard. You can now view the duos scoreboard on the post-game screen. Knockout tries to avoid giving you the same opponent twice in a row. The multiplier for permanent stat changes in Knockout for e.g. Brawny kills or Legion Commander duels is now 4 instead of 5. UNDERLORDS Underlords have changed based on community feedback. Players don't start the game with an Underlord, instead they are chosen during the match (Round 10 for Standard/Duos, Round 2 for Knockout). Underlords have been streamlined into Fight Styles. Fight Styles contain a Core ability and an Ultimate. Underlords talent selection has been removed. Some of the talents have been merged into the Core Underlord abilities. See individual Underlord sections below. Hype system has been removed. Underlords will cast their abilities on cooldowns. Underlord Core abilities start each round with 50% cooldown remaining. (eg. Anessix's Martyr's Boon has an 8 second cooldown. It will trigger for the first time 4 seconds into the fight.) Ultimate ability cooldowns have been lowered and their power level increased. Anessix: Martyr's Boon: Anessix takes damage equal to 20% of her max health. All allied units heal hitpoints a second for the next 6 seconds. Cooldown changed from 12.5 to 8 Duration changed from 8 to 6 Healing Support Fighting Style: Martyr's Boon now delivers the first 50% of the heal immediately, and the rest over the duration of the spell. Damage Support Fighting Style: Instead of healing, Martyr's Boon now grants 30% increased attack damage. Pure Pain: Removed from game. Enthrall: Anessix marks a target for 5 seconds, reducing the target's armor by 5 and forcing your army to attack it. If the target dies, Anessix brings them back as a Demon to fight for her. Granted via Damage Support Fighting Style. Cooldown changed from 22 to 15 Summon Demonic Golem: Anessix summons a Demonic Golem, crashing behind enemy lines and stunning every enemy within 2 cells for 2 seconds. Granted via Healing Support Fighting Style. Cooldown changed from 22 to 15 Armor changed from 5 to 0 Maximum Health changed from to Hobgen: Explosivo!: Hobgen launches a fireball at a target that deals magical damage split evenly amongst all targets adjacent and setting them all on fire. High Damage Dealer Fighting Style: Doubles the effect of Explosivo! on the main target. Support Damage Dealer Fighting Style: Enemies hit are stunned for 1.5 seconds. Super-Charged: Removed from game. Let's Go Crazy: Hobgen's attacks now reach the entire battlefield, and your entire army gains increased attack speed. Hobgen will continually switch targets to units that are not on fire. Granted via Support Damage Dealer Fighting Style. No longer silences Hobgen Grants your entire army attack speed. Cooldown changed from 22 to 10 Friendly Fire: Hobgen's buddies throw 8 bombs in the battle field dealing damage to enemies directly hit. Enemies caught in the explosion AoE take half damage. Granted via High Damage Dealer Fighting Style. Cooldown changed from 22 to 15 Jull: !NEW! Shake It Off: Jull reflects 50% of melee damage taken back to all adjacent enemy units, and heals for 30% of melee damage and 15% of ranged damage taken over the last 5 seconds. Aggressive Tank Fighting Style: The reflected damage is now delivered over 8 seconds instead of instantly, but deals twice as much damage. Healing Tank Fighting Style: Damage is also converted to healing split evenly to adjacent friendlies. Cooldown: 10 seconds. Barrels of Fun: Jull calls in barrels from the edges of the board. If they hit an ally, they gain 50 attack speed. If they hit an enemy, they take physical damage and receive 20% more magical and physical damage for the rest of the fight. Granted via Aggress...",1576696027,['patchnotes']
1046930,The Bug Smash Update,"GENERAL Fixed the most common crash on Android. Added a Play Again option to the Post Match page. Fixed another issue with item dragging. Fixed an issue on the in-game leaderboard where names in some languages were getting clipped. Fixed Snapfire health bar icon in combat. Fixed Alliance popup dialogs getting stuck in the Rulebook on mobile. Fixed damage bars not taking up the whole width of the battle stats window. Fixed an issue where the order of unit alliance icons in the shop didn't match the board alliance icon order right underneath them. Fixed issue with missing rank up icons on the rank up popup. When changing language in settings, show a popup reminding you to restart the app. After a hero has died do not allow selecting their cell to select the dead unit on the cell. ",1576194292,
1046930,We Ranked Up Our Knockout Game,"GENERAL Fixed so many crashes we didn't have time to make a crashfix joke: Fixed a number of crashes related to UI particles and dragging units; Fixed a crash when resorting items in the Rulebook; Fixed an engine-level iOS crash; Fixed a crash from showing unit ranges. Fixed an issue where the minijail popup would continue to display even if the user opened a new page from the main menu. Fixed some issues with Select Underlord page on phones with nonstandard resolutions/aspect ratios. Fixed an issue with Tap to Move working incorrectly during combat. Fixed an issue on PC where items could not be equpped when the screen resolution was 1360x768 Fixed end-of-round VO not playing. Fixed an issue with share codes and full benches. RANKED KNOCKOUT We've added a ranked mode for Knockout! Your Knockout rank is independent of your Standard rank. We removed the rank display from the main menu. You can now see your rank in the Play page. Select a mode and Ranked as the way to play that mode and you'll see your rank. TALENT CHANGES Absolute Unit: Fixed Golem health to actually double when the talent is selected. Normal Golem health is 3000. Absolute Unit health changed from 5000 to 6000. HERO CHANGES Bloodseeker: Bloodrage: Bloodseeker now heals if any adjacent enemy unit dies, no matter what kills it. Crystal Maiden: Frostbite: Now prevents the target from healing for the duration of Frostbite's effects. Ogre Magi: Draft Tier changed from 1 to 2 Snapfire: Ol' Scatterblast: Fixed an issue where the blast cone could be inconsistent in some cases. Weaver: Shukuchi: Will no longer Shukuchi if Rooted. ALLIANCE CHANGES Demon: The damage bonus now counts all allied demons, both alive and dead, as well as all allied demons summoned. ",1575591432,
1046930,The Update In Which We Debuff A Debuff,"GENERAL We let the Brutes debuff some crashes. Fix numbers not showing on global item tooltips on the in-game scoreboard. HERO CHANGES Disruptor: Ace Effect: Instead of increasing number of links per Alliance level, the duration of the link is now increased by 1 second per Alliance level. ALLIANCE CHANGES Brute: Changed damage debuff from to Changed debuff duration from 3 to 4 ",1575328117,['patchnotes']
1046930,An Update for U and I,"GENERAL Completely redesigned the UI flow when pressing the Play button from the dashboard. There's now a new page for selecting the type of match you want to play and what options you want. We're loving it, and we hope you do too! Added more audio cues in Knockout mode when you lose a heart or a player is knocked out. Fixed an issue where item images could fail to appear in the Rulebook. Fixed an issue with the shop button's location overlapping Reroll on some aspect ratios. Fixed Show Scoreboard button on all layouts and aspect ratios. HERO CHANGES Void Spirit: Dissimilate: Fixed a bug where the damage dealt was done as Physical. It should be Magical. Display damage type on the ability description window. ",1575321551,
1046930,"It's like Duos, But For Updates!","GENERAL We dragged some crashes on drag right out of the game. And some other crashes too! More memory savings on mobile! Fixed Snapfire's mana bar showing up when the Dragon Alliance wasn't active. Fixed the spectate next/previous hotkeys not working. Fixed an issue where the wrong Underlord could speak on the Post Match screen if you were spectating at the time you won (or lost) the match. Added some UI to signal that the heroes from your initial Knockout crew sell for 0 gold. TALENT CHANGES Sharp Pain: Damage increase to Pure Pain changed from 100% to 50% Sympathy Pains: The extra target no longer takes the full damage, it now takes 50% of the damage. HERO CHANGES Lich: Chain Frost: Cooldown changed from to Necrophos: Death Pulse: Cooldown changed from 7.5 to 5 Snapfire: Mortimer Kisses: Damage changed from to Sets targets on fire. Storm Spirit: Ball Lightning: Damage changed from to Damage per cell changed from to Venomancer: Venomancer is now a Savage Scaled Warlock Witch Doctor: Paralyzing Cask: Bounces changed from to Cooldown changed from 15 to 10 ALLIANCE CHANGES Mage: Extra Magic Damage changed from to Primordial - Eidolon: Armor changed from to Maximum Health changed from to Savage: Bonus damage per attack changed from to Scaled: Magic Resistance changed from to Warlock: Lifesteal Percent changed from to Lifesteal Duration changed from 2 to ",1574882582,['patchnotes']
1046930,Dota adds two new heroes with the Outlanders Updates today,"<a href=""https://assets.rockpapershotgun.com/images/2019/11/dota-2-snapfire.jpg""> </a> A lizard-riding auntie with a shotgun and an incarnation of aether today arrived in <a href=""https://www.rockpapershotgun.com/game/dota-2/"">Dota 2</a> and <a href=""https://www.rockpapershotgun.com/game/dota-underlords/"">Dota Underlords</a> in matching Outlanders Updates. Snapfire and Void Spirit are the two new heroes announced at The International in August, and here they are in both games now. They&#8217;re accompanied by big updates for each, with Dota 2 adding new buildings and dozens of new items and Underlords adding a new quick-paced mode plus the other Spirit heroes. These patch notes sure are a lot to take in. Damn, Dota. <a href=""https://www.rockpapershotgun.com/2019/11/26/dota-adds-two-new-heroes-with-the-outlanders-updates-today/#more-761901"" class=""more-link""> (more&hellip;) </a> ",1574795976,
