appid,title,contents,date,tags
1046930,The Outlanders Update,"We are updating Underlords today with the Outlanders, a new Alliance, a speedy game mode, a new new player experience, and a partridge in a pear tree. If you'd like to see the pretty version of these update notes, check out our sparkly Outlanders website. Let’s get started, shall we? The Outlanders and the Spirit Alliance White Spire has five new heroes in town, and the Underlords can't wait to get them fighting for their crews. Snapfire and Void Spirit are new to both Dota 2 and Underlords, while the three Spirits are just tagging along to keep their long lost Spirit cousin company. Snapfire - Snapfire is a Dragon Inventor. She provides ranged support for the crew and will periodically fire a shotgun blast and slow enemy attack rate. If the Dragon Alliance is active, her lizard mount fires globs of fire at the enemy. Void Spirit - Void Spirit is a Spirit Warlock and is the Ace of Spirits. He is a melee attacker and his Dissimilate ability allows him to create portals and perform sneak attacks on opponents. Void Spirit’s Ace ability makes charged Spirits deal 100% more damage. Spirit Alliance - Void Spirit didn’t head to White Spire on his own. He brought a few cousins with him: Storm Spirit, Ember Spirit, and Earth Spirit. When three of the spirits are on the board together and charged, they fire off the Triangular Delta Slam. This damages all enemy heroes within and applies each spirit’s elemental effects. Knockout Mode We’ve added a new fast-paced game mode called Knockout. In Knockout, every player begins by choosing a starting crew of 5 heroes. It only takes two heroes to combine, and players level up automatically every other round. Each player has 4 strikes (losses) before they get knocked out and games last an average of 10 minutes. Players are matched up in a pseudo bracket and will only be fighting against other players with the same or similar health. Full game rules in the patch notes below. We are starting with Knockout Casual and will soon be adding Ranked. And of course we taught our bots how to play Knockout, so players will be able to get some quick bot games in. The team has been having way too much fun playtesting this internally and we’re excited to get in the queue with the rest of the community! New Player Experience As we get closer to shipping Season 1, we want to make sure the onboarding flow is as smooth as possible for new Underlords. With this update we’ve added a new tutorial in which Ricky Ravenhook quickly teaches new players the basic concepts in Underlords. This tutorial only gets triggered for players who have played less than three games of Underlords and only shows up once. If you’d like to run the tutorial manually, it can be found as a game mode under “Bot Match”. Mobile UI The team continues to make updates and improvements to the in-game UI. This update comes with a significant design pass to the both PC and Mobile UI, making things more legible, tappable / clickable, and visually balanced for all players regardless of device. This work is ongoing, and we look forward to hearing your feedback. Full Patch Notes GENERAL Updated new player experience - tutorial starts automatically for players who have played less than three games of Underlords. Significant design pass to the both PC and Mobile UI, making things more legible, tappable / clickable, and visually balanced. The Janitor took off some time from a busy Dota update to sweep out more crashes. Added many more 2-star and 3-star visual upgrades for heroes. Improved queue times for parties. KNOCKOUT New game mode, available for bots and for casual online matches. At the beginning of the game, choose from three starter crews of five heroes, drawn from two Alliances. These two Alliances will be completed to the first tier. Don't like your three choices? You get one reroll. Players start at level 5 and automatically level up on even rounds. Players get to choose an item on odd rounds and on the starter-crew round. Only two of the same hero are needed to rank up. Only one Underlord Talent is pickable (the Ultimate). Four strikes (losses) and you’re out. Round pairs are made based on player health - players with the same or similar health will be matched up when possible. No interest on your bank and no extra gold from streaks. Average 10 minute games. HERO CHANGES Earth Spirit: Newly added. Alliances: Spirit Warrior Tier: 3 Ability: Geomagnetic Grip - Earth Spirit summons a Stone Remnant off the map and pulls it towards his current target. Enemies struck by the incoming Stone Remnant are silenced for 3 seconds and take damage. Ability: Earth Elemental - Passive - When Earth Spirit executes a Delta Slam, he silences affected enemy units for 3 seconds. Ember Spirit: Newly added. Alliances: Spirit Assassin Tier: 2 Ability: Sleight of Fist - Ember Spirit dashes around with blazing speed, attacking all enemies within cells, then returning to his start location. Attacks deal bonus damage. Ability: Fire Elemental - Passive - Wh...",1574791166,
1046930,HotCrashFix,HOTFIXES Fixed a client crash after completing a solo ranked match and leaving the post-game screen. This was purely client side and all rank changes were still applied. This fix is out on PC and deploying on Android and iOS as soon as approved.,1574398358,['patchnotes']
1046930,The Update in which Knight is Day,"GENERAL Nerfed crashes across the board. Memory savings on mobile Improved drag behavior, including adding a particle when hovering an item over a unit. Fixed an issue where units dragged from the shop could improperly displace board units. Fixed card reward screen for mobile. Fixed a UI issue where the last row of the jail could be squished. Fixed a UI issue with win streaks on neutral rounds. Improved win/lose streak FX for the new UI. Fixed a UI issue with decimals showing in DPS meters. Added detailed tooltips to the DPS meters. Visual updates to leaderboard UI Fixed an issue with the player icon sidebar when switching between Large and Small Screen layouts. {STEAM_CLAN_LOC_IMAGE}/35233241/fe2f673c6857313b818a43a7165dfc6a3f0ec5fa.png DUOS Duos Teams Playing a Duos match with a friend now creates a persistent Duos team. The number of matches played along with your track record will be tracked for each of your teams. When you’ve played three matches with the same player, you’ll unlock the ability to name your team. Have team name ragrets? No worries, you can rename your team every three matches. Ranked Duos There is now a Ranked Duos matchmaking queue. Progress in this mode counts towards your solo (existing) rank up to Big Boss level. Each Duos team now also has its own Duos team rank, so grab a friend and become Big Bosses together! Casual Duos You can now queue for Casual Duos with a bot partner for those times when your friends aren’t online Using Team Chat, your bot teammate will request units from you to rank up heroes and complete Alliances They will also respond to your Team Chat requests for units and Alliances Be nice to your bot teammate UNDERLORD CHANGES Anessix: Maximum Health changed: -> Demon Archer: Attack Damage Minimum changed: -> Attack Damage Maximum changed: -> Hobgen: Maximum Health changed: -> Attack Damage Minimum changed: -> Attack Damage Maximum changed: -> Talent Changes: Fire Break: Damage Reduction changed from 45 to 40 Hot Rod: Attack Speed bonus changed from 10 to 15 Melting Point: Armor lost per second changed from 0.5 to 1 HERO CHANGES Anti-Mage: Maximum Health changed from to Bounty Hunter: Maximum Health changed from to Chaos Knight: Maximum Mana changed from 100 to 75 Chaos Bolt: Min Damage changed from to Min Stun changed from to Mana Cost changed from 100 to 75 Dragon Knight: Breathe Fire: Damage changed from to Faceless Void: Maximum Health changed from to Juggernaut: Attack Rate changed from to Maximum Health changed from to Attack Damage Minimum changed from to Attack Damage Maximum changed from to Legion Commander: Armor changed from 10 to 5 Maximum Health changed from to Attack Damage Minimum changed from to Attack Damage Maximum changed from to NOTE: These Legion Commander changes go hand in hand with the changes to the Champion Alliance. Luna: Attack Damage Minimum changed from to Attack Damage Maximum changed from to Morphling: Maximum Mana changed from 100 to 75 Maximum Health changed from to Waveform: Damage changed from to Mana Cost changed from 100 to 75 Nyx Assassin: Maximum Health changed from to Ogre Magi: Now a Brute in addition to being a Bloodbound Mage. Omniknight: Maximum Mana changed from 100 to 60 Maximum Health changed from to Purification: Cooldown changed from 10 to Mana Cost changed from 100 to 60 Phantom Assassin: Maximum Health changed from to Pudge: Maximum Health changed from to Queen of Pain: Maximum Health changed from to Sand King: Fixed Caustic Finale going off after every attack. Shadow Fiend: Attack Damage Minimum changed from to Attack Damage Maximum changed from to Requiem of Souls: Max projectile width changed from 256 to 425 Slark: Maximum Health changed from to Essence shift no longer reduces attack speed and damage from the target (Slark still gains the effects) Templar Assassin: Maximum Health changed from to Weaver Can no longer Shukuchi while silenced. ALLIANCE CHANGES Heartless: Armor Reduction changed from to . Warrior: Armor Reduction changed from to . Insect: Spawn rate of spiderlings changed to 3 every 0.5 seconds. This means it'll take 2 seconds to spawn the initial batch of 12. Champion: Now also grants 10% bonus damage and max health per Alliance affecting the Champion (excluding her own). Primordial: Eidolon: Armor changed from to ",1574373285,
1046930,The Update In Which We All Grow Together,"GENERAL Memory usage improvements. The Crash Police put some crashes in jail. Chickens were involved, for sure. Anessix VO improvements. You'll be hearing a bit less about the Court of Ristul now, too, from both of them. Fixed some sounds like Io's Tether and Crystal Maiden's Frostbite not persisting while the ability lasted. Improved dragging on mobile. Dead players will no longer have Underlord talents selected for them. Stay dead! The bots once again had their shiny metal heads unscrewed and more Smartness inserted. UI improvements for where the smaller item icons are displayed. Party UI improvements. Healthbars now only show stars for 2 and 3-star units. GAMEPLAY Spiderlings now die as soon as they take any damage whatsoever. Previously, HP-based damage would take many seconds to kill them. Spiderlings no longer have Alliance buffs applied to them, with the exception of Troll since it affects attack speed. Fixed an issue where Assassins would not jump if they had a castable item equipped. Round Damage is back, at 1 per every 10 rounds of the game, e.g. 1 per round at 10-19, 2 at 20-29, etc. JAIL While the jail concept succeeded at keeping the game fresher day after day, our initial implementation made it so certain alliances were overly punished (Scrappies/Inventors) while some others (Assassins) where virtually unaffected most of the time. In order to address some of these problems we are changing the jail algorithm a little bit: Every day 8 to 12 heroes are jailed. Up to 3 heroes from a single alliance can be banned. This means that some days certain alliances won’t be fully completable (this will be displayed in the ingame alliance UI) One Ace will be jailed every day. Heroes from Tiers 1-4 can no longer have more than 1 unit banned over other tiers, for example if there’s 10 jailed heroes, the Jail might might look like this: Tier 1: Two bans Tier 2: Three bans Tier 3: Two bans Tier 4: Two bans Tier 5: One ban (as always). Additionally, some units have changed alliances, which will make the impact more even across different alliances. We look forward to hearing what you think. UNDERLORD CHANGES Rank is no longer tied to Player Level. All Underlords in the game grow steadily in power throughout the game on the same schedule. At their maximum power, they are equivalent to the old version's Rank 8. Underlords no longer require Hype to cast abilities. Abilities start on cooldown and will be cast every time their cooldowns are ready. Hype now increases your Underlord's damage (up to +50% max Total Damage at full Hype) and how fast their cooldowns tick (up to 40% faster at full Hype). Ultimate abilities can now only be cast once. We thought it was time to try a different approach to Underlords. One thing we agreed strongly on was that they were overshadowing our Hero units, with the Underlords' actions (or lack thereof) changing the direction of combat too wildly. We also didn't like how hard it skewed leveling vs rolling: spending gold on XP was the clear choice most of the time. With better units in the shop, space for an extra unit on the board, and greater Underlord power, Team Rolling never had a chance. Thank you for letting us experiment on you with all these changes! Anessix: Passive Ability: Passive Hype generation changed from 1.8 to 1.5 Hype per Demon changed from 0.72 to 1.0 Martyr's Boon: Cooldown changed from 15 to 12.5 Heal per level changed from 10 to 11 No longer targets Spiderlings. Pure Pain: Damage per level changed from 10 to 15 Now targets the highest-health enemy. Enthrall: Cooldown changed from 20 to 22 Summon Demonic Golem: Cooldown changed from 15 to 22 Chaotic Hunter: Extra Shots changed from 1 to 2 Phantom Pain: Armor per level changed from 2 to 1 Anessix's Golem: Attack Damage Minimum changed from to Attack Damage Maximum changed from to Maximum Health changed from to Movement Speed changed from 270 to 260 Hobgen: Passive Ability: Passive Hype generation changed from 1.65 to 1.5 Hype per unit on fire changed from 1.2 to 1.0 Explosivo!: Base damage per level changed from 125 to 150 Cooldown changed from 15 to 12 Super-Charged: Attack Speed per level changed from 15 to 13 Cooldown changed from 5 to 8 Let's Go Crazy: Cooldown changed from 60 to 22 Friendly Fire: Cooldown changed from 15 to 22 Round will not end while bombs are exploding, in the same way as the round will not end while Gyrocopter's Call Down airstrike is in progress. Afterburn: Now burns the cells adjacent to the target cell. Duration changed from 5 to 3 Damage per second changed from 10 to 20 Fixed an issue where the effects would end when Hobgen died. Drain Bomb: No longer drains Hype. Drain amount changed from 50 to 100 Molten Armor: Only ignites adjacent attackers. Doesn't work against magic-immune or invulnerable enemies. Keep It Secret: Now reads: ""Whenever an enemy is set on fire, they are silenced for 1.5 seconds. This effect can happen again every time the fire expires."" No longer silences magic-immune un...",1573776863,
1046930,The Hotfix So Hot It Melted,HOTFIXES Fixed Melting Point not being unlockable or selectable. Took a bite out of some Apple crashes. Fixed a talent display issue on mobile in the Underlords info screen. Fixed the in-match minijail displaying the wrong heroes when the jailed heroes change daily and you're already in a match. We have submitted these fixes for review and they'll roll out for Android and iOS as soon as they are approved.,1573254585,['patchnotes']
1046930,Balance Update (11/7/2019),"GENERAL Escape key now cancels some popups. We're gradually adding more and more support for this. Fixed middle mouse button being used for the camera regardless of binding. Fixed haptic feedback bug when dragging on mobile. Added a mini-jail on hover in the shop, to quickly show the jailed heroes. Updated Duos wanted posters. Party UI improvements Other miscellaneous UI improvements. Added VO lines to more new heroes. Music and soundscape improvements. Memory usage improvements. GAMEPLAY Fire is now lethal if the applier is an enemy. Fixed a bug where Knights would not get their bonus magical damage reduction when standing next to friendly knights. Break no longer affects Alliances. HERO CHANGES Anessix: Martyr's Boon: No longer has a burst heal component, instead it heals over time. Heal per second changed from 5 to 10 (per Underlord level). Duration changed from 5 to 8 seconds. Rejuvenating Ritual: Replaces Arcane Ritual Now reads: Martyr's Boon now delivers the first 50% of the heal immediately, and the rest over the duration of the spell. Instant Regret: Duration changed from infinite to 5 seconds. Arc Warden: Tempest Double: Clones have a -50% debuff to their attack damage. Axe: Maximum Health changed from to . Bloodseeker: Armor changed from 5 to 0. Maximum Health changed from to . Bloodrage: Instead of reaching maximum attack rate at 20% health, Bloodseeker now reaches maximum attack speed at % health. Hobgen: Explosivo!: Animation Length changed from 4.0 to 2.4 seconds. Let's Go Crazy: Hype Cost changed from 100 to 85. Now silences Hobgen. Attack Range while under Let's Go Crazy increased to 8. Fire Break: Damage Reduction changed from 25% to 45%. Feedback Loop: With the new changes to Let's Go Crazy, we have brought back the old Feedback Loop: Super-Charged units gain mana from damage caused by abilities. Upon casting, they deal damage equal to the mana cost to adjacent enemies. Lifestealer: Attack Rate changed from to . Feast: Lifesteal percent changed from % to %. Magnus: Maximum Health changed from to . Pudge: Meat Hook: Cooldown changed from to . Razor: Plasma Field: Minimum damage changed from 10 to 25. Maximum damage changed from to . Troll Warlord: Fervor: Bonus attack speed changed from to . Max Stacks changed from to . Viper: Nethertoxin: Damage changed from to . ITEM CHANGES Force Staff: No longer disabled by Break. Helm of the Undying: As before, Break will prevent a unit with the Helm from entering Undying state. Now, in addition, if the unit is broken after the Helm activates, it will become targetable and killable again. ALLIANCE CHANGES Brute: Debuff to enemy attack damage changed from % to %. Damage on debuff being applied changed from to . Demon: When a Demon casts, now only allied Demons are silenced. Heartless: Armor debuff for enemies changed from to . Warrior: Armor buff for allied warriors changed from to . ",1573169877,
1046930,Hotfix 2: The Re-Piggening,FIXES Scythe of Vyse now turns units into pigs again. Skadi now has its projectiles back. Fixed Hood of Defiance not working. Fixed Sand King Burrow Strike not shifting units. Fixed a UI issue with Octarine Essence. Fixed an issue where Brute would appear as Healer on the post-match stats screen. Fixed another UI issue with the Duos scoreboard. ,1572657846,['patchnotes']
1046930,The Halloween Hotfix,HOTFIXES Fixed a crash users on old versions experienced after today's update. Fixed some UI bugs on the new Duos scoreboard. ,1572570309,['patchnotes']
1046930,The Update In Which There's More Gloating,"GENERAL Brought back the hero display on the defeat screen. Fixed an issue where if your Aegis triggers (or you lose Divine Rapier) you can no longer assign some items. AXE SMASH CRASH. Fixed matches that would normally grant XP not granting XP. Scoreboard added back to Duos! Increased post-combat time slightly for all players. Fixed a memory leak that caused slowdown when the game was played for many hours. Added Underlords to Party UI. Added two more Duos chat lines - ""Should we level up?"" and ""Should we spend to reroll?"" Fixed some assassins not leaping. Freestyle board code formats have been updated to support saving benched units. Added support for custom jails on party matches: You can set a custom party jail by clicking on your “Create Custom Jail” context menu within the party and pasting a board code. Any draftable unit in the board or bench of your board code (up to 9) will be marked as banned in that custom lobby game. Added charts to the Rulebook Glossary. Other various UI improvements. GAMEPLAY Increased cost to level up to level 9 (and therefore 10) by 10 XP. New unit odds in the shop for player level 3 and 9. {STEAM_CLAN_LOC_IMAGE}/35233241/daa7517aca10b98ade5ffb31ee578e253ca0784e.png {STEAM_CLAN_LOC_IMAGE}/35233241/738a584ada74e22ce56dda1e68de3b4a37468fe0.png Anessix: Passive Hype generation increased: 1.5 -> 1.8. Martyr's Boon: buff duration down: 8 seconds -> 5 seconds. Pure Pain: debuff duration up: 6 seconds -> 7 seconds. Chaotic Hunter: number of extra shots down: 3 -> 1. The End of Medicine: attack damage bonus increased: 25% -> 30%. Fixed A Demon's Revenge not doing damage to the killer. Fixed Phantom Pain not interacting correctly with Sympathy Pains. Now as long as one of the 2 targets affected by Pure Pain is alive, Phantom Pain is active. Instant Regret: No longer affects Underlords. Hobgen: Attack Rate changed from 0.769->0.588 Attack Damage Minimum changed from to Attack Damage Maximum changed from to Hype generation per burning unit changed 0.95 -> 1.2. Super-Charged cast time decreased by 25%. Hobgen is invulnerable and untargetable while casting Let's Go Crazy. Fixed Let's Go Crazy not applying all Super-Charged upgrades to Hobgen. Feedback Loop changed: Before: Super-Charged units gain mana from damage caused by abilities. Upon casting, they deal damage equal to the mana cost to adjacent enemies. After: Super-Charged unit's cast speed is increased by 30%. Grease Fire: Hype granted per unit hit by Explosivo! up: 1 -> 3. Got A Light? is now Burn out. Before: Enemies attacked by Super-Charged units are set on fire for 3 seconds. After: Super-Charged units have a 17% chance of stunning targets that are on fire for 1.25 seconds. HERO CHANGES Faceless Void: Chronocube: Cooldown changed -> 60. Legion Commander: Attack Rate changed 0.667 -> 0.8. ITEM CHANGES Chainmail: Bonus Armor changed 10 -> 7. Octarine Essence: Cooldown reduction changed 50% -> 30%. Target Buddy: Tier changed 2 -> 3. ALLIANCE CHANGES Savage: Bonus Attack Damage per attack changed -> Venomancer only gains 1 bonus stack on cast of Venomous Gale and does not gain per tick of that ability. ",1572564452,
1046930,The Hotfix Where We Stop The Jailbreaks,"HOTFIXES Fixed an issue (in most cases) where some users could not start multiplayer or Proto-Pass bot games (symptom: loading to the map with no UI). There is still one rare circumstance that we are trying to track down. Fixed an issue where items couldn't be equipped to units. Fixed Jail not updating ingame. Fixed Disruptor's Warlock Ace Bonus only working for 4 Warlocks, not 6. Fixed Assassins being trapped in Chronocube. Fixed Legion Commander not receiving Ace bonuses. Fixed Morphling not animating. Moved the Brawny kill tracker from unit status to the alliance tooltip. Fixed Tap To Move on mobile. Fixed alliance tooltip window being too small for some alliance descriptions. Further Radeon fixes. Fixed incorrect team names on match intro screen in Duos. Added an option to disable hero icons on healthbars. Underlord ability tooltips now show cooldowns. Added back the preview (board flip) button. Misc UI fixes. ",1572395104,['patchnotes']
1046930,Hot Weekend Fix!,"HOTFIXES Hobgen: Fixed Sticky Strike instantly killing units. Fixed sound cutting out on iOS when dragging a unit from the shop to buy it (once Apple approves this patch). Fixed Underlord In-Combat Speech checkbox being purely a placebo. Fixed Assassin's Veil causing a unit to fail to attack if the enemy Underlord is alive but unreachable. Added a specific binding option for Camera Reset. Fixed a UI issue with the Talent browser. Fixed an issue where, if a Talent round starts while you're spectating another board, you wouldn't be offered Talent choices when you return to your own board. ",1572158572,['patchnotes']
1046930,The Hotfix In Which We Undamage Damage,HOTFIXES Fixed an issue with the damage meters on PC where the scrollbar could hide some numbers. Fixed multiplayer and proto-pass bot matches on old clients (including the only active iOS client). ,1572065618,['patchnotes']
1046930,The Itemized Hotfix,"HOTFIXES Fixed an issue with dragging items on mobile (when Android and iOS stores approve). Fixed an issue resulting in reduced shields with the new Knight alliance (included, but not patchnoted) in the Big Update. Knights only get their additional shielding when attacked from the side or front, not from behind. Added Rulebook button to the shop. Further healthbar tweaks. Always display Duos team name on the Underlord panel. Further UI improvements, including considerable improvement to 4:3 aspect ratio (i.e. iPads). Fixed an issue with barricades in Freestyle causing a crash. Mobile performance improvements. ",1572055964,['patchnotes']
1046930,Sorry For Dragging Out This Hotfix,"HOTFIXES Fixed dragging units on the board being broken. Turns out fixing crashes doesn't fix the crashes those crashes had crashed. Those are now fixed too. Duos spectating is good now. Improved dragging targeting. Hide ""Send to Teammate"" button if unit can't be sent (Target Buddy is yours forever). Tweak health bar size, especially on low resolution phones. Hobgen: Adjusted timing of Friendly Fire so bomb damage is done when the bomb lands, not when it's launched. Fixed an issue where Faceless Void wouldn't get the Ace appearance bonus in the shop when you have Assassins alliance. Mobile: Require two-finger touch to tilt the camera. Minor UI tweaks. Added a toggle in Audio Settings for playing speech when Underlords cast abilities. Improved mobile UI performance. Attempt to fix black text for users with Radeon graphics cards. Bots don't Spam That Thanks Button in Duos anymore. ",1572040463,['patchnotes']
