appid,title,contents,date,tags
1172710,New Patch Now Live with Vehicle Recovery System and More!,"Greetings Sleepers, A new patch has just gone live, introducing the vehicle recovery system! Today’s patch also brings a number of significant improvements, including to the Deep Desert looting experience. Your feedback and support continue to motivate the team as they work on shaping Arrakis and improving your time there. Take a look at the highlights of today’s patch below, and check out the full patch notes here.  Vehicle Recovery System Your vehicle backup tool now has a new function – Recovery Mode. With this, you can restore any destroyed vehicle at the cost of Solari and the maximum durability of that vehicle. Items stored in the vehicle’s inventory cannot be recovered. Keep in mind that destroyed vehicles are only recoverable for a limited time (currently 72 hours). Whether it was the victim of a sandstorm, sandworm, or anything else, any vehicle can be restored. Please note that only vehicles lost after today's patch will be recoverable.  Replace Building Pieces Directly The construction tool now features a ‘Replace' mode that can be used to replace building pieces with other compatible pieces. This allows you to quickly upgrade your bases to new sets.   Vehicle View Distance The view distance of vehicles has been drastically increased (2 km) across all of Arrakis.  Instanced Deep Desert Loot Loot in PvP areas is now instanced, bringing it in alignment with other areas in the game. Every player will now get their own personal loot in the PvP areas of the Deep Desert. This ensures that you will always be rewarded for successfully clearing an area with loot chests. PvP loot has been rebalanced to fit this new experience. The loot in PvP areas still has increased drops compared to PvE areas.  Deep Desert Loot Distribution We have implemented a new loot structure for schematics in the Deep Desert. Schematics are no longer ever off rotation, meaning they can all be acquired at any time. Schematics are still tied to a certain location like a Testing Station or shipwreck (higher drops in PvP areas). The result is that for a single shipwreck for example, the loot pool is far larger, but individually, the schematics have a lower drop chance. The goal of this is to make all areas in the Deep Desert more consistently rewarding to explore and loot, while also making some rarer items somewhat more available. Massively Increased Bank Storage The banks of Arrakis have been patched to store far more. The previous restrictions were too harsh, and there were not enough ways to safeguard your hard-earned resources. Bank slots have increased from 25 to 500.  Bank inventory volume has increased from 1500 to 30000.  Research Menu Search The research menu has been patched with a search feature.  Dune Man Building Pieces (only Lost Harvest DLC owners) 17 new Dune Man Building pieces have been added to the Lost Harvest DLC. This applies to both existing and future owners of the DLC. The garage door now fits the treadwheel when it’s open.  The List Goes On These are only a few of the main highlights. Dig deeper into the changes of today’s patch with the full patch notes. Seek the shade, Sleepers ",1759829406,
1172710,Funcom Autumn Sale 2025,"Hello everyone! It’s the season of change, but some things you can always rely on: Halloween stuff is sold too early, children turn feral for candy, and the Steam Autumn Sale knocks on the door like an old friend bearing gifts. If you haven’t immersed yourself in the epic world of Dune in Dune: Awakening, this is the perfect opportunity, with a 20% discount and new content in the Chapter 2 free update and Lost Harvest DLC. Browse the full Funcom library for amazing discounts including: Dune: Awakening – 20% off Aloft – 20% off Conan Exiles & DLCs – up to 75% off Metal: Hellsinger & DLCs – up to 75% off Metal: Hellsinger VR & DLCs – up to 60% off Dune: Spice Wars & DLCs – up to 60% off Mutant Year Zero – 75% off The Longest Journey – 75% off Empyrion: Galactic Survival – 70% off ",1759165576,
1172710,Dune: Adventures in the Imperium - Discounts and Freebies!,"Greetings Sleepers, If you need a break from your screen but need that sweet sweet spice, we’re here to remind you about Dune: Adventures in the Imperium, the tabletop roleplaying game! We’re pleased to help you get started with a completely FREE PDF of the core rulebook, along with 60% off any products (except the Imperial Limited Edition) from Modiphius’ shop page, including gamemaster’s toolkits, physical books, dice sets, and all sorts of goodies. Use this link for the free Core Rulebook PDF Get 60% off with the code: DUNEAWAKENING Take your characters on a journey through the storied worlds of Frank Herbert’s sci-fi masterpiece, inhabit elite agents working for noble Houses where Mentats, Swordmasters, Spies, Bene Gesserit Sisters, Devious Advisors, or even desert Fremen join together to follow your banner. Establish your House in the Imperium, and perhaps even claim the throne. It’s always a pleasure to spread the good word of Dune. Until next time, Sleepers. ",1758811621,
1172710,Dune: Awakening - 1.2.0.0 Hotfix 4,"Hey Sleepers,This hotfix requires a client-side download. Remember to restart your Steam client if the download does not appear automatically for you. Servers will be coming back up shortly.For the list of known issues, please visit our Discord server or Steam discussion boards.FixesFixed an issue on private servers where some volume in the player’s inventory could be taken by invisible resources if the player had visited other servers while crafting had been ongoing. The issue on public servers was fixed last week. Fixed an issue where the Right of Salvage Decree didn’t cause players to drop their items as expected when they were killed in Deep Desert PvP areas.The Respawn button is now disabled in the Esc Menu when you open it in social hubs.",1758796261,['patchnotes']
1172710,This is your last change to win Dune Awakening for under $5,"The burning sun and the dangerous, golden sands of Arrakis may be intimidating, but do you know what's not scary? Scoring a copy of the brilliant <strong>Dune Awakening</strong> for under $5 - admittedly, it's only a chance, but either way, you'll get three games at a fraction of their typical prices, so there's no real losing here. Either you get a triple-A hit or another game that is also great, but which just had less budget behind it. <a href=""https://www.pcgamesn.com/dune-awakening/vip-mystery-bundle-verified"">Read the rest of the story...</a> RELATED LINKS: <a href=""https://www.pcgamesn.com/dune-awakening/twitch-drops"">Dune Awakening Twitch drops and how to claim</a> <a href=""https://www.pcgamesn.com/dune-awakening/lost-harvest-dlc"">Dune Awakening's first paid DLC adds the funkiest vehicle I've ever seen</a> <a href=""https://www.pcgamesn.com/dune-awakening/free-weekend"">Upcoming Dune Awakening free weekend lets you explore every corner of Arrakis</a> ",1758737754,
1172710,Dune: Awakening Community Items Have Arrived! ,"Greetings Sleepers, We're excited to launch the Dune: Awakening Community Items! Are you ready to spice up your Steam profile? Let’s look at what you can earn. Play for Trading Cards -> Craft Badges Get Dune: Awakening Trading Cards by playing the game for one part of a set and trading with other players to complete the set. With a complete set of cards, you’ll be able to craft them into game badges, which you can upgrade and show off on your Steam profile. Check them out here.Customize your Steam Profile Each time you craft or upgrade your badge you’ll get random rewards, including emoticons and Steam profile backgrounds! Show those who visit your profile the vast expanses you have explored. With Steam Points you can also buy animated frames, avatars, and additional profile backgrounds directly from the Steam Points Shop. Display your House allegiance and specialty for all to see.  Get the Full Collection For all you completionists out there, we've compiled the full list of items you can acquire: 10 trading cards 6 tiers of badges 3 animated profile backgrounds 3 still profile backgrounds 5 emoticons 4 avatars 10 frames We hope you all enjoy the collection and turning the heat on your profile up to a nice crispy Arrakis day. Nothing says home like Hagga Basin. ",1758549806,
1172710,Public Test Client: Version 1.2.10.0,"Welcome to the 1.2.10.0 Public Test Client Patch, Sleepers!We're excited to share with you early our next patch for the game, which includes several improvements and important changes. These include the highly anticipated 'Replace' mode in Building Mode and instanced loot in PvP areas and greatly improved rendering distances for vehicles in the Deep Desert. There are also a myriad of fixes and stability improvements for the game. Be one of the first to experience the patch and help us identify any technical issues.Happy reading and testing! HighlightsThe construction tool now features a ‘Replace' mode that can be used to replace building pieces with other compatible pieces. Allowing you to quickly upgrade your bases to new sets.Updated loot in PvP areas to be instanced, similar to loot in PvE areas. More on this under the “Resources, Building, and Crafting” header.We have implemented a new loot structure for the Deep Desert. Schematics no longer rotate on a weekly basis. More on this under the “Deep Desert and Landsraad” header.Added the ability to recover lost vehicles using a new mode in the Vehicle Backup Tool. More on this under the “Vehicles” header.In the vehicle management menu, it is now possible to chose the vehicle as a respawn point.Vehicle visibility distances have been drastically increased, up to 2km.Windtraps will now stop consuming filters if the base’s water storage is full.You can find the full patch notes list here.You can discuss the patch on the relevant Steam Discussion Board and our Discord.Thank you and happy testing!",1758294747,
1172710,Pre-Purchase The Art and Making of Dune: Awakening,"Greetings Sleepers, In The Art and Making of Dune: Awakening, you will walk in the footsteps of the development team on a journey to build the first-ever immersive and open world Arrakis. Between its covers, the team takes you beyond the game with a curated collection of stunning concept art, exclusive interviews, behind-the-scenes, and much more. Get a glimpse of some of the exclusive art below. This volume is an ideal collectible for fans of the Dune series, featuring a foreword by Creative Director Joel Bylos and an introduction by Brian Herbert, Kevin J. Anderson, Byron Merrit, and Kim Herbert. The Art and Making of Dune: Awakening releases on October 21. You can pre-order it now on your platform of choice: InsightEditions Barnes and Noble Amazon 20% off Dune: Awakening Until September 22, Dune: Awakening is discounted for the first time, at 20% off! Invite your friends and embark on an epic journey across Arrakis. With the release of Chapter 2 and the Lost Harvest DLC, and more to come, there has never been a better time to play Dune: Awakening. ",1758117928,
1172710,Dune: Awakening - 1.2.0.0 Hotfix 3,"Hey Sleepers,This hotfix requires a client-side download. Remember to restart your Steam client if the download does not appear automatically for you. Servers will be coming back up shortly.For the list of known issues, please visit our Discord server or Steam discussion boards.FixesTechnical and StabilityFixed a server performance issue.Improved server stability.Resources, Building and CraftingFixed an issue with several placeables and decorations where they would be rotated at a different angle when a player tried to place them using the Solido Replicator. Fixed an issue where a building blueprint could not be placed using the Solido Replicator under certain conditions.Fixed an issue where invisible crafted items would pile up in the player’s inventory and take up space if the player switched Sietches while crafting was still ongoing. The fix will prevent the issue from affecting anyone who was not affected before the hotfix was implemented. The accounts already affected will be fixed at a later date.CombatFixed an issue where a rocket detonation could be slightly desynchronized for the shooter and the observer. VehiclesFixed an issue where the vehicle’s handbrake wouldn’t engage by pressing the space bar. Story, Journey and New Player ExperienceFixed an issue with the “The Price of Rejection“ Mentat contract where the player couldn’t complete the ‘'Use the Hunter-Seeker to Assassinate the Informant’' objective as there was no informant to kill.We added a fail-safe dialogue option for players who could crash during the loading or inside the dialogue with Fenring during the ""Called to a Count"" journey. To retrigger the dialogue with Fenring, go back to Elara during the ""Talk to Count Fenring"" step and choose the ""You said Fenring wants to see me"" again.Fixed an issue where selected players would fail to obtain more intel points.Fixed an issue with unlocalized text in the Deep Digger journey.Fixed an issue where the ""Find Olmen"" first objective wouldn't complete when a player entered Imperial Testing Station no. 163.Fixed an issue where players could be blocked in progressing through the Lost Harvest journey if the ""Villari's Prize"" contract failed to spawn. In case it fails to spawn, we added the contract to the Anvil Contract Board so you can take it from there.Fixed a known issue with the deletion of a character and the creation of a new one, where you would spawn at your deleted character’s last logoff location instead of a Hagga Basin South spot after the Tutorial.Deep Desert and LandsraadFixed an issue where the Landsraad contracts got closed several hours after being revealed on North American servers, with multiple servers having no winning decree. The decree that won on Monday will be the one set as the enacted decree after the hotfix. Fixed an issue where there were considerably fewer crashing ships in the Deep Desert.The “Right of Salvage” Landsraad decree’s description was updated to mention only PvP areas in the Deep Desert instead of the entire Deep Desert beyond the Shield Wall.A fix for “Right of Salvage” not causing players to drop their items as expected is in the works and will come at a later date.Fixed an issue where the Deep Desert layout had the same loot it had last week. ",1758108413,['patchnotes']
1172710,Dune: Awakening 20% off until September 22,"Greetings Sleepers, The Dune: Awakening Free Weekend has now ended, but the 20% discount will remain until September 22! Arrakis saw a lot of newcomers this weekend. Much moisture was sucked from plants (and blood from bodies). This is how we all begin. To you we extend our thanks, and a reminder: if you purchase the game, you will keep all your progress. Please remember to pick the same World and Sietch to find your base. The desert is not kind to those without shelter. The sands are calling, Sleepers. ",1758031249,
1172710,Free Weekend Now Live!,"Greetings Sleepers, The Dune: Awakening Free Weekend is here and will run until September 15!During the Free Weekend and until September 22, the game can also be purchased at 20% off, our first ever discount!This Free Weekend has no restrictions on content, which includes the full base game and the big Chapter 2 content update released earlier this week. Venture across every zone in Hagga Basin to the far reaches of the Deep Desert, then pay a visit to Harko Village and Arrakeen City.Get the Arrakis Rising decoration, a beautiful mural for your base, by simply playing the game during the Free Weekend. This applies whether you have bought the game or not. The mural will appear in your building menu shortly after the end of the Free Weekend.Quick info on the Free Weekend: Play for free from now until September 15 Full Base game, including the recent Chapter 2 update No time restrictions All progress is saved, once you buy the game you continue where you left off  Play with friends who own the game - simply pick the same World/Sietch Buy the game 20% discounted until September 22 ",1757610243,
1172710,Dune: Awakening - 1.2.0.0 Hotfix 2,"Hey Sleepers,This hotfix requires a client-side download. Remember to restart your Steam client if the download does not appear automatically for you. Servers will be coming back up shortly.For the list of known issues, please visit our Discord server or Steam discussion boards.This update addresses a number of issues, including the connection issues with the 5Q2 error code and the crashes during shader check.CHANGESUpdated the maximum time players could stay in DLC Testing Stations from 30 to 60 minutes and added a notification that shows 5 minutes before the maximum time.FIXESFixed the issue where some players could not connect to the world and receive error code 5Q2.Fixed a crash that occur during the shaders check.Fixed a server crash that could happen when looting NPCs and chests.Fixed an issue where a spice field could spawn under the Mithra shipwreck.Fixed an issue where hit marker visual and audio effects appeared on the reticle when players were repairing a vehicle.Fixed an issue where the “Return to Elara Tuek in Harko Village“ text was displayed unlocalized in the Digging Deeper journey.Fixed an issue where the holster-unholster audio played when the player started and stopped climbing with an unholstered weapon.Fixed a rare issue where the journey and contract tracker would not update the tracked journey or contract, especially the second step in “A New Beginning” journey, showing a single dot instead of the objective.Fixed an issue where an empty Contract Board wouldn’t show the “No Contracts Available at the Moment"" notification.Fixed a known issue where the Checkpoint and Entry Point respawn locations were mislabeled in Forgotten Testing Station, causing players to spawn at Entrance when Checkpoint was chosen and the last location when Entry Point was chosen.Fixed a rare issue where sometimes players were not able to leave the Mithra and teleported back inside.",1757581935,['patchnotes']
1172710,Regarding the Dune Man Building Pieces,"First, big thanks to everyone who jumped into Chapter 2 and the Lost Harvest DLC yesterday and who took the time to share your thoughts with us.We realize that our communication around the contents of the DLC has not been clear enough. The Lost Harvest DLC has a variety of content, with the focus being on the new side story and the Treadwheel, but the way the Dune Man building pieces were communicated created expectations that it would be a full building set rather than what was our intention: four new pieces to supplement the base game building sets.We understand the disappointment some of you have shared, and to rectify that, we will work on creating more Dune Man building pieces that we’ll make available to all owners of the Lost Harvest DLC. We’re looking at adding around 15 more pieces and we aim to have these available late September or early October.Some of you were asking if we were planning on releasing additional Dune Man building pieces via Twitch Drops. No, that was never the plan. Those campaigns have their own exclusive rewards.While we’re on the topic of Twitch Drops, we can also share that we plan to make all (including past) Twitch Drops obtainable in the game and we’ll provide more details about that when ready. As with many other games, Twitch Drops are important for us to support the creator ecosystem and give the game more visibility on the Twitch platform. But, while these are free rewards available to everyone, we understand not everyone wants to or have the time to watch live streams and we want to make sure those people also get access to these items in-game sometime after the Twitch Drops campaign concludes.Once again, thank you for spending time with Chapter 2 and the Lost Harvest DLC, and please keep sharing your thoughts with us. We’ll keep you updated on all the above.",1757528844,['patchnotes']
1172710,Dune: Awakening - 1.2.0.0 Hotfix 1,"Hey Sleepers,This hotfix requires a client-side download. Remember to restart your Steam client if the download does not appear automatically for you. Servers will be coming back up shortly.For the list of known issues, please visit our Discord server or Steam discussion boards.FIXESFixed a rendering client crash that could happen with the disabled Lumen option in the settings.Fixed various minor issues that led to server crashes.Fixed a recent known issue where radiation sometimes did not affect the player.Fixed an issue where the CHOAM cargo crates couldn’t be removed from inventory. As part of the fix, all CHOAM cargo crates have been removed from players' inventories.Fixed an issue with a missing dialogue with Ugo Firenze in the ""Bouncer Duty"" contract, if “The Call"" journey was also tracked.Fixed an issue with the new trainer armors dropping on the ground if the player’s inventory was full. These armor are now provided as customization variants and schematics, to be crafted.Fixed an issue where the dialogue with Dhood Shazz would be canceled if players kept running upon entering the Banquet Hall.Fixed players' accounts that had duplicated emotes and abilities that prevented them from obtaining the new DLC emotes.Fixed an issue where the""Digging Deeper"" contract could be retaken multiple times.Fixed an issue where the boss fight in one of the Lost Harvest Testing Stations would not progress if a player died and respawned inside the encounter.Fixed an issue where chests in Deep Desert Imperial Testing Stations could be looted multiple times.Fixed issue where the player who had started on the Lost Harvest DLC and then disconnected from the game would be placed at the entrance to the journey, but always in Sietch Abbir.",1757496050,['patchnotes']
1172710,Dune Awakening's first paid DLC adds the funkiest vehicle I've ever seen,"Like the planet Arrakis itself, Dune is a story ripe for mining. The number of stories you can tell in Frank Herbert's incredibly rich universe are immeasurable, and I'm glad <strong>Dune Awakening</strong> is allowing players to create their own, emergent narratives on the desert planet. The game had a mixed reception at launch, one that developer Funcom is keen to repair with the release of a free update and paid DLC story, which are both available now. <a href=""https://www.pcgamesn.com/dune-awakening/lost-harvest-dlc"">Read the rest of the story...</a> RELATED LINKS: <a href=""https://www.pcgamesn.com/dune-awakening/free-weekend"">Upcoming Dune Awakening free weekend lets you explore every corner of Arrakis</a> <a href=""https://www.pcgamesn.com/dune-awakening/chapter-two-lost-harvest-dlc-free-trial"">Dune Awakening launches free trial and reveals major update plans</a> <a href=""https://www.pcgamesn.com/dune-awakening/roadmap-august-2025"">Dune Awakening dev apologizes for radio silence as new roadmap arrives</a> ",1757440365,
