appid,title,contents,date,tags
1172710,Major new feature and a free surprise,"Greetings Sleepers, Another patch is now available, and it's a hot one! Store your spice, park your vehicle and head back inside to sip a hot spice coffee while you take a gander at today’s patch highlights. You can also read the full patch notes here.  Gift of the Sands Free Pack As a heartfelt thank you for being part of our journey, we’re excited to gift a special free pack to everyone who owns Dune: Awakening. Enjoy this holiday surprise from us! This pack features a variety of beautiful, new decorative items. The centrepiece is a strategy table and assorted miniatures to place “strategically”, such as a miniature ornithopter, faction miniatures and much more. Handy as you lay out your plans to influence the spice trade on Arrakis. It also features two new weapon skins, and, for those in seasonal spirit, a special holographic tree. Check out your free pack on its Steam store page!  Store your base and place it back out in its entirety, including all its content with the Base Reconstruction Tool.  You can now craft the Base Reconstruction Tool and aim it at your base to store it. Vehicles are not backed up with this new tool. For vehicles you can’t back up in your vehicle backup tool, we recommend disassembling them and storing their parts in your bank or base storage if you’re bringing them with you.   The process is similar to using the vehicle backup tool: it will immediately remove your entire base from the world, including everything placed directly on or inside it. Placing your base works differently from blueprints. The entire base will be spawned instantly, without the need for gathering and manual rebuilding, including all its contents. Additionally, there is a “snap to origin” feature that will try to place your base in the exact location from which you removed it.  For all the nitty-gritty details on how storing and placing work, be sure to check out our dedicated Base Reconstruction Tool Blog   Past Twitch Drop Vendors Vendors with a special inventory are waiting for new customers in both Arrakeen and Harko Village. These dedicated individuals will sell past Twitch Drops in exchange for your heard-earned Solaris. The first inventory rotation includes our Chapter 1 Twitch Drops, featuring 11 different pieces from our Observer building set. Some very cool options are the Observer Windows, Observer Columns, and the Observer Hatch.   Cargo Container for Ornithopters We’ve introduced a new cargo container designed for transporting large quantities of items or materials. You craft pieces which need to be assembled via a welding torch to build this special container. Once put together, it can be used via a carrier ornithopter for transportation.    You can access its storage through the bank/exchange interface or your base’s circuits system.  QoL changes and exploit preventions We are continuously working on quality of life improvements and have added an unstuck vehicle button to get you and your vehicle out of sticky situations. To assist you in sticky situations with your vehicle, we have introduced an “unstuck vehicle button” that should get you out to safety quickly.  We also made it easier for you to find relevant information after a new game update has been released.  Griefing alleviation We continuously commit resources to mitigate griefing and have put further prevention methods in place. Additionally, we fixed a known solari duplicate exploit. Thank you for being part of our community, Sleepers and may you find spice in abundance. ",1765891867,"['mod_reviewed', 'ModAct_1786767382_1765892785_0', 'ModAct_1301790999_1765894461_4', 'mod_require_rereview']"
1172710,"Dust off your Stillsuit, survival MMO Dune Awakening is now cheaper than ever","Whether it's the eerie loneliness as the sand lightly dances on the surface of Arrakis, or the intensity of a huge Sandworm chasing you down for dinner, <strong>Dune Awakening</strong>'s take on the iconic sci-fi franchise makes for one of the <a href=""https://www.pcgamesn.com/best-survival-games"">best survival games</a> ever. After watching the new duo of movies multiple times, and reading the classic novel, I'd say Funcom's take on the franchise is one of my favorites, and right now, it's got a huge discount - one that will have you feeling like you're the Lisan al-Gaib. <a href=""https://www.pcgamesn.com/dune-awakening/winter-sale"">Read the rest of the story...</a> RELATED LINKS: <a href=""https://www.pcgamesn.com/dune-awakening/free-trial-november-2025"">Dune Awakening gives franchise fans and MMO skeptics a chance to try it for free with a generous new trial</a> <a href=""https://www.pcgamesn.com/dune-awakening/fanatical-sale-lowest-price"">Dune Awakening is down to its lowest price yet, but only for a short time</a> <a href=""https://www.pcgamesn.com/dune-awakening/vip-mystery-bundle-verified"">This is your last change to win Dune Awakening for under $5</a> ",1765802021,
1172710,Developer Update Livestream – 18th of December,"Greetings Sleepers, Tune in on 18th of December at 6pm CET for a new developer update livestream where we will dive into what’s coming for Chapter 3! Make sure your shelter is moisture-sealed, then sit back as we chat with developers and play some of the content coming in this major update. We can’t wait to show you what we’ve been working on. Get ready for Landsraad updates, the next chapter in the story, new PvE activities and Testing Stations, a new DLC, and more!Watch it on Youtube or Twitch.See you soon, Sleepers",1765551940,"['mod_reviewed', 'ModAct_1301790999_1765553602_0', 'mod_require_rereview', 'ModAct_1301790999_1765554256_4']"
1172710,Communinet Signal #10,"Opening WordsWelcome to the next Communinet Signal, Sleepers! We’ve got some exciting things to share in this issue including creations from the community, early concept art of the very hungry sandworm along with insight on the design by our Senior Designer John Wiksen, and a Q&A. Let’s get into it!Round UpDeveloper UpdateWe recently published a new developer update that talks about major upcoming changes including the Base Reconstruction Tool, Server Migrations, and some things you can expect in Chapter 3. This new chapter that will add more activities for both solo and co-op players, add new progression paths, as well as continue the main storyline.Read all about it here!Public Testing Client Patch 1.2.30.0Get in on testing the latest patch on our public testing client, where we have enabled character transfers. You can now move your character, inventory, base, and bank contents (including Solari) to a new Sietch and World! This patch also includes pieces of the Observer building set, so if you missed any that were offered through Twitch Drops, you can now buy them with Solari at the building decor vendor in Arrakeen and Harko Village.If you would like an extra boost to help with testing, you can request vehicles and XP through the Bug Reports button in the game. Press the “esc” button, then click on “report bug” at the bottom right of the screen. You can find the PTC as a separate game in your Steam library.Read the full patch notes here!Developer Deep DiveYou can expect more developer content in this section in future Signals such as interviews, office shares, behind-the-scenes, concept art, and more. Our focus on this Signal will be an asset highlight! And what better way to introduce this section than with the iconic sandworm! Below you’ll find very early exploration concept images of the sandworm. This was when we were initially deciding how the tri-mouthed arrangement would look, its size, how it moved and so on.Here’s a fun fact: A huge inspiration for the design was taken from the original images of the sandworm that was drawn on the cover of the first edition book!The tri-mouth design has a lot of potential when it comes to silhouettes and ""personality"" in animation because it has more moving parts that are easy to manipulate. The much larger round-mouth sandworms also exist in the game, but these only in the Deep Desert.We asked our Senior Designer John Wiksen on his thoughts when it came to designing the tri-mouth sandworm,“In a game, players will have the camera generally lower to the ground, we can't just move the camera up and have cool shots of things as seen from above. So with the pointy mouth of the worm it is easier for players to recognize the worm if it breaches behind a dune or tries to swallow them from below compared to a ringmouth which has simpler lines.Other than that, there are some things in the concepts for the wormsign, that are seen where the worm moves when it is close to the surface. We really wanted this to be visible and something that players could spot from a distance so they would understand where a sandworm could be. Like looking to your left and right before crossing the street; you looked for wormsign before running across open sand.”Community CornerFan ContentLike in the previous Signal, anyone mentioned here will receive keys to the Atreides Battle Rifle. Take a gander at these amazing creations, and make sure to submit your own on Discord, Instagram, Reddit, X, BlueSky, or Threads!   Valka-arialitan on Tumblr and Discord has more wonderful art pieces. A very friendly and polite sandworm with pencil and paper. As well as scenes from Arrakis using gouache on paper.Event Horizon by u/Tavenji. See more pictures of this build here on Reddit!Beautiful Eastern Shield Wall base by u/ZeroGNexus. See more pictures of this incredible base here on Reddit!“Time to get the tent out” by u/LNZEROTime to do some bowling by abid1ng_dude on Discord.A gorgeous base built by Solik on Discord.An incredible stillsuit cosplay by Danica Rockwood on Twitter.Q&AQ: Are there plans for a “destroy vehicle” or “abandon vehicle” option from the map? A: We’re working on expanding the Vehicle Backup Tool with a new mode called “Relocation”, which allows you to summon a vehicle that is on the same map as you. We’re aiming to get this feature to you when Chapter 3 releases or in the following patch.Q: Will the Cargo Container for the Carrier Ornithopter take up vehicle space? A: Yes, the storage container does count towards your 10 vehicle limit.Q: What are the plans for endgame? A: There will be an endgame revamp with the release of chapter 3. We mention more about this in the October developer update; while we can’t say much more about it right now, keep an eye out for more information coming in the next month.Closing WordsThat’s all for this Signal! Remember, if you would like your creations featured in the next issue, make sure to share in the official Discord server (under #fanart or #screen...",1764863569,
1172710,Developer Update – November 2025,"It’s time for another update from the dunes. In our last post, we covered several major improvements coming in the next patches, along with early details about the next chapter.  Base Reconstruction Tool A while back, we mentioned the Base Reconstruction Tool, something many of you have been excited about. The team is working hard on improvements based on your feedback, but we need a little more time to properly address all comments. As a result, this feature is shifting to the next update, arriving slightly later than originally planned.  Server Migrations We’ve also seen many questions about server migrations and character transfers, so we want to clarify how this will work.  As we approach the merge window, empty or low-population worlds will be marked in-game for closure. Players on these worlds will be able to migrate to their preferred world and sietch, bringing their bases, inventory and vehicles with them. More details are available in our recent blog post about the Base Reconstruction Tool.  If you miss the migration period, or have been away for a while, you will still be able to migrate later from the game’s main menu and bring bases, inventory and vehicles with you.  We understand how important server population and migration are to bring the best out of the game. Our first step is to give players the tools to move freely. This includes both the Base Reconstruction Tool and Character Transfers. While the Base Reconstruction Tool is moving to the next patch (not a hotfix), you should expect it soon. Once both tools are live, we’ll begin monitoring server populations and will share our merge plans well in advance so everyone can prepare. Our goal is simple: players should be able to move to their preferred world and sietch with their full base, inventory, and character progress intact.  Carrier Ornithopter Cargo Container With the recent addition of vehicle harnessing across maps, we’re now preparing the next step: the Cargo Container for the Carrier Ornithopter, arriving in just a few weeks. This large, ground-built container—assembled with the welding torch—can be picked up and transported by the Carrier, making large-scale material transport across the map far more efficient.Chapter 3  One of our key focuses for the next chapter is adding more activities for both solo and co-op players. Expect new progression paths, new locations to explore, and difficulty scaling that creates meaningful challenges for all playstyles. Chapter 3 will also continue the main storyline, and much more. We’ll have more to share in December, so stay tuned.  What topics would you like us to cover in the next Developer Update? Share your thoughts and questions with us on Discord, Reddit, and our social channels. We read everything, and your input continues to help shape the world of Arrakis.  Thank you for your passion and support, The Funcom Team ",1764255834,
1172710,Dune: Awakening - 1.2.20.4 Hotfix Patch Notes,"Hey Sleepers,This hotfix requires a client-side download. Remember to restart your Steam client if the download does not appear automatically for you. Servers will be coming back up shortly. For the list of known issues, please visit our Discord server or Steam discussion boards.FixesReverted a change introduced in 1.2.20.0 to NPC melee behavior. This change addressed an issue where some NPCs were not dashing out correctly after a slow blade attack penetrated their shield. This occurred when the attacker was using a short blade, regardless of the NPC's stamina level.While this is an intended change that aligns with our goal of making enemy NPCs behave more like players who adhere to the same combat engagement rules, without other balance adjustments they might not be as enjoyable for everyone as we’d like.We understand that some of you who enjoyed the new behavior might be disappointed and we can’t wait to bring it back along with the rest of the balance changes we have in store at a later date.",1764064825,['patchnotes']
1172710,Nominate Dune: Awakening for Most Innovative Gameplay at the Steam Awards!,"Greetings Sleepers, You can now vote for Dune: Awakening in the Most Innovative Gameplay category of the Steam Awards! The team gave it their all to make Dune: Awakening something special, and continues to do so. A vast, seamless, and ever-changing Deep Desert; colossal sandworms that burrow through the sand as persistent creatures, displacing the surface; an array of traversal methods and vehicles that make it a thrill to explore diverse and vertical environments; a survival system deeply in tune with the themes and realities of Arrakis; and many more systems designed to interact in ways that bring Frank Herbert’s vision of Arrakis to life unlike ever before. Vote now, and may all your spice runs be bountiful! ",1764007783,"['steam_award_nomination_request', 'mod_hide_library_overview']"
1172710,Public Test Client: Patch 1.2.30.0,"We have just pushed out the 1.2.30.0 Public Test Client Patch! Learn more about our Public Test Clients and how they work here. Here are the highlights: New Item: Carrier Ornithopter Cargo Container. Carry heavy loads of materials and items with your Carrier Ornithopter using this brand-new plastanium-tier object, crafted in the vehicle category of the tech menu. It can be placed in the world as a vehicle and holds up to 150 slots and 15000 in volume. The Observer building set pieces are now available for purchase from the building decor vendor in Arrakeen and Harko Village. Each piece costs 2500 Solaris. Dashing out of stun no longer always defaults to backwards, allowing you to dash in the direction you have input. Activating Prescience now clears existing poison and poison stacks. Read the full patch notes here for many more bug fixes and improvements. The best place to discuss the PTC is the relevant Steam Discussion Board and our PTC Discussion channel on Discord. Remember your water discipline, Sleepers. ",1763999105,"['mod_reviewed', 'ModAct_1607812438_1764001160_0', 'mod_require_rereview']"
1172710,Dune Awakening gives franchise fans and MMO skeptics a chance to try it for free with a generous new trial,"There have been a few decent Dune videogames over the years, but they've often been strategy-focused and limited in terms of fully immersing fans in Arrakis. <strong>Dune Awakening</strong>, however, is different from the rest. An elaborate survival <a href=""https://www.pcgamesn.com/10-best-pc-mmos"">MMO</a> that's got all the hallmarks a franchise fan would want to see, it's the biggest and most social Dune game ever. However, the breadth of that multiplayer and the potential for PvP combat can be off-putting to some, so developer Funcom is keen to provide regular free trials to let folks dip their toes into the sand. The latest has just arrived. <a href=""https://www.pcgamesn.com/dune-awakening/free-trial-november-2025"">Read the rest of the story...</a> RELATED LINKS: <a href=""https://www.pcgamesn.com/dune-awakening/fanatical-sale-lowest-price"">Dune Awakening is down to its lowest price yet, but only for a short time</a> <a href=""https://www.pcgamesn.com/dune-awakening/vip-mystery-bundle-verified"">This is your last change to win Dune Awakening for under $5</a> <a href=""https://www.pcgamesn.com/dune-awakening/twitch-drops"">Dune Awakening Twitch drops and how to claim</a> ",1763735102,
1172710,Dune: Awakening gets a limited time free trial and the biggest discount yet,"Dune: Awakening from Funcom is trying to pull in some fresh players, with a new free trial available and the biggest discount on Steam so far. Read the full article here: https://www.gamingonlinux.com/2025/11/dune-awakening-gets-a-limited-time-free-trial-and-the-biggest-discount-yet/ ",1763727436,
1172710,Dune: Awakening - 1.2.20.3 Hotfix Patch Notes,"Hey Sleepers,This hotfix requires a client-side download. Remember to restart your Steam client if the download does not appear automatically for you. Servers will be coming back up shortly. For the list of known issues, please visit our Discord server or Steam discussion boards.FIXESFixed an issue where the large spice fields were missing in the Deep Desert.Fixed an issue where the “Secrets of the Past"" and ""Once Upon a Time"" contracts during the Lost Harvest journey could’ve been affected by a recent bug that contracts that were not completed were removed from the character.Elara will now reissue these two contracts.Note: The new dialogue lines are in English only in the hotfix. Localization for these will come at a later date.",1763719113,['patchnotes']
1172710,The Free Trial Returns November 20 - 27,"Greetings Sleepers, We’re excited to bring back the Free Trial, now with the combined benefit of all the content and improvements we’ve added since launch! The trial will run from November 20 –27.  To anyone who wishes to take up permanent residence on Arrakis during or after their Free Trial, they can purchase the game at a 25% discount until December 1, the highest discount we’ve had yet! The Free Trial will work in much the same way as previously, except that now you’ll be able to create a character on any Sietch and World you want. Invite your friends and show them your home on Arrakis and the wider desert. Or feed them to Shai-Hulud – the deserts do not judge.Everything You Need to Know Play for free for 10 hours until November 27. The timer only progresses when you are playing. Explore the entirety of Hagga Basin! Only Harko Village, Arrakeen, and the Deep Desert are unavailable. Keep your progress if you buy the game! Keep everything, including character progress, Journey, inventory, base, vehicles, etc. A few communications restrictions apply to avoid things like bots and griefing. Arrakis Has Grown Since Dune: Awakening launched, a lot has changed on Arrakis. The Chapter 2 major update continued the main story and brought a ton of new content and features. The Lost Harvest DLC added a brand-new standalone storyline along with the treadwheel vehicle, Dune Man building pieces, and more. The Deep Desert has seen major improvements as well, both in Chapter 2 and in the many other content updates and patches. More variety was added, along with loot improvements, vastly increased vehicle view distance, and major stability improvements. Of what has been added, this is only the tip of the dune, and there is so much more to come. With the Base Reconstruction Tool and Server Transfers coming soon, and Chapter 3 on the horizon, now is an auspicious time to don the stillsuit and follow in the footsteps of the Fremen, into the vast world of Dune. Seek the spice, Sleepers ",1763661725,
1172710,Dune: Awakening - 1.2.20.2 Hotfix Patch Notes,"Hey Sleepers,This hotfix requires a client-side download. Remember to restart your Steam client if the download does not appear automatically for you. Servers will be coming back up shortly. For the list of known issues, please visit our Discord server or Steam discussion boards.FIXESFixed an issue where in rare cases some materials from the canceled problematic fabrication queues could become invisible after yesterday’s hotfix. If they did, they are now back in the fabricator’s inventory.Fixed an issue where the Titanium Ore was scarce or missing from the Deep Desert’s Shield Wall area.",1763633263,['patchnotes']
1172710,Dune: Awakening - 1.2.20.1 Hotfix Patch Notes,"Hey Sleepers, This hotfix requires a client-side download. Remember to restart your Steam client if the download does not appear automatically for you. Servers will be coming back up shortly. For the list of known issues, please visit our Discord server or Steam discussion boards.FIXESFixed an issue where contracts that were accepted but not completed before Patch 1.2.20.0 disappeared from the player's character and needed to be picked up again.This was fixed during the Nov. 18 downtime.Fixed a server crash in relation to crafting queues.The update will cancel the problematic crafting queues that may have caused server crashes. Some of the materials in these queues may visually disappear. We will bring these items back in an upcoming hotfix.Fixed an issue where selected worlds were not visible in the Server Browser for some time.",1763549933,['patchnotes']
1172710,New Patch Now Live! ,"Greetings Sleepers, Our latest patch is live, bringing you a list of improvements and fixes. Sit back, switch off your personal shield for a moment of peace, and peruse the highlights of today’s patch. You can also read the full patch notes here. Carry Vehicles Across Maps We have added the ability for transport ornithopters to carry vehicles between maps. This should save some time for those spice runs! New Communinet Channel A new Communinet channel has appeared, bringing sounds from another thread in time, yet the same space: it’s the full Dune: Spice Wars soundtrack! Griefing Mitigation We have put several griefing mitigation methods in place, including updated ornithopter collision; Ornithopters taking off are no longer slowed down by collisions from harassing Ornithopters above them. Also fixed an issue that made it possible for players to block interactions with some NPCs. Fixed Deep Desert Testing Station PvP/PvE Designations Some of the Deep Desert Testing Stations were incorrectly displaying whether it was a PvP or PvE area. Testing Stations in the northern part of the Deep Desert now correctly display PvP and ones in the southern part PvE. Many More Bug Fixes, Improvements, and Tweaks You can view the full list of additional changes and fixes in the full patch notes. Coming Soon: Base Reconstruction Tool and Server Transfers We're currently working on adding two much-requested features: the Base Reconstruction Tool and Character Server Transfers. The Base Reconstruction Tool lets you safely store your entire base and all its contents, so you can take a break from the game without losing any of your progress. Character Server Transfers will allow you to move your character to another World entirely. Combined with the Base Reconstruction Tool, you'll be able to bring everything with you when you move. We have also seen your feedback about imbalanced server populations, and have plans for improving this, too. We will share more about it as work progresses. Thank you all for your continued support! Your feedback is as precious as spice to us. Keep an eye out for more news on future content. Seek the shade, Sleepers ",1763458461,
