appid,title,contents,date,tags
1172710,Chapter 2 Free Update and Lost Harvest DLC Out Now!,"Greetings Sleepers, The Chapter 2 Free Update and Lost Harvest DLC are now available!  We're also excited to share that Dune: Awakening is free to play in the Free Weekend that runs from September 11-15! This is the perfect opportunity to get your friends to join you on Arrakis, as Free Weekend players can join any World and Sietch. We’re also firing off our first discount from September 11-22, when the game will be available at 20% off its original price. Discover the update’s long list of new content and improvements, including the continuation of the main story, character re-customization, new contracts, new armors, and much more! See the highlights below and the full patch notes here. DLC: Lost HarvestThe Lost Harvest DLC is also now available for $12.99 and as part of the Season Pass, for those who want to experience Arrakis from its deepest depths to its most dizzying highs. If you own the Deluxe or Ultimate Edition, you already own the Season Pass and will automatically get access to the DLC. Lost Harvest brings: The new treadwheel vehicle – an alternative to the sandbike. Enjoy unique animations and handling Four Dune Man building pieces Several base decorations Two armor skins Four weapon skins The Vermillius Dusk swatch The Thumper emote Chapter 2 Highlights Continue Your Story Following the sinister revelations in Act 3, you must now continue your journey. Meet new and familiar characters, explore new locations, investigate brutal murders, and delve deeper into the past as you unravel a web that stretches into the darkest corners of the Imperium. Character Re-Customization Visit Arrakeen or Harko Village at any time to re-customize your character using the advanced and unnatural methods of the Suk and the Tleilaxu. Fashion the flesh to suit your whim. New Hairstyles & Tattoos New trends from across the Imperium eventually find their way even to Arrakis. Explore four new hairstyles and five new tattoos. Don't expose those to the sun. Arrakeen and Harko Village Contracts Discover new characters in the social hubs with stories to tell and contracts to offer. Make money working as a bouncer, get goods through customs, and more! Archetype Armors Complete the advanced trainer contracts to earn the five new archetype armor sets, styled according to each Great School of the Imperium, such as the Bene Gesserit or the Mentat Order. Let people see what you are and what you can do. Rename Storage Containers The spice must flow! Increase your base’s efficiency and organization with the new renaming functionality, available for storage containers, vehicles, and some placeables. More Dynamic Encounters We continue adding more variety to the deserts of Arrakis. Take on assassination contracts and come across new temporary merchants in the wilderness. Auto-Run Toggle With the press of a button you can now toggle auto-run. This also works for vehicles, letting you cruise across the sand with ease. It won’t stop the worm from eating you though. More Reliable Ornithopter Rockets Firing rockets from an ornithopter is now a far better experience overall. The rockets are more accurate and fire where you are aiming. The skies are yours, Sleeper. Combat Improvements Long live the fighters! Enemies will now generally react quicker, such as when activating their Holtzman shields. Sprint attacks are easier to aim when there are clusters of enemies, and there’s a new graphical effect when dashing out of a stagger. See the full list in the patch notes. Deep Desert Borders Removed We have removed the quicksand between sectors in the Deep Desert, allowing you to cross these borders on foot and in ground vehicles. In addition, abilities, weapons, and combat overall works across sectors, and crossing these borders should no longer cause disconnects and hitching. Deep Desert Variety The Deep Desert is ever-changing. We have added new Deep Desert layouts for more variety and increased rock island density across the board, giving more access to building space for new bases. New Missile Launcher Tier A new duraluminium-tier missile launcher has been added, letting you defend against ornithopters at an earlier stage. Unlock it in the research menu and fill the sky with fire. Synced Loot Boxes & NPCs Various loot containers in PvP areas now respawn at the same time as related NPCs, improving the Deep Desert and shipwreck looting experience. Assault Ornithopter Capacity Inventory slots on the assault ornithopter have been increased from 15 to 20, and volume from 1,000 to 2,000. Time to haul some spice! Vehicle Seat Hotkeys Tired of climbing around in your buggy? Switch seats with ease using F1-F8. Twitch Drops You can earn new building pieces by watching any Drops-enabled Dune: Awakening Twitch Stream. Starting September 11 and running until October 8, you’ll be able to earn more Observer-styled building pieces, including stairs, ladders and pillars. Arrakis is Growing We’re so excited for you all to experience these first major additio...",1757426465,
1172710,"Dune: Awakening gets a free weekend for September 11, a first ever discount and early DLC release","Dune: Awakening from Funcom is getting a free weekend soon and it's getting a first ever discount, so a good time to see what all the fuss is about. Read the full article here: https://www.gamingonlinux.com/2025/09/dune-awakening-gets-a-free-weekend-for-september-11-a-first-ever-discount-and-early-dlc-release/ ",1757072347,
1172710,Upcoming Dune Awakening free weekend lets you explore every corner of Arrakis,"It's been a while since Dune Part 2 hit movie theaters, but there's about to be another reason to return to the desert world of Arrakis. From September 11-15, you'll be able to play <b><strong class=""Lexical__textBold"">Dune Awakening </strong></b>for free. It's a sprawling survival MMO which takes from Ark: Survival Evolved and Final Fantasy XIV alike, and the free weekend celebrates the game's massive Chapter 2 update and its first ever discount price. <a href=""https://www.pcgamesn.com/dune-awakening/free-weekend"">Read the rest of the story...</a> RELATED LINKS: <a href=""https://www.pcgamesn.com/dune-awakening/chapter-two-lost-harvest-dlc-free-trial"">Dune Awakening launches free trial and reveals major update plans</a> <a href=""https://www.pcgamesn.com/dune-awakening/roadmap-august-2025"">Dune Awakening dev apologizes for radio silence as new roadmap arrives</a> <a href=""https://www.pcgamesn.com/dune-awakening/twitch-drops"">Dune Awakening Twitch drops and how to claim</a> ",1757031487,
1172710,Free Weekend September 11-15!,"Greetings Sleepers,The Dune: Awakening Free Weekend will run September 11-15, opening the vast deserts of Arrakis to everyone! Play for free and then enjoy a 20% discount until September 22.There are zero restrictions on content during this Free Weekend, which also includes the big Chapter 2 content update coming on September 9. Venture across every zone in Hagga Basin to the Deep Desert to Harko Village and Arrakeen City.Anyone who plays during the Free Weekend, even those who already own the game, will receive the Arrakis Rising decoration, a beautiful mural for your base.Quick info on the Free Weekend:Play for free from September 11-15No content restrictionsNo time restrictionsAll progress is saved, once you buy the game you continue where you left offPlay with friends who own the game - simply pick the same World/SietchBuy the game 20% discounted from September 11-22Chapter 2 and DLC is Coming Early!Lastly, we’re happy to announce that the Chapter 2 update and Lost Harvest DLC will arrive on September 9, a day earlier than expected! Hope you’re stocked up on spice coffee, Sleepers.",1757005882,
1172710,Developer Update Livestream – September 4th,"Greetings Sleepers, Join us on September 4th at 9AM PT/12PM ET/6PM CEST for a new livestream with the Dune: Awakening development team. To make it easier to stay up to date with our plans for the game, and to have regular community check-ins, we are introducing two types of live streams: Developer Update Livestreams (content focused) The upcoming stream on September 4th will be a Developer Update Livestream. This is where we present upcoming updates coming to the game, giving you a look at the content and gameplay ahead of time. We aim to hold these streams as early as we can, generally. This time, due to Gamescom, it will be held a bit closer to the update’s release. Sietch Talks (community focused) In these streams, we take the opportunity to discuss where the game is at, what we're working on improving and fixing, and what you can expect going forward. The Sietch Talk livestreams won't feature major content announcements, instead focusing primarily on community conversations. Tune in on September 4th! Our upcoming Developer Update Livestream will be hosted by our Global PR Manager Natascha, and include several of our developers as we guide you through what you can expect in the Chapter 2 free update and The Lost Harvest DLC.  Plant your feet firmly, Sleepers, for the sands of Arrakis are shifting. Watch it here.Until next time, Sleepers. ",1756735232,
1172710,Dune: Awakening - 1.1.25.0 Hotfix 5,"Hey Sleepers,This hotfix requires a client-side download. Remember to restart your Steam client if the download does not appear automatically for you. Servers will be coming back up shortly.For the list of known issues, please visit our Discord server or Steam discussion boards.FIXESFixed an issue with the CHOAM Salvage Rights live event that caused a server crash.",1756461843,['patchnotes']
1172710,Public Test Client: Patch 1.2.0.0,"Welcome to chapter 2, Sleepers!At least for the Public Testing Client! Before we push this to the live client, we’d love your thoughts and feedback on many of the additions and changes made with this large patch. Besides the main story chapter we added new dynamic encounters, the ability to recustomize your character’s appearance, and many quality of life changes you can see right below. This patch also, of course, includes a multitude of bug fixes and improvements.Happy reading and testing!HighlightsIntroduced new journey storyline, ‘The Great Convention’. Continue the main story directly after the events of ‘Find the Fremen’ and ‘The Assassins Handbook’. Remember your mission. Wake the Sleeper, find the Fremen!Added renaming functionality in the Placeables and Vehicles menu for players to be able to organize their bases better.Implemented auto-run toggle which automatically moves character/vehicle forward.Completing the Advanced Trainer Contracts now rewards an exclusive armor set specific to each trainer, together with a customization item that allows other armors of the same type to be styled accordingly. Players that have already completed these contracts will get these armor sets retroactively.Added a new weapon, the Adept Missile Launcher! More on on this under the “Combat” header.Storage capacity for the Assault Ornithopters has been increased.Character Recustomizer: There is a new Recustomizer room in each Social hub (Harko Village and Arrakeen City) where you can pay to have your appearance altered. It also includes 4 new hairstyles, new tattoos, and new tattoo tinting and custom colors.You can find the full patch notes list here.You can discuss the patch on the relevant Steam Discussion Board and our Discord.Thank you and happy testing!",1756390284,
1172710,Dune: Awakening - 1.1.25.0 Hotfix 4,"Hey Sleepers,This hotfix requires a client-side download. Remember to restart your Steam client if the download does not appear automatically for you. Servers will be coming back up shortly.For the list of known issues, please visit our Discord server or Steam discussion boards.FIXESFixed an issue where the CHOAM Salvage Rights Event failed to initiate after a server restart.",1756380797,['patchnotes']
1172710,The CHOAM Salvage Rights Event is Live!,"CHOAM activity is rising in the skies above Hagga Basin. Each freighter is a fat prize, and the Kirab know it. The rumble of their artillery rolls across the desert, sending ships crashing into the dunes. As burning ships leave black streaks across the sky, CHOAM is ready to hire mercenaries to defend its assets from the Kirab. Are you ready to go, Sleeper?  Greetings Sleepers, The CHOAM Salvage Rights Event is now live! CHOAM freighters are being shot down all across the Hagga Basin and their cargo is up for grabs. That is, if you can survive the bandits, and of course, sandworms. Pick up new contracts from the CHOAM merchants that have set up shop at tradeposts, then investigate what is happening, sabotage the Kirab’s guns, and retrieve ship salvage. Earn several new CHOAM weapons and a miniature turret base decoration. This time-limited event will set you up for the launch of the Lost Harvest DLC and Chapter 2, our free major content update coming in September, which continues the main storyline and adds even more world content, contracts, items and more.  The CHOAM Salvage Rights event will end on September 10th. UPDATE: We have moved the ending date forward to September 9 due to the new launch date of Chapter 2!The free Chapter 2 update will release alongside The Lost Harvest DLC, which brings a new standalone storyline, several cosmetic items, and the new treadwheel vehicle. While similar to the sandbike, the treadwheel has unique animations and handling. See you on the sands, Sleepers ",1756303329,
1172710,Dune: Awakening - 1.1.25.0 Hotfix 3,"Hey Sleepers,This hotfix requires a client-side download. Remember to restart your Steam client if the download does not appear automatically for you. Servers will be coming back up shortly.For the list of known issues, please visit our Discord server or Steam discussion boards.CHANGESWe removed the task that required Solari delivery from the Landsraad board. It will no longer appear on the Landsraad board starting September 2.FIXESFixed an issue where only the first party member could loot the corpse in the Wreck of Kytheria during the Track Down Skorda contract.Fixed a very rare issue that made it look like the players lost ownership of their assets.Fixed an issue where the player could get knocked back from a melee attack by an NPC despite successfully parrying it.",1756200470,['patchnotes']
1172710,Pre-Order the Dune: Awakening Vinyl Soundtrack!,"Greetings Sleepers, The full Dune: Awakening vinyl soundtrack, comprising 24 tracks, will arrive in January 2026, and is now available for pre-order, for £36 / $42. The soundtrack, sold in partnership with Laced Records, and with our own bespoke sleeve artwork, was created by award-winning composer Knut Avenstroup Haugen and was recorded in AIR Studio’s Lyndhurst Hall, the legendary recording studio in London. Pre-order in the US: https://www.lacedrecords.com/collections/dunePre-order anywhere else: https://www.lacedrecords.co/collections/duneHaugen's soundtrack conjures a planetary sense of scale, capturing Dune's singular blend of science fiction and spiritual tradition. Soaring vocal performances from Clara Sorace, Eurielle and Emília Rovira Alegre center this sense of the sacred, pushing the soundtrack to ecstatic emotional peaks. Seek the shade, Sleepers ",1755784757,
1172710,Dune Awakening launches free trial and reveals major update plans,"Survival MMO <strong>Dune Awakening</strong> has been going through it as of late, but developer Funcom is doing its best to fight fires while building on its big Arrakean adventure. After recently unveiling an expansive new content roadmap that takes us well into next year, the studio has delved deeper into what we can expect from its upcoming second narrative chapter and Lost Harvest DLC when they arrive next month. To entice prospective players who have yet to experience the joys of being chomped by a sandworm, a ten-hour free trial has also been revealed. <a href=""https://www.pcgamesn.com/dune-awakening/chapter-two-lost-harvest-dlc-free-trial"">Read the rest of the story...</a> RELATED LINKS: <a href=""https://www.pcgamesn.com/dune-awakening/roadmap-august-2025"">Dune Awakening dev apologizes for radio silence as new roadmap arrives</a> <a href=""https://www.pcgamesn.com/dune-awakening/twitch-drops"">Dune Awakening Twitch drops and how to claim</a> <a href=""https://www.pcgamesn.com/dune-awakening/down-server-status"">Is Dune Awakening down? Server status right now</a> ",1755783543,
1172710,Dune: Awakening - 1.1.25.0 Hotfix 2,"Hey Sleepers,This hotfix requires a client-side download. Remember to restart your Steam client if the download does not appear automatically for you. Servers will be coming back up shortly.For the list of known issues, please visit our Discord server or Steam discussion boards.FIXESFixed a crash that could happen when a player tried to view a blueprint containing a pentashield.Fixed a crash that could happen when a player accessed selected blueprints in social hubs.Fixed a rare issue that interfered with players logging in.",1755768109,['patchnotes']
1172710,Chapter 2 Free Update and The Lost Harvest DLC,"Greetings Sleepers, Change is coming to Arrakis. We’re excited to announce that our Chapter 2 free update and The Lost Harvest DLC, priced at $12.99, will release on September 10th, as revealed in the Into the Infinite Showcase at Gamescom! UPDATE: We have moved the date forward to September 9!Today, we will cover what you can expect in the free Chapter 2 Update, the Lost Harvest DLC, as well as a few other events to look out for in the near future. Get a taste of the update and DLC in our announcement trailer! Chapter 2 Update (Free) Our update plan for Dune: Awakening is structured into free major content updates in the form of Books and Chapters, and paid content in the form of DLCs and Expansions. Generally, Chapter Updates will be released in parallel with DLCs. Chapter 2 will be our first major content update. Embark on the next chapter of the main story following the sinister revelations at the end of Chapter 1. Explore new locations, meet new and familiar faces, delve deeper into the nature of your origins, and unravel a web that stretches into the darkest corners of the Imperium. Alongside the continuation of the story, Chapter 2 brings several new contracts, new dynamic encounters, new archetype armors, character re-customization, and more. DLC: The Lost Harvest (Paid) The Lost Harvest is a paid DLC with a complete standalone storyline. A carryall transporting a Miner’s Guild spice harvester has been shot out of the sky, and its cargo could change everything. Your job is to find it. The DLC also includes several unique cosmetics, including a brand-new vehicle, the Treadwheel, complete with its own unique animations and tier upgrades. The vehicle and other cosmetics provide no material benefit over its base game counterpart. Other cosmetics include several armor and weapon skins, and the Dune Man building set, letting you build bases in the style of those pragmatic and weathered workers of Arrakis. The DLC is available for $12.99 and is included in the Season Pass ($24.99), which includes The Lost Harvest DLC and two more major DLCs. The Season Pass is already included in both the Deluxe and Ultimate Edition. We look forward to sharing more details on the DLC. The Free Trial is Here! Earlier today we launched our Free Trial, letting anyone taste the spice of Arrakis for free, for 10 hours, until August 24th. Free Trial characters are unable to play with those who own the game, but they will keep their character’s progress and backpack contents if they purchase the game. The only inaccessible areas are Arrakeen, Harko Village, and the Deep Desert. The entire Hagga Basin is free to explore, with all its varied biomes. Advance through the story, build a base, a vehicle, and explore the vast deserts. In almost every respect, the Free Trial gives you access to everything the full game has to offer. But be warned - once one tastes the spice, and the blue Eyes of Ibad start to take hold, one becomes bound to Arrakis forever. Get the full details on the Free Trial here. In-Game Event Changes are coming to Arrakis earlier than you may think! Before Chapter 2 arrives, you will experience a new conflict that leads into the major update. We’ll have more to share on this soon. Developer Livestream We’ll be doing a deeper dive into the contents of both the free update and the DLC in a livestream featuring our community managers and developers. Keep your eye on our channels for when we announce the date and time. Soundtrack Vinyl Pre-Orders Now LiveThe full Dune: Awakening vinyl soundtrack, including two bonus-tracks, is now available for pre-order! US here and anywhere else here.The soundtrack was created by award-winning composer Knut Avenstroup Haugen and was recorded in AIR Studio’s Lyndhurst Hall, the legendary recording studio in London. We look forward to sharing more news as we approach the launch of Chapter 2. Seek the shade, Sleepers ",1755711115,
1172710,Free Trial Now Live!,"Greetings Sleepers,The Dune: Awakening Free Trial is now available! Until August 24th, anyone can download the game on Steam and play for 10 hours.In the interest of making the experience of getting consumed by Shai-Hulud more accessible to all – we are incredibly excited to open the planet up for a limited time. We have also made it possible for a character’s progress to get transferred if you buy the game during or after the Trial.Let's go over what the Free Trial encompasses in detail.Play for free for 10 hours until August 24th. The timer only progresses when you are playing.Explore the entirety of Hagga Basin! Only Harko Village, Arrakeen, and the Deep Desert are unavailable.Keep your progress if you buy the game! More details below.Free Trial characters will play on dedicated Free Trial servers, meaning they may encounter other Free Trial players, but not those who have purchased the game.NOTE: If you upgrade to the full game, you can pick and continue on any server within the World (group of servers) you first chose for your Trial character. Therefore, if you have friends already playing the full game, make sure to pick the World they’re on for your Free Trial character.Get rewards when you buy the game.The Desert Mechanic cosmetic items are unlocked when you buy the game during or after the trial. These cosmetics are also available to existing players at in-game vendors.  Get a bundle of basic materials when you buy the game, to help you quickly rebuild your base. As we mentioned, character progress is kept if you purchase the game. We want to be completely clear about what that includes and doesn’t include, however.The following is transferred when going from Free Trial to purchased game:Character journey progress, level, skill and tech pointsCharacter backpack contentsThe following is not transferred when going from Free Trial to purchased game: Your base (although if you progress very quickly, you can blueprint your base and keep that). Vehicles (this too can be circumvented by backing it up with a vehicle backup tool). More than 10,000 Solaris.Invite your friends, Sleepers, to the crucible of Arrakis. Let them find their way. We’ll leave you with a quote from Dune:“A poison - so subtle, so insidious... so irreversible. It won't even kill you unless you stop taking it. We can't leave Arrakis unless we take part of Arrakis with us.""",1755706397,
1172710,Dune: Awakening - 1.1.25.0 Hotfix,"Hey Sleepers,This hotfix requires a client-side download. Remember to restart your Steam client if the download does not appear automatically for you. Servers will be coming back up shortly.For the list of known issues, please visit our Discord server or Steam discussion boards.CHANGESTechnical backend changes.",1755680608,['patchnotes']
1172710,Dune: Awakening is now Steam Deck Verified,"After Funcom have patched Dune: Awakening quite a few times since release, the experience on Steam Deck is now good enough that it's been Steam Deck Verified. Read the full article here: https://www.gamingonlinux.com/2025/08/dune-awakening-is-now-steam-deck-verified/ ",1755679388,
1172710,Dune Awakening dev apologizes for radio silence as new roadmap arrives,"It's been a tough post-launch period for <strong>Dune Awakening</strong>. Despite Funcom's best efforts to ensure the sandworms are the only bug-adjacent entities players have to worry about, its bold new MMO has been riddled with issues from the off. I'm not surprised there have been teething problems considering the sheer scope of its undertaking, but the studio's consistently risen to the challenges it's faced. While the game may not be in a perfect state, its new roadmap offers a promising look ahead. <a href=""https://www.pcgamesn.com/dune-awakening/roadmap-august-2025"">Read the rest of the story...</a> RELATED LINKS: <a href=""https://www.pcgamesn.com/dune-awakening/twitch-drops"">Dune Awakening Twitch drops and how to claim</a> <a href=""https://www.pcgamesn.com/dune-awakening/down-server-status"">Is Dune Awakening down? Server status right now</a> <a href=""https://www.pcgamesn.com/dune-awakening/mystery-bundle"">Here's your chance to get Dune Awakening and two more games for $5</a> ",1755612720,
