appid,title,contents,date,tags
1172710,Dune: Awakening - 1.1.25.0 Patch Notes,"Hey Sleepers,We've just updated the game with the version 1.1.25.0, please find the patch notes below.Remember to restart your Steam client if the download does not appear automatically for you.For the list of known issues, please visit our Discord server of Steam discussion boards.FEATURES AND CHANGESThe volume of Cobalt Paste has been reduced from 1.0 to 0.5.Removed the UI visual showing server language on the server browser.Further improved server and client stabilityFIXESAddressed gaps in Deep Desert Shield Wall landscapes.Fixed an issue that caused starter abilities to be reset to level 1, causing players to lose skill points.Fixed an issue that caused the player to enter “free look” camera mode on a black screen, or a completely black screen, if travel was refused by the server.Ground vehicles can now be suspended by patrol ships.Fixed a bug that caused detonating deployables to be stuck on cooldown when entering a vehicle.Fixed an issue where a player could spawn falling under the terrain instead of on the correct respawn location in Hagga Basin.Fixed an issue where players would fall indefinitely if they fell through the map. Now you should be put on top of terrain, if you fell down through the mesh.",1755610706,['patchnotes']
1172710,Dune: Awakening is Steam Deck Verified!,"Greetings Sleepers, We’re excited to announce that Dune: Awakening is now fully Steam Deck verified! Until now, it has been in the Playable category, but after some tweaks, it now meets all of Valve’s requirements to be a smooth experience on the Deck: All functionality is accessible when using the default controller configurationThis game shows Steam Deck controller icons In-game interface text is legible on Steam DeckThis game’s default graphics configuration performs well on Steam Deck So put some Dune in your Deck and bring a little spice wherever you go. Thank you all so much for your support as the team continues to work on improvements. Any issues you report using the in-game tool and feedback you leave across all our channels is massively appreciated! We look forward to sharing more details about all the new content we have in store for Dune: Awakening. If you're looking for backup on your next spice run, don’t hesitate to join our Discord to chat with other survivors and get live updates on the game.  ",1755606880,
1172710,Developer Update – Roadmap and Future Plans,"Hi everybody, It’s been a while since we put out our last letter and people have been chomping at the bit to hear more about our plans for the future. I apologize if people feel the communication around issues with the game has been lacking; we are focused on improving this. With a percentage of the team having their well earned (and state mandated) vacations, customer service and the community team have not always had access to developers who can answer their every question. We’ve been playing whack-a-mole with bugs, cheats and exploits during the July month of summer. We’ve banned thousands of cheaters, fixed a bunch of duplication and exploit bugs and continued working on the stability of the game. We’ve been working to achieve a cadence of patches that allows us time to make stable and consistent fixes, while being fast enough to address issues like exploits before they get too far out of control. Live Game development is a blend of reactivity and long term planning. This week, at Gamescom, we are going to be talking about the Chapter 2 Free Update and The Lost Harvest DLC, our first major additions to the game, which will be releasing in parallel. Some of you will note that while Chapter 2 and the DLC add new content and cosmetics to the game, they are not focused on the endgame. This is because Chapter 2 and the DLC were planned and began development before launch. Take a look at our Roadmap below. You can see both the free updates and paid DLCs planned for the near future, and our monthly development cycle as it pertains to player feedback, bugs, and cheats. This monthly cadence is not necessarily always achieved, but it serves to give a window into our approach.  We will share more about the major content and features coming in Chapter 2 and the DLC soon, but in terms of quality of life improvements, we’re adding the ability to rename vehicles, storage containers, and other placeables; more reliable ornithopter rockets for combat enthusiasts; and the highly requested option to swap seats in a vehicle with a hotkey. All of these features will be available for testing on the Public Test Client soon! So let’s talk about the endgame. During summer we’ve made changes and tweaks to the formula of the Deep Desert – with varying degrees of success. We have attracted very different demographics to the game and they are asking for very different things. We’ve identified several core issues; loss of items/vehicles, players feeling that they are forced into PvP, exploits and cheats, and lack of endgame content/grind. There are things that we can do in the short term to address some of these, and things that will take us longer to improve. Short-term, we will be making changes that are heavily requested by players. Here are some that are coming quickly: Improved Player Logging – One of the key frustrations we see is the lack of information and clarity around why certain items/objects/vehicles are gone. We will increase the information in your logs so that you have a better idea of what is going on. For example, listing the names of people who take things from chests in your base. Vehicle Salvaging System – We’re working on a vehicle salvaging system that will allow you to recover lost vehicles. Cobalt Paste/Vehicle Inventory – We’re adjusting the volume of the infamous cobalt paste and adding more slots to the Assault Ornithopter vehicle inventory. We will be adding a cargo container that can be carried by the Carrier Ornithopter. Instanced Deep Desert Loot – The constant camping and queuing of the Deep Desert Testing Stations leads to a frustrating experience where people arrive at an empty Testing Station. We’re going to change these to be more in line with the rest of the game. Offline Notifications about important events – We understand that not everybody can or wants to log in to check power/taxes constantly in the game. We would like to create a notification service that sends you the status of your base via email. This one is squarely aimed at you, Ben. These are in addition to the current slate of UI/UX improvements, continued crackdown on exploiters/cheaters, and stability improvements. Now let’s talk about longer term planning and what we have in store for the endgame. As we’ve mentioned previously, the Landsraad is supposed to be the endgame activity driver. Currently it does not have the breadth or depth of content or progression to serve that function. As we work towards Chapter 3, we will begin to tie the faction progression of the game to the Landsraad, while also systematically building out the Landsraad with a greater variety of activities across the world. As a player this means that you can increase your faction rank by completing Landsraad tasks, checking in with your Duke or Baron occasionally to perform special missions and visit faction vendors. Landsraad activities will become contract based, rather than delivery based, which will allow us to effectively remove the issue of stockpiling th...",1755534394,
1172710,Dune: Awakening - 1.1.20.0 Hotfix,"Hey Sleepers,This hotfix requires a client-side download. Remember to restart your Steam client if the download does not appear automatically for you. Servers will be coming back up shortly.For the list of known issues, please visit our Discord server or Steam discussion boards.FIXESServer and client stability improvements.Fixed the stuttering issue on low and medium graphical settings.Fixed the P83 travel error that prevented players from traveling and could have resulted in vehicle loss. Players who lost their vehicles due to this bug will get them back.Fixed an issue with traveling that could result in the loss of inventory items.",1755162192,['patchnotes']
1172710,Dune: Awakening – 1.1.20.0 Patch Notes,"Hey Sleepers,Our latest 1.1.20.0 update is now online! This update addresses several issues and adds many Quality of Life changes, including the highly anticipated Deposit/Extract All Blood/Water buttons. Let the liquids flow!We have run the patch on the Public Test server in the last couple of weeks, applying updates daily and making changes based on your feedback.We will continue to make changes and address more issues. Please report any bugs you face using the in-game Report Bug feature. You can also use Request Help to receive assistance from our Support team.For the list of known issues, please visit our Discord server or Steam discussion boards.HighlightsIt is now possible to place pillars between walls.A new Sandbike variant and a new set of Desert Mechanic Decorations is available for purchase at the vehicle vendor.NPCs can no longer damage player-owned buildings or placeables in PvE areas. This fix addresses an exploit used to get NPCs to destroy other players' building pieces or subfief console.Colliding with the sandworm's body while it is above the ground on open sand will now result in death.You can now search for items by name in the exchange, and the categories have been re-organized to make browsing for items more convenient and intuitive.Added Deposit All Blood and Deposit/Extract All Water buttons to blood purifiers and water cisterns.The Solido Replicator will now encode placeables and decoration, allowing you to copy your fully functional and stylish bases with everything included.Fixed an issue where you could build horizontal pentashields without attaching them to walls.Partially harvested Spice fields now show correct visuals after a client reconnect.Read the complete patch notes list here.",1755075766,['patchnotes']
1172710,Build Your Dune: Winners!,"Sleepers, The very first building contest for Dune: Awakening is over and we are simply blown away by the participation! Thousands of you joined in the fun, sharing buildings into which you clearly put so much heart, time, and effort. We’ve watched your videos and checked your screenshots and read the backstories you shared – even though that wasn’t required to participate! Selecting winners among all of these amazing buildings was incredibly challenging. We’ve had long deliberations and a lot of back-and-forth. While all participants are winners in our hearts, we ultimately had to select the ones that we thought did the best based on our criteria. We’ve also expanded our Honorary Mentions size to include more of you! If your building isn't featured here, don't be afraid to post it on social media, our Discord server, the subreddit, and elsewhere if you haven't already! If you are featured here, we will be reaching out to you about your prizes. If you submitted through Pimp My Dune and have won, you will receive an email within the week. If you won elsewhere, you will receive a DM from the official Dune: Awakening account. Special thanks to Lent for supporting the contest through their website, as well as Madrinas for sponsoring the runner up prize! We've listed the first place winners here, but to see the runner ups and many honorable mentions, please go to our blog!First Place WinnersOur first place winners will be receiving the LEGO Ornithopter as well as the Atreides Battle Rifle skin. We've added their descriptions when one was included, as well as a link where you can see more photos and/or videos of their amazing creations.Choam""A trade center run by CHOAM mercantiles. It has two watch tower's, one at the peak of the center to watch for incoming sand storms in the distance. And another on the ground to watch for sand worms attacking from below. It's unique pyramid shape helps protect the building from high winds and sand erosion over the years. Attached is a visitor center, for people to relax while doing their trade business deals."" - Saphiria, Pimp My DuneHarkonnen""It was built and altered, piece by piece, over a many years and through many conflicts . It has been a factory, it has been a smuggler's post, it has been a church. It might still be all these things or none of these things."" - Fiefie, Pimp My DuneAtreides""The Windchime Monastery, working as a school for the Atreides, houses a vast knowledge from the ways of combat to the ancient history of the great houses. One could say topping even the Imperium's prestiged schools.The school has four buildings, Main Dormitory (tallest tower), Main Library (second tallest tower), Watch Tower (second shortest tower), and Main Lecture Hall (shortest tower), with an outside dining balcony.""For every student graduated, shall one wind chime be hung"" - PrincipalA tradition of the school meant to bring good fortune for each graduate parting ways."" - Jorua, Pimp My DuneRemember to check out the blog for more!",1754663863,
1172710,Here's your chance to get Dune Awakening and two more games for $5,"After pouring hours into gaining materials and fighting off hordes of enemies, I finally felt comfortable enough to tackle anything Arrakis threw my way in <strong>Dune Awakening</strong>. What I didn't account for was my lack of a Sandbike, and as I walked across the endlessness of the desert, a rumbling underneath sent the Sandworms straight to me, eating me and all my hard work in one big gulp. It's a brutal, challenging, and yet serious fun take on the franchise, and it's even better if you can grab it for just $5 / £5. <a href=""https://www.pcgamesn.com/dune-awakening/mystery-bundle"">Read the rest of the story...</a> RELATED LINKS: <a href=""https://www.pcgamesn.com/dune-awakening/down-server-status"">Is Dune Awakening down? Server status right now</a> <a href=""https://www.pcgamesn.com/dune-awakening/patch-pentashields"">Dune Awakening's new patch may collapse your Pentashields if you're not careful</a> <a href=""https://www.pcgamesn.com/dune-awakening/exploits-cheating-steam-family-sharing-disabled"">Dune Awakening disables Family Sharing as exploits see it ""abused frequently""</a> ",1754309468,
1172710,Public Test Client: Patch 1.1.20.0,"Hey Sleepers,We have opened the Public Test Client to test patch 1.1.20.0! You can find the PTC in your Steam library as a separate client.Before we dive into the patch notes we’ve got some important information on a couple things. First, we would appreciate your help in testing the following changes:Colliding ornithopters will now get an impulse applied to separate them. This will mitigate the griefing done to Carrier ornithopters by swarming with multiple ornithopters.Added Deposit All Blood and Deposit/Extract All Water buttons to blood purifiers and water cisterns.To help with testing this, we will provide a top-tier buggy, a scout ornithopter, assault ornithopter, and a transport ornithopter. To receive the vehicles, use the Claim option in Escape menu or if you have an issue, make an in-game bug report. We suggest being in a base with Storage nearby when claiming them, as you will receive the parts for the vehicles.We are also disabling taxation and sandstorms for the first week of this patch to not endanger your base. You can find the full patch notes list here: \LINK]You can discuss the patch on the relevant Steam Discussion Board and our Discord.Thank you and happy testing!",1754294703,
1172710,Dune Awakening's new patch may collapse your Pentashields if you're not careful,"<strong>Dune Awakening</strong> has had a pretty good run so far since launching in June. Despite a slightly more bumpy road in recent weeks, the reviews for the MMO are still sitting at 'mostly positive,' with a 75% rating from Steam users. But the upcoming patch is set to shake some things up, adding new content, balancing, and tweaks, including a bug fix that might collapse your Pentashield. That's not all; you can test out the new patch for yourself right now. <a href=""https://www.pcgamesn.com/dune-awakening/patch-pentashields"">Read the rest of the story...</a> RELATED LINKS: <a href=""https://www.pcgamesn.com/dune-awakening/down-server-status"">Is Dune Awakening down? Server status right now</a> <a href=""https://www.pcgamesn.com/dune-awakening/exploits-cheating-steam-family-sharing-disabled"">Dune Awakening disables Family Sharing as exploits see it ""abused frequently""</a> <a href=""https://www.pcgamesn.com/dune-awakening/base-building"">Dune Awakening base building guide</a> ",1753980005,
1172710,Upcoming Change to Pentashield-Only Bases,"Sleepers,With the upcoming 1.1.20 patch, we are making a change that will fix a bug that allowed building Pentashields without proper support. As a consequence, all Pentashields built in this way will collapse when the patch goes live.If you have any Pentashields built this way (not attached to the walls but to one another), please rebuild them properly to avoid losing your base.The current ETA for the patch is August 12. In the meanwhile, 1.1.20 is available in the Public Test Client now, you can read more about it here.See you on Arrakis, Sleepers.",1753967329,
1172710,"Dune Awakening disables Family Sharing as exploits see it ""abused frequently""","<strong>Dune Awakening</strong> is doing a fairly decent job at cementing its place in the MMO scene so far - a scene that's notoriously hard to break into. However, as with all online multiplayer games, it's got an army of cheaters and bad actors to fight back against. In its efforts to make things fair for all players, developer Funcom has just revealed that it'll be disabling Family Sharing on Steam as it works to eliminate a rampant exploit. Even though it has already banned ""hundreds of players"" and wiped out lots of illegitimately earned Solaris, the studio says it has to remove the feature while it works out a way to permanently eliminate the exploit. <a href=""https://www.pcgamesn.com/dune-awakening/exploits-cheating-steam-family-sharing-disabled"">Read the rest of the story...</a> RELATED LINKS: <a href=""https://www.pcgamesn.com/dune-awakening/base-building"">Dune Awakening base building guide</a> <a href=""https://www.pcgamesn.com/dune-awakening/down-server-status"">Is Dune Awakening down? Server status right now</a> <a href=""https://www.pcgamesn.com/dune-awakening/best-settings-for-pc-and-steam-deck"">Best Dune Awakening settings for PC and Steam Deck</a> ",1753475428,
1172710,An Update to Family Sharing and Recent Efforts,"Sleepers, We would like to share a quick update on cheats and exploits and inform you that we’re temporarily disabling Family Sharing.  As soon as these issues started, we began gathering reports and data to work on fixes and preventative measures. Over the past weeks, we have deployed multiple hotfixes that addressed several exploits. We are monitoring the situation and will continue our efforts as needed.  In addition to fixing the causes, we have also taken some direct action against players who used exploits, banning hundreds of players and removing large amounts of exploited Solaris from the game. These efforts are currently ongoing: our investigations continue and our banhammer has more work to do.  We are aware of some other issues caused by cheats and we have fixes in the works that we aim to implement in the next patches. In the meantime, we will continue to take action on accounts you reported via the Request Help option in the game.  Last but not least, we are temporarily disabling Family Sharing as part of our efforts as we have unfortunately seen this feature abused frequently. We apologize to our players who legitimately used this feature. We are actively working on changes that will allow us to re-enable the system as soon as possible. While we don’t have an ETA to share at the moment, we are aiming to implement those changes within this year. We will let you know as soon as we have a date.  Thank you all for your reports, cooperation, and your continued patience and understanding. ",1753461581,
1172710,Dune: Awakening - 1.1.17.0 Hotfix,"Hey Sleepers,This hotfix requires a client-side download. Remember to restart your Steam client if the download does not appear automatically for you. Servers will be coming back up shortly.For the list of known issues, please visit our Discord server or Steam discussion boards.FIXESBackend security improvements.Fixed a shipwreck with the wrong Kanly setting. This will affect future Deep Desert layouts.Restored emotes that were missing for some players in public servers.",1753435823,['patchnotes']
1172710,Dune: Awakening - 1.1.17.0 Patch Notes,"Hey Sleepers,We've just updated the game with the version 1.1.17.0, please find the patch notes below.Remember to restart your Steam client if the download does not appear automatically for you.For the list of known issues, please visit our Discord server of Steam discussion boards.FEATURES AND CHANGESAdded more rock islands in Deep Desert, primarily in the PvE area, to allow for more resources and real estate for base building, effective on July 29th after the Coriolis Storm apex.If you encounter a connection issue while crossing between servers in the Deep Desert and leave your ornithopter, it will be teleported to the respawn location, alongside you.Ben, if you’re reading this, your base power is out.FIXESImproved server and client stability.Fixed an issue where you could lose connection to the server if you exited the ornithopter after the failed attempt to cross between Deep Desert partitions.Fixed an exploit that allowed a player to gain experience using points of interest.Fixed a vulnerability that allowed players to duplicate items in social hubs.Fixed an issue where you could fail to climb the sides of a small shipwreck and get into a rubberbanded state.",1753348727,
1172710,Dune: Awakening - 1.1.15.0 Hotfix 3,"Hey Sleepers,We released a hotfix on July 20th that addresses a couple of exploits. Please find the patch notes below.For the list of known issues, please visit our Discord server or Steam discussion boards.FIXESFixed a vulnerability that allowed players to dupe solari at city bankers.Fixed a vulnerability that allowed players to harness other players’ vehicles without having the vehicle permission.",1753089941,['patchnotes']
1172710,Dune: Awakening - 1.1.15.0 Hotfix 2,"Hey Sleepers,This hotfix requires a client-side download. Remember to restart your Steam client if the download does not appear automatically for you. Servers will be coming back up shortly.For the list of known issues, please visit our Discord server or Steam discussion boards.FIXESImproved server and client stability.Fixed an additional instance of the issue where players were sometimes unable to travel from Arrakeen and Harko Village to the Overland Map.Fixed an edge case issue where inventory items could get missing after travelling between the maps.Fixed an issue with invisible inventory items when the player moved the items between inventories and quickly swapped their positions in the target inventory.Fixed a vulnerability that allowed item duplication at the Exchange, while trading or in inventories. Visually, you may see duplicated items on your game client, but they don’t exist.Fixed an issue where players were unable to connect to the game, receiving the H74 error code message.",1752740021,['patchnotes']
1172710,"New Dune Awakening patch notes fix an item dupe glitch, even if you can't tell","The latest <strong>Dune Awakening </strong>patch notes are here, and developer Funcom has fixed a prevalent item duplication glitch. Some players had previously been able to copy items while trading via the Exchange, but this exploit is now a thing of the past. Funcom says you might still see any duplicated items in your inventory, but confirms ""they don't exist."" <a href=""https://www.pcgamesn.com/dune-awakening/patch-notes-item-duplication-fix"">Read the rest of the story...</a> RELATED LINKS: <a href=""https://www.pcgamesn.com/dune-awakening/down-server-status"">Is Dune Awakening down? Server status right now</a> <a href=""https://www.pcgamesn.com/dune-awakening/guides"">Dune Awakening guides</a> <a href=""https://www.pcgamesn.com/dune-awakening/deep-desert-pve-apology"">Dune Awakening dev apologizes for Deep Desert PvE issue, promises reimbursement</a> ",1752673535,
