appid,title,contents,date,tags
1240440,Operation: Infinite Out Now,"To celebrate all the Spartans in our Halo Infinite Fireteam, Operation: Infinite introduces a 100-tier free Operation Pass featuring three full armor sets and a 100-tier Premium Pass offering five more sets, six weapon models, and over 30 exclusive Spartan customizations.Upgrade to the Premium Pass at any time to transfer your tier progress from the free Operation Pass and earn your way to eight full sets.Halo Infinite’s last planned multiplayer update also welcomes permanent progression boosts, new maps, refreshed Ranked Seasons, over 200 never-before-seen customizations arriving in The Exchange, and more!Steady on, Spartan. The future is Infinite.OPERATION PASSThe missions may change, but these Operation Passes are here to stay. Operation: Infinite’s 100-tier Operation Passes have no expiration date, meaning their armor sets, customizations, and Spartan Points can be earned at any time.Likewise, the 100-tier Premium Pass—offering five exclusive armor sets, instant unlocks, and a heroic assortment of Spartan customizations—can be purchased indefinitely.FREE OPERATION PASSThree new armor sets await in Operation: Infinite’s free Operation Pass. Complete all 100 tiers at your leisure to unlock the Serpin, Seeker, and Adamant armor sets, plus a champion’s purse of coatings, rewards, and Spartan customizations.As you complete all 100 tiers, you’ll also unlock the Questing Sky, Celestite Sparkle, Unbroken Defender, and Silent Snow armor coatings, Icicle Falls visor, Blackened Steel weapon coating, and the terminally chill Respect stance.See all armor sets in the Operation: Infinite preview.PREMIUM OPERATION PASSThe 100-tier Premium Operation Pass features five earnable armor sets, six all-new weapon models, instant unlocks, and over 30 Spartan customizations you won’t find anywhere else.Check out our Community Livestream to see all five armor sets and more exclusive customizations only available in Operation: Infinite’s Premium Operation Pass.See all armor sets in the Operation: Infinite preview.Upgrade to the Premium Operation Pass to instantly unlock the Charged Quill Shock Rifle weapon model and the Phoenix Gold weapon coating.Operation: Infinite’s Premium Operation Pass can be purchased at any time. Once acquired, you’ll instantly carry over your tier progress from Operation: Infinite’s free Operation Pass and permanently unlock bonus XP and an additional challenge slot.2 NEW MAPSGet tactical in a new Ranked map and cozy up to a festive Husky hideaway just in time for the Halodays!YULETIDEBookmark this map.Forged by: Sikamikanico, bullet2thehead9, Whos BlazeSet in a quiet, alpine village nestled beneath the Northern Lights, Yuletide gift-wraps the warm glow of streetlights, freshly fallen snow, and the aimless smoke of a familiar hearth together in one beautifully serene package—and shatters it with mercilessly merry Husky combat.Yuletide is available in Husky Raid and Super Husky Raid modes in the Quick Play playlist.VACANCYBookmark this map.Forged by: MikRips, Ethan HibbsOn a quiet square sits the Hotel Kijani, a modest inn baked into its surroundings by years of mid-afternoon heat. Hours after the markets have closed, when the alleyways and busy thoroughfares have emptied, and long shadows begin to grow on the crested archways of this storied city—only then do warriors strafe its scenic courtyards in pursuit of glory.Vacancy is available in Ranked Arena, Slayer, Doubles, and select rotational modes.PROGRESSION UPDATESWe’ve updated two core progression mechanics to make playing Halo Infinite more rewarding than ever! Starting today, you’ll earn 2X SP on Daily Challenges and Weekly Ultimate Rewards, and progress twice as fast through Career Ranks thanks to doubled Applied Score multipliers on every matchmaking playlist.Check out our Operation: Infinite preview for more details and a rundown on what to expect for the 25th anniversary of Halo: Combat Evolved.FREE LOG-IN UNLOCKAs the 25th anniversary of Halo: Combat Evolved approaches, we look forward to celebrating Halo’s universe, community, and enduring legacy with you throughout next year.To kick things off, look for a free customization bundle to arrive in January as an instant log-in unlock for all Halo Infinite players, containing all these never-before-released items:25th Anniversary NameplateGEN XII Vehicle CoatingAccess Denied Armor CoatingLifegivers Hex Weapon CoatingRing Breaker Weapon CharmZeta Emissary NameplateZeta Trailblazer NameplatePlay Halo Infinite anytime in 2026 to unlock the anniversary bundle!THE SHOPAs we bid adieu to four years of Halo Infinite multiplayer updates, the sentimental caretakers of The Shop have forged fitting testaments to three of Halo’s legendary villains—and one fiendish incarnation straight from the Covenant’s nightmares.DEFIANT BUNDLEProve your legend with the Defiant bundle, featuring arcane weaponry, an exclusive death effect, and armor sets inspired by Halo Infinite’s enigmatic Harbinger and the demoniac Spartan...",1763491810,
1240440,Operation: Infinite Out Now,"To celebrate all the Spartans in our Halo Infinite Fireteam, Operation: Infinite introduces a 100-tier free Operation Pass featuring three full armor sets and a 100-tier Premium Pass offering five more sets, six weapon models, and over 30 exclusive Spartan customizations.Upgrade to the Premium Pass at any time to transfer your tier progress from the free Operation Pass and earn your way to eight full sets.Halo Infinite’s last planned multiplayer update also welcomes permanent progression boosts, new maps, refreshed Ranked Seasons, over 200 never-before-seen customizations arriving in The Exchange, and more!Steady on, Spartan. The future is Infinite.OPERATION PASSThe missions may change, but these Operation Passes are here to stay. Operation: Infinite’s 100-tier Operation Passes have no expiration date, meaning their armor sets, customizations, and Spartan Points can be earned at any time.Likewise, the 100-tier Premium Pass—offering five exclusive armor sets, instant unlocks, and a heroic assortment of Spartan customizations—can be purchased indefinitely.FREE OPERATION PASSThree new armor sets await in Operation: Infinite’s free Operation Pass. Complete all 100 tiers at your leisure to unlock the Serpin, Seeker, and Adamant armor sets, plus a champion’s purse of coatings, rewards, and Spartan customizations.As you complete all 100 tiers, you’ll also unlock the Questing Sky, Celestite Sparkle, Unbroken Defender, and Silent Snow armor coatings, Icicle Falls visor, Blackened Steel weapon coating, and the terminally chill Respect stance.See all armor sets in the Operation: Infinite preview.PREMIUM OPERATION PASSThe 100-tier Premium Operation Pass features five earnable armor sets, six all-new weapon models, instant unlocks, and over 30 Spartan customizations you won’t find anywhere else.Check out our Community Livestream to see all five armor sets and more exclusive customizations only available in Operation: Infinite’s Premium Operation Pass.See all armor sets in the Operation: Infinite preview.Upgrade to the Premium Operation Pass to instantly unlock the Charged Quill Shock Rifle weapon model and the Phoenix Gold weapon coating.Operation: Infinite’s Premium Operation Pass can be purchased at any time. Once acquired, you’ll instantly carry over your tier progress from Operation: Infinite’s free Operation Pass and permanently unlock bonus XP and an additional challenge slot.2 NEW MAPSGet tactical in a new Ranked map and cozy up to a festive Husky hideaway just in time for the Halodays!YULETIDEBookmark this map.Forged by: Sikamikanico, bullet2thehead9, Whos BlazeSet in a quiet, alpine village nestled beneath the Northern Lights, Yuletide gift-wraps the warm glow of streetlights, freshly fallen snow, and the aimless smoke of a familiar hearth together in one beautifully serene package—and shatters it with mercilessly merry Husky combat.Yuletide is available in Husky Raid and Super Husky Raid modes in the Quick Play playlist.VACANCYBookmark this map.Forged by: MikRips, Ethan HibbsOn a quiet square sits the Hotel Kijani, a modest inn baked into its surroundings by years of mid-afternoon heat. Hours after the markets have closed, when the alleyways and busy thoroughfares have emptied, and long shadows begin to grow on the crested archways of this storied city—only then do warriors strafe its scenic courtyards in pursuit of glory.Vacancy is available in Ranked Arena, Slayer, Doubles, and select rotational modes.PROGRESSION UPDATESWe’ve updated two core progression mechanics to make playing Halo Infinite more rewarding than ever! Starting today, you’ll earn 2X SP on Daily Challenges and Weekly Ultimate Rewards, and progress twice as fast through Career Ranks thanks to doubled Applied Score multipliers on every matchmaking playlist.Check out our Operation: Infinite preview for more details and a rundown on what to expect for the 25th anniversary of Halo: Combat Evolved.FREE LOG-IN UNLOCKAs the 25th anniversary of Halo: Combat Evolved approaches, we look forward to celebrating Halo’s universe, community, and enduring legacy with you throughout next year.To kick things off, look for a free customization bundle to arrive in January as an instant log-in unlock for all Halo Infinite players, containing all these never-before-released items:25th Anniversary NameplateGEN XII Vehicle CoatingAccess Denied Armor CoatingLifegivers Hex Weapon CoatingRing Breaker Weapon CharmZeta Emissary NameplateZeta Trailblazer NameplatePlay Halo Infinite anytime in 2026 to unlock the anniversary bundle!THE SHOPAs we bid adieu to four years of Halo Infinite multiplayer updates, the sentimental caretakers of The Shop have forged fitting testaments to three of Halo’s legendary villains—and one fiendish incarnation straight from the Covenant’s nightmares.DEFIANT BUNDLEProve your legend with the Defiant bundle, featuring arcane weaponry, an exclusive death effect, and armor sets inspired by Halo Infinite’s enigmatic Harbinger and the demoniac Spartan...",1762552849,
1240440,Operation: Infinite Update Preview,"As we look back on four years of evolution and updates in Halo Infinite, we’d like to thank our community for your steadfast support. Without your feedback and enthusiasm, Halo Infinite multiplayer would not be the special place it is today: a robust arena for slaying and playing, with something for every Spartan.With multiple Halo titles in development, we’ll need our whole team’s combined focus to deliver new experiences with the same passion and care that our community has given us. While we remain committed to supporting Halo Infinite on the road ahead, Operation: Infinite is the last major content update currently planned.Starting November 18, Operation: Infinite will introduce a 2X boosts on Career Rank and SP, 100-tier Operation Pass, eight earnable armor sets, new Ranked Seasons, and 200 never-before-released customizations arriving in The Exchange.Jump into Operation: Infinite on November 18. A “perfectly perfect” pair of progression updates awaits! On November 18, we’ll double the earning rate for both Career Rank and Spartan Points to make each match of Halo Infinite more rewarding than ever.2X Career Rank ProgressStarting in Operation: Infinite, the Applied Score multipliers for all matchmaking playlists will be doubled so that players can progress twice as fast through Career Ranks.Upon completing matches in Halo Infinite, your match-based Personal Score gets factored into an Applied Score multiplier to generate Career Rank progress from your heroic exploits. With a 2X boost on every matchmaking playlist, you’ll climb ranks on the double.Reach the maximum level of Hero, and you’ll unlock the coveted Mark VI armor kit as worn by the Master Chief in the Halo Infinite Campaign.2X Spartan Point RewardsIf you’ve been admiring something shiny in The Exchange, get ready to splurge!Halo Infinite players will soon earn twice as many Spartan Points (SP) for completing any match-based Daily Challenge that awards SP. Weekly Ultimate Rewards (earned by completing all Weekly Challenges) will also be doubled to 2,000 SP—making one mighty bonus for champion challenge-seekers.OPERATION PASS OVERVIEWThe missions may change, but these Operation Passes are here to stay. Operation: Infinite’s free, 100-tier Operation Pass and 100-tier Premium Pass have no planned expiration date.Upgrade to the 100-tier Premium Pass to transfer your Operation: Infinite progress and earn your way to five more unique armor sets, six weapon models, and over 30 exclusive Spartan customizations. That’s eight total armor sets up for grabs!FREE OPERATION PASSThree new armor sets await in Halo Infinite’s final free Operation Pass. Complete all 100 tiers at your leisure to unlock the following exclusive armor sets, plus a champion’s purse of coatings, rewards, and Spartan customizations.Serpin: Kaidon Thel ‘Vadam grants the rank of Serpin to Spartans who have proven their loyalty and martial prowess in battle beside the Swords of Sanghelios. The master-crafted Serpin regalia betokens their esteem among Sangheili.Seeker: Lethbridge Industrial’s GEN 2 SEEKER armor set contains state-of-the-art distortion and sensor technology to ensure that you can always find your target—but they’ll never know what hit ‘em.Adamant: Cultivated from a flake of Forerunner crystal, the ADAMANT unit’s lab-grown layers resonate harmoniously with ancient mechanisms and instantaneously forge compatible interfaces with Mjolnir systems.As you climb through this Operation’s lofty 100 reward tiers, you’ll also unlock the Silent Snow armor coating, Icicle Falls visor, Blackened Steel weapon coating, and the terminally chill Respect stance.PREMIUM OPERATION PASSThe 100-tier Premium Operation Pass features five additional earnable armor sets, six all-new weapon models, and over 30 Spartan customizations you won’t find anywhere else.Artificer: The totemic gaze of the Artificer reveals multitudes of overlaid meanings that only its bearer may parse. Each interlocking piece of its indecipherable whole is a potsherd sculpted through reverent contemplations on war.Seedwarden: A reclaimed instrument of long-promised legacy. The Seedwarden’s nascent abilities may be inscrutable to Executors and other infolife, but its capacity as a weapon of war pales in comparison to its lifegiving potential.Kobold: Models from the KOBOLD combat drone series are interoperable with most GEN2 Mjolnir armor cores through specialized jockey frames. This armor can be outfitted with a tactical chassis for autonomous combat or operated remotely via telepresence.Phoenix: The PHOENIX is an artistic expression of the bold anima that drives Meyer’s visionary engineers to continuously redefine armored combat. Enhanced with energy dispersion technology, it is the ideal armor for rising from the ashes.First Vanguard: Though unlikely, a Spartan adopted into a Sangheili clan may rise to the rank of Kaidon—and become First Vanguard of their lands in times of war. This armor is cast with soil from the Kaidon’s land...",1762546049,
1240440,Thank You | Halo World Championship 2025,"Whether you joined us in Seattle or on our live broadcast, we’d like to thank everyone in the Halo community for making this year’s Halo World Championship in Seattle such an unforgettable experience.Between swapping stories with Halo fans, watching elite Halo Infinite players duke it out on the main stage, announcing Halo: Campaign Evolved, and seeing our community raise a whopping $67,000 for Gamers Outreach, it’s hard to pick a favorite moment from this incredible weekend—so we thought we’d share a whole collection of them!Check out more highlights from this year’s Halo World Championship below.Congrats to Shopify RebellionAfter three days of intense competitive heat, Shopify Rebellion clutched up and came out on top against OpTic Gaming in the best-of-seven Grand Finals. It was a remarkable journey from this year’s earliest HCS events to the Halo World Championship stage, and their relentless dedication certainly paid off on Sunday!Congratulations to Shopify Rebellion, our 2025 Halo World Champions, and to all the teams that made this year’s tournament the most attended HCS event to date.Cunning CosplayHalo cosplayers really know how to strut their Spartan stuff! This year’s Community Cosplay Contest welcomed 85 cosplayers to the Community Stage, where they showed off their stellar handiwork and a flair for dramatic entrances.Congratulations to Miss_Boof (as Olympia Vale), James (as Crochet Master Chief), and Sola Mors (as Flood Spartan) on ascending to the Main Stage, and to all our heroic contestants who dazzled the crowd at the Community Cosplay Contest!Download photos from the contest: Part 1 | Part 2 | Part 3Mighty MakersThis year’s Maker’s Contest was filled with impressive armaments, curious creations, and oddly satisfying oddments. Check out photos from the top three winners below!Draxes took first place with his Jega ‘Rdomnai bust and Elite Bloodblade (above), followed closely by MightyMarkProps with an extra-lethal Hydra model and Fallen922 with a Craigtastic bass guitar (below).Meet-up MemoriesIt’s always a treat to meet so many Halo fans IRL! During this weekend’s event, the Halo Studios community team held daily Community Meet-ups featuring Halo-themed games and limited-edition posters by Soul_ant19, OutletChief729, and entransing.We’re so grateful to everyone who stopped by to say hello, play games, and sign our posters for the Halo Studios office! If you couldn’t attend in person, don't forget to snag a digital copy of this year’s Community Meet-up posters.Halo Fest 2026Don’t miss your chance to join us in Seattle, WA again for Halo Fest in December 2026.The event begins with an orchestral performance of iconic Halo music, in concert for one night only on December 11, followed by a two-day convention celebrating Halo’s legacy, story, and unrivaled community. We hope you can make it!",1761861723,
1240440,Operation: Haloween II Community Playdate,Something wicked this way spawns…Join us for our Operation: Haloween II Community Playdate tomorrow at 11am PT for some spooktacular shenanigans. Match us to earn your treat – the Unicorn of Ice rewards!Costumes optional. Chaos guaranteed.,1761855227,
1240440,Happy 10th Birthday Halo 5,"Fireteam Osiris, the light is green!It has been ten years since Spartan Locke sent Fireteam Osiris to Kamchatka, thus setting in motion the events of Halo: 5 Guardians.We’re celebrating in Halo Infinite by bringing some fan-favorite armor sets to the Exchange and bringing back the new, unique mode, Extermination.Anniversary ArmorsIf you’ve banked enough Spartan Points, you’ll be able to grab these sets as soon as they drop out of slipspace. If not, fear not – they will be available from the Exchange so you may obtain them at your leisure. (Or you can grab them from the Shop if you prefer that route.) Hunter: Savvy Spartans choose HUNTER technology for its customizable interfaces, a puissant surveillance suite, and dependable maneuverability in hand-to-hand sparring.Helljumper: Thanks to innovative field upgrades by Cascade Stronghold Technologies, testbed HELLJUMPER armor can reliably endure the atmospheric rigors expected of GEN3 Mjolnir.Copperhead: When it comes to building interspecies alliances, COPPERHEAD armor has consistently proven its merits for both kinetic diplomacy and charm offensives.Shinobi: Though the design’s origins remain obscure, the undisclosed reasons behind its approved use among Spartans of the UNSC may prove even more unknowable.Exacting ExterminationWe’re all familiar with Team Slayer where it’s 4v4 and you score a point for each kill on the opponent’s team. And first team to 50 points, wins the match. Extermination is the same at the very basics: 4v4 and you gotta kill the enemy. But you’re not trying to get to 50 kills.The Goal:Eliminate all members of the enemy team at once.Super simple right? If you can kill the entire enemy team before anyone respawns, you win the round.Were it so easy.So what’s the catch? If a player can stay alive long enough for their teammates to respawn, the round continues. You’ll have a 15 second respawn between each death. And for the record: this goes by fast when you’re hunting that last elusive Spartan but somehow seems to last an eternity when you’re desperately evading, trying to let your teammate respawn.Combat ComponentsAlright let’s get the lowdown before you throwdown:Short, two-minute roundsFirst to win five rounds, winsTeams swap sides after each roundRound ends at time or when an entire team is on respawnTies can occur when no team was Exterminated before timer runs outIf three ties occur, the team with the most points winsStrategic SpacesWith a new playlist comes new maps! Bookmark the mode here, then grab the maps and check ‘em out!Collateral Bookmark Credits: Pat Sounds, DellsotoNo uplink. No Signal...Nothing but static and rainStadium Bookmark Credits: Pat Sounds1...2...3 kills, you're out.Breakthrough Bookmark Credits: Silencer EU, Kat Rat A TatJust listen to the rain and the wind.Eyrie Bookmark Credits:  DanZama, ArturBlooshot, Starkey213036Guess some of us just don't like leaving a job half-finished.Ilex Bookmark Credits: Igrizhar, Yeehaw J24, JoValiant, Virus11010It's the facility, not the goat.Oppressor Bookmark Credits: Starkey213036, ArturBloodshotDrowned desperate screams of useless defiance.Runoff Bookmark Credits: Cousin Tim, MikRipsWhere does the water come from?Abbiocco Bookmark Credits: bullet2thehead9Grab a pizza on your way out.Closing ContemplationsThe light is still green, Spartans. Grab the new gear and check out Extermination today!",1761700438,
