appid,title,contents,date,tags
1240440,Halo: Whispers from the Pyre,"May 2560. As the Master Chief cuts a brutal swath through the ranks of the Banished, a Sangheili studymaster and his Kig-Yar companion seek to uncover the secrets of Zeta Halo’s mysterious ring totems. {STEAM_CLAN_IMAGE}/38365036/511d15ee3c6acd035678378dc7c6b98325bd93dd.png Halo: Whispers From the Pyre is available here, on Halo Waypoint, as a free PDF, and in audiobook format on YouTube. Historian's Note Halo: Whispers from the Pyre takes place at the end of May 2560—immediately following the death of War Chief Escharum at the hands of the Master Chief on Zeta Halo. “It is our great burden, is it not? To guide the preservation of the galaxy—even to the ends of erasing it. Weapons of last resort, built by my makers many millennia ago to starve out the great parasite. This ring is but one of seven. Designed to preserve life, designed to destroy it. One of seven. But, this ring is… different. Reforged from the remains of an earlier effort, it possesses abilities not shared by its siblings. This ring has… many secrets, some even worth dying for. Many in my place would see this charge as a burden. Custodian of one of the galaxy’s greatest marvels—and greatest perils. I admit, I often found myself feeling out of place with others like me. The monitors of the other installations seemed to share similar perspectives and experiences amongst each other, but I’ve always been an outcast among them—by both design, and by birthright. A different type of caretaker for a very different type of ring. While zero-seven’s integral place within the Array is most unquestionable, its history and original composition allow for far more… direct applications. Applications invoked in order to uphold the Mantle… or betray it.” {STEAM_CLAN_IMAGE}/38365036/5ca1a92b335ad9041d1b93890f99b9bbb1ec739c.jpg The voice of Despondent Pyre, the elusive monitor of Installation 07, faded. Studymaster Ciar ‘Yaham retracted his semi-circular datapad and clacked his mandibles in satisfaction as he scrutinized the great stone ring artifact that lay before him. Wisps of mist-like blue energy would typically indicate it had clusters of fragmented data to access, wherein ghostly voices from the past would slough off their digital embalmment to offer a fractured testimony. But this particular arcane curio had now fallen dark and silent. “Though this artifact appears to have been accessed recently, it still bore latent datastreams that we were able to extract.” Studymaster ‘Yaham turned to Dahk’rah, a Kig-Yar Skirmisher of a group known as the Mind Talon with whom he had found himself partnered in their joint efforts to uncover the many ancient secrets of Zeta Halo. “More from monitor,” Dahk’rah said, running a hand through her plume of red feathers. “Curious mention of Oth Koronn’s past. Reforged, unique abilities and applications… Great prestige for us if we find!” ‘Yaham nodded in agreement. Installation 07—designated “Oth Koronn” by the Banished and “Zeta Halo” by the Forerunners—had a fascinating history that they had only just scratched the surface of. Finding that history was one matter, but the process of interrogation and interpretation of data was another thing entirely. The Sangheili studymaster found that he was developing a fondness for Dahk’rah’s company of late. He had come to understand that, like many Kig-Yar, she possessed a great drive for profit, but rather than seeking abundance in riches, “profit” for Dahk’rah meant accumulating knowledge. In the days of the Covenant, that had been largely the singular domain of the San’Shyuum, but within the Banished it was just one way of many that anybody could make themselves useful. The mystery of the stone ring totems was something that they had discovered within a lunar cycle of occupying Oth Koronn, and both Studymaster ‘Yaham and Dahk’rah were determined to be the first to discover the truth of these strange artifacts. It had taken little work to convince Battle Officer Zeretus to establish a dedicated research outpost in the local area. ‘Yaham’s gaze swept across the vast landscape of the ring. From his position, standing near the summit of an alpine mountain which had been split in two by the Tyrant’s recent rending of the ring, he and Dahk’rah had an excellent line of sight over many nearby landmarks. To the north, the ring’s vista revealed an ocean of stars. Whenever the studymaster had looked into that abyss, attempting to trace the division between the dark of space and the azure sky, he had been moved to dizziness. At the farthest end of those suspended columns lay the Silent Auditorium—the site of the Tyrant’s immolation—which was still slowly reforming. Immediately north-east was a beacon tower that he had visited several day-cycles ago, where his correspondence with Dahk’rah had enabled him to translate excerpts of Despondent Pyre’s data. From there, the winding roads traveled eastward where rising stacks of hexagonal pillars—the building blocks of the installation’s artificial lands...",1734542771,
1240440,Community Playdate,Get ready to snowball into some festive fun ❄️ {STEAM_CLAN_IMAGE}/38365036/f97642e771add1bb15fbc98d94b22793d7f1289c.jpg Join us tomorrow at 11am PT for our final Community Playdate of 2024 as we dive into the Snowball Fight playlist. Earn your Unicorn of Ice rewards and celebrate the season 🦄 🟣 Twitch 🔴 YouTube {STEAM_CLAN_IMAGE}/38365036/eacba320bd89aab9c180ef9c5bf7a8487869a25a.jpg,1734480057,
1240440,Snowball Fight,"Winter has come to Halo Infinite, and with it, a flurry of excitement with the introduction of a veritable Snowball Fight. {STEAM_CLAN_IMAGE}/38365036/23f4e763fcce45b89659243348fd9d63c7d5065b.jpg That’s right. It’s time to be merry! ❄️ Unleashing the Snowballs Forget about the conventional arsenal of weapons; in Snowball Fight, the battlefield is ruled by the infinite supply of plasma grenades. Dip, dodge, and duck other team’s plasmas while launching your own. This is a team-based race to 50 so be sure to watch your teammate’s back too! As a bonus, you’ll be doing all this in Third-Person so you get the additional thrill of watching “snowballs” whiz by you as you enter the fray. A Winter Wonderland It wouldn’t be a snowball fight without snow and we’ve got three winter wonderlands for you to romp around on. Snow Fire Credits: Halo Studios Bookmark {STEAM_CLAN_IMAGE}/38365036/e6eaf8a20c07855b5fb082dd27096054b88383e9.jpg The perfect map to sing Frostyyyyyy the Snowman as you frolic around, throwing your snowballs at each other. Snowbound Credits: UneeQ Bookmark {STEAM_CLAN_IMAGE}/38365036/fe3df02d0ceb72ff53230983fa74052e4ed132b0.jpg There's bound to be snow here. Snow Ground Credits: UneeQ Bookmark {STEAM_CLAN_IMAGE}/38365036/caa5f6780f02fc45891b25d1826dc68aeae84502.jpg It’s over, Spartan, I have the snow ground. Break out the reindeer antlers and winter finery (or grab it in the Exchange) and get ready for a snowball fight!",1734459307,
1240440,Forge Features,"It’s the final countdown to 2025! {STEAM_CLAN_IMAGE}/38365036/ddf672f62f40e8fceff97e435e3bd56393c86d23.png We’ve got one more fantastic Forge Feature for 2024 and if you stick around to the end, you’ll see a list of things that the team here is looking for to beef up some future playlists. No time to waste, let’s jump in and see how we’re rounding out the year! Chill Out Credits: MadogWarrior, KunFuChicken93 Bookmark {STEAM_CLAN_IMAGE}/38365036/cd11fb4a4e903aa3b4529d292ede574a1916c113.png One of my all-time favorite maps from CE, Chill Out gives the perfect winter vibes. Bunker Buster Credits: CptCrunchy5405 Bookmarks: Map | Heroic | Legendary {STEAM_CLAN_IMAGE}/38365036/83e91a78449d819ef698dbfc48ccda4d720a9699.jpg You and up to 23 of your fellow Spartans (but preferably 2-8) can jump into this PvE mode and bust some bunkers as you try to prevent the Banished from taking hold of the UNSC tech at the end. Battle of Noctis Credits: iMightBeWright Bookmarks: Map | H5 Warzone Mode | H5 Warzone Whiplash {STEAM_CLAN_IMAGE}/38365036/de9bc38f274e8c340985da729d530a5bc887b1a2.png Even when the odds aren’t looking great, you can still destroy the enemy’s core on this remake of Halo 5’s Battle of Noctis! Plentiful Prefabs Credits: Scrubulba Bookmarks: Space Pickle | Albatross | Covenant Artillery | UNSC In Amber Clad | UNSC Forward Unto Dawn | R'Sisho Pattern Ship Breacher | Halo 3: ODST Olifant | Halo 3 Elephant | Enforcer Sentinel {STEAM_CLAN_IMAGE}/38365036/8233304ba85045e321ac2e9efa82c67bf80a1475.jpg {STEAM_CLAN_IMAGE}/38365036/b91566b21b9b9f6f855ffe40abca08ff15bec6bc.png {STEAM_CLAN_IMAGE}/38365036/115e15d46f247ce9a578b4d223d71dbfba32d838.png {STEAM_CLAN_IMAGE}/38365036/5b8f7d2b3a94c775cd25adf9871f59e38dffba2c.jpg Sometimes you just need a prefab to complete your build and Scrubulba has been putting in the work to keep you stocked up! Forward Unto 2025 We’re always on the lookout for new and exciting Forge content created by the community and as we head into 2025, next year is no different. While we’re always keeping our eyes peeled for new Husky Raid, Arena & BTB maps, here is a list of other interesting directions that we’d be excited to hear about. If you know of one (or have built one!), feel free to use the corresponding “343asks” tags in-game to get them on our radar! Specifically: Invasion maps Academy-themed Linear PvE Halo 4 maps & content Linear PvE experiences Linear Spooky experiences Halo 5 themed PvP & PvE experiences That’s a wrap! 2024 has been a very full year of Forge and we can’t wait to see what 2025 brings. HUGE thanks to all the creators who have made such incredible content, we will see you next year!",1734121845,
1240440,1v1 Showdown,"Guess what’s back. Back again—tell a friend. Today, the 1v1 Showdown makes its official debut in matchmaking! 1v1 Me Bro. For Real This Time. {STEAM_CLAN_IMAGE}/38365036/c5890f67e3c926659f90f52ae862f7ff721348d3.jpg One of the most common pieces of feedback we heard during the Combat Workshop outing was that you would love to take a friend with you for the ultimate showdown. We heard you loud and clear and the playlist has been updated to allow parties of two to search. Thanks to Forger Artifice, you can now literally challenge someone to a 1v1 and duke it out on the battlefield for the ultimate bragging rights. Rules of Engagement Before you jump in, you should know what you’re getting into and how to win. The victor is the first to win the best of 5 rounds. If you’re asking “How do I win a round?” we have you covered. You can win in one of two ways: Be the first to 5 kills Capture the zone Each round is a race to 5 with spawns resetting immediately after a kill happens to ensure everyone is on an even playing field. However, if at any point during the round someone captures a hill, they win the round. Yes, this means you can be down 4-1, capture the zone, and still win the round. Both players will be equipped identically with random loadouts that vary from round to round. You never know what you’ll have in your pockets so be nimble and ready to flex your strategy to adapt to the gear you might find. Just to keep you on your toes, you may be granted a round modifier (you’ll see the UI banner pop up) that adds a new twist to the game. Keep your reflexes sharp and be ready to adjust to whatever the game throws you, including a damage boost, low gravity, or amped up speed. You never know whatcha gonna get. Lay of the Land So, you’ve thrown the gauntlet and are ready to face off in the 1v1, meaning you’ve got the who and the what. Now all you need is where. We have found that standard Arena maps are slightly too large for 1v1, so with the help of community Forger UneeQ, we’ve taken slices of some of your favorite maps and created a unique set of battlefields. Between rounds, loadouts aren’t the only thing that changes—you’ll be teleported to a new map slice so the scenery will also stay fresh. Here are the maps that have had slices pulled from them: Aquarius {STEAM_CLAN_IMAGE}/38365036/69f8dcf522908998543b6650f3c9addae98ee7a4.jpg Argyle {STEAM_CLAN_IMAGE}/38365036/05af8762e8501124ac011452f4c459d321fb9947.jpg Bazaar {STEAM_CLAN_IMAGE}/38365036/e399cbaec528e3537f8a93b33714b6f486c1dea5.jpg Catalyst {STEAM_CLAN_IMAGE}/38365036/fd70174c8dac1eca5784bf4e51949b1d305e26ce.jpg Empyrean {STEAM_CLAN_IMAGE}/38365036/b4b90a13afac3d8580da8de0aae16fc04400a0d2.jpg Fortress* {STEAM_CLAN_IMAGE}/38365036/e746af9cb26f81f65f6bf835d8820f852df29f12.jpg Origin* {STEAM_CLAN_IMAGE}/38365036/1ea6dfeba367916808d4fea0787112a03166b23d.jpg *Fortress and Origin slices are making their debut with the full release of the playlist, with Origin joining the full map pool at a later date. If you can talk the talk, you better be able to walk the walk so challenge your friend and put your skills to the test!",1733250723,
1240440,Operation: Snowbound,"Spartans in the snow In a Warthog turret bay O’er the cliff we go Slaying all the way! {STEAM_CLAN_IMAGE}/38365036/c5890f67e3c926659f90f52ae862f7ff721348d3.jpg Operation: Snowbound has arrived in Halo Infinite, spanning December 3, 2024, through January 7, 2025. Let’s take a closer look at all the festive fun on offer for the Haloday season! 1v1 Showdown Whether you’re looking to settle amicable disagreements in a civil fashion, or seeking to put your skills to the test, you’ll want to step into the 1v1 Showdown playlist! Go head-to-head with other Spartans on small slices of some familiar maps, with identical randomized weapon and equipment loadouts, leaving the outcome to pure skill. Of course, this time of year is all about having fun and enjoying yourselves, so if you want to enter the 1v1 arena with a friend, you can absolutely party up with them and duke it out against each other in matchmaking. For a full briefing on this experience, head over to the 1v1 Showdown playlist blog. Return to Old Haunts The year is 2007. You’re back home from school or work, the days are growing shorter and the nights are getting colder, but there is comfort and good cheer to be found in the digital realm of Halo 3 matchmaking. The lobby decided to veto CTF on Isolation—very well, Oddball on Snowbound will do nicely! Snowbound Credits: UneeQ, Mr Greencastle, Azwilko1997, xMick3y Chiefx, MikRips, ArtN00b, Foge {STEAM_CLAN_IMAGE}/38365036/fe3df02d0ceb72ff53230983fa74052e4ed132b0.jpg Remade in Halo Infinite’s Forge, relive those old memories on Snowbound this Holiday. Two Covenant bases, winding caverns connecting them below ground, sentry turrets guarding the perimeter (keeping us in, or enemies out?), and a vast expanse of snow as far as the eye can see… Snow Ground Credits: UneeQ, Mr Greencastle {STEAM_CLAN_IMAGE}/38365036/caa5f6780f02fc45891b25d1826dc68aeae84502.jpg Also remade with Halo Infinite’s Forge, return to High Ground during a very different time of year! The sand and mud of this beach-bound outpost has been covered in snow, but you’ll quickly feel right at home. Snow Fire Credits: Halo Studios {STEAM_CLAN_IMAGE}/38365036/e6eaf8a20c07855b5fb082dd27096054b88383e9.jpg Originally released as a map variant of Live Fire during the Winter Contingency III event last year, Snow Fire returns to matchmaking for another outing (and you can find it in your map selection for Custom Games already). Operation Pass {STEAM_CLAN_IMAGE}/38365036/68535c257a85766ccbc833ec39868a89da7bcf18.jpg Operation: Snowbound brings a free new 20-tier Operation Pass, featuring the Infractor armor set. Covert infiltrators, deft assassins, and expert reconnaissance units, the Infractor armor is based on the Jiralhanae Stalkers encountered in Halo 3 and Halo 3: ODST. There’s no stronger look for putting your foes on ice. Additional premium options for the Operation Pass include: 500 credits will make the Operation Pass durable (it will not expire), offers bonus XP during the Operation’s live window, an extra Challenge slot while your pass is equipped, and comes with an exclusive customization item 2,000 credits instantly unlocks all 20 tiers of the Operation Pass at purchase and includes the exclusive bonus customization item Upgrade to the Premium Pass to acquire the Offworld Holiday weapon model for the VK78 Commando and Everything Nice weapon coating. Snowball Fight {STEAM_CLAN_IMAGE}/38365036/d5a67bc4f1a94e0d9f0b6d8d88f87673d09e5e33.jpg Not even Spartans are immune to the festive fun found in a good snowball fight! Coming later in the Operation, the Snowball Fight mode will be playable across Snowbound, Snow Ground, and Snow Fire. This mode trades out your weapons for an infinite number of plasma grenades. How’s your throwing arm? By the end of the Holidays, nobody’ll be better at getting grenade sticks than you! The Exchange In Operation: Snowbound, pick up a variety of Holiday-themed items from previous Winter Contingency Events, along with previous Ultimate Rewards and new customization items, like the Arctic Disruption vehicle coating. Play matches and complete weekly challenges to earn Spartan Points which you can spend in The Exchange. Here’s the full list of what’s available: Grenade Harness – Hip Gear (NEW) Envious Gift – Weapon Charm (NEW) Breadhead – Weapon Charm (NEW) Arctic Disruption – Vehicle Coating (NEW) Silent Nightcap – Helmet Attachment (Winter Contingency II) Ornamental – Chest Attachment (Winter Contingency II) Peppermint Laughter – Armor Coating (Winter Contingency) Peppermint Laughter – Weapon Coating (Winter Contingency) UA/Tacitus – Shoulderpads (Winter Contingency) Sweetsight – Visor (Winter Contingency II) Myesel Ammo Pouch – Hip Gear (Winter Contingency) That One – Stance (Ultimate Reward) Korolev Grizzlies – Weapon Charm (Winter Contingency II) Misriah Maulers – Weapon Charm (Winter Contingency II) Soft Impact – Weapon Charm (Halo Gear) Pop Dollie – Vehicle Coating (Halo Gear) Dart Blaster – Weapon Coating (Halo Gear...",1733181082,
1240440,Forge Features,"Welcome back to Forge Features! {STEAM_CLAN_IMAGE}/38365036/74f77154ca7de65375948d679e121ef411a51648.png We’re back to take a look at some community-made maps and modes in Halo Infinite’s Forge. Get your bookmarks at the ready! Bowling Owner: ADSR7865 BOOKMARK MAP | BOO{STEAM_CLAN_IMAGE}/38365036/1008c6ea44ec88ee4ba50024dd425e607890e490.jpgKMARK MODE https://www.halowaypoint.com/halo-infinite/ugc/modes/d9a58c19-8600-4b24-8377-5e115d052b89 “What if you miss?” “I won’t.” “GUTTERBALL!” Welcome to Halo: Bowling Evolved! Grab your friends, put on your Spartan shoes, choose a lane, and bring some snacks. Phylacter Campaign Owner: Juanivan7 BOOKMARK MAP | BOOKMARK MODE | MYTHIC DIFFICULTY {STEAM_CLAN_IMAGE}/38365036/ab8e3daa85efdedf1f4c93c254387d88591de8d6.jpg Storm the beach and stop the Banished from uncovering a mysterious weapon. This custom campaign experience is recommended for four players, so link up with your fireteam and take back that beach! Backrooms – Husky Raid Owner: JAYZEN0009 BOOKMARK MAP {STEAM_CLAN_IMAGE}/38365036/56e41e80b778e4b16f00151a1b73053a19675f3d.jpg Those who have no-clipped out of reality into the mono-yellow realm of the backrooms need to occupy their time with fun and games too. Spartan Ops: Operation Zeta Owner: JamdadJonJon BOOKMARK MAP | BOOKMARK MODE {STEAM_CLAN_IMAGE}/38365036/a06e7a5b76fe28a1c8c3003dc23282f4ae2ab3c8.jpg Another fantastic custom campaign experience set on a verdant alien world where a myriad of foes have occupied a nearby Forerunner tower and the surrounding area. Quantum Owner: SE7ENGINE BOOKMARK MAP {STEAM_CLAN_IMAGE}/38365036/9a360ecb62a12ecfbc4a17fd8bc9567792c257d9.jpg Fans of Halo 4’s Forerunner aesthetics will immediately feel right at home in this stunning 2v2 arena. Zero Order Hold Owner: MadmanEpic BOOKMARK MAP | BOOKMARK MODE | MYTHIC DIFFICULTY {STEAM_CLAN_IMAGE}/38365036/abf694fdc7dcbb5ecd0d54189137646b06735bc8.jpg Escape from captivity and fight your way through a Banished ship. The design for this custom campaign level is jaw-dropping, right down to the illusion of movement as the Banished vessel passes over alpine trees below. That’s a wrap for this month’s issue of Forge Features. With the weekend here, now is the perfect time to jump into some custom campaigns and competitive action—whether you’re looking to show your skill with a battle rifle or bowling ball. Until next time!",1732304731,
1240440,Operation: Great Journey Exchange & Shop,"For a look that says ""Straight outta Delta Halo."" {STEAM_CLAN_IMAGE}/38365036/19aa3b76379cd453fa39faf9d684558b202e3a28.png The Delta Forged bundle combines the Rocket Reclaimer & Arbitration bundles containing: Helioskrill helmet Stormclaw Mask helmet attachment Helioskrill Pauldrons Helioskrill Harness chest attachment Helioskrill Cuisse hip gear Helioskrill Poleyn kneepads Risk Explorer armor coating Reclaimed Wings armor effects set Master Chief Mark VI armor kit Green Man armor coating Veteran SPNKr weapon model Veteran Metal weapon coating As a bonus, purchasing this bundle additionally secures: Oracle Augmentor shoulders Oracle Protocol chest attachment ""Halo. Its divine wind will rush through the stars, propelling all who are worthy along the path to salvation."" Enter The Exchange for customization rewards from the past🪙 {STEAM_CLAN_IMAGE}/38365036/c30876f3d0661e020184cd027384b5ee39593b8b.jpg Earn Spartan Points from matches, Operation Pass progress, and weekly Ultimate Rewards. Redeem for past and new items like: 🪖 War Hero weapon charm 🪖 Zeta Sky helmet 🦄 HUL-I/Lightspike helmet attachment 🔵 Covenant Frontline armor coating ➕ And more! Don't forget, items will not be “going away” when the Exchange refreshes. They will still be available to purchase with Spartan Points through the customization menus (much like bundles once they have rotated out of the Shop). ""Your new suit’s a Mark VI, just came up from Seongnam this morning."" {STEAM_CLAN_IMAGE}/38365036/363c99cc2b1d8479d39a706dbacb03460d10bfed.png The Rocket Reclaimer bundle includes: Master Chief Mark VI armor kit Green Man armor coating Veteran SPNKr weapon model Veteran Metal weapon coating Step into the iconic Mjolnir Mark VI armor of the Master Chief in Halo 2 and prepare to finish the fight. Created by a Sangheili prodigy, an artisan-armorer inspired to test her skill against the best that humanity could muster, the Helioskrill armor was regarded as a work of art in both form and function for Spartan super-soldiers. {STEAM_CLAN_IMAGE}/38365036/cc00a7a607641da364fca90ff1c7c061ed691b0a.png The Arbitration bundle contains: Helioskrill helmet Stormclaw Mask helmet attachment Helioskrill Pauldrons shoulder pads Helioskrill Harness chest attachment Helioskrill Cuisse hip gear Helioskrill Poleyn kneepads Risk Explorer armor coating Reclaimed Wings armor effects set This armor suits you! ""Get tactical, Marines!"" {STEAM_CLAN_IMAGE}/38365036/72241c5ca3135d39cc9cc1d396b53a9031d55d14.png Even prototype Marine Corps helmet designs have been snapped up for use by active-duty Spartans. This bundle contains: XM55 ACH helmet HUL-I/UPTIK helmet attachment UA/Model 48 shoulder pads UA/M532 Plate chest attachment UA/ULAP hip gear UA/Type MI kneepads Pixel Camouflage armor coating Podium Finish stance Based on the design of the UNSC Marines’ battle dress uniforms, particularly those seen in Halo 2: Anniversary, the Wartime Requisition bundle offers a fitting look for the frontlines!",1731690020,
1240440,Community Playdate,A blast from the past 💥 {STEAM_CLAN_IMAGE}/38365036/5977bcba51c71665b64faf9cf9337b010debbd11.jpg Join us tomorrow at 11am PT for our Community Playdate in Delta Arena! Get in on the action and claim your exclusive Unicorn of Ice rewards 🦄✨ 🟣 Twitch 🔴 YouTube {STEAM_CLAN_IMAGE}/38365036/4ca32adcf4083ac26c350346adb2b86f7dd0bea0.jpg,1731529842,
