appid,title,contents,date,tags
1240440,Summer 2025 Playlists,"Firefight continues to evolve in Halo Infinite. You’ve already had a taste of this version when the mode first released and now, it’s time to battle at the Academy. Say your ardent prayers as you prepare to fight. {STEAM_CLAN_IMAGE}/38365036/22e6d15542740fdf2684b8c545d2e4f277eebf19.png Battle Brief The Banished were invited in by Iratus and it’s up to you to repel the forces from the steps of the Avery J. Johnson Academy of Military Science. In your typical fireteam size of four you’ll be squadding up to stand your ground. Our first taste of this linear Firefight mode came with Ardent Prayer back at launch. “What does linear Firefight mean?” Thank you for asking, I’d love to tell you. Rather than simply defend hills or race ahead to each hill, you’ll find this mode progresses and gets a bit more difficult at each turn. a campaign, this experience moves forward sequentially – you’ll need to finish one battle before you can move forward and start another. In short, Firefight: Battle of the Academy is raising the stakes and is asking you to defend the bases from the onslaught. The goal? Keep the Banished from getting their hands on humanity’s best kept secrets. Don’t forget to read the upcoming Waypoint Chronicles for more color and insight into the battle. Lay of the Land You’ll be going Out With a Bang as you enact the Cole Protocol in this playlist. Okay, not really but those are the two maps you’ll be playing on as you engage in the Battle of the Academy. Out With A Bang {STEAM_CLAN_IMAGE}/38365036/d916dcc498b6acd3abc66a849c4a69c990bfbd78.jpg Bookmarks: Map | Mode If you’re gonna go out, is there any better way than going out with a bang? I thought not. Under cover of darkness, you’ll be tasked with making your way to the evac zone but it’s no easy task. Battle through chokeholds, fight alongside the Marines you find along the way, work your way through the facility, and even brush up on your parkour a bit. Scavenge for ammo/weapons and keep moving! Cole Protocol {STEAM_CLAN_IMAGE}/38365036/9e7880c3a571282bb09d2a8cf8c4fd3a3870fb18.jpg Bookmarks: Map | Mode Credits: Cousin Tim, Timmyforges Established by Admiral Preston J. Cole (only the most interesting man in Halo if you ask me), the Cole Protocol is a directive set to prevent the Covenant (or other enemies) from discovering Earth or other colonies. Now, it is up to you to defend the data and knowledge. Armed with your weapons, wit, and the Marines battling alongside you, repel the Banished forces and hold your ground. Good luck. Mutilator Madness {STEAM_CLAN_IMAGE}/38365036/8a4adb6cd7c2cfc58d847676b9a1cb1bb3514606.png The fabled Mutilator arrives in Halo Infinite. Previously the stuff of legends, the brutal cross between a shotgun and Gravity Hammer takes no prisoners and has no mercy. The Mutilator boasts a double barrel that fires one shell at a time in primary fire mode or fires both at once in the alt-fire mode. And the melee packs a punch! You know what who else packs a punch? Juggernaut. As we learned before, the Juggernaut has some good perks: Buffed shields Increased damage resistance Speed Boost Quantum Translocator Gravity Hammer In Mutilator Madness, the same applies except as the Juggernaut you won’t wield the Gravity Hammer. Instead, you’ll be equipped with the Mutilator and Grappleshot. If you kill the Juggernaut, get ready! It’s your turn to be a menace. Well, what are you waiting for? The battle’s begun, get in there, Spartans!",1746556497,
1240440,Summer Update 2025,"The 2025 Summer Update kicks off with a bang in Operation: Last Stand. {STEAM_CLAN_IMAGE}/38365036/91e4b512e42de3dd90eb7418fdcd7bf8d844b28f.png Later this month, we’ll return to the Spartan Academy in a linear Firefight experience and introduce a heroic assortment of updates, including a devastating new power weapon, sniper ricochets, expanded Weapons Bench customizations, a monstrous Juggernaut mode, and a 50-tier Premium Operation Pass with four armor sets and a variety of instant unlocks. Ready up, Spartan. It’s time to fight. Update Calendar {STEAM_CLAN_IMAGE}/38365036/7a3ea64bad371f1f1e99a4a9665ae32bbfc754c3.png The 2025 Summer Update continues the Operation format introduced in the 2024 Winter Update. We’re looking at a new season of month-long Operations packed with playlists, modes, unlockable armor, and a few surprises to come! Here’s a look at our sizzling Summer Update schedule: Operation: Last Stand (May 6) Operation: Legacy (June 10) Operation: Reclaimer (July 8) Since our 2025 Spring Update, each seasonal Update also starts with a Spartan-sized kickoff, featuring a 50-tier Premium Operation Pass and major milestones such as new weapons, mechanics overhauls, Forge updates, and exciting new game modes. Read on to see everything that’s coming in Operation: Last Stand. New Weapon: Mutilator {STEAM_CLAN_IMAGE}/38365036/97faf50f1eadf1ff36acf1ceebbea65120933e29.jpg Long rumored, and ever feared: the mighty Mutilator is finally here! If you want brute force with no assembly required, look no further. The Mutilator is a double-barreled powerhouse with a Gravity Hammer at the business end. Unload one shell at a time, or switch to alt-fire mode for a twofer of titanic output. If there’s anything left to devastate, the hammer should finish the job. Starting in Operation: Last Stand, you can wield this abominable bludgeoner in Mutilator Madness, a new Juggernaut variant for the truly courageous. The Mutilator can also be found as a power weapon on maps, added to custom matches, or spawned in Forge. Operation Pass Overview {STEAM_CLAN_IMAGE}/38365036/8dc270f0e3d8320a20dede9030febafcc2024eb8.jpg The start of a season always warrants a celebration! As the first Operation in the Summer Update, Operation: Last Stand arrives with a 50-tier Premium Pass featuring four full armor sets and plenty of party favors. Free Operation Pass 20 tiers, available to play free May 6–June 10. Complete a 20-tier reward track to unlock the SECOPS armor set, plus a healthy supply drop of Spartan Points to score more customizations from The Exchange. Designed by ONI Security for counterinsurgency and precision interventions, this tactical gear is as quiet as it is lethal. Premium Operation Pass 50 tiers, never expires, includes bonus XP and an additional challenge slot, PLUS instant customization unlocks. {STEAM_CLAN_IMAGE}/38365036/8502e2d05fec3873094b7b3cdd55e58af0297fba.jpg Purchase the Premium Operation Pass to expand your armory in a durable, 50-tier reward track offering four unlockable armor sets! In addition to the SECOPS armor, Premium Pass operators can get tactical with the new Raider, EVA GEN1, and Scarred Comet armor sets. Once purchased, Premium Pass operators can complete all 50 tiers at their leisure. They’ll also receive an exclusive unlock bundle containing the Commander Agyrna armor kit and more customizations. How It Works Free Operation Pass rewards are available for the duration of their respective Operation. In Operation: Last Stand, you’ll have until June 10 to complete the 20-tier reward track and earn all its unique armor customizations. Premium Operation Passes can be purchased at any time during their respective Operation. In Operation: Last Stand, you’ll have until June 10 to upgrade using one of two redemption options: 1,000 Credits: Reward tiers become durable (i.e., never expire), bonus XP activates, an extra challenge slot opens, and a bonus customization bundle is instantly unlocked 2,500 Credits: Unlocks all the above perks, plus instantly completes the first 20 tiers of the reward track and unlocks its customization rewards If you missed any free customizations from Spring Update Operations, watch for those to hit The Exchange during the Summer Update. Premium Pass customizations will arrive in The Shop to be purchased separately at a later date. Upcoming Playlists Eagle-eyed Spartans will have already seen two major playlist updates teased in this announcement. We can’t divulge too much info (Iratus is listening), but we hope you can make something of this coded communique: Firefight: Battle of the Academy {STEAM_CLAN_IMAGE}/38365036/bb4311675e96598e948c2d1abbc5f740ac30554a.jpg The captured AI Iratus has exposed the location of the Spartan Academy. It’s up to you to fend off a Banished onslaught in Firefight: Battle of the Academy. Can you repel invaders, secure objectives, and protect humanity’s best-kept secrets? Mutilator Madness A new Juggernaut has arisen—and it’s got two barrels of bucksho...",1746210314,
1240440,2025 Summer Update Community Livestream,"The Academy stands ready. Join us tomorrow at 11am PT for an in-depth look at Halo Infinite’s Summer Update. {STEAM_CLAN_IMAGE}/38365036/bbdbfc177ba3b75d7160562bab90a3ea7a561d80.png Prepare for #OperationLastStand, a monstrous new Juggernaut mode, a devastating power weapon, and more! 🟣 Twitch 🔴 YouTube {STEAM_CLAN_IMAGE}/38365036/5779784ebc2c8914dffba212151321d9705a09c0.png",1746134979,
1240440,Operation: Last Stand,"Be hope in times of darkness. Return to the Academy and repel the Banished in Operation: Last Stand, live now through June 10. {STEAM_CLAN_IMAGE}/38365036/c582f20e01b692566626968a445ae0c46747b891.jpg The captured AI Iratus has exposed the location of the Spartan Academy. It’s up to you to fend off a Banished onslaught in Firefight: Battle of the Academy, a new linear Firefight experience where securing objectives is tantamount to survival. Can you outlast your foes long enough to enact the Cole Protocol? The 2025 Summer Update arrives in Halo Infinite with new playlists, a devastating new power weapon, expanded Weapons Bench customization options, and a last stand for some of humanity’s most decorated soldiers. New Weapon: Mutilator {STEAM_CLAN_IMAGE}/38365036/97faf50f1eadf1ff36acf1ceebbea65120933e29.jpg Two barrels. One gravity-shifting wallop. The Mutilator is a cruel instrument of maximum devastation, borne of the imponderable pairing of a double-barreled shotgun and a Gravity Hammer. Unload one shell at a time in standard fire, or switch to alt-fire mode for a twofer of titanic output. If there’s anything left to mutilate, the hammer at the business end should finish the job. The Mutilator can be found as a power weapon on maps, added to custom matches, or spawned in Forge. New Mode: Mutilator Madness {STEAM_CLAN_IMAGE}/38365036/8a4adb6cd7c2cfc58d847676b9a1cb1bb3514606.png Jump into Mutilator Madness to wield the mighty Mutilator in a new, more monstrous incarnation of Juggernaut. At the start of each match, one player randomly assumes the role of the Mutilator-toting Juggernaut, a nigh-invincible foe whose kills earn points toward victory. The rules are simple: kill the Juggernaut, become the Juggernaut. Everyone else is cannon fodder. Firefight: Battle of the Academy {STEAM_CLAN_IMAGE}/38365036/22e6d15542740fdf2684b8c545d2e4f277eebf19.png Iratus has brought the Banished to the Spartan Academy. Brace for contact in Firefight: Battle of the Academy, a new linear Firefight experience set in the Avery J. Johnson Academy of Military Science. You’ll have to defend your allies, commit acts of sabotage, and prevent the enemy from attaining intel on humanity’s best-kept secrets. Our survival as a species may depend on it. Banished don’t relent without a fight. Let’s give them what they came for. Operation Pass Overview As covered in our Summer Update teaser, Operation: Last Stand kicks off the season with an expanded Premium Pass offering and armor sets commemorating the heroes of the United Nations Space Command. Free Operation Pass {STEAM_CLAN_IMAGE}/38365036/91887d9d432dfdf39d498ca4b590825e1a91616a.jpg Iratus just invited the Banished to our doorstep, and you’re not going to answer in pajamas. Fight back in style with the SECOPS armor set, a special issue freshly dispatched from ONI Security. Designed for counterinsurgency and precision interventions, this tactical gear is as quiet as it is lethal. If they see you coming, they’re already dead. Complete the first 20 free tiers of the latest Operation Pass to unlock the full SECOPS armor set, the Cold Justice coating, and a supply drop of Spartan Points. Premium Operation Pass {STEAM_CLAN_IMAGE}/38365036/bf78f0b2f86030582a3038d55a790e5146029377.jpg Purchase the Premium Operation Pass to expand your armory in a 50-tier reward track with four full armor sets and a salvo of instant unlocks! In addition to the SECOPS armor, Premium Pass operators can get tactical with the new Raider, EVA GEN1, and Scarred Comet armor sets. Scarred Comet: The commemorative-issue Scarred Comet armor reminds us of the noble sacrifice of Headhunter Jonah-B283, Eirene’s favorite son and one enlightened individual. EVA GEN1: First seen in service in Halo 3, the Extra Vehicular Activity armor was designed for maneuverability in zero-grav conditions. Its staying power lies in its full-width shroud visor and timeless aesthetic. Raider: Adapted from tactical-assault gear first seen in Halo 4, the devilish silhouette of the Raider armor rankles with primal potency. What may be lost in its narrow visor is recouped by its effect on prey. {STEAM_CLAN_IMAGE}/38365036/8502e2d05fec3873094b7b3cdd55e58af0297fba.jpg Premium Pass holders will also receive customizations that pay tribute to some of the UNSC’s finest. Upgrade to the Premium Operation Pass to instantly unlock the Commander Agryna armor kit, Academy Champion coating, Pendragon and Victor visors, and Chibi Johnson weapon charm. Summer Update Now Live {STEAM_CLAN_IMAGE}/38365036/233b6a5500407382817ae340568c772398ecdf38.jpg Check out our Summer Update blog for a details on new Weapons Bench customizations and other changes now live in Halo Infinite: New Forge nodes and features Ranked S&D Extraction $20,000 ForgeHub Map Contest Sniper ricochet mechanics Kill Feed and tuning updates Free Log-In Unlocks Log in by May 31 to unlock commemorative customization bundles for Asian and Pacific Islander Heritage Month and Mental Health Awareness Mont...",1745952340,
1240440,Community Playdate,"New maps, new modes 🔥 {STEAM_CLAN_IMAGE}/38365036/46cbf2be6f3bd643d079558f5901529a385994cd.jpg Join us in the freshly updated Big Team Battle playlist for our #OperationForerunner Community Playdate tomorrow at 11AM PT! 🟣 Twitch 🔴 YouTube {STEAM_CLAN_IMAGE}/38365036/1dc9e177e50501c50eed93709dc95deb3fb037a4.jpg",1745536425,
1240440,April Big Team Battle Refresh,"Big Team Battle is bigger and battle-ier than ever in Halo Infinite already. But it’s time to take it up a notch and add “more bombastic than ever” to the list now too. {STEAM_CLAN_IMAGE}/38365036/47486ca20fea658adb6fec85b9d8734260e58027.jpg Extraction Not seen since Halo 4, Multi-Site Extraction lands on the (big) battlefield. With a win condition of “first to 7 extractions,” you and your team will want to have a plan in place. {STEAM_CLAN_IMAGE}/38365036/97ee032ecf03140e5b8e84d65f52e10d22061b73.jpg Cover one zone and go 1:1 with the opposing team? Or battle for both? The choice is yours but be ready to move swiftly to snag the zones from your enemies. Each extraction is worth 1 point so just get 7 and you win. That’s probably easier said than done but you got this. I believe in you! Assault {STEAM_CLAN_IMAGE}/38365036/6084ea7127e6ea70f8b36191378fd1414fa164aa.jpg By now you know the drill. Grab your bomb, load up a vehicle for optimal shenanigans, and full steam ahead into the enemy base to arm the bomb. Or, in the case of One Bomb, you’ll need to be prepared to swap between offense and defense as you take turns attacking and repelling the enemy. Battlegrounds Coming alongside the new modes are a few new battlefields for you to enjoy. Revel in their g(l)ory and majesty. Flood Gulch Bookmark {STEAM_CLAN_IMAGE}/38365036/46cbf2be6f3bd643d079558f5901529a385994cd.jpg These hallowed grounds absolutely ooze with familiarity. Watch your step. Credence Credits: Zaddy Hammer Bookmark {STEAM_CLAN_IMAGE}/38365036/46d0dcf3345c44f6bc6d99f122155f8deb3e5985.jpg This hauntingly beautiful forest of ruins will have you standing on the edge of eternity, looking out over the vast expanse below you, contemplating why we’re even here. Dawnbreaker Credits: Anvil Prime 52, Galaxytivity, Cousin Tim, I Crush All, Draius Bookmark {STEAM_CLAN_IMAGE}/38365036/6d7e02be0dae900d21ea778c60a952a1dbf9a088.jpg As the day breaks, you will need to be on the lookout for all types of assaults as this map has it all. Fabulous footpaths for infantry and open spaces for vehicles to careen through – anything goes. Threshold Credits: Squally DaBeanz, Kat Rat A Tat, NightAvenger01 Bookmark {STEAM_CLAN_IMAGE}/38365036/7e2327f27b485b00a97562b29deb985f559f7e42.jpg The installation survives while the fire burns below. Break left or right when leaving your base unless you think you can make the leap across the gap without falling to the pit below. This BTB refresh will knock your socks off with the explosive new content so pack a spare pair on your way to the battlefield. We’ll see you there!",1745363457,
1240440,Forge Features,"Welcome to another edition of Forge Features! This series highlights notable maps, modes, and other creations from our talented Forge community. Bookmark your favorites using the links below for your next custom game. {STEAM_CLAN_IMAGE}/38365036/a8bca134c5fcdf110f505d9bd215c59bb07fa009.png This Forge Feature collects sprawling estates, highway chases, biome-swapped remakes, and arenas from across the known universe. After seeing the Forgers’ handiwork, we’ve got to ask: is there anything you can’t build in Forge? Uchiha Estate Bookmark Credits: Galaxytivity, Le Frenchys, Saber, vL3GO, Kordaak, Smileus, Ampoligy, Premiery, Vibrant, hvmmie, Typhoonsy, Animosity, B0ARD, Sai Ryku, Befi, Disciple, Shots Fatal, OOOHGIE, Minds Evil, Mikasa, Levi, Jalen Cortez, Lea SIV, Splenzo, Wither TTG, Malccolo {STEAM_CLAN_IMAGE}/38365036/5d4240008ff3b9570beade23821d842e923de229.png A sprawling estate for an esteemed ninja family. The serene surroundings of the valley boast lush gardens, cherry blossoms, and roaring waterfalls. Should enemies stroll past the scenery and penetrate the outer wall, try taking gravity lifts into the watchtowers to defend the courtyard. Worthwhile Bookmark Credits: The Xzamplez, Lahont, Level Design, NightAvenger01, th3jmanx, ARC1T3CTZ, InfiniteForges, Death Penalty, facingbowls, Sqeazu, IKYLEIZBEASTLY, CertifiedChamp, HeIIjumper 1357, Soulful Soul, Tedonator, Xscape, Undeni4ble, purely fat, HaloBoxStudios, Epik Xero, Black Picture, bullet2thehead9, Status CROW, I Crush All, tdubfed1 {STEAM_CLAN_IMAGE}/38365036/2db9fac1dcfa908433f428f801306b4f0f26abc3.png Slay your opponents within the enameled halls of a massive shipbuilding facility. With excellent combat flow between its multicolored rooms and carefully applied details in every corner, Worthwhile certainly lives up to its name. Surazal Bookmarks: Map | Mode Credits: ForgeLudward, Juturna2jz, ColtyChoas {STEAM_CLAN_IMAGE}/38365036/cd9d5e3a0f3b7409eb7df7d325607dbc9cfcc0d2.png If you’ve tangled with the cityscapes of “New Alexandria 2552” or “Lazarus,” you’ll instantly recognize the low roofs and terraces of Surazal, now transplanted in the heat of Old Mombasa. This dense city map supports Slayer, BTB, and Firefight, with a custom boss-wave Firefight mode. Guardlock Bookmarks: Blue | Green Credits: THE CUJ0, BlundellMemes77, Lil Breezy4086, DrShaboingry, PTB Bucky6200 {STEAM_CLAN_IMAGE}/38365036/b6b41797fc5a901ea8503340693a1156d316861a.png A tribute to Lockout (Halo 2) and Guardian (Halo 3), Guardlock is a hybrid map that presents an etude in asymmetrical catwalks and rooms of death. Borrowing inspiration and elements from its twin namesakes, this map is also available in both “frigid mountain” and “sweltering treetop” aesthetics. Call it “variations on a Forge.” Planetoid Bookmark Credits: ForgeLudward, Juturna2jz {STEAM_CLAN_IMAGE}/38365036/f2f2b74ea3da44186c8d755cecd6117ab42969c0.png A testament to slayer fundamentals. Set in a suspended platform drilled into the titular planetoid, this map is perfect for those who love spraying shotties around corners, teleporter escapes, and scoring headshots from the open gangways. Try a cozy rendezvous among the stars with teams of two to four. Lake Hot Pursuit Bookmarks: Map | Mode Credits: AversiveSphinx, Dovahk666, TyRant Hacker {STEAM_CLAN_IMAGE}/38365036/5736ea04c816dc22b3486ab0592f492ab6e5c97b.png A lakeside circuit built for cops-and-robbers Infection modes. A team of Infected must use Razorbacks to pursue runaway Survivors on Mongooses. Use your all-terrain superiority to lay down the law before time runs out, or else the bandits get away. Nothing but open road between you and cold justice. Cruise or Lose Bookmarks: Map | Mode Credits: Horse Choker297, Dolbywonder, LOVEWOLFE, Kr1spyTurtle, Lucidmocs, Bamstertwo86, egg boy 26 {STEAM_CLAN_IMAGE}/38365036/249bd1150466d4a7810c9a043a3d8e66f1e4f562.png An Infection variant with an existential need for speed. Infected players enjoy a virulent strain of endless Active Camo, inexhaustible Gravity Hammers, and monstrous ups. With precious few seconds to mount up before the Infected team teleports in, Survivors can’t afford to spin wheels. Get your ‘goose and cruise! Tutorial: Campaign Weapon Variants Zechariot shows Forgers how to build a custom node graph to upgrade your currently held weapon to a variant from the Halo Infinite campaign. Check it out below: Stay tuned for another Forge Feature coming soon! To share your creations with the Halo Infinite community team, be sure to drop a link in the #forge-show-and-tell channel of our official Discord or post to r/Halo using the Forge tag. We’re also still looking for inspired Invasion maps to consider for future Recommends playlists. If you’ve got a great Invasion map you’d like us to see, be sure to use tag #343asks-invasion on your Forge creation before June 20.",1744833179,
