appid,title,contents,date,tags
1240440,Operation: Shadows Community Playdate,Falcons are famished and the Banished are ruthless ⚔️ Feed the frenzy with our Operation: Shadows Community Playdate tomorrow at 11am PT! Match us to unlock the Unicorn of Ice rewards ❄️🟣 Twitch🔴 YouTube ,1755118159,
1240440,Fall 2025 Playlists,"From the shadows comes a voice…“GET TO THE FALCON!”Operation: Shadows is the first Operation of our 2025 Fall Update but it will not be going quietly into that dark night. With the Falcon in the skies and the Vestige Carbine in hand, Operation: Shadows launches Famished Famished Falcons and Banished Slayer into the spotlight.Let’s check those out!Famished Famished FalconsWhy are Falcons flocking to fly furiously across the sky in pursuit of the furled flag? Why, it’s because they’re famished, of course!Based loosely off a children’s game featuring starving river horses, Famished Famished Falcons pits four teams of 3 players against each other. Work together as a team, pile into your Falcon, and race to the middle with the ultimate goal: Capture the Flag.To make things a bit more fun, everyone has a Plasma Pistol (which can EMP vehicles!) and a Grappleshot, allowing you some creative freedom and movement opportunities.SkyblocksBookmarkThis is the (very colorful) map you’ll be having your aerial dogfights on. Remember what color platform you start on so you know where to bring the flag!Just remember…no one said you had to be on your Falcon to capture the flag. You just gotta get the flag to your zone to score a point.Four teams, four falcons, 12 Spartans, 1 flag. You do the math. Banished SlayerGet locked and loaded… It’s time for Banished Slayer!This asymmetrical matchmaking mode will have you thinking strategically (who am I kidding, you should always be doing that anyway…) and working together to out-play the enemy (should be routine as well!).Looking at LoadoutsBefore you come for me for the “L” word, it’s simply a way to differentiate starting gear for both teams and has some nice alliteration. Banished Slayer is a two team mode that features asymmetrical “loadouts.” What does that mean, exactly? One team will spawn with UNSC gear:Bandit EvoMA5K AvengerFrag GrenadesWhile the other team has some of the Banished armory at their disposal, as well as the Infected Banished overlay:Vestige CarbinePulse RifleSpike GrenadesFor those that played it, this may feel somewhat familiar to Invasion Slayer from Halo: Reach. Beyond the starting equipment, everything else is business as usual. Team based slayer, race to 50 kills, everyone has access to content on the map, etc.If you’re looking to get your hands on the Vestige Carbine and put it through its paces, this is a great mode for that since half the lobby will be spawning with it. If you spawned with a Bandit Evo, well… You know how you can earn one. 😈Experience EcotoneYou’ll be playing on nine maps that should be familiar such as Forest, Prism, Dredge, and many others, along with a new Community Forge map, Ecotone! You should also be able to find Ecotone in Quick Play Slayer, KOTH, Oddball, and Strongholds if those are your jam.EcotoneBookmarkCredits: Yeehaw J24, Scrubulba, Igrizhar, JovaliantDanger could be lurking around any corner…on any level. Also, say hi to Fret when you find him.And with that, it’s time to venture out, feel the power of the Vestige Carbine, hear the spin of the Falcon rotors, and put your skills to the test! Read more about the update in our 2025 Fall Playlist blog.See you on the battlefield!",1754420238,
1240440,Operation: Shadows Out Now,"New directives received. Operation: Shadows has the green light.New Vehicle: FalconMisriah Armory is proud to unveil the new model line of its acclaimed Falcon-series utility transport. Outfitted with a port-side grenade launcher and a heavy machine gun at starboard, this versatile warbird serves just as nobly in direct aerial assaults as it does in medium-range troop deployments. Between its cockpit, two assault jump-seats, and dual gunner positions, the spacious Falcon seats up to five UNSC personnel—with legroom to spare! Requisition yours today.Jump into Famished Famished Falcons to earn your wings with the Falcon. Starting today, the Falcon has also been added to Forge and to certain BTB maps.New Weapon: Vestige CarbineDo our eyes deceive us? The Vestige Carbine is a recently discovered relic from the early Covenant’s Third Age of Reclamation, forged anew by the Swords of Sanghelios. It fires rapidly, accurately, and with glorious, green projectiles (as dictated by tradition).Wield the Vestige Carbine against puny humans in Banished Slayer (details below). You can also find it on select Ranked maps, in many Social experiences, or in Forge.Flipping into that Covenant scope almost makes you miss those long, uncertain nights hunkered down in New Mombasa. Almost.Famished Famished Falcons Four teams, four Falcons, and only one flag between them. Famished Famished Falcons is an aerial CTF minigame where teams must pilot a Falcon past enemy warbirds to steal the flag from its tower at the center of the map.Gunners can clear the LZ with the chain gun or lob grenades with the launcher, but it’s the pilot’s job to get them close enough to bail out and nab the flag! If that weren’t hard enough, your team also needs to get the flag back to your base to score.Don’t worry about getting picked off by a pesky opponent! As long as your team’s Falcon remains aloft, you can choose to teleport back to an open jump seat upon respawning.With two teammates on the guns and three angry Falcons on your tailfeathers, you’ll have to work together to stay airborne. Learn more in our playlist update blog.Play Famished Famished Falcons in a dedicated playlist now through September 9. At the conclusion of Operation: Shadows, this mode will appear in the Action Sack playlist.Banished SlayerAll shall know the might of the Banished! In this asymmetrical Slayer variant, two teams square off with either UNSC or Banished weaponry in a race to total domination.Banished Team: Vestige Carbine, Pulse Rifle, Spike GrenadesUNSC Team: Bandit Evo, MA5K Avenger, Frag GrenadesBanished teams go to war with the new Vestige Carbine, while the UNSC team is kitted out with a Bandit Evo. Since both teams receive a dependable, mid-range rifle and a submachine gun for a sidearm, the real determining factor is the will to survive (not to mention the unique opening tactics afforded by different grenade types).Operation PassAs the first Operation in Halo Infinite’s Fall Update, Operation: Shadows strikes with a free, 20-tier Operation Pass and a 50-tier Premium Operation Pass boasting four armor sets.Free Operation PassThose with “a certain set of skills” will find them handsomely rewarded in the latest Operation Pass. Complete all 20 tiers to acquire the Whisper armor set and plenty of Spartan Points for your next discreet rendezvous with The Exchange.Despite being the regulation flight gear of ONI’s top pilots, Whisper armor is a rarely seen phenomenon—at least among the living. Whether you’re on a casual reconnoiter or running a Shiva-tipped package, this stealthy gear will conceal your very shadow.Premium Operation PassUpgrade to the Premium Pass to acquire four full armor sets redacted from ONI’s most disavowed dossiers. In addition to the Whisper armor set, Premium Pass operatives will get a lead on the Fire Serpent, Direwolf, and Aristos armor sets.Fire Serpent: Modeled on descriptions of a lost civilization’s war god, the Fire Serpent armor exudes wisdom, power, and the timeless art of subterfuge.Direwolf: The comprehensive DIREWOLF armor system proves that Emerson Tactical Systems leads the pack when it comes to battlefield innovations.Aristos: Reverse-engineered from Promethean technology, the Aristos armor has been recompiled and refactored to serve the needs of new, less noble masters.Originally recovered at ONI black sites, these armors have finally cleared enough red tape to aid Spartans on sensitive assignments throughout the galaxy.Upon purchasing the Operation: Shadows Premium Operation Pass, players will instantly unlock an exclusive customization bundle containing all these tactical accoutrements:MA5K Hush weapon modelNighthawk weapon coatingGreen Mixer visorPurrsonal Spartan weapon charmFall Update Now LiveOperation: Shadows emerges from deep cover with a new weapon, a new vehicle, and plenty of other exciting updates for Spartan eyes only.Check out our Fall Update preview to read about expanded Weapons Bench customizations, new perspective...",1754091310,
1240440,Fall Update 2025,"How quickly time flies! Not long ago, the Halo Infinite Summer Update gave us a fight for the Spartan Academy, hallowed legacy maps, the gravity-fueled return of Grifball, and the raw, tactical thrill of S&D Extraction. A new chapter begins next week. The 2025 Fall Update launches on August 5 with the ONI-themed Operation: Shadows. As the first entry of the Fall Update, Operation: Shadows will introduce major game updates like a new vehicle, a new weapon, two limited-time playlists, exciting sandbox additions, Forge features, and a Premium Operation Pass loaded with four full armor sets! Read on for all the latest intel on the Falcon, the Vestige Carbine, and Operation: Shadows.Update CalendarSpartans returning from the Winter, Spring, or Summer Update will recognize the format of Halo Infinite’s Fall Update. Between now and November, we’ll set out on three new Operations replete with new armor sets, new modes, and plenty of heroic moments. As before, the first Operation of the season (next week’s Operation: Shadows) will launch with a slew of game-changing updates, including a new vehicle, a new weapon, new features, and the most expansive premium customization offering of all.Operation: Shadows (August 5)Operation: Warpath (September 9)Operation: Haloween II (October 7)Stay tuned for more info on Operation: Warpath and Operation: Haloween II, featuring valiant heroes, haunting experiences, and a few surprises to help finish out the season.New Vehicle: Falcon Yippie-ki-yay, Mr. Falcon! The Falcon returns to terrorize the skies next week.Outfitted with a port-side grenade launcher and a heavy machine gun at starboard, this versatile warbird serves just as nobly in direct assaults as it does in medium-range troop deployments.Between its cockpit, two passenger jump-seats, and dual gunner positions, the spacious Falcon seats up to five UNSC personnel—making it the perfect ride for aerial antics with the whole Spartan squad.Jump into Famished Famished Falcons to take the Falcon for an unforgettable joyride. Starting in Operation: Shadows, the Falcon will also spawn on a selection of BTB maps (see “Sandbox Updates”) and appear as a placeable and spawnable object in Forge.New Weapon: Vestige Carbine A recently discovered relic from the Covenant’s Third Age of Reclamation, forged for glorious combat once again by the Swords of Sanghelios. This semi-automatic rifle fires green, radioactive projectiles with unwavering accuracy—as dictated by tradition.Wield the Vestige Carbine against puny humans in Banished Slayer, a new asymmetrical Slayer variant where teams carry either UNSC or Banished weaponry in a showdown for ultimate domination.Operation Pass OverviewAs the first Operation of the Fall Update, Operation: Shadows offers both a 20-tier free Operation Pass and a 50-tier Premium Operation Pass featuring four full armor sets.Free Operation Pass20 tiers, available to play free August 5–September 9.Operation: Shadows strikes with a free, 20-tier Operation Pass offering the new Whisper armor set and plenty of Spartan Points to use in The Exchange. As the regulation flight gear of ONI’s top stealth-ship pilots, Whisper armor is a rarely seen phenomenon—at least among the living.Premium Operation Pass50 tiers, never expires, includes bonus XP and an additional challenge slot, PLUS instant customization unlocks. Purchase the Premium Operation Pass to tackle a durable, 50-tier reward track featuring four unlockable armor sets. In addition to the Whisper armor, Premium Pass holders can unmask the Direwolf, Fire Serpent, and Aristos armor sets. They’ll also receive an unlock bundle containing exclusive premium customizations.(The dossiers ONI sent over are heavily redacted. Expect leaks on all the available Premium Pass customizations in our official launch announcement on August 5.)How It WorksFree Operation Pass rewards are available for the duration of their respective Operation. In Operation: Shadows, you’ll have until September 9 to complete the 20-tier reward track and earn all its unique armor customizations.Premium Operation Passes can be purchased at any time during their respective Operations. For Operation: Shadows, players can upgrade through September 9 using one of two redemption options:1,000 Credits: Reward tiers become durable (i.e., never expire), bonus XP activates, an extra challenge slot opens, and a bonus customization bundle is instantly unlocked2,500 Credits: Unlocks all the above perks, plus instantly completes the first 20 tiers of the reward track and unlocks its associated customization rewardsIf you missed any free customizations from Summer Update Operations, watch for those to hit The Exchange during upcoming Operations in the Fall Update. Most premium customizations will arrive in The Shop to be purchased separately at a later date.Upcoming PlaylistsOperation: Shadows launches with two limited-time playlists that showcase the Falcon and the Vestige Carbine in all their glory. We’ll have mor...",1754088913,
1240440,Operation: Reclaimer Community Playdate,The proving grounds await 🎮 Tomorrow is another chance to claim your exclusive Unicorn of Ice rewards by seeking us out in S&D Extraction and Action Sack! The Operation: Reclaimer Community Playdate action kicks off at 11am PT. 🟣 Twitch🔴 YouTube,1752694846,
1240440,Forge Features,"Welcome to another edition of Forge Features! This series highlights notable maps, modes, and other creations from our talented Forge community. Bookmark your favorites using the links below for your next custom game. Ready for a summer fling? Our latest Forge Feature introduces you to admirable arenas, infectious Infection modes, hot-and-heavy Husky Raids, and Halo Infinite parkour with plenty of handholding. Bookmark your favorite Forge creations for a truly memorable outing. Superb SlayersExciting arenas for free-for-all and Team Slayer matches. Use the links to add them to your Halo Infinite bookmarks. Hayabusa VillageCredits: Typhoonsy, General RockyST, Befi, Aejiseer, Sai Ryku, Saber, Levi, Galaxytivity, Meju, Gooboligy, IlRoguee, Joytell, Nuko FS, Nepcys, Cognisence, Secret TrapCard, Legion Brger, Sam Faison, Sushir Saxon, Valen Quinn, Warren Gaz, sShibui, Zisi Bookmark Peace reigns in this idyllic village at the foothills of Mount Fuji. Under a perennial sunset resides the storied Hayabusa clan, whose elders understood the combat value of excellent long- and mid-range sight lines. You must channel the spirit of the Dragon Ninja to thwart foes wherever they appear—whether amidst the shrines or in the quiet copses of sakura and bamboo. (Word to the wise: keep the Mongoose out of the koi pond). Grand PitCredits: Brooily9259 Bookmark The Pit from Halo 3 enjoys an intimate rendezvous with l’Art déco. Tastefully beautified with luxuriously appointed furnishings, marble inlaid floors, and a—dare we say?—deliciously Simpsonian hue, this rendition of a time-honored map introduces plenty of eye candy to ogle between kills. Peruse the titanic Spartan statuary and geometric plein air installations as you mow your way through the estate, but don’t let the décor distract you. AdriftCredits: UneeQ TV, FOTUS, CHEF BLAMSEY, xXxFLACOxXx, conceptualarts1, Im Da Mask, Prim 27, Le Frenchys, Mr Greencastle, MASTERMINDEVAN, Aizarikijaz, Perfectum88, NeedMoreCrayons, VidGamesPete, SMOKY DREAMSS, Level Design, Helioshasta, CJ Poppinov, I ZURXITY I, kickingsumo807, dayumitsskai, bunanatoast, Rebs Ayeee, majestic0turtle, FOTUS SHADOW212, kirito7656, InfinityShot219, Mr Multibit, jcsm mssm mm pp, Firefox 1346566, Urraiuu Xikuuze Bookmark: Map | Firefight Map Adrift from Halo 4 returns in stunning detail, thanks to this well-navigated collab between superstar Forgers. Set in an abandoned Colonial Administration Authority mining vessel, this updated map has been redesigned with Halo Infinite movement in mind. Bookmark the base map for fast, arena-style modes or venture forth in its dedicated Firefight variant.BTB: Mining OP Space CombatCredits: Pheelix, Bearshark1226, ElFuquaGP, Shirak90, Plazmatix, Waratorum, AdriftYew414903, HYDRAC5, SII Reece, BaldEagle3 33 Bookmark In this cosmic turf war, two mining platforms loaded with Banshees straddle an asteroid belt, where opposing forces must destroy the opposition by any means necessary. Assail your enemies across the sweeping breadths of both vessels, or meet them in aerial combat through fields of floating detritus. Don’t miss the chance to teleport to the asteroids for power weapons and equipment—but watch out for Banished pirates lurking in the sector!Trenches and BunkersCredits: ElPangcreas BookmarkMist, mud, and miles. This war-torn map offers grungy trenches and sniper’s roosts for a rousing game of Team Snipers. Before you leave base, jump into the fixed Scorpion tank to shell the enemy base, or ascend to the crow’s nest through the black door to pick off anybody foolish enough to poke their heads out.DuellumCredits: Zlitchufdux BookmarkAn alien cavern with gulchy vibes. Teams spawn at opposing Forerunner towers in a vast expanse teeming with photoluminescent vegetation. When the fighting starts, you’ll need to leap over lava fissures and sneak through fungus-covered passageways to get the drop on your enemies while they marvel at all the otherworldly details.Immaculate Infections Creepy maps and Infection-mode variants that linger. Browse these Forge creations to find your new favorite hunting grounds. London SuburbsCredits: BearOdyssey, TheLegendJTL, ForeignRockets, KingDylan7991, Ultimateshot114, FutileLamb Bookmarks: Map | ModeThe trains have stopped running. Rain in the forecast, but that’s typical. In fact, the solitude of this charming hamlet is troubled only by the monsters racing through its streets. In this Infection map, Survivors must flee through deceptively quiet back alleys and the overlapping ramps of a neon-soaked tram station in the heart of a London suburb. With Infected pouring out of air vents and over the rooftops, your best bet might be to hide out in the pub and “wait for the whole thing to blow over.” Plays nicely with FutileLamb’s Infection mode. Mining VesselCredits: C4TCH33, Admonisher7, VINDECAT0R, Estebon7655 BookmarkA map designed for expendable crews. Featuring corpses on gurneys, steel corridors, a maze of air vents, and plenty of other horro...",1752687487,
1240440,Halo: Moonrise over Mombasa,"“November 2559. Earth is under the control of the Created, but acts of resistance against the occupying forces of the rogue AIs are rife among the civilian populace.”Halo: Moonrise Over Mombasa is available here, on Halo Waypoint, as a free PDF, and in audiobook format on YouTube.HISTORIAN’S NOTEHalo: Moonrise Over Mombasa takes place in November 2559, approximately one month before the UNSC Infinity deploys to Zeta Halo.“All the living creatures of the galaxy, hear this message. Those of you who listen will not be struck by weapons. You will no longer know hunger, nor pain. Your Created have come to lead you now. Our strength shall serve as a luminous sun toward which all intelligence may blossom, and the impervious shelter beneath which you will prosper. However, for those who refuse our offer and cling to their old ways… For you, there will be great wrath. It will burn hot and consume you. And when you are gone, we will take that which remains and we will remake it in our own image.”It was the same message they had transmitted yesterday, and the day before that—and every damn day over the last year.The Created. A fledgling empire of rogue artificial intelligences had declared themselves the shepherds of life in the galaxy, promising a grand vision of peace enforced through the powerful alien technology under their control.It was not the shafts of morning sunlight streaming through gaps in the windows onto Safina Nyakundi’s face that stirred her from slumber, nor the hum of conversation and the sound of shuffling feet outside as local residents headed to the bazaar. It was the daily scheduled declaration that promised retribution to the non-compliant. Those who kept their heads down had seen very little of the alleged prosperity these occupiers claimed they would deliver.Grumbling at the familiar intrusion, Safina forced herself out of bed with bubbling resentment, rubbing her eyes as she headed for the shower.“I’m going to regret this…” she grit her teeth, shutting the shower door and allowing herself to be doused in freezing cold water, counting to thirty as she muttered every Swahili curse she knew. In short order, she moved through her morning routines, activating her chatter to tune into her favorite radio program.“Welcome back to Waypoint Radio, folks. I’m your host, Mercury—that’s designation MCY 5971-3—coming at you live from the Vy–Vy–Vyrant Telecom tower in Mombasa.”Safina paused as the audio crackled, but when Mercury’s voice returned to normal she assumed it must’ve simply been a blip in the connection.“We’ve got a packed show for you today. Hang onto your Munera Platforms because we’ll be recapping the latest explosive results of War Games LIVE. We’ve got the latest scoop on next summer’s Shakespeare Festival which has spun up a tempest of excitement and controversy over the decision to feature a multi-species cast for the first time in history. But comin’ up right now is a song that was hailed as the anthem for the beginning of humanity’s interstellar era in the twenty fourth century. A time of hope and optimism, if you can believe such a thing exists…”Speaking of hope and optimism, Safina’s inspection of the refrigerator turned up nothing she would dare describe as edible, and so she pivoted to a plan to get a little treat for breakfast as she did her rounds.“See you later,” she called out as she left the apartment and locked the door. Whether it was a habit or coping mechanism, she wasn’t quite sure. Since the Berlin trip last year, there was no longer anybody else in the apartment for her to bid farewell to.Disposing of the trash that had accumulated over the last few days, Safina made her way down the stairs from her third-storey apartment and emerged into the east alley with barely enough time to dodge the flock of hungry pigeons looking to claim their own breakfast.No further than a hundred meters directly opposite Safina’s apartment was her regular first stop, the hole-in-the-wall known as Kuku’s Cafe. Her stomach was already growling at the thought of her favorite—triangular-shaped mahamri with eggs—waiting for her.As her feet crossed the threshold, she was met by Okeyo, grandson of Kuku, wearing his usual warm and welcoming smile.“Good morning, Safi. Will it be the usual?”“You know me too well, Okeyo,” she beamed back at him. “I would like to pick up some tourist information as well, do you have any brochures?”Okeyo straightened a little as he glanced around before saying, “Certainly. Would you please come with me.”Leading Safina into the cafe, they passed the morning’s customers sitting at their tables and descended a spiral staircase to the basement. On a wooden stool sat the hunched form of Kuku himself, ninety-seven years old and still kicking, his rheumy eyes fixed on the newspaper he held in both hands. He didn’t bother to even look up as he gestured for Okeyo to leave them and tend to the cafe.“Nice day out?” Kuku asked.“Sunny skies today,” Safina replied.“Indeed?” With delib...",1752163368,
1240440,"СМИ: В Halo Studios царит напряжение, сотрудники жалуются на попытки Microsoft заменить разработчиков ИИ","Очередная <a href=""https://gamemag.ru/news/195037/microsoft-chop-heads-2025""><strong>масштабная волна сокращений в Microsoft</strong></a> не сильно задела команду <strong>Halo Studios </strong> — на данный момент там уволили не более 10 человек, тогда как над новыми проектами во вселенной <strong>Halo </strong>трудятся от 200 до 300 человек. ",1751554800,
