appid,title,contents,date,tags
553850,Alinea Analytics: Helldivers 2 хорошо продается на Xbox Series X|S — аудитория Microsoft проявила интерес к шутеру Sony,"Согласно оценкам аналитической компании <strong>Alinea Analytics</strong>, <strong>Helldivers II</strong> разошлась на <strong>Xbox Series X|S</strong> тиражом<strong> свыше 600 тысяч копий</strong> в первые дни после релиза — запуск можно считать очень успешным, особенно учитывая, что речь идёт о порте выпущенной полтора года назад игры. ",1756758360,
553850,Война между PlayStation и Xbox окончена: Sony и Microsoft прорекламировали игры друг друга в социальных сетях,"Уходящая неделя отметилась небывалым сближением<strong> Sony</strong> и <strong>Microsoft</strong> — первая выпустила <strong>Helldivers 2</strong> на <strong>Xbox Series X|S</strong>, а вторая <a href=""http://gamemag.ru/reviews/gears-of-war-reloaded-xbox-review""><strong>представила Gears of War: Reloaded на PlayStation 5</strong></a>. ",1756687740,
553850,Patch 01.003.303,Freedoms greetings Helldivers!Release Captain Morris here with a small update this fine Friday!🌍 OverviewWarbond Token fixCrash fix🔧 Fixes Fixed issue where the Halo Warbond could not be purchased if you had unlocked all Warbonds at the point of upgrading to Super Citizen EditionFixed crash that occurred when multiple helldivers equip the MA5C Assault Rifle on the ship and the host leaves,1756458049,['patchnotes']
553850,"""Stop sh*tting your pants"" says Helldivers 2 boss as it hits 500,000 players","Being the parent of a four-month old child, I deal with a lot of shitty underwear (or, more specifically, diapers) every day. But I didn't expect to have to deal with them at work, too. However, Arrowhead Studios CEO Shams Jorjani has jumped back onto an old <strong>Helldivers 2</strong> meme, telling players to ""stop shitting your pants"" as the game launches on Xbox. Over half a million Helldivers jumped into the game yesterday, all with the sole aim of bringing democracy to every corner of the galaxy - nothing to do with the satisfying sound that the bugs make when they pop, I swear. <a href=""https://www.pcgamesn.com/helldivers-2/concurrent-players"">Read the rest of the story...</a> RELATED LINKS: <a href=""https://www.pcgamesn.com/helldivers-2/halo-odst-crossover"">Helldivers 2's Halo collab arrives sooner than you think, and it looks perfect</a> <a href=""https://www.pcgamesn.com/helldivers-2/halo-crossover"">Helldivers 2's most-anticipated collab is coming and it's exactly what we wanted</a> <a href=""https://www.pcgamesn.com/helldivers-2/weapon-patch-update"">New Helldivers 2 update makes Super Earth flags even more lethal</a> ",1756388891,
553850,Dust Devils Premium Warbond coming to HELLDIVERS 2 on September 4!,"Uncharted territory? Unknown risks? Unimaginable threats? Sounds like our kinda expedition. Trailer:We now have the technology to storm into The Gloom on a glorious voyage of virtuous vengeance with the Dust Devils Premium Warbond – deploying to the Destroyer’s Acquisition’s Panel for today, tomorrow, and all your days of Super Earth service.The mysterious Gloom spore clouds hide the vile alien wastelands of the Terminid plague; a galaxy-wide infestation swarming across peaceful star systems, and they are now ripe for swatting and stomping into extinction. Explore and exterminate everything in your way in cavernous caves and underground lairs teeming with bug-eyed beasts, craven creepy crawlies, and mutated monsters. This may be their home but make it their graveyard. Purge these planets, Helldivers, and extract every last resource to help fuel a brighter, safer tomorrow for Super Earth and all proud patriotic citizens. Incinerate bugs in the heat of the AR-2 Coyote assault rifle’s incendiary rounds; skewer your target with the heavy duty S-11 Speargun; and serve our enemies their fruity five-a-day with the explosive G-7 Pineapple cluster grenade.Launch long-range justice to the face of your freedom-hating foes with the MS-11 Solo Silo Stratagem; and set the field ablaze in the flames of liberty with the EAT-700 Expendable Napalm launcher Stratagem. Survive the brutal elements with all-new armour sets and capes; and give your Shuttle, Hellpod, FRV, and exosuit a venomous overhaul with the Rattlesnake patterns.For some, this will be a one-way trip… but history always remembers the first. We named you the Dust Devils for a reason. So, go raise some hell. Warbond includes:AR-2 Coyote assault rifle.S-11 Speargun.G-7 Pineapple.MS-11 Solo Silo Stratagem.EAT-700 Expendable Napalm Stratagem.DS-42 Federation’s Blade, and DS-191 Scorpion armour sets with Desert Stormer passive ability.Windswept Wayfinder, and Rightful Occupier capes and cards.Raider’s Cheer emote.Burier of Heads player title.Rattlesnake patterns for the Shuttle, Hellpod, FRV, and exosuit. The Dust Devils Premium Warbond releases on September 4!Requires base game, paid purchase of Super Credits, and game progression to unlock. ",1756386556,
553850,Helldivers 2 will send you deep underground in the next major update on September 2,"As if the Halo ODST crossover for Helldivers 2 wasn't enough, now we're actually going underground too on Terminid Hive Worlds. Read the full article here: https://www.gamingonlinux.com/2025/08/helldivers-2-will-send-you-deep-underground-in-the-next-major-update-on-september-2/ ",1756290403,
553850,Helldivers 2 от Sony вышла на Xbox Series X|S,"Кооперативный шутер<strong> Helldivers 2 </strong>добрался до<strong> Xbox Series X|S</strong>. Разработчики <strong>Arrowhead Studios</strong> с подачи<strong> Sony </strong>разрешили перенести своё творение на консоли<strong> Microsoft</strong>. Версией для<strong> Xbox Series X|S</strong> занималась <strong>Nixxes Software</strong>, ранее отметившаяся несколькими портами издательства на <strong>ПК</strong>. ",1756263480,
553850,"Out very soon, Helldivers 2's giant Terminid caving update is a feast of nods to Aliens and Dune, plus dragons","<a href=""https://www.rockpapershotgun.com/games/helldivers-2"">Helldivers 2</a>'s homaging of Starship Troopers and/or parodying of real-life fascist interventionalism continues with Into the Unjust, a sizeable game update that will take you out to the Terminid Hive Worlds for a spot of cave combat. According to multiple geographers interviewed by RPS, caves are located underground. That's going to cause problems if, for example, your entire military strategy depends on being able to call in air support whenever you choose. The same geographers also allege that caves are dark. That's going to cause problems if you like to see the things you're shooting at. Helldivers 2 Into the Unjust launches 2nd September, and why read the rest of this evidently stupid news piece when you can just watch this seven minute ""deep dive"" (comedy whoopee cushion sound effect)? <a href=""https://www.rockpapershotgun.com/out-very-soon-helldivers-2s-giant-terminid-caving-update-is-a-feast-of-nods-to-aliens-and-dune-plus-dragons"">Read more</a> ",1756220006,
553850,Helldivers 2: Into the Unjust launches September 2!,"For too long, we’ve waited and watched as The Gloom expands to swallow more innocent star systems. For too long, we’ve let the Terminds wreak havoc on our colonies, our cities, our homes. The Terminids have pushed into our territory for long enough. Now, with new recruits trained and ready, it’s time to push into unknown territory. Into the Unjust. Enter the Gloom {STEAM_CLAN_IMAGE}/44156989/dbb2ce709e2c352ac5145f4ac9d389cf11eea191.jpg It’s finally time to discover what lies behind the Gloom shroud enveloping these planets we call Hive Worlds. Prepare your squad to disappear into the fog and discover new dangers, from towering structures built by Terminids to what horrors lurk beneath the planet surfaces. Into the Heart of Darkness {STEAM_CLAN_IMAGE}/44156989/69083650548db94fd9cd8b11f832769edfc43b79.jpg Deep underground lies a labyrinth of cave tunnels that twist and turn, infested with the Hive Lung that seems to be the force that produces the thickening fog that makes up the Gloom. Because of the nature of the caves, your Super Destroyer won’t be able to give you full support. It’ll be your team alone against the horror. Terrors Above and Below {STEAM_CLAN_IMAGE}/44156989/a0b58554561effda900150dc76548f7785236c53.jpg What little intelligence we have on the Gloom contains information about a new subterranean species of Terminid Warriors, Bile Spewers, and Chargers that, when they detect a threat, will burrow underground and begin moving toward prey. Once close enough, they erupt from the ground and attack. It doesn’t stop there. The Gloom has mutated the Terminids even further, into grotesque monsters like the Dragonroach: a menace in the sky that dives unsuspecting Helldivers and rains down burning bile. Our reports indicate that there are even greater, more terrifying creatures lying in wait on Hive Worlds, Helldiver. You must find them and take them out. Taking Back Hive Worlds {STEAM_CLAN_IMAGE}/44156989/e8c1efc1e06b0ef33341bf79b27b097a06210777.jpg The Helldivers will also face brand new challenges while liberating Hive Worlds, like escorting a mobile oil rig. Helldivers must defend the rig from attacks while it traverses the treacherous Hive World terrain to the next drill site, where it will extract oil. Meanwhile in the underground, you’ll be forced to locate and destroy the Hive Lung in an effort to stem the spread of the Gloom. There are also new optional and sub-objectives available, too. It’s going to take all your determination and teamwork to stop the infestation from spreading any further and liberate the Hive Worlds. Get ready to dive Into the Unjust on September 2, Helldivers! Introducing the Dust Devils Premium Warbond We’re not sending you to a Hive World without the best gear we have to offer, Helldiver. The Ministry of Defense has fast-tracked the deployment of the Dust Devils Warbond, which will ensure survival in the harshest conditions these worlds can throw your way. Weapons & Stratagems Dust Devils comes with a hefty offering of one primary weapon, a new throwable, and three unique stratagems that will aid in clearing the air–and all the bugs–on Hive Worlds. {STEAM_CLAN_IMAGE}/44156989/d37ec097381efc003f8b5e7649bfe54678272b4a.jpg • AR-2 Coyote You can hunt in packs or go by your lonesome with this assault rifle that features incendiary ammunition. But be warned: this coyote is wild. • G-7 Pineapple This cluster frag grenade might look like a cute and unassuming fruit, but it’ll have the bugs in absolute pieces. {STEAM_CLAN_IMAGE}/44156989/c60ad8fcd74d5e8886c70b1ceb4ae677f446f3bf.jpg • S-11 Speargun A true big game hunter’s companion. The S-11 fires heavy-duty projectiles that release a cloud of gas on impact. • EAT-700 Expendable Napalm Heat up the planet with this single-use missile that contains napalm cluster bombs. • MS-11 Solo Silo The long-range power of a missile in a new convenient package! Calls down a Hellpod-sized missile silo with a single, ultra-powerful missile and a handheld targeting remote. Armors, Capes, and More Whether you’re crouched behind craggy boulders, waiting for your moment to spring a trap on unsuspecting Terminids or marching in formation with your squad to intimidate them, they’ll look the part. Both feature the Desert Stormer passive, which grants resistance to fire, gas, acid, and arc, as well as providing a throw range increase to the bearer. {STEAM_CLAN_IMAGE}/44156989/df675f86872950938d040722f18c65843883e1e0.jpg You’ll also receive capes, player cards, an emote and player title, and a new pattern for your vehicles and Hellpods! • DS-42 Federation’s Blade Captures the essence of armies marching through the desert sands. Wear with the Rightful occupier cape and player card for a polished look. • DS-191 Scorpion Look like a true nomadic warrior in this desert-proof draped set, pairs perfectly with the Windswept Wayfinder cape and player card. • Title: Burier of Heads • Emote: Raider’s Cheer • Pattern: “Rattlesnake” for vehicles and Hellpods Arm your ...",1756211503,
553850,Patch 01.003.302,"🌍Public Service Announcement🌍Release Captain´s Carlberg & Morris reporting in for this important PSAAttention, Helldivers!The pods are primed. Coordinates locked.In moments, you will drop into the Galactic War’s most brutal warzones — and that’s exactly where you belong. Shoulder to shoulder with your brothers and sisters from every corner of the Galaxy, fighting as one. We stand united in our love of Super Earth, guided by the steady hand of Managed Democracy. Like the legendary Helljumpers of another Great War, we go feet first into hell — because that’s where the fight is fiercest. There will be no rescue. No retreat. Only you, Helldivers, together against the enemy. You are the first boots to hit the ground, the last to leave it.And when the Galaxy sees those four blazing streaks cut through the sky, they know: Liberty has arrived, and it will not be denied. Now suit up. Lock in. Remember your extensive training. And see you planetside! With love from all of us at Arrowhead,Happy Xbox launch day iO ",1756195288,
553850,Консольные войны завершились кроссовером: Десант из Halo появится в Helldivers 2 в конце августа,"Arrowhead Game Studios официально анонсировала в <strong>Helldivers 2</strong> кроссовер с <strong>Halo</strong>. Событие приурочено к релизу игры на консолях Xbox Series X|S, который запланирован на 26 августа. ",1755638566,
553850,"Helldivers 2's Halo collab arrives sooner than you think, and it looks perfect","When we talk about games taking the world by storm, my mind always thinks back to Animal Crossing: New Horizons in the pandemic, or Baldur's Gate 3 reaching a worldwide audience that nobody, not even Larian, could have imagined. While a slightly smaller scale, <strong>Helldivers 2</strong> had a similar impact when it launched, in my friendship group at least. We squadded up and got boots on the ground to defeat waves of bug-like Terminids in the Starship Troopers pastiche. But the game is going even bigger this month, as it launches on Xbox and announces a Halo ODST crossover that fans will be ravenous for. <a href=""https://www.pcgamesn.com/helldivers-2/halo-odst-crossover"">Read the rest of the story...</a> RELATED LINKS: <a href=""https://www.pcgamesn.com/helldivers-2/halo-crossover"">Helldivers 2's most-anticipated collab is coming and it's exactly what we wanted</a> <a href=""https://www.pcgamesn.com/helldivers-2/weapon-patch-update"">New Helldivers 2 update makes Super Earth flags even more lethal</a> <a href=""https://www.pcgamesn.com/helldivers-2/control-group-warbond"">One of Helldivers 2's most ludicrous guns yet arrives in new Warbond</a> ",1755618080,
553850,HELLDIVERS 2 x Halo: ODST crossover arrives on August 26,"Okay fine, I'll load HELLDIVERS 2 up again. I definitely don't want to miss the new HELLDIVERS 2 x HALO: ODST Legendary Warbond. Read the full article here: https://www.gamingonlinux.com/2025/08/helldivers-2-x-halo-odst-crossover-arrives-on-august-26/ ",1755610295,
553850,The long-awaited HELLDIVERS™ 2 x HALO: ODST Legendary Warbond arrives August 26,"The Galactic war rages on... Countless Helldivers have laid down their lives to protect Managed Democracy. The call was put out for more recruits, and its been answered by the best of the best. Of the best. Enter The Obedient Democracy Support Troopers (ODST), AKA The Helljumpers! This new equipment set from the Ministry of Defense will give your Helldivers the look of the fabled unit every Super Earth citizen had on their school lunch box as kids. Jam-packed with iconic weaponry, armors, patterns and more Are you ready to jump in? This is the first HELLDIVERS™ 2 Legendary Warbond*;, symbolizing a new tier of Warbond. We have given meticulous attention to detail to deliver a long-requested homage to a fan-favorite series. The HELLDIVERS™ 2 x Halo: ODST Legendary Warbond will be available in the Acquisitions Center for 1500 Super Credits – Legendary Warbonds are not compatible with the new Premier Warbond Token. Firepower {STEAM_CLAN_IMAGE}/44156989/46bb922e7b884d5cafa0b4e424ff0e8573786131.jpg MA5C Assault Rifle An iconic rifle; the definition of reliable and having taken down countless aliens bent on wiping out humanity, it is time to turn its sights on enemies of MANAGED DEMOCRACY. It comes equipped with the convenient ammo counter and a built-in compass - let it guide you to victory. M6C/SOCOM Pistol They say to keep your friends close and your sidearm closer. Well, WE say that. This standard issue ODST pistol will always be your friend, with built-in laser sight, suppressor, and flashlight. M90A Shotgun This powerful shotgun carries a kick and has a handy flashlight mounted on it so you can see the fear in your enemies' eyes before you teach them a valuable lesson about LIBERTY. M7S SMG Silent and deadly, this SMG is the model ODST soldier’s primary weapon. With caseless ammo and a non-removable suppressor; this weapon is ready to spread FREEDOM to every corner of the galaxy. Armors {STEAM_CLAN_IMAGE}/44156989/d4400009a990c9d24fb8d45314296a56d0041084.jpg A-9 Helljumper Armor Set Step into the armored boots of a legendary Lance Corporal who served the ODST with immense bravery and courage under fire. Passive boost – Feet First. A-35 Recon Armour Set Sleeker and stealthier than theA-9 Armor, this set is made to move and groove, with a helmet modeled after an iconic intelligence officer’s headgear. Passive boost – Feet First. Feet First passive -Make less noise from movement -Range when finding points of interest increased by 30% -Immune to leg injuries Capes {STEAM_CLAN_IMAGE}/44156989/09a97adb222cc39805d7ec86502f073324b1d474.jpg Honored Heirloom This cape, emblazoned with the ODST logo, is passed down to a Jumper’s bravest child in the event of their untimely demise. Eye of the Clandestine Some soldiers fight on the front line, and some from the shadows. Wrap yourself in secrecy with this sleek, subtle cape, and slip away from the light. You can also honor the Helljumpers with ODST-themed player cards, a new player title, and the Mean Green vehicle pattern for your hellpod, shuttle, exosuit, and FRV. {STEAM_CLAN_IMAGE}/44156989/38136a1a92b2cd6b93e9ed4e807f11d1963032c3.jpg HELLDIVERS™ 2 x HALO: ODST lands August 26th at 1pm BST. This is the moment we’ve been waiting for. Squad up, drop in, and let’s crush every enemy of Freedom and Managed Democracy TOGETHER. Move out! *Requires base game, paid purchase of Super Credits, and game progression to unlock.",1755609048,
553850,"""Играйте на Xbox"": Sony напомнила о скором выходе Helldivers 2 на Xbox Series X|S","На официальном сайте <strong>Helldivers 2</strong> <a href=""https://www.playstation.com/en-us/games/helldivers-2/#all-notices""><strong>появилась</strong></a> посвященная версии для <strong>Xbox Series X|S</strong> вкладка. <strong>Sony </strong>напомнила о скором выходе своего мультиплеерного шутера на консоли <strong>Microsoft</strong> и дала ссылку на магазин<strong> Xbox</strong>, где можно провести оплату . ",1755462000,
553850,Десант ODST вступает в бой: Разработчики Helldivers 2 тизерят кроссовер с Halo,"<strong>Arrowhead Game Studios </strong>опубликовала новый трейлер <strong>Helldivers 2</strong>. Ролик вновь напоминает о том, что 26 августа PlayStation-эксклюзив доберётся до консолей Xbox Series X|S. ",1755042900,
553850,Helldivers 2's most-anticipated collab is coming and it's exactly what we wanted,"Few multiplayer games have captured our collective imaginations like <strong>Helldivers 2</strong> in recent years. From the exciting missions against hordes of angry bugs, to the sensibly-priced battle passes, to the fact we can squad up with our mates to re-enact the scenes of Starship Troopers, it was an instant hit. Developer Arrowhead Game Studios has supported it well, crafting a deft overarching narrative as players defend Super Earth and democracy. Nearly 18 months after the game first released on PC and Playstation, Xbox players will soon finally get in on the action, and they might be bringing the console's mascot with them - Arrowhead has teased a Helldivers 2 and Halo crossover. <a href=""https://www.pcgamesn.com/helldivers-2/halo-crossover"">Read the rest of the story...</a> RELATED LINKS: <a href=""https://www.pcgamesn.com/helldivers-2/weapon-patch-update"">New Helldivers 2 update makes Super Earth flags even more lethal</a> <a href=""https://www.pcgamesn.com/helldivers-2/control-group-warbond"">One of Helldivers 2's most ludicrous guns yet arrives in new Warbond</a> <a href=""https://www.pcgamesn.com/helldivers-2/game-pass-xbox-launch"">Helldivers 2 dev says there are ""no plans"" for shooter to come to Game Pass</a> ",1755015948,
553850,PATCH 01.003.202,"Freedoms Greetings Citizens and Helldivers, Release Captain Carlberg here rejuvenated after a Super Earth sanctioned vacation.Transmission from Super Earth incoming🌍 OverviewCrash FixesWeapon FixesMissing DLC and Warbond fixYou may now laugh on the ship with full audio🔧 FixesCrash fixesFix a crash caused by tinkering with weapon customizationFix a crash that could occur when enemies despawned after being killedFix crash after getting killed by explosions Weapons Stratagems & BoostersPLAS-45 EPOCH: Improved spreadDecreased by 75% to improve the weapons accuracyThe Laser turret now displays correct heat build upThe LIFT-182 Warp Pack FX no longer shows when in first person modeDisabled LIFT-182 Warp Pack fields around shuttles, preventing any Helldiver escapees. You are done, it is time to go homeFix desync between clients when using the LIFT-182 Warp Pack to get out of a vehicleFixed issue with the AR-32 PACIFIER being unable to fire for a second after reloadingEnemiesFixes for enemy navigation in cities where they could not traverse certain areasMiscellaneous FixesFixed an issue where some players were unable to access items tied to their DLC or WarbondsFix for some emotes snapping the Helldiver torso when standing near a hellpod dropFix for Manic Laughter emote not triggering sound on shipKnown Issues",1754384439,['patchnotes']
553850,Sony пообещала сохранить уникальную идентичность PlayStation в ответ на недовольство фаната выпуском игр на ПК и Xbox Series X|S,"Недавняя <a href=""https://gamemag.ru/news/195374/playstation-ishet-cheloveka-kotoryj-pomozhet-v-vyhode-igr-na-pk-xbox-i-nintendo""><strong>новость о поиске Sony старшего директора по мультиплатформенной и партнёрской коммерции в PlayStation Studios</strong></a> вызвала бурю негодования в фанатском сообществе — многие игроки интерпретировали появившуюся вакансию как намёк на массовый перенос эксклюзивов с <strong>PlayStation 5</strong> на <strong>Xbox Series X|S</strong>. Это спровоцировало жаркие споры, и обеспокоенные поклонники <strong>PlayStation </strong>начали писать письма Sony с вопросами о дальнейших планах. ",1753956000,
553850,Что будет с эксклюзивами PlayStation? Sony решила выпускать больше игр на Xbox Series X|S и NIntendo Switch 2 — официально,"Компания <strong>Sony Interactive Entertainment</strong> разместила вакансию на позицию старшего директора по мультиплатформенной и партнёрской коммерции в подразделении <strong>PlayStation Studios</strong>. Судя по описанию, PlayStation готовится заметно расширить присутствие своих тайтлов за пределами собственных консолей — <strong>включая выпуск игр на ПК, консолях Xbox, Nintendo и мобильных устройствах</strong> . Все они прямо фигурируют в официальном объявлении о поиске сотрудника. ",1753510020,
