appid,title,contents,date,tags
553850,"Helldivers 2's Killzone crossover gear is returning via warbond, a year on from causing pricing controversy","Around this time last year, <a href=""https://www.rockpapershotgun.com/games/helldivers-2"">Helldivers 2</a> was being <a href=""https://www.rockpapershotgun.com/helldivers-2s-update-adds-the-dreaded-illuminate-faction-plus-city-maps-and-bouncy-jeeps"">filled with squishy squids</a>. These squishy squids have since come close to <a href=""https://www.rockpapershotgun.com/helldivers-2s-battle-for-super-earth-makes-chinese-news-following-the-successful-and-slightly-review-bomby-defense-of-equality-on-sea"">squishing Super Earth</a>. Also being squished in late 2024 were some players' positive perceptions of Arrowhead's gear pricing, as a Killzone crossover arrived and was <a href=""https://www.vg247.com/helldivers-2-dev-arrowhead-suitably-festive-solution-killzone-collab-price-backlash"">so throughly panned for being expensive</a> that the studio ended up giving the last bit of it away for free as a make-good. <a href=""https://www.rockpapershotgun.com/helldivers-2s-killzone-crossover-gear-is-returning-via-warbond-a-year-on-from-causing-pricing-controversy"">Read more</a> ",1765471884,
553850,"Helldivers 2's controversial Killzone Warbond returns, this time with better pricing, more items, and less FOMO","Nothing angers me more than an illogical, out-of-place videogame crossover - as a long-suffering Call of Duty fan, I've got my fair share of scars from this already. However, a genuinely great crossover, where the tone and aesthetics match up to great effect, always fills me with joy. The <strong>Helldivers 2</strong> Killzone crossover last year was meant to be just that - weapons and armor sets that celebrate Guerrilla Game's shooter series while fitting into the galactic battles of Arrowhead's excellent co-op game. However, the limited-time Killzone set ended up being shrouded in controversy before disappearing into the ether. Now, 12 months on, it's returning, and it'll be sticking around for good. <a href=""https://www.pcgamesn.com/helldivers-2/killzone-crossover-returns"">Read the rest of the story...</a> RELATED LINKS: <a href=""https://www.pcgamesn.com/helldivers-2/black-friday-flash-deal"">Helldivers 2 gets a huge Black Friday deal, making it cheaper than ever, but only for a day</a> <a href=""https://www.pcgamesn.com/helldivers-2/install-size-growth"">Helldivers 2 has grown gargantuan on PC, leaving Arrowhead with an HDD dilemma</a> <a href=""https://www.pcgamesn.com/helldivers-2/performance-issues-arrowhead-apology"">Helldivers 2 dev springs into action over its growing list of performance issues</a> ",1765467702,
553850,The HELLDIVERS™ 2 x Killzone items return as a Legendary Warbond December 18th,"Attention, Helldivers! Helldivers™ 2 x Killzone is back and this time, it's back for good! It seems fitting that a year after their initial launch, we bring back this iconic content but now in a new and improved format and pricing – yes, we totally heard you all!  Along with our partners at Guerrilla, we’re pleased to announce Helldivers™ 2 x Killzone is now officially a Legendary Warbond*, costing 1500 Super Credits. We couldn’t just add the same stuff as before and leave it, where is the fun in that(?!), so we’ve even added some extra content to round out the package. Not only is the content returning with extra items, but we want to continue to do right by everyone who purchased Super Store content from last year, therefore a whole load of people will be able to unlock this Legendary Warbond at no extra cost. Check out if you’re eligible below. Who gets what and how does it work:  Players who have previously purchased any (even one) of the Killzone items, will have the whole Helldivers™ 2 x Killzone Legendary Warbond unlocked at no extra cost!** Additionally, there is no medal vacuum here! The items previously purchased (and those which were gifted last December) will be medal unlocked. So no need to spend medals on the items you already own! Players who received the gifted items in December 2024 but didn’t pay for any single item, will have to pay the 1500 Super Credits to unlock the full Legendary Warbond.  Not to worry, if you do pay for the warbond; the gifted items will also be medal unlocked. Players joining after the Helldivers™ 2 x Killzone items left the store in December 2024 can access the Warbond by unlocking it for 1500 SC, and then enjoy redeeming medals on their favorite items just as usual Let’s recap all the items included and dig into those new items as well.Weapons and stratagems:  Arm yourself with some of the best weapons Stål has to offer.Beginning with the StA-52 Assault rifle the pride of the Stål armory, providing you with the strength to decimate your foes. It boasts a high-capacity drum mag, great for providing sustained fire.  StA-11 SMG with a helical-feed magazine, which provides a higher ammo capacity whilst making it more front heavy. This close-range weapon is the nightmare of the enemies of freedom.PLAS-39 Accelerator rifle, a high precision burst-fire rifle that will banish your foes after a short charging period.  Armors and capes: AC-1 Dutiful/ The Strength in Our Arms cape This heavy armor boasts a breathing apparatus built in to help both soldiers and colonists thrive, even when assigned to planets with atmospheres rated ""suboptimal"", ""extreme"", and ""character building"".  AC-2 Obedient/ Defender of Our Dream cape The muted colors and relaxed, high mobility fit make this light armor a favorite among long-distance snipers and hide-and-seek champions alike.  Acclimated passive The passive of these armors provides 50% resistance to fire, gas, acid, and electrical damage.  The “Defender of Our Dream” and “Strength in Our Arms” player cards are also returning along with the Assault infantry player title  New Patterns:The latest additions to round out this Warbond are the Extrasolar Ash patterns for your Exosuits, FRV, Hellpods and Pelicans.   So start saving your Super Credits for December 18th at 3pm CET when Helldivers™ 2 x Killzone Legendary Warbond will be available for purchase from wherever you enjoy our game!*Requires base game, paid purchase of Super Credits, and game progression to unlock. **Regional limitations apply.Please note you will not be able to claim the Helldivers™ 2 x Killzone Legendary Warbond with a Premium Warbond token. ",1765462117,"['mod_reviewed', 'ModAct_487176015_1765463753_0', 'mod_require_rereview']"
553850,"With little fanfare, Helldivers 2's creative director shares that Arrowhead are prototyping a roguelite mode","I think there is a very compelling case for Twitter not being the place that information about, well, honestly anything, should be casually shared in a matter of fact manner. It is a site for, if we must use it, posting things like ""just downloaded some MP3s to my iPod Touch,"" not sharing that Arrowhead are currently testing a roguelite mode in <a href=""https://www.rockpapershotgun.com/games/helldivers-2"">Helldivers 2</a>, which is exactly what the game's creative director Johan Pilestedt did today. <a href=""https://www.rockpapershotgun.com/with-little-fanfare-helldivers-2s-creative-director-shares-that-arrowhead-are-prototyping-a-roguelite-mode"">Read more</a> ",1765407299,
553850,Steam Global Top Sellers for week of 2 Dec — 9 December 2025,"<a href=""https://steamdb.info/topsellers/2025W50/?utm_source=Steam&utm_medium=Steam&utm_campaign=SteamRSS""> </a> * <a href=""https://steamdb.info/app/1675200/charts/?utm_source=Steam&utm_medium=Steam&utm_campaign=SteamRSS"">Steam Deck</a>; * <a href=""https://steamdb.info/app/1808500/charts/?utm_source=Steam&utm_medium=Steam&utm_campaign=SteamRSS"">ARC Raiders</a>; * <a href=""https://steamdb.info/app/1142710/charts/?utm_source=Steam&utm_medium=Steam&utm_campaign=SteamRSS"">Total War: WARHAMMER III</a>; * <a href=""https://steamdb.info/app/2807960/charts/?utm_source=Steam&utm_medium=Steam&utm_campaign=SteamRSS"">Battlefield™ 6</a>; * <a href=""https://steamdb.info/app/2622380/charts/?utm_source=Steam&utm_medium=Steam&utm_campaign=SteamRSS"">ELDEN RING NIGHTREIGN</a>; * <a href=""https://steamdb.info/app/1361210/charts/?utm_source=Steam&utm_medium=Steam&utm_campaign=SteamRSS"">Warhammer 40,000: Darktide</a>; * <a href=""https://steamdb.info/app/3531720/charts/?utm_source=Steam&utm_medium=Steam&utm_campaign=SteamRSS"">ELDEN RING NIGHTREIGN The Forsaken Hollows</a>; * <a href=""https://steamdb.info/app/1091500/charts/?utm_source=Steam&utm_medium=Steam&utm_campaign=SteamRSS"">Cyberpunk 2077</a>; * <a href=""https://steamdb.info/app/3405690/charts/?utm_source=Steam&utm_medium=Steam&utm_campaign=SteamRSS"">EA SPORTS FC™ 26</a>; * <a href=""https://steamdb.info/app/553850/charts/?utm_source=Steam&utm_medium=Steam&utm_campaign=SteamRSS"">HELLDIVERS™ 2</a>; <i>* excluding free to play games</i> <a href=""https://steamdb.info/topsellers/2025W50/?utm_source=Steam&utm_medium=Steam&utm_campaign=SteamRSS"">View top 100 on SteamDB</a>",1765270800,
553850,HELLDIVERS 2 file-size on Steam gets massively reduced,"One problem with a lot of modern games is just how big they're getting, but HELLDIVERS 2 is about to massively shrink thanks to work behind the scenes. Read the full article here: https://www.gamingonlinux.com/2025/12/helldivers-2-file-size-on-steam-gets-massively-reduced/ ",1764773038,
553850,HELLDIVERS 2 Tech Blog #2,"IntroductionHey Helldivers,This blog post is a follow up to my previous post about the installation size of the game on PC which you can find here. Today, I will update you on our progress in reducing the installation size and how you can help.  PC Installation SizeUpdateWe have followed through on our plans and made small reductions in the PC installation size over the last few patches while still adding new content. While this was a good start, our short term fixes have not been enough to keep up with all of the new content in the latest patch. The longer term goal has always been to bring the PC installation size much closer in line with the console versions. We are happy to report that, thanks to our partners at Nixxes, we have reached that goal much sooner than expected. By completely de-duplicating our data, we were able to reduce the PC installation size from ~154GB to ~23GB, for a total saving of ~131GB (~85%). We have completed several rounds of internal QA and are ready to roll this out to early adopters as a public technical beta. Our testing shows that for the small percentage of players still using mechanical hard disk drives, mission loading times have only increased by a few seconds in the worst cases. This is live NOW!Only a few seconds difference?Further good news: the change in the file size will result in minimal changes to load times - seconds at most. “Wait a minute,” I hear you ask - “didn’t you just tell us all that you duplicate data because the loading times on HDDs could be 10 times worse?”. I am pleased to say that our worst case projections did not come to pass. These loading time projections were based on industry data - comparing the loading times between SSD and HDD users where data duplication was and was not used. In the worst cases, a 5x difference was reported between instances that used duplication and those that did not. We were being very conservative and doubled that projection again to account for unknown unknowns.Now things are different. We have real measurements specific to our game instead of industry data. We now know that the true number of players actively playing HD2 on a mechanical HDD was around 11% during the last week (seems our estimates were not so bad after all). We now know that, contrary to most games, the majority of the loading time in HELLDIVERS 2 is due to level-generation rather than asset loading. This level generation happens in parallel with loading assets from the disk and so is the main determining factor of the loading time. We now know that this is true even for users with mechanical HDDs. Great! When does this happen? How can I help?Do you want to be an early adopter? You can opt-in right now and help us test the slim version! There are no functional differences between the legacy and slim versions besides the installation size. You will be connected to the same galactic war as everyone else and be using the same account you always do - so all progression, war contributions and purchases will carry over between the different versions. You will still be able to matchmake and play with all other players. You can also opt-out at any time if you experience issues. It’s a low-risk way to save ~131GB of space on your drive and help us extend our testing to real-life conditions. Full instructions for opting in and out of the technical beta can be found at the end of this blog post. The future!When the public technical beta confirms that there are no issues present in the slim version, it will become the default version for everyone. For a limited time, we will allow players to opt-in to the legacy version as a way to self-troubleshoot any issues that were not picked up during our internal testing or the public technical beta. Given the very minor differences in loading times between the two versions, there is no justification for us to keep supporting the legacy version long term. Maintaining the legacy version alongside the slim version would only add extra burden to our developers, build machines, QA teams and release processes. Assuming all goes smoothly, the legacy version will be discontinued some time next year. FinallyThank you to the community for all your support with the game as we work through these technical pieces, and thank you to our partners at Nixxes for helping us troubleshoot and implement all the above improvements. Beta InstructionsWarning!Modders beware! Any patch we roll out can break the game if you have mods installed and this one is no exception. We recommend that only players with a clean installation opt-in to the slim version. As always, you mod the game at your own risk.If any of this seems a bit scary to you, we encourage you to just sit back and wait for the slim version to become the default version.Opting in to the slim versionStep 1.In your steam library, right click on HELLDIVERS 2 and select ‘Properties’.Step 2.Next select the ‘Betas’ tab.Step 3.In the Beta Participation drop down list, select “prod_slim”Step...",1764688243,
553850,Into the Unjust: 5.0.0,"Release Captain Morris, coming to you this democratic Tuesday with an important update from High Command. Super Earth has detected strange signals from previously unmonitored worlds on the Galactic map. The Ministry of Intelligence is investigating the source of the signals. Helldivers, be vigilant and hold the high ground.Patch HighlightsFor this patch, we have tackled a bunch of items from our Known Issues list, including audio issues, XP modifiers, and several crashes.We have made more optimizations and improvements!Balancing changes that raise weapon damage and fixes to weapon FOV.⚖️ BalancingGeneral changesDecreased ergonomics penalty on magnifying scopes weapon attachmentsThe intent is to make magnifying scopes more a matter of preference by decreasing the penalty they impose on a weapon's ergonomics (low ergonomics makes the weapons muzzle follow the crosshair slower). Some of the Pistol ammo balance updateThe intent with this change is to make some of the pistol rounds weapons more effective after the last pistol ammo re-balance that did make them more of a close range weapon.The pistol rounds re-balance general intent is to make them more effective at close range while not more effective at long range then for example assault or marksman rifles2x Tube Red Dot Decreased ergonomic modifier from (-3) to (-1)4x Combat ScopeDecreased ergonomic modifier from (-6) to (-2)10x Sniper Scope Decreased ergonomic modifier from (-9) to (-4)APW-1 Anti-Materiel Rifle is also effected by this change so it will get an increased ergonomics from 26 to 31 Primary weapons SMG-37 DefenderIncreased damage from 100 to 110Increased durable damage from 20 to 22SMG-32 ReprimandIncreased damage from 135 to 140M7S SMGIncreased damage from 80 to 90Increased durable damage from 16 to 18VG-70 VariableIncreased durable damage 20 to 23M90A ShotgunIncreased durable damage 15 to 20 Sidearms weaponsP-2 PeacemakerIncreased damage from 95 to 100Increased durable damage 30 to 32P-113 VerdictIncreased damage from 135 to 140M6C/SOCOM PistolIncreased damage from 110 to 125Increased durable damage from 25 to 28EnemiesWar striderDecreased force strength on grenade explosion from 50 to 30Bile SpewerDecreased force strength on artillery explosion from 50 to 30Decreased force impulse on artillery explosion from 60 to 40StalkerDecreased force strength from 40 to 35 when a tongue attack hits the player (Force strength is the value that decides if a player or enemy should stagger or ragdoll.) 🎮 GameplayKeybind options for quick weapon function:New, unbound keybind options have been added for quickly swapping weapon functions (like changing fire modes or ammo).The intent is to give players better ease of use, especially for weapons with multiple ammo types like the Halt, Autocannon, and the new ""One Two"" AR.    Updated First Person View (FPV)We updated how First Person View (FPV) works with the intention of improving the aiming experience across different FOV settings (Field of view). The intent is that the size and distance of the scope will be more consistent with different FOV settings.We also updated how ergonomics works in FPV with the intent to make it more responsive.Fixed instances of flickering textures in various city locations🔧 Fixes Crash Fixes & SoftlocksFixed a rare crash that would occur when combat music would startFixed a rare crash that could occur during 'Nuke Nursery' missionFixed crash after hotjoining a game that just started where the existing players are using certain stratagemsFixed a rare crash when enemies would fall through the groundFix rare crash on mission load Weapons & Stratagem FixesFixed an issue with the BR-14 Adjudicator, when aiming with the 10x scope on 200 m setting which would cause the model to disappear  Fixed a visual issue on VG-70 Variable during the reload animation when aiming down sightsFixed a torso clipping issue with the CE-07 Demolition Specialist armorFixed pump-shotguns sometimes not showing a new shell being inserted on reloadPLAS-45 Epoch now correctly zooms in ADS mode, just like any other support weaponFixed display related to no ammo being shown for Infinite Ammo weapons Fixed the VO (Voice Over) line for “no ammo” being played after pressing reload whilst using Infinite Ammo weaponsFixed a small bug where supply packs were giving ammo without consuming a charge when droppedFixed a bug that locks stratagems after drowning while holding that stratagem ballFixed the red glow that would happen if the player would empty one or two magazines with MG-206 Heavy Machine Gun, M-105 Stalwart or MG-43 Machine Gun EnemiesFactory Striders will no longer be launched to sky erratically when dyingHellpods that hit Factory Striders will no longer remain in the air after the enemy diesWar Striders now detonate minesEnemy presence around Cognitive Disruptor Towers is now cleared from the mini-map when the objective is completedChargers no longer speed up when exiting chargeFixed Rupture Warriors getting stuck ...",1764670145,
553850,"Helldivers 2 gets a huge Black Friday deal, making it cheaper than ever, but only for a day","Arc Raiders may be the most talked-about co-op shooter right now, but in my eyes, it doesn't hold a candle to <strong>Helldivers 2</strong>. From the excellent bug-slaying and robot-demolishing combat to the community missions that help you feel part of something bigger, it's one of the <a href=""https://www.pcgamesn.com/10-best-co-op-pc-games"">best co-op games</a> of all time (and a viral hit, when it first launched), and you can grab it at a massive <strong>Black Friday</strong> discount right now - but you only have a day. <a href=""https://www.pcgamesn.com/helldivers-2/black-friday-flash-deal"">Read the rest of the story...</a> RELATED LINKS: <a href=""https://www.pcgamesn.com/the-last-of-us/half-price-fanatical"">If The Last of Us hasn't broken your heart yet, grab it at half price in the Black Friday sales</a> <a href=""https://www.pcgamesn.com/ninja-gaiden-2-black/fanatical-black-friday-deal"">Tough-as-nails action adventure game Ninja Gaiden 2 Black is down to its lowest ever price for the Black Friday weekend</a> <a href=""https://www.pcgamesn.com/dynasty-warriors-origins/black-friday-flash"">Dynasty Warriors Origins has a huge Black Friday discount, bringing the underloved action game to its lowest price</a> ",1764341803,
553850,Heck yeah - the next HELLDIVERS 2 Warbond finally brings a minigun,"HELLDIVERS 2 is still one of the best online co-op action games around, and we're finally going to be able to get a minigun to really tear through enemies. Read the full article here: https://www.gamingonlinux.com/2025/11/heck-yeah-the-next-helldivers-2-warbond-finally-brings-a-minigun/ ",1764157125,
553850,Python Commandos Premium Warbond airdrops into the jungle on December 2!,"Helldivers, high-ranking officials in the Ministry of Defense have accused you of being the best. And if you’re the best, then you’re going to need to be outfitted with the best, which is why the Ministry has fast-tracked the deployment of the Python Commandos Premium Warbond–arriving to your Super Destroyers on December 2! Weapons & StratagemsLet’s talk firepower first. Python Commandos is loaded with three brand new stratagems and a new primary. The Ministry of Defense received thousands of requests from squad commanders for a minigun and we’re excited to finally give our Helldivers access to the M-1000 Maxigun! Belt-fed with ultra-high ammo capacity, this one is sure to make those bugs bleed.This Warbond also includes another addition to the line-up of faithful sidekicks for your Helldiver: the AX/FLAM-75 “Guard Dog” Hot Dog. This drone is equipped with a flamethrower to coat your foes in the fires of freedom before returning to your backpack to refuel.But if you don’t want to burn the jungle down, consider doing your deforestation with the CQC-9 Defoliation Tool. If the machete doesn’t cut it–whether it’s a tree or an enemy–surely this will!And finally, Python Commandos has a new and unique primary weapon: a combination assault rifle and grenade launcher called the AR/GL-21 One-Two. Heavy to wield, but the damage dealt is heavy too, making your primary slot more versatile than ever with two guns in one! Armors & CapesPython Commandos features two armor sets and, like Viper Commandos before it, they both let you get those guns out for some fresh air.First up is the RS-20 Constrictor light armor set. It’s also the official uniform for the League of Patriotic Arm Wrestlers, so it’s guaranteed to give your squad bigger and more rippling biceps to intimidate the enemy. But if you’re carrying the team, maybe you need the RS-40 Best of Prey: a heavy armor set patterned after legendary Helldiver, Ronald Mambo, and his famously powerful and burly physique.Both of these armors are equipped with the Rock Solid passive, which makes your Helldiver more steadfast against staggering and ragdolling attacks.You’ll also have two capes and coordinating player cards available: Foe Rent Asunder, which is pre-tattered to give a battle-worn appearance, and Mark of the Constrictor, for Helldivers who strangle out any anti-democratic behavior they encounter.Patterns & EmotesAlong with all this, you’ll get access to the Front-Leaning Rest Position emote–now you can drop and give ‘em 20 anytime! Python Commandos also includes the Chameleon Camo pattern for your FRV, Exosuit, Hellpod, and Shuttle.The finishing touch is to get the whole team coordinated with the Python Commando player title and organize a swift strike on anything that stands between you and extraction.The Python Commandos Premium Warbond is dropping in on December 2, divers. Get ready to deliver the venom of Liberty directly into the heart of evil! *Requires base game, paid purchase of Super Credits, and game progression to unlock. ",1764079586,
553850,"Стало известно, какой будет следующая игра создателей Helldivers 2","Сотрудники <strong>Arrowhead Game Studios </strong>приступили к предварительному производству своей следующей крупной игры, которую студия будет издавать самостоятельно — <a href=""https://gamemag.ru/news/194310/helldivers-2-dev-new-game-in-progress""><strong>без участия Sony Interactive Entertainment</strong></a>. Информацией поделился креативный директор <strong>Йохан Пилестедт</strong>. ",1764044640,
