appid,title,contents,date,tags
553850,"Helldivers 2 wants you to make sure virtual citizens don't wet the bed, and also here's another free cape","You need to buck your ideas up and start doing better. No, it's not what your parents say whenever you tell them what you're up to for a living, it's what <a href=""https://www.rockpapershotgun.com/games/helldivers-2"">Helldivers 2</a> developers Arrowhead are basically telling players with the <a href=""https://www.rockpapershotgun.com/best-fps-games"">shooter</a>'s latest major order. Get out there with those <a href=""https://www.rockpapershotgun.com/helldivers-2s-latest-patch-lets-you-impale-baddies-with-flags-as-the-bots-take-aim-at-the-democracy-space-station"">stabby flags</a> and murder-death millions of the enemies Super Earth's citizens are most afraid of, in order to restore their faith in your ability to protect them by murder-deathing things. It's not all tough love, though. There's also another free cape for folks who helped solve a puzzle in May. <a href=""https://www.rockpapershotgun.com/helldivers-2-wants-you-to-make-sure-virtual-citizens-dont-wet-the-bed-and-also-heres-another-free-cape"">Read more</a> ",1753197917,
553850,Steam Global Top Sellers for week of 15 Jul — 22 July 2025,"<a href=""https://steamdb.info/topsellers/2025W30/?utm_source=Steam&utm_medium=Steam&utm_campaign=SteamRSS""> </a> * <a href=""https://steamdb.info/app/1675200/charts/?utm_source=Steam&utm_medium=Steam&utm_campaign=SteamRSS"">Steam Deck</a>; * <a href=""https://steamdb.info/app/3527290/charts/?utm_source=Steam&utm_medium=Steam&utm_campaign=SteamRSS"">PEAK</a>; * <a href=""https://steamdb.info/app/294100/charts/?utm_source=Steam&utm_medium=Steam&utm_campaign=SteamRSS"">RimWorld</a>; * <a href=""https://steamdb.info/app/553850/charts/?utm_source=Steam&utm_medium=Steam&utm_campaign=SteamRSS"">HELLDIVERS™ 2</a>; * <a href=""https://steamdb.info/app/2277560/charts/?utm_source=Steam&utm_medium=Steam&utm_campaign=SteamRSS"">WUCHANG: Fallen Feathers</a>; * <a href=""https://steamdb.info/app/3024040/charts/?utm_source=Steam&utm_medium=Steam&utm_campaign=SteamRSS"">Stronghold Crusader: Definitive Edition</a>; * <a href=""https://steamdb.info/app/1144200/charts/?utm_source=Steam&utm_medium=Steam&utm_campaign=SteamRSS"">Ready or Not</a>; * <a href=""https://steamdb.info/app/381210/charts/?utm_source=Steam&utm_medium=Steam&utm_campaign=SteamRSS"">Dead by Daylight</a>; * <a href=""https://steamdb.info/app/3022790/charts/?utm_source=Steam&utm_medium=Steam&utm_campaign=SteamRSS"">RimWorld - Odyssey</a>; * <a href=""https://steamdb.info/app/3186490/charts/?utm_source=Steam&utm_medium=Steam&utm_campaign=SteamRSS"">Destiny 2: The Edge of Fate</a>; <i>* excluding free to play games</i> <a href=""https://steamdb.info/topsellers/2025W30/?utm_source=Steam&utm_medium=Steam&utm_campaign=SteamRSS"">View top 100 on SteamDB</a>",1753174800,
553850,Patch 01.003.201,Issuing an Emergency Hot Fix from High CommandOverviewCrash FixFixFix for the host crashing the game for other players when planting the CQC-1 One True Flag stratagem,1752656473,['patchnotes']
553850,New Helldivers 2 update makes Super Earth flags even more lethal,"When fighting against aliens that will stop at nothing to end you, everything should be considered a potential weapon - even flags. And thanks to groundbreaking military research from Arrowhead, the latest <b>Helldivers 2</b> update has made those portable battle banners even pointier. What does this mean? Well, you can now proudly plant Super Earth's flag directly into your enemies with even more force. <a href=""https://www.pcgamesn.com/helldivers-2/weapon-patch-update"">Read the rest of the story...</a> RELATED LINKS: <a href=""https://www.pcgamesn.com/helldivers-2/control-group-warbond"">One of Helldivers 2's most ludicrous guns yet arrives in new Warbond</a> <a href=""https://www.pcgamesn.com/helldivers-2/game-pass-xbox-launch"">Helldivers 2 dev says there are ""no plans"" for shooter to come to Game Pass</a> <a href=""https://www.pcgamesn.com/helldivers-2/restrictions-removed"">Helldivers 2 and other Sony hits get over 100 Steam region restrictions lifted</a> ",1752588212,
553850,PATCH 01.003.200,"Freedoms greetings Helldivers!Release Captain Carlberg coming to you this democratic Tuesday with an update from high command🌍 OverviewBalancingMission FixesWeapon FixesMiscellaneous Fixes ⚖️ Balancing GeneralHelldiverReduced the time it takes for the Helldiver to regain control after ragdolling from 0.8 to 0.5 secIncreased chest injury bleed damage from 1 to 10. Chest injuries now cause more noticeable damage, as the previous value of 1 was so low it appeared to have no effectCQC-1 One True Flag Thanks to some groundbreaking military research into pointier flag tips, the flag can now be proudly planted directly into enemies—dead or alive—ensuring the eternal colors of Super Earth are never tainted, only quenched by the blood of its foes. Absolute DemocracyPrimary weaponsAR-32 PacifierStun duration increased from 1.5 to 3 sec Starting magazines increased from 5 to 6Max amount of magazines increased from 7 to 8Slight increase in stun value applied to enemies SMG-72 PummelerStun duration increased from 1.5 to 3 secSlight increase in stun value applied to enemies ARC-12 BlitzerSlight increase in stun value applied to enemies R-2124 ConstitutionBayonet stagger strength increased from 20 to 25 R-2 Amendment Bayonet stagger strength increased from 20 to 25 SidearmsP-92 WarrantNow also locks-on to Large sized enemies ThrowablesG-109 UrchinStagger strength increased from 0 to 50It now staggers and affects Large sized enemies G-10 IncendiaryThe amount of fuel has been increased in the grenade, resulting in longer-lasting fire duration G-13 Incendiary impactThe amount of fuel has been increased in the grenade, resulting in a longer-lasting fire duration StratagemsA/FLAM-40 Flame sentryFire damage resistance increased from 0 to 95%Cooldown reduced from 150 to 100 sec GL-52 De-EscalatorSlight increase in stun value applied to enemiesBoostersFirebomb HellpodNow affects the Hellpods default explosion as well Stagger strength decreased from 80 to 15 to prevent ragdolling playersDemolition strength decreased from 40 to 20 because we now correctly also additively apply the normal Hellpod explosionStun PodsNow affects the Hellpods default explosion as wellStagger strength decreased from 80 to 15 to prevent ragdolling playersDemolition strength decreased from 40 to 20 because we now correctly also additively apply the normal Hellpod explosion EnemiesGeneralIt’s now easier to put Large to Massive sized enemies on fireTerminidsWarrior Damage needed to gib Warriors increased from 500 to 750 damageThis is how much damage is needed to explode the body without leaving a corpse behind AutomatonsScout striderLegs armor decreased from 3 to 2Legs durable resistance has been increasedIlluminatesOverseer variantsUnarmored Torso healthzone armor decreased from 2 to 1 🔧 FixesWeapons Stratagems & BoostersFixed an issue with the R-2124 Constitution playing audio during the wrong instancesFixed an issue with the draw and holster speed with the Gunslinger Armor PassiveFixed an issue with ranged weapon grips after dropping the Entrenchment ToolEnemiesFixed an issue where status effect damage were attempting to apply more times than intendedMissionsFixed an issue that prevented stratagems from working correctly on Terminate Illegal Broadcast objectivesFixed an issue with bad enemy pathing on military uplink objectivesFixed an issue for the terminal and drop off point, where they became inaccessible during the Retrieve Recon Craft Intel objectiveMiscellaneous FixesFixed an issue in first person view where some armors resulted in visible obstructions around the shoulder while using a high Field Of ViewFixed an issue during map generation that could result in missing terrain featuresFixed fall animations occasionally playing before victory posesExtended some fonts to handle Bengali characters in player namesFixed an error that caused some enemy models to appear in lower qualityFixed an issue to prevent accidentally triggering jump packs or climbing on supply pods while using the interact button on controllerFixed an issue where exiting the chat was leaving players unarmedFixed an issue with aiming during the draw emoteFixed issues when exiting First Person View using emotesKNOWN ISSUES",1752570038,
553850,One of Helldivers 2's most ludicrous guns yet arrives in new Warbond,"There's only one answer when someone asks you: 'Would you like to obliterate some aliens with a seven-barreled volley gun?' And that's 'hell yes.' <strong>Helldivers 2</strong> just unveiled its next Warbond, Control Group, that contains some experimental and ludicrous weaponry forged from alien tech. The Warbond, which arrives in Helldivers 2 on Thursday July 17, also contains a new Stratagem that lets 'Divers teleport around the battlefield. <a href=""https://www.pcgamesn.com/helldivers-2/control-group-warbond"">Read the rest of the story...</a> RELATED LINKS: <a href=""https://www.pcgamesn.com/helldivers-2/game-pass-xbox-launch"">Helldivers 2 dev says there are ""no plans"" for shooter to come to Game Pass</a> <a href=""https://www.pcgamesn.com/helldivers-2/restrictions-removed"">Helldivers 2 and other Sony hits get over 100 Steam region restrictions lifted</a> <a href=""https://www.pcgamesn.com/helldivers-2/patch-stealth-change"">Helldivers 2 patch brings back the Terminids alongside a new way to fight them</a> ",1752164421,
553850,После Helldivers 2 на конкурирующих с PlayStation 5 консолях могут появиться другие эксклюзивы Sony,"Вслед за <a href=""https://gamemag.ru/news/195130/definitely-not-helldivers-2-devs-confirm-it-wont-ever-come-to-xbox-game-pass""><strong>Helldivers 2 для Xbox Series X|S</strong></a> на конкурирующих с <strong>PlayStation 5</strong> консолях могут появиться другие эксклюзивы <strong>Sony</strong> — но речь идет прежде всего о сервисных проектах. Об этом сообщил авторитетный французский журналист <strong>Жюльен Шьез</strong>. ",1752159600,
553850,"Helldivers 2's next warbond is full of funky alien tech, including a ""(somewhat) stable wormhole"" teleportation pack","Sometimes, when you're fighting aliens, you've got to whip out a gun that might explode in your own face. Them's the rules. You've got to risk it for a chocolate biscuit. Or, at least that's premise of <a href=""https://www.rockpapershotgun.com/games/helldivers-2"">Helldivers 2</a>'s latest warbond. Dubbed Control Group, it'll give you access to a bunch of experimental gear Super Earth's scientists have cobbled together from captured Illuminate tech if you opt to pick it up when it drops on June 17th. <a href=""https://www.rockpapershotgun.com/helldivers-2s-next-warbond-is-full-of-funky-alien-tech-including-a-somewhat-stable-wormhole-teleportation-pack"">Read more</a> ",1752157082,
553850,Helldivers 2 Control Group Warbond launches July 17!,"Attention, Helldivers! The Ministry of Defense Research & Development team has just declassified the following information for immediate release. You have been cleared to field test a new range of experimental weapons built from acquired alien technology. R&D scientists have completed the Control Group Premium Warbond* for deployment to your Super Destroyer! Weapons & StratagemsFirst up, in the primary weapon category, is the VG-70 Variable, a seven-barrelled volley gun with three different firing modes: Auto, which has three selectable RPM values; Volley, which fires a single shot from each barrel at once; and Total, which fires all remaining ammunition in one go. Researchers noted that using the Total firing mode with a lot of ammunition may result in bodily harm to the user. Also in need of field testing is the new G-31 Arc grenade. The lightweight G-31 bounces while discharging electricity that strikes enemies (and Helldivers) in proximity.The next declassified item is the PLAS-45 Epoch support weapon which charges plasma into a focused sphere which is then fired. This weapon is ready for battlefield use, but additional research data suggests that it can explode if overcharged. No safe mode is available. But we're sure you can handle it, Helldiver. This is what field testing is all about! Next up in offensive technology is the A/LAS-98 Laser Sentry. For this sentry, the ammunition canisters on standard turrets have been replaced with a supersized heatsink, allowing the potential for infinite laser firing. However, R&D would like to remind users that the turret can overheat and explode if the laser is continuously active with no cooldown.Perhaps the most significant and exciting development from the Ministry of Defense is the new LIFT-182 Warp Pack stratagem. R&D has harnessed the power of Dark Fluid to generate a (somewhat) stable wormhole on demand. Once the wormhole is active, wearers can teleport short distances with no cooldown between jumps. In practice, the wearer is pulled into the singularity, dematerialized, and rematerialized again in a new location. The head of R&D noted that the dematerialization process can be somewhat painful, and that users should bear in mind that the wormhole cannot maintain integrity for extended periods–each jump will further destabilize it, and the wearer may experience death should the singularity fully collapse. A small price to pay for ultra-convenient traversal!Armors & MoreAnd don’t forget about proper personal protective equipment! Good field testing involves enforcing safety protocols, which is why we’re outfitting Control Group with two new sets of armor designed to provide adequate battlefield protection. For medium armor, we’ve included the AD-26 Bleeding Edge that will allow for protection and greater ease of movement combined. But for more dangerous experiments, there’s also the AD-49 Apollonian heavy armor that’s meant to assist you with the perils of evaluating all this new equipment. Each armor set looks professionally stylish with the coordinating capes, Conductor of Brilliance and Over Artifice Triumphant, and both armor sets feature a new and exciting passive: Adreno-Defibrillator! After you take lethal damage and the Adreno-Defibrillator detects that the user has collapsed, it activates and revives the user to full health. R&D did indicate that the Adreno-Defibrillator only has enough charge for one use to bring the user to maximum health, and the user will begin losing health continually after activating it. In addition to all this, R&D is including new player cards to match the Conductor of Brilliance and Over Artifice Triumphant capes, and we’re giving you access to a new emote to assist in testing: Protect Eardrums. Covering your ears is the leading method to prevent noise-induced hearing loss. Safety first! And, finally, with great scientific discovery comes much hard work and sacrifice, Helldivers, and that’s why we want to recognize your valiant field testing efforts of the Control Group Warbond with a special title: Exemplary Subject. Wear this to show your squad that you got in on the ground floor of this advanced technology! You’ve been recruited into the Control Group, divers. Report to R&D for field testing on July 17! *Requires base game, paid purchase of Super Credits, and game progression to unlock.",1752152781,
553850,"Helldivers 2 dev says there are ""no plans"" for shooter to come to Game Pass","In case you missed it amid all of the other Microsoft news last week, one of 2024's hottest games, <strong>Helldivers 2,</strong> will be deployed on Xbox this August. This makes it the first ever Sony-published game to be released on Microsoft's flagship console, with reviews riding high after the huge Heart of Democracy update saw Steam numbers skyrocket. But there's a caveat. <a href=""https://www.pcgamesn.com/helldivers-2/game-pass-xbox-launch"">Read the rest of the story...</a> RELATED LINKS: <a href=""https://www.pcgamesn.com/helldivers-2/restrictions-removed"">Helldivers 2 and other Sony hits get over 100 Steam region restrictions lifted</a> <a href=""https://www.pcgamesn.com/helldivers-2/patch-stealth-change"">Helldivers 2 patch brings back the Terminids alongside a new way to fight them</a> <a href=""https://www.pcgamesn.com/helldivers-2/warbond"">Helldivers 2 Warbond - Masters of Ceremony details</a> ",1751912999,
553850,Sony неожиданно анонсировала Helldivers 2 для Xbox Series X|S,<strong>Arrowhead Game Studios </strong>выпустит <strong>Helldivers 2</strong> на <strong>Xbox Series X|S</strong>. Релиз кооперативного шутера на консолях <strong>Microsoft </strong>состоится <strong>26 августа 2025 года</strong>. Дебютный трейлер можно посмотреть ниже. ,1751571780,
553850,Warbond Token Announcement,"Warbond Token - incoming!Greetings Helldivers,We’ve been listening to our community and we’re here to let you know of an upcoming update to the HELLDIVERS 2 editions.Introducing the Warbond Token*!The upcoming, new Warbond Token What is a Warbond Token? we hear you ask: A Warbond Token will allow players who purchase the HELLDIVERS 2: Super Citizen Edition or HELLDIVERS 2: Super Citizen Edition Upgrade to unlock any Premium Warbond released in HELLDIVERS 2. The Warbond Token will replace the ‘Steeled Veterans Warbond’ within both special editions. We will be introducing the new token into these two editions on August 26th, 2025.But why?Prior to now players could accidentally double up purchases on the ‘Steeled Veterans Warbond’ in the game and with the Super Citizen Edition Upgrade. We never want players to buy things twice and not get the value of what they paid for!Can I purchase a Warbond Token by itself?There are no plans for the Warbond Token to exist as a standalone product. Players will still be able to access and purchase any Premium Warbond within the game as it has been to date.When does this happen? Can I get it now? I’ve been meaning to upgrade for ages!The update will happen August 26th, 2025. If you own a HELLDIVERS 2 Standard Edition and have bought ‘Steeled Veterans Warbond’ already then we recommend waiting until August to purchase the Super Citizen Edition Upgrade. You will be able to choose to unlock a different Warbond from ‘Steeled Veterans’!Do I need to do anything?If you already own the Super Citizen Edition then congratulations you don’t need to do anything!If you own a HELLDIVERS 2 Standard Edition and have bought ‘Steeled Veterans Warbond’ already then we recommend waiting until August to purchase the Super Citizen Edition Upgrade. You will then be able to unlock a different Warbond.If you own HELLDIVERS 2 Standard Edition and have not bought ‘Steeled Veterans Warbond’, then we highly recommend taking a look at the Super Citizen Edition Upgrade, you can choose to buy this now and get the ‘Steeled Veterans Warbond’, or wait until August and choose to unlock any of the Premium Warbonds currently available in HELLDIVERS 2.If you don’t own any edition of HELLDIVERS 2 then we suggest purchasing as soon as possible or risk being reported to High Command. Your team needs you Helldivers! How will the Warbond Token appear in the game?After purchasing the updated Super Citizen Edition or Super Citizen Edition Upgrade (post 26th August), the Warbond Token will be granted to your Helldivers 2 account after you login to the game for the first time and reach the shiphub. To check if you have a Warbond Token in your inventory, open the game menu and select any Premium Warbond. If the button in the bottom right says ""Claim Premium Warbond"" instead of ""Buy Premium Warbond"", the token is available.- To use the token, click ""Claim Premium Warbond"". A ""Confirm Purchase"" prompt will appear. Confirm it to unlock the selected Premium Warbond. In-game confirmation What will the options look like?HELLDIVERS 2 Standard EditionHELLDIVERS 2 Super Citizen Edition – will be replacing the Steeled Veterans Warbond with a Warbond TokenHELLDIVERS 2 Super Citizen Edition Upgrade – will be replacing the Steeled Veterans Warbond with a Warbond Token.Legal:*Not available for standalone purchase.",1751460677,
553850,"Helldivers 2's latest patch nerfs Leviathans, and might have snuck that review bomb cape in behind-the-scenes","It's Tuesday, so <a href=""https://www.rockpapershotgun.com/games/helldivers-2"">Helldivers 2</a> has gotten a fresh patch. This one makes the Illuminate's flying death slugs easier to battle and looks like it might have laid the groundwork for the game's long-awaited review bomb cape. Those Leviathan balancing tweaks have come after players continued to struggle to beat the airborne enemy, despite Arrowhead having <a href=""https://www.rockpapershotgun.com/helldivers-2s-latest-patch-delivers-a-free-cape-and-lets-you-rock-the-spotlight-before-getting-zapped-by-a-leviathan"">previously added a spotlight effect</a> to the attack it can use to one-shot your bottom into oblivion. <a href=""https://www.rockpapershotgun.com/helldivers-2s-latest-patch-nerfs-leviathans-and-might-have-snuck-that-review-bomb-cape-in-behind-the-scenes"">Read more</a> ",1750774646,
553850,Patch 01.003.104,"Freedoms greetings Helldivers!Release Captain Carlberg here with a small update this fine Tuesday!🌍 OverviewGeneral Weapons fixesLeviathan🔧 Fixes Weapons and StratagemsFixed weapons being unable to fire after stimming while using a mounted weapon. P-92 Warrant bullets no longer penetrate when ricochetingFixed guard dog text issues EnemiesLeviathansWe have heard your feedback and are attempting to balance Leviathans to more manageable levels. The Leviathans no longer cause ragdolling and deal less impulse damage to vehiclesAdjusted spawn rates, so you encounter less per missionAdded an additional 1 second delay between shots for target lockingLeviathan cannons can now be destroyed Miscellaneous FixesFixed a bug that caused mission items to disappear when entering vehicles Fix for chat interactions causing weapon switches while using a mounted weapon, emotes and victory posesFixed weapon grip issues and melee attack issues after using stims or emotes",1750755646,['patchnotes']
553850,"Helldivers 2's post-death and destruction Super Earth rebuild begins, financed by more death and destruction","<a href=""https://www.rockpapershotgun.com/games/helldivers-2"">Helldivers 2</a> players might have managed to <a href=""https://www.rockpapershotgun.com/helldivers-2s-battle-for-super-earth-makes-chinese-news-following-the-successful-and-slightly-review-bomby-defense-of-equality-on-sea"">stop the Illuminate</a> from totally destroying their home planet towards the end of last month, but it still got pretty badly trashed. Enter the game's latest mission - kick off the Super Earth rebuild by securing ""reparations"". How are those funds being secured, you ask? This is Helldivers 2, so it's by killing a bunch more baddies. <a href=""https://www.rockpapershotgun.com/helldivers-2-post-death-and-destruction-super-earth-rebuild-begins-financed-by-more-death-and-destruction"">Read more</a> ",1750671526,
