appid,title,contents,date,tags
553850,Helldivers 2 dev springs into action over its growing list of performance issues,"It feels like <strong>Helldivers 2</strong> is defined by its rollercoaster relationship with its community at this point. How many times have we seen the game hit stratospheric heights with amazing updates and incredible moments of emergent storytelling, only for a miscommunication or an ill-received balance change to result in sour sentiment and review bombing? Recently, performance issues have been irking players, with Arrowhead remaining fairly tight-lipped and more focused on pushing out new Warbonds and content updates. However, it's now apologized to fans, saying it's heard the feedback on Helldivers 2's growing list of performance gremlins, and is springing into action to fix them. <a href=""https://www.pcgamesn.com/helldivers-2/performance-issues-arrowhead-apology"">Read the rest of the story...</a> RELATED LINKS: <a href=""https://www.pcgamesn.com/helldivers-2/concurrent-players"">""Stop sh*tting your pants"" says Helldivers 2 boss as it hits 500,000 players</a> <a href=""https://www.pcgamesn.com/helldivers-2/halo-odst-crossover"">Helldivers 2's Halo collab arrives sooner than you think, and it looks perfect</a> <a href=""https://www.pcgamesn.com/helldivers-2/halo-crossover"">Helldivers 2's most-anticipated collab is coming and it's exactly what we wanted</a> ",1758731706,
553850,State of the Game Update #1,"Greetings Helldivers,We know many of you have been experiencing issues including performance drops, stability hiccups, freezes, and the annoying audio bugs. We’ve seen the feedback across Discord, forums, Reddit and our dashboards. You’ve been loud, clear, and absolutely right to expect better. We also recognise that our recent updates haven’t hit the mark, and our silence hasn’t helped. That’s on us. We read all of it and we are hard at work creating a roadmap to address this.Starting with the good news: there is an incoming update (mid October-ish) where we’ll start chipping away at: Some key crash fixesFixed the Primary weapon/Side-arm audio that stops during a missionMinor performance improvementsLong overdue bug fixes, like Charger footstep sounds (pretty useful) or weapon audio stopping mid missionNo more landing on cavesA Balance Pass (we’re unleashing Niklas & Lennart) For some of the bigger performances pieces unfortunately we can’t wave a ‘short-turnaround-magic-wand’, nor would a 60 day patch fix them fully (rather it would be duct tape where we need to solder); so we’re working on a bigger development plan as to how we can address some of the larger concerns. Short term, we think the above will make a noticeable improvement and beyond that we’ll keep working on the top issues you keep raising. In the future, we’re planning more transparency and more talk! We’re looking to share more about the processes, performance and how we got here, plus further improvements and evolution. For starters expect another post next week to kick that off. Between the Xbox launch, the Halo: ODST Legendary Warbond, the free Into the Unjust update, and other surprises, we’ve welcomed a ton of new players, brought back veterans, and delivered a lot of content. Now, it’s time to double down on fixes, polish, and better communication.TL;DRWe hear you, we want things to be in a better state, we are taking it very seriously, we will continue working and sharing. Thanks for sticking with us! For Super Earth!The Arrowhead Dev Team ",1758718921,
553850,Steam Global Top Sellers for week of 16 Sep — 23 September 2025,"<a href=""https://steamdb.info/topsellers/2025W39/?utm_source=Steam&utm_medium=Steam&utm_campaign=SteamRSS""> </a> * <a href=""https://steamdb.info/app/3008130/charts/?utm_source=Steam&utm_medium=Steam&utm_campaign=SteamRSS"">Dying Light: The Beast</a>; * <a href=""https://steamdb.info/app/3405690/charts/?utm_source=Steam&utm_medium=Steam&utm_campaign=SteamRSS"">EA SPORTS FC™ 26</a>; * <a href=""https://steamdb.info/app/1285190/charts/?utm_source=Steam&utm_medium=Steam&utm_campaign=SteamRSS"">Borderlands 4</a>; * <a href=""https://steamdb.info/app/1675200/charts/?utm_source=Steam&utm_medium=Steam&utm_campaign=SteamRSS"">Steam Deck</a>; * <a href=""https://steamdb.info/app/1757300/charts/?utm_source=Steam&utm_medium=Steam&utm_campaign=SteamRSS"">Jump Space</a>; * <a href=""https://steamdb.info/app/1091500/charts/?utm_source=Steam&utm_medium=Steam&utm_campaign=SteamRSS"">Cyberpunk 2077</a>; * <a href=""https://steamdb.info/app/2947440/charts/?utm_source=Steam&utm_medium=Steam&utm_campaign=SteamRSS"">SILENT HILL f</a>; * <a href=""https://steamdb.info/app/1030300/charts/?utm_source=Steam&utm_medium=Steam&utm_campaign=SteamRSS"">Hollow Knight: Silksong</a>; * <a href=""https://steamdb.info/app/2807960/charts/?utm_source=Steam&utm_medium=Steam&utm_campaign=SteamRSS"">Battlefield™ 6</a>; * <a href=""https://steamdb.info/app/553850/charts/?utm_source=Steam&utm_medium=Steam&utm_campaign=SteamRSS"">HELLDIVERS™ 2</a>; <i>* excluding free to play games</i> <a href=""https://steamdb.info/topsellers/2025W39/?utm_source=Steam&utm_medium=Steam&utm_campaign=SteamRSS"">View top 100 on SteamDB</a>",1758618000,
553850,"Helldivers 2 devs Arrowhead pull new Rupture Strain bugs offline for five weeks to fix their, er, bugs","<a href=""https://www.rockpapershotgun.com/games/helldivers-2"">Helldivers 2</a> developers Arrowhead have opted to pull a recently deployed variant of the shooter's Terminid bugs offline for five weeks, in order to fix issues with them. Yep, for now you can dive onto planets like Oshaune and explore some <a href=""https://www.rockpapershotgun.com/giant-new-bug-worms-of-helldivers-2-i-will-find-you-and-i-will-watch-someone-else-kill-you"">Into the Unjust update</a> caves without having to worry about burrowing bugs jumping out to mercilessly kick your bottom. Rupture Warriors have been the main source of Rupture Strain ire since their arrival at the start of this month, as their ability to pop out of the Earth and <a href=""https://www.reddit.com/r/Helldivers/comments/1niof9a/rupture_warriors_and_their_various_bugs/"">instantly murder unsuspecting troops</a> has proven tough to counter. At first, those hosting sessions were most at risk of dying like this, but Arrowhead's attempt to rectify the issue in <a href=""https://store.steampowered.com/news/app/553850/view/787688820859470905"">Tuesday's patch</a> seemingly put everyone in each party in an <a href=""https://www.reddit.com/r/Helldivers/comments/1nieus5/ah_why_in_the_world_would_you_think_this_should/"">equal amount of danger</a>, though some players did <a href=""https://www.reddit.com/r/Helldivers/comments/1nilttr/the_patch_did_not_make_rupture_warriors/"">dispute this was the case</a>. <a href=""https://www.rockpapershotgun.com/helldivers-2-devs-arrowhead-pull-new-rupture-strain-bugs-offline-for-five-weeks-to-fix-their-er-bugs"">Read more</a> ",1758187076,
553850,Patch 01.400.002,"Freedoms greetings Helldivers!Release Captain Morris here with a small update this fine Tuesday!🌍 OverviewCrash fixesAudio bug fixes, including cave audio🔧 FixesFixed a crash on cave maps, when host migrates under certain conditionsFixed a crash to desktop which would occur if the oil rig was destroyed when the shuttle was on its wayFixed a crash when joining someone who is using bombardment stratagemsFixed a crash on game start-upFixed an issue where Helldivers were reinforcing on top of cave structuresThe Dragonroach can now be damaged with fire and/or gasRupture Warriors now track moving clients accurately, leveling the difficulty level of attacks between client and hostFixed an audio bug related to Devastator projectilesRebalanced caves audio levelsFixed a rare instance where Primary Weapon audio would go missing Known Issues ",1758015601,['patchnotes']
553850,Steam Global Top Sellers for week of 9 Sep — 16 September 2025,"<a href=""https://steamdb.info/topsellers/2025W38/?utm_source=Steam&utm_medium=Steam&utm_campaign=SteamRSS""> </a> * <a href=""https://steamdb.info/app/1285190/charts/?utm_source=Steam&utm_medium=Steam&utm_campaign=SteamRSS"">Borderlands 4</a>; * <a href=""https://steamdb.info/app/1030300/charts/?utm_source=Steam&utm_medium=Steam&utm_campaign=SteamRSS"">Hollow Knight: Silksong</a>; * <a href=""https://steamdb.info/app/1675200/charts/?utm_source=Steam&utm_medium=Steam&utm_campaign=SteamRSS"">Steam Deck</a>; * <a href=""https://steamdb.info/app/553850/charts/?utm_source=Steam&utm_medium=Steam&utm_campaign=SteamRSS"">HELLDIVERS™ 2</a>; * <a href=""https://steamdb.info/app/2694490/charts/?utm_source=Steam&utm_medium=Steam&utm_campaign=SteamRSS"">Path of Exile 2</a>; * <a href=""https://steamdb.info/app/3472040/charts/?utm_source=Steam&utm_medium=Steam&utm_campaign=SteamRSS"">NBA 2K26</a>; * <a href=""https://steamdb.info/app/2444750/charts/?utm_source=Steam&utm_medium=Steam&utm_campaign=SteamRSS"">Shape of Dreams</a>; * <a href=""https://steamdb.info/app/2183900/charts/?utm_source=Steam&utm_medium=Steam&utm_campaign=SteamRSS"">Warhammer 40,000: Space Marine 2</a>; * <a href=""https://steamdb.info/app/2807960/charts/?utm_source=Steam&utm_medium=Steam&utm_campaign=SteamRSS"">Battlefield™ 6</a>; * <a href=""https://steamdb.info/app/3008130/charts/?utm_source=Steam&utm_medium=Steam&utm_campaign=SteamRSS"">Dying Light: The Beast</a>; <i>* excluding free to play games</i> <a href=""https://steamdb.info/topsellers/2025W38/?utm_source=Steam&utm_medium=Steam&utm_campaign=SteamRSS"">View top 100 on SteamDB</a>",1758013200,
553850,Steam Global Top Sellers for week of 2 Sep — 9 September 2025,"<a href=""https://steamdb.info/topsellers/2025W37/?utm_source=Steam&utm_medium=Steam&utm_campaign=SteamRSS""> </a> * <a href=""https://steamdb.info/app/1030300/charts/?utm_source=Steam&utm_medium=Steam&utm_campaign=SteamRSS"">Hollow Knight: Silksong</a>; * <a href=""https://steamdb.info/app/1285190/charts/?utm_source=Steam&utm_medium=Steam&utm_campaign=SteamRSS"">Borderlands 4</a>; * <a href=""https://steamdb.info/app/553850/charts/?utm_source=Steam&utm_medium=Steam&utm_campaign=SteamRSS"">HELLDIVERS™ 2</a>; * <a href=""https://steamdb.info/app/3472040/charts/?utm_source=Steam&utm_medium=Steam&utm_campaign=SteamRSS"">NBA 2K26</a>; * <a href=""https://steamdb.info/app/1675200/charts/?utm_source=Steam&utm_medium=Steam&utm_campaign=SteamRSS"">Steam Deck</a>; * <a href=""https://steamdb.info/app/2694490/charts/?utm_source=Steam&utm_medium=Steam&utm_campaign=SteamRSS"">Path of Exile 2</a>; * <a href=""https://steamdb.info/app/2183900/charts/?utm_source=Steam&utm_medium=Steam&utm_campaign=SteamRSS"">Warhammer 40,000: Space Marine 2</a>; * <a href=""https://steamdb.info/app/1086940/charts/?utm_source=Steam&utm_medium=Steam&utm_campaign=SteamRSS"">Baldur's Gate 3</a>; * <a href=""https://steamdb.info/app/275850/charts/?utm_source=Steam&utm_medium=Steam&utm_campaign=SteamRSS"">No Man's Sky</a>; * <a href=""https://steamdb.info/app/367520/charts/?utm_source=Steam&utm_medium=Steam&utm_campaign=SteamRSS"">Hollow Knight</a>; <i>* excluding free to play games</i> <a href=""https://steamdb.info/topsellers/2025W37/?utm_source=Steam&utm_medium=Steam&utm_campaign=SteamRSS"">View top 100 on SteamDB</a>",1757408400,
553850,"Неожиданно: Helldivers 2 продается на Xbox Series X|S лучше, чем на PlayStation 5 — Alinea Analytics","<strong>Helldivers 2</strong> продолжает покорять владельцев <strong>Xbox Series X|S</strong>. Согласно представленным сегодня оценкам аналитического агентства <strong>Alinea Analytics</strong>, по итогам первых шести дней мультиплеерный шутер разошелся<strong> </strong>на консолях <strong>Microsoft</strong> тиражом в <strong>926 тысяч копий</strong> . Результат называют отличным. ",1757011080,
553850,"Helldivers 2 hotfix tackling some Into the Unjust update crashes out now, and Arrowhead are looking into PC freezing","After rapidly declaring that they were <a href=""https://www.rockpapershotgun.com/helldivers-2s-into-the-unjust-update-has-caused-an-uptick-in-crashes-and-arrowhead-are-working-to-isolate-fixes"">looking into action</a> the other day, <a href=""https://www.rockpapershotgun.com/games/helldivers-2"">Helldivers 2</a> developers Arrowhead have released a hotfix aiming to rectify some of the crashing that's affected players diving Into the Unjust. Unlike the giant worms I've still seen hide nor mandible of, it didn't take the studio long to address reports of an <a href=""https://www.rockpapershotgun.com/arrowhead-will-target-helldivers-2s-crippling-tech-issues-now-xbox-release-is-sorted-but-would-rather-not-do-a-performance-only-update"">uptick in technical issues</a> for the shooter following the update's arrival on Tuesday. Here's hoping that these fixes'll help keep thing a bit more stable. <a href=""https://www.rockpapershotgun.com/helldivers-2-hotfix-tackling-into-the-unjust-update-crashes-out-now-and-arrowhead-are-looking-into-pc-freezing"">Read more</a> ",1756987749,
553850,Hotfix 01.004.001,"Release Captain Morris here, rolling out a hotfix to a Super Destroyer near you. ⚖️ BalancingS-11 SpeargunDecreased reload duration 3.5 -> 2.5 secMS-11 Solo SiloReduced cooldown from 210 seconds to 180 seconds🔧 FixesFixed a crash that can happen when too many particle effects are spawnedFixed a crash when Helldivers are in Hellpods after being reinforcedFixed an issue where light emitted by the Hellpad could become excessively bright under certain conditionsGeneral crash fix occurring during Automaton missionsFixed issue in which hive world tunnels would become darker than intended in certain circumstances when a user is using lower graphics settingsFixed a crash that could occur if the target of a seeking missile gets deleted before impactThe extraction shuttle will land in a more safe and sound manner Weapons & Stratagem FixesFixed the LIFT-182 Warp Pack getting stuck suspended in the air or crashingFixed a rare crash caused by multiple players having the MA5C AR equipped on the Super DestroyerFixed Displacements Backpack VFX issues whilst aiming down sightsFixed a rare crash which could occur when aborting a mission while a player was wielding a turret or driving a vehicle Known Issues",1756980695,['patchnotes']
553850,"Arrowhead will target Helldivers 2's ""crippling"" tech issues now Xbox release is sorted, but would rather not do a ""performance-only update""","Shams Jorjani, boss of <a href=""https://www.rockpapershotgun.com/games/helldivers-2"">Helldivers 2</a> developers Arrowhead, has taken to Discord to address the rise in reports of performance issues following the arrival of the shooter's Into the Unjust update. In addition to admitting that the new addition has missed the mark from a stability pespective, the exec added that the game's Xbox release now being in the rear view mirror should free up more resources to tackle performance problems. Since the <a href=""https://www.rockpapershotgun.com/out-very-soon-helldivers-2s-giant-terminid-caving-update-is-a-feast-of-nods-to-aliens-and-dune-plus-dragons"">Terminid spelunking expedition-themed update</a> arrived yesterday, players have cited an uptick in crashes that Arrowhead are <a href=""https://www.rockpapershotgun.com/helldivers-2s-into-the-unjust-update-has-caused-an-uptick-in-crashes-and-arrowhead-are-working-to-isolate-fixes"">already looking into</a>, with the installation size the game's ballooned to on PC and your usual sorts of pesky bugs also being sources of ire, at least among vocal online <a href=""https://www.rockpapershotgun.com/games/helldivers"">Helldivers</a>. <a href=""https://www.rockpapershotgun.com/arrowhead-will-target-helldivers-2s-crippling-tech-issues-now-xbox-release-is-sorted-but-would-rather-not-do-a-performance-only-update"">Read more</a> ",1756900854,
553850,"Helldivers 2's Into the Unjust update has caused an uptick in crashes, and Arrowhead are ""working to isolate fixes""","<a href=""https://www.rockpapershotgun.com/games/helldivers-2"">Helldivers 2</a>'s Terminid spelunking update, dubbed Into the Unjust, has dropped from orbit today, September 2nd. Sadly, that hellpod's impact with the game's surface looks to have triggered an uptick in crash reports, and Arrowhead are now busy ""working to isolate fixes"". If you missed the update's announcement the other day, Edwin was strapped into the news driver's seat at the time, and has a <a href=""https://www.rockpapershotgun.com/out-very-soon-helldivers-2s-giant-terminid-caving-update-is-a-feast-of-nods-to-aliens-and-dune-plus-dragons"">nice rundown of what's in it here</a>. He even consulted some very real geographers, the absolute pro. The short version? Terminid cave missions on Hive Worlds to aid Super Earth's efforts to fight an evil cloud, and some new enemies flying around. <a href=""https://www.rockpapershotgun.com/helldivers-2s-into-the-unjust-update-has-caused-an-uptick-in-crashes-and-arrowhead-are-working-to-isolate-fixes"">Read more</a> ",1756828802,
553850,Into the Unjust - Out Now!,"Freedoms greetings Helldivers!Release Captain Morris coming to you this democratic Tuesday with an update from high command. 🌍 OverviewNew additionsBalancing FixesMiscellaneous fixesKnown issues For too long, we’ve waited and watched as The Gloom expands to swallow more innocent star systems. For too long, we’ve let the Terminids wreak havoc on our colonies, our cities, our homes. The Terminids have pushed into our territory for long enough. Now, with new recruits trained and ready, it’s time to push into unknown territory. Into the Unjust.🎮 New AdditionsHive WorldsRandomly-generated giant cave systemsA new tactical challengeDiscover disgusting flora and fauna and advanced Terminid lifeHive World surface - acid lakes and advanced bug spiresHoles in the cave roof will allow stratagems to be called downDestructible walls within the caves to navigateBring a flashlight!MissionsDelve deep into the caves to destroy the Spore Lung and stop its infectious Gloom spreadTake control of the GATER mobile oil rig and siphon the mysterious oily substance from the surface of Hive WorldsUndertake more missions to extract resources and destroy the enemy threat on Hive WorldsHave Super Earth approved levels of fun!New EnemiesRupture Spewer; The foul Rupture Spewer bursts from the ground only to spew its undemocratic pestilence on the innocent. Upon returning to its dark warrens, it is believed to consume its own dead in order to generate more of its corrosive acid.Rupture Warrior; A product of Gloom-induced mutation, the Rupture Warrior has lost the UV-insulating chitin layer that would protect its internal organs from solar radiation damage. Captured specimens prefer burrowing to open-air movement, a pattern indicative of subconscious shame at their own undemocratic ways.Rupture Charger; When this armored beast senses the presence of Liberty, it buries itself underground to escape its light. Its Charger instincts compel it to tunnel through the ground at high speeds, emerging only to attack those who represent the Liberty that blinds it so.Dragonroach; This oversized affront to Free skies everywhere circles its would-be prey, swooping down intermittently to bespew them with air-combustible acid. A spineless tactic befitting an exoskeletal monstrosity. ⚖️ BalancingUnified “none explosive Orbitals” so they have the same projectile damage and destruction values as the Orbital gas. This effects: Orbital smoke Increased Projectile Damage 0 → 300 Increased Projectile AP 0 → 7Increased Projectile Demolition strength 30 → 50Orbital E.M.SIncreased Projectile Damage 250 → 300 Increased Projectile AP 3 → 7Increased Projectile Demolition strength 30 → 50 Unified Stun explosions work. They all apply the stun effect on the explosion and not only on the status effect volume. This effects:Orbital E.M.SMortar E.M.S Changed how all stun explosions work in that they now initially stagger the enemy they stun but also without ragdolling the player if hit by such an explosion ThrowablesStun grenadeIncreased stagger strength 0 -> 50UrchinDecreased stagger impulse 15 -> 0 StratagemsOrbital E.M.SIncreased stagger strength 10 -> 50Decreased stagger impulse 40 → 0Mortar E.M.SIncreased stagger strength 10 -> 50Decreased stagger impulse 40 → 0 BoosterStun HellpodIncreased stagger strength 10 -> 50Decreased stagger impulse 20 → 0🔧 Fixes Crash Fixes & SoftlocksFixed a rare crash caused by multiple players having the MA5C AR equipped on the super destroyerFixed crash that could occur during hot-joiningFixed a rare crash that could occur when dropping backpacks Weapons & Stratagem FixesFixes for mute AX/LAS-5 'GUARD DOG' ROVER audioAudio fixes for multiple weapons not having reverb applied to themFixed Hellpod payloads being targetable by guidance systemGL-52 De-Escalator stratagem input code now begins with a down arrow, inline with other support weapon stratagemsMotivational Shocks Booster no longer applies to enemiesFixed the StA X3 WASP Launcher firemode - it will no longer fire in Semi-Auto mode after switching from Artillery firing modeFixed guidance system targeting Tanks incorrectly EnemiesInstalled additional hydraulic leg supports on dropship Automaton units (they will no longer take damage when dropped from the dropships).Updated automaton city outpost to prevent broken pathing on the bridgeIlluminate enemies are now less likely to warp on top of destroyed outpost ship rubble MissionsUpdated the design of city evacuation objectives that will allow brave citizens to evacuate correctlyFixed a missions issue that caused ghost objectives to appear during the mission complete screenFixed issue where the landed Automaton dropships in the Sabotage Airbase objective could be destroyed with LIFT-182 Warp PackFixed occasional Charger pathing issues around certain bug rocks Miscellaneous FixesFix flickering VFX shadows in some areas.Fixed strange movement after falling while marchingFixed chat typing animations - Helldivers no longer suffer from fat fingers...",1756803656,
553850,Steam Global Top Sellers for week of 26 Aug — 2 September 2025,"<a href=""https://steamdb.info/topsellers/2025W36/?utm_source=Steam&utm_medium=Steam&utm_campaign=SteamRSS""> </a> * <a href=""https://steamdb.info/app/553850/charts/?utm_source=Steam&utm_medium=Steam&utm_campaign=SteamRSS"">HELLDIVERS™ 2</a>; * <a href=""https://steamdb.info/app/2417610/charts/?utm_source=Steam&utm_medium=Steam&utm_campaign=SteamRSS"">METAL GEAR SOLID Δ: SNAKE EATER</a>; * <a href=""https://steamdb.info/app/1675200/charts/?utm_source=Steam&utm_medium=Steam&utm_campaign=SteamRSS"">Steam Deck</a>; * <a href=""https://steamdb.info/app/2694490/charts/?utm_source=Steam&utm_medium=Steam&utm_campaign=SteamRSS"">Path of Exile 2</a>; * <a href=""https://steamdb.info/app/1285190/charts/?utm_source=Steam&utm_medium=Steam&utm_campaign=SteamRSS"">Borderlands 4</a>; * <a href=""https://steamdb.info/app/3472040/charts/?utm_source=Steam&utm_medium=Steam&utm_campaign=SteamRSS"">NBA 2K26</a>; * <a href=""https://steamdb.info/app/275850/charts/?utm_source=Steam&utm_medium=Steam&utm_campaign=SteamRSS"">No Man's Sky</a>; * <a href=""https://steamdb.info/app/990080/charts/?utm_source=Steam&utm_medium=Steam&utm_campaign=SteamRSS"">Hogwarts Legacy</a>; * <a href=""https://steamdb.info/app/1174180/charts/?utm_source=Steam&utm_medium=Steam&utm_campaign=SteamRSS"">Red Dead Redemption 2</a>; * <a href=""https://steamdb.info/app/3527290/charts/?utm_source=Steam&utm_medium=Steam&utm_campaign=SteamRSS"">PEAK</a>; <i>* excluding free to play games</i> <a href=""https://steamdb.info/topsellers/2025W36/?utm_source=Steam&utm_medium=Steam&utm_campaign=SteamRSS"">View top 100 on SteamDB</a>",1756803600,
553850,Helldivers 2 (Xbox) Review,"This past week in console gaming—Aug. 26, 2025, to be exact—the unthinkable occurred. In what many have called a historic swap for the ages, a port of <em>Helldivers 2</em> was released on Xbox Series consoles by PlayStation Publishing LLC on the same day <em>Gears of War: Reloaded</em> launched on PlayStation 5. That’s right: a former PlayStation 5 console-exclusive title (excluding <em><a href=""https://www.cgmagonline.com/review/game/mlb-show-17-definitive-mlb-experience/"" data-type=""review"" data-id=""98065"">MLB The Show</a></em>) published by Sony is now playable on Xbox Series X and S, while <em>Reloaded</em>—a “re-remaster” of the first installment in one of Microsoft’s most treasured console-exclusive franchises—can now be played on PlayStation 5. Crazier still, both titles feature cross-platform play. <em><a href=""https://www.cgmagonline.com/review/game/gears-of-war-reloaded-ps5/"" data-type=""review"" data-id=""1128732"">Gears of War: Reloaded</a></em> players on PlayStation can squad up with Xbox and PC owners, while <em>Helldivers 2</em> players on Xbox can join PC and PlayStation users. No longer do we have to imagine some nebulous kumbaya moment in a distant future where console wars no longer exist. Right now (and I say this with affection), Xbots, Sony Ponies and... <a href=""https://www.cgmagonline.com/review/game/helldivers-2-xbox/"">Read more</a> ",1756803600,
