appid,title,contents,date,tags
1030300,How to get to Hollow Knight Silksong Bilewater,"<strong>How do you get to Bilewater in Silksong?</strong> This murky swamp signals the shift from the mid to late-game in Team Cherry's Metroidvania. However, like many other areas, just reaching it can be an exercise in patience and ingenuity. We can show you exactly how to get there, with several routes to choose from. Bilewater is an optional area on the <a href=""http://www.pcgamesn.com/hollow-knight-silksong/map"">Silksong map</a>, which means you don't strictly need to explore it until you're ready. However, clearing it early rewards you with several <a href=""http://www.pcgamesn.com/hollow-knight-silksong/tools"">Silksong tools</a>, Memory Lockets, and <a href=""https://www.pcgamesn.com/hollow-knight-silksong/flea-locations"">Lost Fleas</a>. While finding a bench should be your top priority, we also recommend picking up Ascendant's Grip from Jubilana in Songclave. While it costs 350 Rosaries, it can make this punishing land a little easier to handle, especially once you face the <a href=""http://www.pcgamesn.com/hollow-knight-silksong/bosses"">Silksong boss</a> who calls it home. <a href=""https://www.pcgamesn.com/hollow-knight-silksong/bilewater"">Read the rest of the story...</a> RELATED LINKS: <a href=""https://www.pcgamesn.com/hollow-knight-silksong/trobbio"">How to beat Trobbio in Hollow Knight Silksong</a> <a href=""https://www.pcgamesn.com/hollow-knight-silksong/mods-best"">Best Hollow Knight Silksong mods</a> <a href=""https://www.pcgamesn.com/hollow-knight-silksong/crest-best"">All Hollow Knight Silksong crest locations and best crest</a> ",1757507635,
1030300,Best Silksong Tools and all locations,"<strong>What are the best Silksong Tools? </strong>It's an understatement to say that Silksong is challenging. While some players are reveling in the undertaking, others are struggling with tough bosses and even tougher runbacks. If you're in the latter camp, we feel your pain, so we've done our research to help you (and ourselves) out. You may get some way through the <a href=""https://www.pcgamesn.com/hollow-knight-silksong/map"">Silksong map</a> before even realizing how good <a href=""https://www.pcgamesn.com/hollow-knight-silksong"">Hollow Knight Silksong</a>'s Tools are, but these valuable items are essential to your success. There are three tool types, limited slots, and secret locations to get to grips with if you're going to unlock the best tools in the <a href=""https://www.pcgamesn.com/best-metroidvania-games-pc"">Metroidvania game</a>. Here are all the <strong>Silksong Tool locations</strong> and which ones you should be using. <a href=""https://www.pcgamesn.com/hollow-knight-silksong/tools"">Read the rest of the story...</a> RELATED LINKS: <a href=""https://www.pcgamesn.com/hollow-knight-silksong/trobbio"">How to beat Trobbio in Hollow Knight Silksong</a> <a href=""https://www.pcgamesn.com/hollow-knight-silksong/mods-best"">Best Hollow Knight Silksong mods</a> <a href=""https://www.pcgamesn.com/hollow-knight-silksong/crest-best"">All Hollow Knight Silksong crest locations and best crest</a> ",1758126611,
1030300,How to unlock Hollow Knight Silksong Act 3,"<strong>How do you unlock Act 3 in Hollow Knight Silksong?</strong> With the grandiose final battle of Act 2, it's easy to miss the existence of the game's true final act. And with a convoluted unlock requirement most players only discover by exhausting everything the game has to offer, we're here to run you through the quickest way to unlock Act 3 in Silksong. Beware: there's a long, spoiler-filled road ahead. Unlocking Act 3 in <a href=""https://www.pcgamesn.com/hollow-knight-silksong"">Hollow Knight Silksong</a> means completing a bunch of tasks you might have seen as optional side quests. And while there are plenty you don't need to complete, like winning the <a href=""https://www.pcgamesn.com/hollow-knight-silksong/dice-game"">Silksong dice</a> game, it turns out there are lots of cryptic challenges and hidden boss battles gatekeeping you from the true final showdown in one of the <a href=""https://www.pcgamesn.com/best-metroidvania-games-pc"">best Metroidvania games</a> in recent memory. <a href=""https://www.pcgamesn.com/hollow-knight-silksong/act-3"">Read the rest of the story...</a> RELATED LINKS: <a href=""https://www.pcgamesn.com/hollow-knight-silksong/sister-splinter"">How to beat the Hollow Knight Silksong Sister Splinter</a> <a href=""https://www.pcgamesn.com/hollow-knight-silksong/bell-beast"">Hollow Knight Silksong Bell Beast guide</a> <a href=""https://www.pcgamesn.com/hollow-knight-silksong/hunters-march"">Hollow Knight Silksong Hunter's March bench location and how to unlock</a> ",1757856862,
1030300,The first Hollow Knight: Silksong patch arrives next week - here's what's in it,"Hollow Knight: Silksong is clearly a smash-hit, reaching an incredible player milestone quickly after release and Team Cherry are readying a first update. Read the full article here: https://www.gamingonlinux.com/2025/09/the-first-hollow-knight-silksong-patch-arrives-next-week-heres-whats-in-it/ ",1757434003,
1030300,New Hollow Knight Silksong update will make the game easier after player outcry,"<strong>Hollow Knight Silksong</strong>'s release has certainly been an interesting one. Having literally broken everything from Steam to the Xbox store, Team Cherry's highly anticipated Metroidvania is finally out in the world, debuting to glowing player reviews (ours is still incoming). But as time has gone on and the 'it's finally out' sparkle has worn off, some have started to really scrutinize the game. The first major complaint is about its difficulty: we all expected it to be hard, but not <em>this hard</em>. The second has focused on its respawn points, which are often placed relatively far away from bosses, in turn requiring you to rerun the gauntlet to get to them every time you die. In short, it's kicking players' asses, but the first Hollow Knight Silksong patch is taking some steps towards evening things out. <a href=""https://www.pcgamesn.com/hollow-knight-silksong/first-update"">Read the rest of the story...</a> RELATED LINKS: <a href=""https://www.pcgamesn.com/hollow-knight-silksong/rosary-farm"">Hollow Knight Silksong Rosary farm locations</a> <a href=""https://www.pcgamesn.com/hollow-knight-silksong/endings"">All Hollow Knight Silksong endings and how to unlock them</a> <a href=""https://www.pcgamesn.com/hollow-knight-silksong/mount-fay"">How to get to Hollow Knight Silksong Mount Fay</a> ",1757423247,
1030300,The first Hollow Knight: Silksong patch is going to come with some balance tweaks so you don't quit early,"It’s been a few days now since the launch of <a href=""https://www.vg247.com/games/hollow-knight-silksong"">Hollow Knight: Silksong</a> and a few issues are starting to bubble up. One of the most significant complaints has been about the game’s level of difficulty. <a href=""https://www.vg247.com/hollow-knight-silksong-first-patch-balance-adjustments"">Read more</a> ",1757420336,
1030300,"You can change Hollow Knight Silksong's difficulty after all, and here's how","<strong>Hollow Knight Silksong</strong> has released to rave reviews from players. Everyone is excited to get their hands on Team Cherry's sequel after a seven year wait that felt closer to seven decades. Generally, they like what they see. The atmosphere is exemplary, the art is beautiful, and the gameplay is mostly great. However, there are a few issues with difficulty. Silksong is hard as nails, especially compared with its predecessor. That's why fans were so excited to find a secret cheat that lets you change the difficulty. There's just one catch... <a href=""https://www.pcgamesn.com/hollow-knight-silksong/change-difficulty"">Read the rest of the story...</a> RELATED LINKS: <a href=""https://www.pcgamesn.com/hollow-knight-silksong/endings"">All Hollow Knight Silksong endings and how to unlock them</a> <a href=""https://www.pcgamesn.com/hollow-knight-silksong/mount-fay"">How to get to Hollow Knight Silksong Mount Fay</a> <a href=""https://www.pcgamesn.com/hollow-knight-silksong/map"">Hollow Knight Silksong map, area order, and Shakra locations</a> ",1757416877,
1030300,Steam Global Top Sellers for week of 2 Sep — 9 September 2025,"<a href=""https://steamdb.info/topsellers/2025W37/?utm_source=Steam&utm_medium=Steam&utm_campaign=SteamRSS""> </a> * <a href=""https://steamdb.info/app/1030300/charts/?utm_source=Steam&utm_medium=Steam&utm_campaign=SteamRSS"">Hollow Knight: Silksong</a>; * <a href=""https://steamdb.info/app/1285190/charts/?utm_source=Steam&utm_medium=Steam&utm_campaign=SteamRSS"">Borderlands 4</a>; * <a href=""https://steamdb.info/app/553850/charts/?utm_source=Steam&utm_medium=Steam&utm_campaign=SteamRSS"">HELLDIVERS™ 2</a>; * <a href=""https://steamdb.info/app/3472040/charts/?utm_source=Steam&utm_medium=Steam&utm_campaign=SteamRSS"">NBA 2K26</a>; * <a href=""https://steamdb.info/app/1675200/charts/?utm_source=Steam&utm_medium=Steam&utm_campaign=SteamRSS"">Steam Deck</a>; * <a href=""https://steamdb.info/app/2694490/charts/?utm_source=Steam&utm_medium=Steam&utm_campaign=SteamRSS"">Path of Exile 2</a>; * <a href=""https://steamdb.info/app/2183900/charts/?utm_source=Steam&utm_medium=Steam&utm_campaign=SteamRSS"">Warhammer 40,000: Space Marine 2</a>; * <a href=""https://steamdb.info/app/1086940/charts/?utm_source=Steam&utm_medium=Steam&utm_campaign=SteamRSS"">Baldur's Gate 3</a>; * <a href=""https://steamdb.info/app/275850/charts/?utm_source=Steam&utm_medium=Steam&utm_campaign=SteamRSS"">No Man's Sky</a>; * <a href=""https://steamdb.info/app/367520/charts/?utm_source=Steam&utm_medium=Steam&utm_campaign=SteamRSS"">Hollow Knight</a>; <i>* excluding free to play games</i> <a href=""https://steamdb.info/topsellers/2025W37/?utm_source=Steam&utm_medium=Steam&utm_campaign=SteamRSS"">View top 100 on SteamDB</a>",1757408400,
1030300,All Hollow Knight Silksong Pale Oil locations,"<strong>Where is Silksong Pale Oil?</strong> Hornet learns of this valuable substance after picking up the Pinmaster's Oil quest from Plinney in Bellhart, and it's well worth going out of your way to find. While this might appear like a regular quest item, it's a crucial upgrade item in the later hours of your playthrough. Pale Oil is one of only two <a href=""https://www.pcgamesn.com/hollow-knight-silksong/needle-upgrade"">Silksong Needle upgrades</a> to boost your weapon damage in the <a href=""https://www.pcgamesn.com/best-metroidvania-games-pc"">Metroidvania game</a>, and finding it early can stand you in good stead when going up against mid-to-late-game <a href=""https://www.pcgamesn.com/hollow-knight-silksong/bosses"">Silksong bosses</a>. Given its value, Pale Oil can only be found in the hardest-to-reach areas on the <a href=""https://www.pcgamesn.com/hollow-knight-silksong/map"">Silksong map</a>, and often lie at the end of a nasty platform challenge gauntlet. Sharpen your Needle and prepare accordingly, as we take you through where to find Pale Oil. <a href=""https://www.pcgamesn.com/hollow-knight-silksong/pale-oil"">Read the rest of the story...</a> RELATED LINKS: <a href=""https://www.pcgamesn.com/hollow-knight-silksong/rosary-farm"">Hollow Knight Silksong Rosary farm locations</a> <a href=""https://www.pcgamesn.com/hollow-knight-silksong/double-jump"">How to unlock the Hollow Knight Silksong Double Jump</a> <a href=""https://www.pcgamesn.com/hollow-knight-silksong/wall-jump"">How to unlock the Wall Jump in Hollow Knight Silksong - Cling Grip location</a> ",1757355425,
1030300,"Hollow Knight Silksong's runbacks are proving divisive, but I've got a fix","There's that inevitable moment in every videogame where a boss kicks the shit out of you. Perhaps it's right at the end when you take on the biggest bad yet or, if it's a soulslike, it's literally every time you take on a new boss - at some point, you're going to get put in your place; that's part of the fun. <strong>Hollow Knight Silksong</strong>, much like its predecessor, doesn't pull its punches, and you're absolutely going to find yourself sitting on one of those wrought iron benches at least once. Problem is, they're too far away from the bosses themselves, meaning you have to rerun the gauntlet that got you there in the first place, potentially losing valuable life in the process. <a href=""https://www.pcgamesn.com/hollow-knight-silksong/boss-runbacks-mod"">Read the rest of the story...</a> RELATED LINKS: <a href=""https://www.pcgamesn.com/hollow-knight-silksong/release-date"">Hollow Knight Silksong guides and walkthrough</a> <a href=""https://www.pcgamesn.com/hollow-knight-silksong/flea-locations"">Hollow Knight Silksong flea locations</a> <a href=""https://www.pcgamesn.com/hollow-knight-silksong/crest-best"">Every Hollow Knight Silksong crest and where to find them</a> ",1757334528,
1030300,How to beat the Hollow Knight Silksong Sister Splinter,"<strong>How do you beat the Hollow Knight Silksong Sister Splinter boss?</strong> Staying firmly wedged in the ceiling for almost the entire fight, there's little variety in how you can approach this bothersome battle. You either adapt to the handicap or take a royal beating. If you're struggling to make a dent in her, we have some simple Sister Splinter hints and tips to see you through. As one of main <a href=""https://www.pcgamesn.com/hollow-knight-silksong/bosses"">Silksong bosses</a> you'll have to tussle with sooner or later, cutting down Sister Splinter has a multitude of benefits. Not only do you unlock a vital platforming mechanic in <a href=""https://www.pcgamesn.com/hollow-knight-silksong"">Hollow Knight Silksong</a>, but it also puts you one step closer on your quest to <a href=""https://www.pcgamesn.com/hollow-knight-silksong/bellhart"">save Bellhart</a>. Our <a href=""https://www.pcgamesn.com/hollow-knight-silksong/map"">Silksong map</a> can help you find your bearings on the way to her chamber. <a href=""https://www.pcgamesn.com/hollow-knight-silksong/sister-splinter"">Read the rest of the story...</a> RELATED LINKS: <a href=""https://www.pcgamesn.com/hollow-knight-silksong/twisted-bud"">Hollow Knight Silksong Twisted Bud location and how to use</a> <a href=""https://www.pcgamesn.com/hollow-knight-silksong/flea-locations"">All Hollow Knight Silksong flea locations</a> <a href=""https://www.pcgamesn.com/hollow-knight-silksong/needle-upgrade"">How to get the Hollow Knight Silksong Needle upgrade</a> ",1757959837,
1030300,How to beat the Hollow Knight Silksong Last Judge,"<strong>How do you beat the Hollow Knight Silksong Last Judge?</strong> If you're struggling to take on the Citadel's thurible-flinging boss, we can help. Like most of the major boss fights in Pharloom, beating Last Judge requires you to keep a level head - get intimidated by her fancy footwork and you're sure to get squashed. Last Judge is one of the main <a href=""https://www.pcgamesn.com/hollow-knight-silksong/bosses"">Silksong bosses</a> you need to beat to progress through the <a href=""https://www.pcgamesn.com/best-metroidvania-games-pc"">Metroidvania game</a>'s story, so there's no way to avoid it. She's the next stop after you <a href=""https://www.pcgamesn.com/hollow-knight-silksong/bellhart"">save Bellhart</a>, so check out our <a href=""https://www.pcgamesn.com/hollow-knight-silksong/map"">Silksong map</a> to get your bearings. Don't forget to pick up the <a href=""https://www.pcgamesn.com/hollow-knight-silksong/needle-upgrade"">Silksong Needle upgrade</a> before you set off to beat this ruthless boss. <a href=""https://www.pcgamesn.com/hollow-knight-silksong/last-judge"">Read the rest of the story...</a> RELATED LINKS: <a href=""https://www.pcgamesn.com/hollow-knight-silksong/rosary-farm"">Hollow Knight Silksong Rosary farm locations</a> <a href=""https://www.pcgamesn.com/hollow-knight-silksong/double-jump"">How to unlock the Hollow Knight Silksong Double Jump</a> <a href=""https://www.pcgamesn.com/hollow-knight-silksong/wall-jump"">How to unlock the Wall Jump in Hollow Knight Silksong - Cling Grip location</a> ",1757699830,
1030300,How to unlock the Wall Jump in Hollow Knight Silksong - Cling Grip location,"<strong>How do you unlock the Wall Jump in Hollow Knight Silksong?</strong> Hidden in one of the many deep tunnels that comprise the haunted kingdom of Pharloom is a handy ability that lets you use any sheer wall as a jumping platform. It's an essential technique you'll need to unlock to access later zones and hidden areas, and one that requires traversing a particularly perilous gauntlet. While a sequel to Hollow Knight - widely considered to be one of the <a class=""text_link"" href=""https://www.pcgamesn.com/best-pc-games"">best PC games</a> ever - <a class=""text_link"" href=""https://www.pcgamesn.com/hollow-knight-silksong"" target=""_blank"" rel=""nofollow noopener"">Hollow Knight Silksong</a> features a new character, Hornet, who is missing many of the abilities you came to rely on in the first game. Finding them all can be made a little easier by using our <a class=""text_link"" href=""https://www.pcgamesn.com/hollow-knight-silksong/map"">Silksong map</a>, but you'll need to beat some properly tough <a class=""text_link"" href=""https://www.pcgamesn.com/hollow-knight-silksong/bosses"">Silksong bosses</a> before you start upping your arsenal. <a href=""https://www.pcgamesn.com/hollow-knight-silksong/wall-jump"">Read the rest of the story...</a> RELATED LINKS: <a href=""https://www.pcgamesn.com/hollow-knight-silksong/rosary-farm"">Hollow Knight Silksong Rosary farm locations</a> <a href=""https://www.pcgamesn.com/hollow-knight-silksong/double-jump"">How to unlock the Hollow Knight Silksong Double Jump</a> <a href=""https://www.pcgamesn.com/hollow-knight-silksong/simple-key"">All Hollow Knight Silksong Simple Key locations</a> ",1757253824,
1030300,All Hollow Knight Silksong crest locations and best crest,"<strong>Where are all the Hollow Knight Silksong crests?</strong> Looted from their corresponding temples found throughout Pharloom, Silksong crests offer a way to switch up Hornet's combat style to your liking. Though you can't mix and match each attack to make your own build from scratch, upgrade paths and tool slots can offer a way to tailor your Silksong experience or exploit an opening in the attack pattern of an especially tricky boss. We're pushing through the land of Pharloom to list every hidden <a href=""https://www.pcgamesn.com/hollow-knight-silksong"">Hollow Knight Silksong</a> crest. Paired with our <a href=""https://www.pcgamesn.com/hollow-knight-silksong/map"">Silksong map</a>, you might be able to unlock your preferred playstyle earlier than you think. Note that reaching some of these perks will require passing certain points in the game, so you may want to check out our guides on how to beat the <a href=""https://www.pcgamesn.com/hollow-knight-silksong/widow"">Silksong Widow</a> boss or how to unlock the <a href=""https://www.pcgamesn.com/hollow-knight-silksong/dash-sprint"">Silksong Dash</a>, too. <a href=""https://www.pcgamesn.com/hollow-knight-silksong/crest-best"">Read the rest of the story...</a> RELATED LINKS: <a href=""https://www.pcgamesn.com/hollow-knight-silksong/trobbio"">How to beat Trobbio in Hollow Knight Silksong</a> <a href=""https://www.pcgamesn.com/hollow-knight-silksong/mods-best"">Best Hollow Knight Silksong mods</a> <a href=""https://www.pcgamesn.com/hollow-knight-silksong/tools"">Best Silksong Tools and all locations</a> ",1758126846,
1030300,Hollow Knight: Silksong (Nintendo Switch 2) Review,"I can’t help but feel like writing a review for <em>Hollow Knight: Silksong</em> is somewhat perfunctory. I mean, this is a game that’s been waited on with such bated breath that it <a href=""https://www.cgmagonline.com/articles/editorals/hollow-knight-silksong-hype/"">crashed almost every storefront</a> it was on the moment it launched. Do you really need me to tell you how good it is? Chances are you already bought it and know how good it is. But if you’re still on the fence or perhaps didn’t play the first <em>Hollow Knight</em>, it is my sword duty as a critic to guide you towards understanding why <em>Hollow Knight: Silksong</em> is as much a masterpiece as its predecessor. The first Hollow Knight was a masterclass in Metroid-like design—and one of the few games I would designate as a “Metroidvania.” It combined intense combat with a dark and brooding world, perfectly paced with incremental upgrades that rewarded exploration and steadily opened new areas to players. <em>Hollow Knight: Silksong</em> finds a way to capture the essence of its predecessor while giving players a game that... <a href=""https://www.cgmagonline.com/review/game/hollow-knight-silksong-switch-2/"">Read more</a> ",1757228400,
1030300,All Hollow Knight Silksong Mask Shard locations,"<strong>Where is every Silksong Mask Shard? </strong>Just like in Hollow Knight, these hidden collectibles are used to upgrade health. While they aren't essential to complete your playthrough, locating them can keep you alive when going up against tough enemies and delving into late-game areas. There are 20 Mask Shards in <a href=""https://www.pcgamesn.com/hollow-knight-silksong"">Hollow Knight Silksong</a>. You need four to unlock a new health node, which means there's five health upgrades up for grabs. Most are hidden in secret areas of the <a href=""https://www.pcgamesn.com/hollow-knight-silksong/map"">Silksong map</a>, and are only accessible once you unlock specific abilities. Here's every Mask Shard location and how to get them. <a href=""https://www.pcgamesn.com/hollow-knight-silksong/mask-shards"">Read the rest of the story...</a> RELATED LINKS: <a href=""https://www.pcgamesn.com/hollow-knight-silksong/trobbio"">How to beat Trobbio in Hollow Knight Silksong</a> <a href=""https://www.pcgamesn.com/hollow-knight-silksong/mods-best"">Best Hollow Knight Silksong mods</a> <a href=""https://www.pcgamesn.com/hollow-knight-silksong/crest-best"">All Hollow Knight Silksong crest locations and best crest</a> ",1757201391,
1030300,How to unlock the Hollow Knight Silksong Double Jump,"<strong>How do you unlock the Silksong Double Jump?</strong> The Faydown Cloak is tucked away in a secret corner of Pharloom, and it's surprisingly difficult to get. Not only do you have to overcome a difficult platform challenge, but you also need several other traversal abilities to reach it. The Silksong Double Jump makes Silksong's <a href=""https://www.pcgamesn.com/best-platform-games"">platform game</a> challenges so much easier, and it doubles as evasive tool against hyper-aggressive <a href=""https://www.pcgamesn.com/hollow-knight-silksong/bosses"">Silksong bosses</a>. However, you first need to reach the <a href=""https://www.pcgamesn.com/hollow-knight-silksong/mount-fay"">Silksong Mount Fay</a> location, and strap in for an arduous climb. Thankfully, we can direct you exactly where to get the Faydown Cloak. <a href=""https://www.pcgamesn.com/hollow-knight-silksong/double-jump"">Read the rest of the story...</a> RELATED LINKS: <a href=""https://www.pcgamesn.com/hollow-knight-silksong/map"">Hollow Knight Silksong map, area order, and Shakra locations</a> <a href=""https://www.pcgamesn.com/hollow-knight-silksong/rosary-farm"">Hollow Knight Silksong Rosary farm locations</a> <a href=""https://www.pcgamesn.com/hollow-knight-silksong/wall-jump"">How to unlock the Wall Jump in Hollow Knight Silksong - Cling Grip location</a> ",1757193542,
1030300,How to save Bellhart in Hollow Knight Silksong,"<strong>How do you save Bellhart in Silksong?</strong> This haunted town is a real spookfest, with all of its occupants suspended in the air by silken threads. You can't interact with anyone in Haunted Bellhart, nor can you enter any of their dwellings - yet. If you're desperate to save Bellhart from its curse, we've got all the answers. You can expect to reach Haunted Bellhart right after you beat the <a href=""https://www.pcgamesn.com/hollow-knight-silksong/moorwing"">Silksong Moorwing</a>, or alternatively, after you ride the Flea Caravan to Greymoor. The objective to save Bellhart in <a href=""https://www.pcgamesn.com/hollow-knight-silksong"">Hollow Knight Silksong</a>, The Threadspun Town, is automatically added to your log the moment you arrive. It's also mandatory to complete it before you can ring the giant bell in this area. <a href=""https://www.pcgamesn.com/hollow-knight-silksong/bellhart"">Read the rest of the story...</a> RELATED LINKS: <a href=""https://www.pcgamesn.com/hollow-knight-silksong/rosary-farm"">Hollow Knight Silksong Rosary farm locations</a> <a href=""https://www.pcgamesn.com/hollow-knight-silksong/double-jump"">How to unlock the Hollow Knight Silksong Double Jump</a> <a href=""https://www.pcgamesn.com/hollow-knight-silksong/wall-jump"">How to unlock the Wall Jump in Hollow Knight Silksong - Cling Grip location</a> ",1757183558,
