appid,title,contents,date,tags
1030300,"Silksong's latest public update fixes its worst boss, but not as much as you're likely hoping","<a href=""https://www.rockpapershotgun.com/games/hollow-knight-silksong"">Hollow Knight: Silksong</a>'s hitherto <a href=""https://www.rockpapershotgun.com/hollow-knight-silksongs-second-patch-is-live-in-steam-beta-includes-fix-for-bug-caused-by-dying-to-bosses-while-killing-them"">beta-only update 1.0.28650</a> is now a fully public release that any dang fool can download without switching to a Steam playtest branch. I'm still noodling my way through the lower levels of Team Cherry's new metroidvania, blissfully unbothered by any pressure to <a href=""https://www.rockpapershotgun.com/hollow-knight-silksong-review"">review it</a> or write <a href=""https://www.rockpapershotgun.com/hollow-knight-silksong-walkthrough"">Silksong walkthroughs</a>. As such, I asked our reviewer James to have a look at the patch notes and pluck out any important changes, based on his many, many hours in Pharloom. A shadow glided over James's face, then returned and took up residence in one earhole. Wordlessly he outstretched a gnarled finger towards item 3 on the list: ""Fixed Savage Beastfly in Far Fields sometimes remaining below the lava."" <a href=""https://www.rockpapershotgun.com/silksongs-latest-public-update-fixes-its-worst-boss-but-not-as-much-as-youre-likely-hoping"">Read more</a> ",1758540254,
1030300,Hollow Knight: Silksong patch 2 is now officially live - here's what's changed,"Team Cherry have now officially released the second patch for Hollow Knight: Silksong, read on to find out everything that's changed and fixed. Read the full article here: https://www.gamingonlinux.com/2025/09/hollow-knight-silksong-patch-2-is-now-officially-live-heres-whats-changed/ ",1758537535,
1030300,Patch Version 1.0.28650 Now Live,Patch Notes: - Added Dithering effect option in Advanced video settings. Reduces colour banding but can slightly soften the appearance of foreground assets. Defaults to 'Off'. - Updated Herald's Wish achievement description to clarify that players must both complete the wish and finish the game. - Fixed Savage Beastfly in Far Fields sometimes remaining below the lava. - Fixed rare cases of Shrine Guardian Seth getting out of bounds during battle. - Fixed rare case of Second Sentinel knocking the player out of bounds during battle. - Added catch to prevent Lugoli sometimes flying off screen and not returning during battle. - Further reduced chance of Silk Snippers getting stuck out of bounds in Chapel of the Reaper battle. - Fixed various instances of dying to bosses while killing them causing death sequences to play messily or out of sync. - Fixed Shaman Binding into a bottom transition causing a softlock. - Cocoon positions in some locations updated to prevent it spawning in inaccessible areas. - Fixed Liquid Lacquer courier delivery not being accessible in Steel Soul mode. - Fixed some NPCs not correctly playing cursed hint dialogues in certain instances. - Fixed Pondcatcher Reed not being able to fly away after singing. - Fixed Verdania memory orbs sometimes replaying layered screen-edge burst effects. - Fixed the break counter not working for certain multihitter tools eg Conchcutter. - Fixed Volt Filament damage multiplier not applying for certain Silk Skills. - Fixed Cogflies and Wisps inappropriately targeting Skullwings. - Fixed Cogflies incorrectly resetting their HP to full on scene change. - Fixed Curveclaw always breaking on the first hit after being deflected. - Fixed Plasmium Phial and Flea Brew sometimes not restoring as intended at benches. - Various other smaller tweaks and fixes.,1758500797,['patchnotes']
1030300,How to beat Trobbio in Hollow Knight Silksong,"<strong>How do you beat Trobbio in Silksong?</strong> There's no such thing as being too dramatic when it comes to theatre, and glitterbug Trobbio certainly knows how to put on a killer show. Prepare to meet and defeat one of Silksong's best bosses. Though he's an optional encounter in <a href=""/hollow-knight-silksong"">Hollow Knight Silksong</a>, Trobbio is one of the <a href=""https://www.pcgamesn.com/hollow-knight-silksong/bosses"">Silksong bosses</a> you'll be remiss to not tango with. The Citadel's top performer has a penchant for pyrotechnics, bringing glitz and glam both times you get to fight him. In return for besting Trobbio, you'll get a couple of incredibly useful <a href=""https://www.pcgamesn.com/hollow-knight-silksong/tools"">Silksong tools</a> that can aid Hornet during her journey through Pharloom. Below, we'll tell you where to find Trobbio, as well as our best boss strategies for both encounters. <a href=""https://www.pcgamesn.com/hollow-knight-silksong/trobbio"">Read the rest of the story...</a> RELATED LINKS: <a href=""https://www.pcgamesn.com/hollow-knight-silksong/mods-best"">Best Hollow Knight Silksong mods</a> <a href=""https://www.pcgamesn.com/hollow-knight-silksong/crest-best"">All Hollow Knight Silksong crest locations and best crest</a> <a href=""https://www.pcgamesn.com/hollow-knight-silksong/tools"">Best Silksong Tools and all locations</a> ",1758222061,
1030300,"Yes, Hollow Knight: Silksong has ""some moments of steep difficulty"" Team Cherry admit, but have you considered going for a pre-boss walk","Something <a href=""https://www.rockpapershotgun.com/games/hollow-knight-silksong"">Hollow Knight: Silksong</a>-related has happened <a href=""https://www.rockpapershotgun.com/silksong-may-release-before-september-given-that-itll-be-publicly-playable-by-then"">at an Australian museum again</a>. This time, rather than the game being confirmed for an appearance back when it was still infinitely mysterious and sans release date, it's Team Cherry devs addressing just how difficult their creation is, following plenty of post-release discourse on the subject. This follows the <a href=""https://www.rockpapershotgun.com/best-metroidvania-games"">metroidvania</a>'s <a href=""https://www.rockpapershotgun.com/hollow-knight-silksongs-first-patch-makes-some-early-bosses-slightly-easier-out-now-in-steam-and-gog-beta"">first patch making a couple of its early bosses a bit easier</a> to tackle, amid debate as to whether it's just good and hard, or pushes into unnecessarily annoying slog territory via the likes of bench placement and hazards being able to deal out two masks of damage. As with every FromSoft game since time itself began with the release of <a href=""https://www.rockpapershotgun.com/games/demons-souls"">Demon's Souls</a>, where you stand on that bickering will likely depend on how prepared you are to spend hours battling one foe over and over again. <a href=""https://www.rockpapershotgun.com/yes-hollow-knight-silksong-has-some-moments-of-steep-difficulty-team-cherry-admit-but-have-you-considered-going-for-a-pre-boss-walk"">Read more</a> ",1758211819,
1030300,"How to install Hollow Knight: Silksong mods on Linux, SteamOS and Steam Deck","Hollow Knight: Silksong can be a challenging game and it has an active modding scene - here's how to install Silksong mods on Linux, SteamOS and Steam Deck. Read the full article here: https://www.gamingonlinux.com/guides/view/how-to-install-hollow-knight-silksong-mods-on-linux-steamos-and-steam-deck ",1758197316,
1030300,Hollow Knight Silksong Twisted Bud location and how to use,"<strong>Where is the Silksong Twisted Bud?</strong> This contorted mass of ashen vine might technically be a quest item, but it sure makes one heck of a racket while you're carrying it around. If you've found the Twisted Bud and grown tired of its incessant crying every time you open your inventory, we can walk you through exactly how to use it. The Twisted Bud is required to unlock one of the <a href=""https://www.pcgamesn.com/hollow-knight-silksong/endings"">Silksong endings</a> - we won't spoil it, but if you'd prefer to navigate the <a href=""https://www.pcgamesn.com/best-metroidvania-games-pc"">Metroidvania game</a> completely in the dark, turn back now. Of course, before you can use the Twisted Bud in <a href=""https://www.pcgamesn.com/hollow-knight-silksong"">Hollow Knight Silksong</a>, you might need to find it first. It's tucked into a secret corner of the <a href=""https://www.pcgamesn.com/hollow-knight-silksong/map"">Silksong map</a>, which means if you haven't stumbled upon it accidentally, you might miss it entirely. To speed up your playthrough, here's exactly how to find and use the Silksong Twisted Bud. <a href=""https://www.pcgamesn.com/hollow-knight-silksong/twisted-bud"">Read the rest of the story...</a> RELATED LINKS: <a href=""https://www.pcgamesn.com/hollow-knight-silksong/mods-best"">Best Hollow Knight Silksong mods</a> <a href=""https://www.pcgamesn.com/hollow-knight-silksong/crest-best"">All Hollow Knight Silksong crest locations and best crest</a> <a href=""https://www.pcgamesn.com/hollow-knight-silksong/tools"">Best Silksong Tools and all locations</a> ",1758109848,
1030300,Hollow Knight: Silksong mod lets you immediately load up any boss fight when you want to get some practice in,"A new <a href=""https://www.rockpapershotgun.com/games/hollow-knight-silksong"">Hollow Knight: Silksong</a> mod lets folks load directly into any of the <a href=""https://www.rockpapershotgun.com/best-metroidvania-games"">metroidvania</a>'s boss fights from a dedicated menu, essentially turning the game into a choose your own bottom kicking adventure. After all, who doesn't crave the ability to deliberately battle the one boss they're actually good at beating over and over again, ego juice coursing through their veins, a roar of sheer powerful ecstacy reverberating around their quarters? Or, you know, you might just fancy some practice ahead of your next full run through the game. <a href=""https://www.rockpapershotgun.com/hollow-knight-silksong-mod-lets-you-immediately-load-up-any-boss-fight-when-you-want-to-get-some-practice-in"">Read more</a> ",1758101096,
1030300,"Hell Is Us lead says Silksong's short notice release date was ""a little callous,"" even if he's happy they didn't delay it","I think that no matter when <a href=""https://www.rockpapershotgun.com/games/hollow-knight-silksong"">Hollow Knight: Silksong</a> released, it was going to ruffle some feathers. Not because of any of that difficulty discourse you've probably seen on your timeline since its release, we're done with that, I'm talking about its literal release date, September 4th. You probably saw several games delay themselves out of its window to be in with a fighting chance in this current media hellscape we have. But there was one notable release that stuck with its date, and that's <a href=""https://www.rockpapershotgun.com/games/hell-is-us"">Hell Is Us</a>, which came out, oh dear, September 4th. And the game's creative director, Jonathan Jacques-Belletête, understandably has some feelings about that. <a href=""https://www.rockpapershotgun.com/hell-is-us-lead-says-silksongs-short-notice-release-date-was-a-little-callous-even-if-hes-happy-they-didnt-delay-it"">Read more</a> ",1758042353,
1030300,A second Hollow Knight: Silksong patch is ready for testing - here's the details,"Team Cherry clearly aren't slowing down on making improvements to the smash-hit Hollow Knight: Silksong, with a second patch already available to test. Read the full article here: https://www.gamingonlinux.com/2025/09/a-second-hollow-knight-silksong-patch-is-ready-for-testing-heres-the-details/ ",1758034174,
1030300,"Hollow Knight: Silksong's second patch is live in Steam beta, includes fix for bug caused by ""dying to bosses while killing them""","<a href=""https://www.rockpapershotgun.com/games/hollow-knight-silksong"">Hollow Knight: Silksong</a>'s second patch is here ahead of an impeding full release, with Team Cherry having shared the notes and initiated Steam beta testing. No balancing tweaks <a href=""https://www.rockpapershotgun.com/hollow-knight-silksongs-first-patch-makes-some-early-bosses-slightly-easier-out-now-in-steam-and-gog-beta"">this time around</a>, just a bunch more handy bug fixes that're well worth being aware of. <a href=""https://www.rockpapershotgun.com/hollow-knight-silksongs-second-patch-is-live-in-steam-beta-includes-fix-for-bug-caused-by-dying-to-bosses-while-killing-them"">Read more</a> ",1758031661,
1030300,How to get to Putrified Ducts in Hollow Knight Silksong,"<strong>How do you get to Putrified Ducts in Silksong?</strong> With a name like 'Putrified Ducts,' it's unsurprising you may have initially been reticent to explore it. But now you're here, and that's a good thing for a couple of big reasons. A fairly unassuming region stashed away in the top right corner of the <a href=""https://www.pcgamesn.com/hollow-knight-silksong/map"">Silksong map</a>, Putrified Ducts is, technically, an optional area. However, it hosts some of the <a href=""https://www.pcgamesn.com/hollow-knight-silksong/tools"">best Silksong tools</a> you can get your mitts on, especially if you've yet to take on Bilewater's misery-inducing swampscape. It's one of <a href=""/hollow-knight-silksong"">Hollow Knight Silksong</a>'s most unforgiving locales, but we recommend taking a trip there as soon as you can hack it. Here's how to get to Putrified Ducts in Silksong. <a href=""https://www.pcgamesn.com/hollow-knight-silksong/putrified-ducts"">Read the rest of the story...</a> RELATED LINKS: <a href=""https://www.pcgamesn.com/hollow-knight-silksong/trobbio"">How to beat Trobbio in Hollow Knight Silksong</a> <a href=""https://www.pcgamesn.com/hollow-knight-silksong/mods-best"">Best Hollow Knight Silksong mods</a> <a href=""https://www.pcgamesn.com/hollow-knight-silksong/crest-best"">All Hollow Knight Silksong crest locations and best crest</a> ",1758025367,
1030300,Steam Global Top Sellers for week of 9 Sep — 16 September 2025,"<a href=""https://steamdb.info/topsellers/2025W38/?utm_source=Steam&utm_medium=Steam&utm_campaign=SteamRSS""> </a> * <a href=""https://steamdb.info/app/1285190/charts/?utm_source=Steam&utm_medium=Steam&utm_campaign=SteamRSS"">Borderlands 4</a>; * <a href=""https://steamdb.info/app/1030300/charts/?utm_source=Steam&utm_medium=Steam&utm_campaign=SteamRSS"">Hollow Knight: Silksong</a>; * <a href=""https://steamdb.info/app/1675200/charts/?utm_source=Steam&utm_medium=Steam&utm_campaign=SteamRSS"">Steam Deck</a>; * <a href=""https://steamdb.info/app/553850/charts/?utm_source=Steam&utm_medium=Steam&utm_campaign=SteamRSS"">HELLDIVERS™ 2</a>; * <a href=""https://steamdb.info/app/2694490/charts/?utm_source=Steam&utm_medium=Steam&utm_campaign=SteamRSS"">Path of Exile 2</a>; * <a href=""https://steamdb.info/app/3472040/charts/?utm_source=Steam&utm_medium=Steam&utm_campaign=SteamRSS"">NBA 2K26</a>; * <a href=""https://steamdb.info/app/2444750/charts/?utm_source=Steam&utm_medium=Steam&utm_campaign=SteamRSS"">Shape of Dreams</a>; * <a href=""https://steamdb.info/app/2183900/charts/?utm_source=Steam&utm_medium=Steam&utm_campaign=SteamRSS"">Warhammer 40,000: Space Marine 2</a>; * <a href=""https://steamdb.info/app/2807960/charts/?utm_source=Steam&utm_medium=Steam&utm_campaign=SteamRSS"">Battlefield™ 6</a>; * <a href=""https://steamdb.info/app/3008130/charts/?utm_source=Steam&utm_medium=Steam&utm_campaign=SteamRSS"">Dying Light: The Beast</a>; <i>* excluding free to play games</i> <a href=""https://steamdb.info/topsellers/2025W38/?utm_source=Steam&utm_medium=Steam&utm_campaign=SteamRSS"">View top 100 on SteamDB</a>",1758013200,
1030300,How to unlock the Clawline in Hollow Knight Silksong,"<strong>How do you unlock the Silksong Clawline?</strong> You may have come across hanging rings during your journey across Pharloom, leaving you wondering what they're for. As it transpires, Hornet eventually utilizes them to trek across some of the kingdom's trickier terrains, though only after she learns the Clawline skill. In <a href=""/hollow-knight-silksong"">Hollow Knight Silksong</a>, Clawline grants Hornet the ability to throw her needle out like a harpoon, granting her a better means to close the gap with terrain and enemies alike than the standard dash. It's also a very handy tool for evading attacks from the various <a href=""https://www.pcgamesn.com/hollow-knight-silksong/bosses"">Silksong bosses</a> you'll encounter throughout one of the <a href=""https://www.pcgamesn.com/best-metroidvania-games-pc"">best Metroidvanias</a>. It won't become available until Act 2, so be sure to make a break for it as soon as you can. <a href=""https://www.pcgamesn.com/hollow-knight-silksong/clawline"">Read the rest of the story...</a> RELATED LINKS: <a href=""https://www.pcgamesn.com/hollow-knight-silksong/map"">Hollow Knight Silksong map, area order, and Shakra locations</a> <a href=""https://www.pcgamesn.com/hollow-knight-silksong/fast-travel"">Hollow Knight Silksong fast travel guide</a> <a href=""https://www.pcgamesn.com/hollow-knight-silksong/putrified-ducts"">How to get to Putrified Ducts in Hollow Knight Silksong</a> ",1757949489,
1030300,All Hollow Knight Silksong Silver Bells locations,"<strong>Where are the Silksong Silver Bells?</strong> This quest item is in high demand by the residents of Bellhart, and you need eight of them to complete the quest of the same name. While it may appear a simple task, locating Silver Bells can feel like searching for a needle in a haystack thanks to low spawn rates. You can pick up the Silksong Silver Bells quest from the Bellhart wishwell, which becomes available after you <a href=""https://www.pcgamesn.com/hollow-knight-silksong/save-bellhart"">save Bellhart</a> itself. It's just one of many side quests in <a href=""https://www.pcgamesn.com/hollow-knight-silksong"">Hollow Knight Silksong</a>, and while it is entirely optional, it's worth it - especially if you're running low on rosaries. It involves delving deep into the <a href=""https://www.pcgamesn.com/hollow-knight-silksong/map"">Silksong map</a> around Bellhart, and we can show you exactly where to go. <a href=""https://www.pcgamesn.com/hollow-knight-silksong/silver-bells"">Read the rest of the story...</a> RELATED LINKS: <a href=""https://www.pcgamesn.com/hollow-knight-silksong/rosary-farm"">Hollow Knight Silksong Rosary farm locations</a> <a href=""https://www.pcgamesn.com/hollow-knight-silksong/double-jump"">How to unlock the Hollow Knight Silksong Double Jump</a> <a href=""https://www.pcgamesn.com/hollow-knight-silksong/wall-jump"">How to unlock the Wall Jump in Hollow Knight Silksong - Cling Grip location</a> ",1757697199,
1030300,"First Hollow Knight Silksong update arrives early, and we all needed it","Developer Team Cherry launched <strong>Hollow Knight Silksong</strong> without much fanfare after seven years of development. It didn't need an extensive marketing campaign, because its predecessor has achieved cult status in the <a href=""https://www.pcgamesn.com/best-metroidvania-games-pc"">Metroidvania</a> and <a href=""https://www.pcgamesn.com/the-15-best-indie-games-on-pc"">indie game</a> communities. All it took to break all known gaming storefronts was a YouTube announcement and a two-week notice period to get players on high alert. However, soon after the game released, players have been disheartened with its difficulty. Team Cherry has responded quickly, and a patch fixing some frustrations went live in the early hours of this morning. <a href=""https://www.pcgamesn.com/hollow-knight-silksong/update-arrives-early"">Read the rest of the story...</a> RELATED LINKS: <a href=""https://www.pcgamesn.com/hollow-knight-silksong/endings"">All Hollow Knight Silksong endings and how to unlock them</a> <a href=""https://www.pcgamesn.com/hollow-knight-silksong/dice-game"">Silksong dice game guide - how to win and rewards</a> <a href=""https://www.pcgamesn.com/hollow-knight-silksong/key-of-apostate"">Hollow Knight Silksong Apostate Key location</a> ",1757679183,
1030300,Patch Version 1.0.28497 Now Live,"Patch Notes:- Fixed situation where players could remain cloakless after Slab escape sequence.- Fixed wish Infestation Operation often not being completable during the late game.- Fixed wish Beast in the Bells not being completable when Bell Beast is summoned at the Bilewater Bellway during the late game.- Fixed getting stuck floating after down-bouncing on certain projectiles.- Fixed courier deliveries sometimes being inaccessible in the late game.- Fixed craft bind behaving incorrectly when in memories.- Fixed Lace tool deflect soft-lock at start of battle in Deep Docks.- Fixed Silk Snippers in Chapel of the Reaper sometimes getting stuck out of bounds.- Fixed Claw Mirrors leaving Hornet inverted if taking damage during a specific moment while binding.- Fixed Snitch Pick not giving rosaries and shell shards as intended.- Fixed Swamp Squits becoming invincible if hit under water.- Fixed instance where Lugoli could leave the arena and not return.- Removed float override input (down + jump, after player has Faydown Cloak).- Slight difficulty reduction in early game bosses Moorwing and Sister Splinter.- Reduction in damage from Sandcarvers.- Slight increase in pea pod collider scale.- Slight reduction in mid-game Bellway and Bell Bench prices.- Slight increase in rosary rewards from relics and psalm cylinders.- Increase in rosary rewards for courier deliveries.- Various additional fixes and tweaks.",1757650807,['patchnotes']
1030300,All Hollow Knight Silksong Pollip locations,"<strong>Where are all the Silksong Pollip Heart locations?</strong> These purple flowers aren't difficult to spot, but it's not always clear how to reach them. However, they're well worth tracking down, especially if you want to use all the best tools in combat. There are six Pollip Hearts in <a href=""https://www.pcgamesn.com/hollow-knight-silksong"">Hollow Knight Silksong</a>, and all of them can be found in Shellwood area of the <a href=""https://www.pcgamesn.com/hollow-knight-silksong/map"">Silksong map</a>. They're a rare item for one of the many side quests in the game, and as the name suggests, you need to find and break open Pollips to retrieve them. This quest is ideal to complete before you beat Sister Splinter, since you need to go through Shellwood before you can <a href=""https://www.pcgamesn.com/hollow-knight-silksong/bellhart"">save Bellhart</a> and continue your progress. <a href=""https://www.pcgamesn.com/hollow-knight-silksong/pollip"">Read the rest of the story...</a> RELATED LINKS: <a href=""https://www.pcgamesn.com/hollow-knight-silksong/silver-bells"">Where to find Silksong Silver Bells</a> <a href=""https://www.pcgamesn.com/hollow-knight-silksong/plasmium"">How to get Hollow Knight Silksong Plasmium</a> <a href=""https://www.pcgamesn.com/hollow-knight-silksong/map"">Hollow Knight Silksong map, area order, and Shakra locations</a> ",1757537642,
1030300,This secret item will neutralize Hollow Knight Silksong's most annoying enemy,"There are some areas in videogames that you just know are going to be a bad time. Blighttown doesn't sound particularly inviting. The Path of Pain in Hollow Knight also comes to mind. I prefer this naming convention to hiding a devious platforming test, puzzle box, or insurmountable foe behind a normal-sounding name, like Water Temple, for instance. But as soon as I reached Bilewater in <strong>Hollow Knight Silksong</strong>, I knew I was in for a bad time. Thankfully, players have quickly found a way to make it slightly easier. <a href=""https://www.pcgamesn.com/hollow-knight-silksong/wreath-of-purity"">Read the rest of the story...</a> RELATED LINKS: <a href=""https://www.pcgamesn.com/hollow-knight-silksong/savage-beastfly"">How to beat the Hollow Knight Silksong Savage Beastfly</a> <a href=""https://www.pcgamesn.com/hollow-knight-silksong/fast-travel"">Hollow Knight Silksong fast travel guide</a> <a href=""https://www.pcgamesn.com/hollow-knight-silksong/mount-fay"">How to get to Mount Fay in Hollow Knight Silksong</a> ",1757522833,
1030300,How to get to Mount Fay in Hollow Knight Silksong,"<strong>How do you get to Mount Fay in Silksong?</strong> The high peaks of Pharloom's ice biome are certainly not for the weak. Destructible terrain can quickly impede your progress, and without proper preparation, you might be forced to turn back. However, just getting to this area can be a real trek in itself. Mount Fay is an optional area on the <a href=""http://www.pcgamesn.com/hollow-knight-silksong/map"">Silksong map</a>, but that doesn't mean you should ignore it. This location includes the item that unlocks the <a href=""https://www.pcgamesn.com/hollow-knight-silksong/double-jump"">Silksong Double Jump</a> ability, plus a Silksong Mask Shard, a Lost Fleas, and one of the best Tools. You can even find a secret cameo for <a href=""https://www.pcgamesn.com/hollow-knight-silksong"">Hollow Knight Silksong</a> loreheads. If all that sounds too good to pass up, here's how to get to Mount Fay in Silksong. <a href=""https://www.pcgamesn.com/hollow-knight-silksong/mount-fay"">Read the rest of the story...</a> RELATED LINKS: <a href=""https://www.pcgamesn.com/hollow-knight-silksong/rosary-farm"">Hollow Knight Silksong Rosary farm locations</a> <a href=""https://www.pcgamesn.com/hollow-knight-silksong/double-jump"">How to unlock the Hollow Knight Silksong Double Jump</a> <a href=""https://www.pcgamesn.com/hollow-knight-silksong/wall-jump"">How to unlock the Wall Jump in Hollow Knight Silksong - Cling Grip location</a> ",1757520693,
