appid,title,contents,date,tags
1623730,Palworld Tides of Terraria Revealed as Pocketpair’s First Collaboration,"A major crossover between Pocketpair’s <em>Palworld</em> and <em>Terraria</em> has been announced, called <em>Tides of Terraria</em>, and it brings new pals, mechanics and a Raid Boss. The past year has been a series of ups and downs for Pocketpair’s <em>Palworld</em>, from <a href=""https://www.cgmagonline.com/news/palworld-lawsuit-nintendo-pokemon-patents/"" data-type=""link"" data-id=""https://www.cgmagonline.com/news/palworld-lawsuit-nintendo-pokemon-patents/"">Nintendo issuing a lawsuit</a> that has resulted in gameplay changes to <em>Palworld</em> since September 2024 (since the lawsuit, Pal Spheres have been removed and gliding creatures have been ‘fixed’), to KRAFTON helping Pocketpair drop the title on mobile, and the big <a href=""https://www.cgmagonline.com/news/palworld-feybreak-a-success-already/"" data-type=""link"" data-id=""https://www.cgmagonline.com/news/palworld-feybreak-a-success-already/""><em>Feybreak</em> expansion</a> that fans flocked back to Palpagos Island in droves for. Pocketpair <a href=""https://www.youtube.com/watch?v=sFVJVWVDIMg"" data-type=""link"" data-id=""https://www.youtube.com/watch?v=sFVJVWVDIMg"" target=""_blank"" rel=""noopener"">has revealed a new trailer</a> today showcasing its first major collaboration event, <em>Tides of Terraria</em>. The animated trailer can be seen below. While the trailer is very brief, the <em>Tides of Terraria</em> trailer embodies the spirit of both indie titles, although the crossover event is only happening on the <em>Palworld</em> side of things. There has been no announcement on whether <em>Terraria</em>... <a href=""https://www.cgmagonline.com/news/palworld-tides-of-terraria/"">Read more</a> ",1750403687,
1623730,"Palworld: Tides of Terraria will be released on Wednesday, June 25, 2025!","･Latest Video: Palworld: Tides of Terraria Animated TrailerIn the collaboration animated trailer, Palworld characters explore a dungeon and obtain the Terraria weapon, the Terra Blade. Also appearing are the Eye of Cthulhu and a silhouette that appears to be the final boss, the Moon Lord. The footage suggests that deadly enemies await at the end of this exciting adventure in the world of Terraria.･About the Palworld “Tides of Terraria” update:""Palworld: Tides of Terraria"" is a major update that introduces a collaboration with the adventure game ""Terraria"", which has sold over 60 million copies worldwide.The world of Terraria collides with Palworld!Capture, train, fight, and work monsters from Terraria just like Pals...?A large update that can be enjoyed by fans of Palworld and Terraria!In addition to the collaboration content, further new content will be added, including new Pals and new islands.The contents of the update will be announced across official Palworld social media channels over the next few weeks, so please follow!",1750381244,
1623730,Nintendo's lawsuit isn't slowing Palworld down as it prepares for a summer collab with Terraria,"little legal jousting with Nintendo hasn't stopped Palworld from making new stuff. This summer, the survival game with totally-not-Pokémon will have a collab with eternally popular indie crafting game <a href=""https://www.pcgamer.com/terraria/"">Terraria</a> in its Tides of Terraria update... <a href=""https://www.pcgamer.com/games/survival-crafting/nintendos-lawsuit-isnt-slowing-palworld-down-as-it-prepares-for-a-summer-collab-with-terraria/?utm_source=steam&utm_medium=referral"" target=""_blank"">Read more.</a>",1747161834,
1623730,The Palworld Terraria crossover is already much bigger than a typical update,"The <strong>Palworld </strong>Terraria crossover is almost here. Bringing together two of the biggest survival games of all time, we'll soon be catching all-new mobs and creatures in Pocketpair's smash hit. That's not all, however, as a new update from the team finally showcases the event itself, revealing that it'll have new Pals, islands, and more. If all of this has piqued your interest, but you haven't gotten around to adding Pocketpair's creature catcher to your Steam library just yet, then I have good news: you can grab it at 25% off right now. <a href=""https://www.pcgamesn.com/palworld/terraria-crossover-update"">Read the rest of the story...</a> RELATED LINKS: <a href=""https://www.pcgamesn.com/palworld/nintendo-lawsuit-gameplay-changes"">Palworld is changing several key gameplay systems amid Pokemon Company lawsuit</a> <a href=""https://www.pcgamesn.com/palworld/mods"">Best Palworld mods and how to install</a> <a href=""https://www.pcgamesn.com/palworld/system-requirements"">Palworld system requirements</a> ",1747139350,
1623730,"Palworld v0.6: ""Tides of Terraria"" coming this summer! Worlds will collide!","Hello everyone! {STEAM_CLAN_IMAGE}/40671762/bbda331bf3731b90e96308dec011cc5b13619de6.png ･About the Palworld “Tides of Terraria” update: ""Palworld: Tides of Terraria"" is a major update that introduces a collaboration with the adventure game ""Terraria"", which has sold over 60 million copies worldwide. The world of Terraria collides with Palworld! Catch, train, fight, and work monsters from Terraria just like Pals...? A large update that can be enjoyed by fans of Palworld and Terraria! In addition to the collaboration content, further new content will be added, including new Pals and new islands. The contents of the update will be announced across official Palworld social media channels over the next few weeks, so please follow! {STEAM_CLAN_IMAGE}/40671762/e480b90f2bc8fa199892bb15a80d09f768b48b9b.png {STEAM_CLAN_IMAGE}/40671762/b7f890bec27deb3a43ae99080a2e7039a00392cd.png {STEAM_CLAN_IMAGE}/40671762/c2a4f51505ef03c7c313691268042e06cb6bc0a2.png Thank you for your continued support of Palworld. Palworld Development Team",1747098983,
1623730,"Palworld devs 'disappointed' as they patch out a game mechanic to appease Nintendo, but 'the alternative would have led to an even greater deterioration'","Today, Palworld received a new patch. Update v0.5.5 doesn't add any new features, Pals, or environments. It doesn't fix any bugs or offer any optimization improvements. Instead, the accompanying <a href=""https://store.steampowered.com/news/app/1623730/view/518587145533785018?l=english"" target=""_blank"">Steam news post</a> from developer Pocketpair only includes one patch note:.. <a href=""https://www.pcgamer.com/games/survival-crafting/palworld-devs-disappointed-as-they-patch-out-a-game-mechanic-to-appease-nintendo-but-the-alternative-would-have-led-to-an-even-greater-deterioration/?utm_source=steam&utm_medium=referral"" target=""_blank"">Read more.</a>",1746724366,
1623730,"Palworld's newest patch stops you from gliding with your Pals, and yes, it is because of Nintendo's lawsuit","We all know that <a href=""https://www.rockpapershotgun.com/games/palworld"">Palworld</a> developer <a href=""https://www.rockpapershotgun.com/companies/pocketpair"">Pocketpair</a> are currently dealing with a lawsuit from Mario maker <a href=""https://www.rockpapershotgun.com/companies/nintendo"">Nintendo</a>. Specifically, it's over <a href=""https://www.rockpapershotgun.com/nintendo-and-the-pokemon-company-are-suing-the-palworld-developers-for-infringement-of-patent-rights"">patent rights</a>, rather than something like copyright infringement which everyone was expecting given the liberties that Palword takes with its Pal designs. In November it was confirmed <a href=""https://www.rockpapershotgun.com/here-are-the-patents-nintendo-and-the-pokemon-company-are-suing-palworld-about-according-to-pocketpair"">what those patents are</a>, partially relating to the fact you could throw out your Pals from a ball and they'd appear, similar to Pokemon Legends Arceus. That feature was patched out from Palworld though, and in a new post Pocketpair has confirmed that this is because of the ongoing lawsuit. <a href=""https://www.rockpapershotgun.com/palworlds-newest-patch-stops-you-from-gliding-with-your-pals-and-yes-it-is-because-of-nintendos-lawsuit"">Read more</a> ",1746719911,
1623730,Palworld is changing several key gameplay systems amid Pokemon Company lawsuit,"<strong>Palworld</strong>, oh, how I've missed you. Blasting onto the scene in January of last year, topping the charts and upsetting parents everywhere, Pocketpair's colossal survival game has been quiet as of late, possibly a result of ongoing legal troubles with Nintendo. Several of Palworld's game mechanics have been compared to the Switch maker's classic creature catcher, Pokemon, with various models also allegedly plagiarized from Nintendo's game. While aspects and mechanics of Palworld have already been removed or adjusted in response to the lawsuit, Pocketpair has now confirmed that more ""disappointing"" changes are on the way. <a href=""https://www.pcgamesn.com/palworld/nintendo-lawsuit-gameplay-changes"">Read the rest of the story...</a> RELATED LINKS: <a href=""https://www.pcgamesn.com/palworld/mods"">Best Palworld mods and how to install</a> <a href=""https://www.pcgamesn.com/palworld/system-requirements"">Palworld system requirements</a> <a href=""https://www.pcgamesn.com/palworld/best-settings-max-fps"">Best Palworld settings for PC</a> ",1746704780,
1623730,Palworld devs confirm game changes due to the Nintendo / Pokemon lawsuit,"As we all suspected, recent changes to Palworld game mechanics were as a direct result of the ongoing lawsuit filed against developer Pocketpair from Nintendo / The Pokemon Company. Read the full article here: https://www.gamingonlinux.com/2025/05/palworld-devs-confirm-game-changes-due-to-the-nintendo-pokemon-lawsuit/ ",1746695579,
1623730,Update v0.5.5: Changes to glider Pals,"Palworld version v0.5.5 has been released! == ▼Mechanics Adjustment ・The mechanics for gliding with a Pal have been changed. → Until now, you could use certain Pals as a glider, however from this patch you will only be able to glide by using a glider. ※ Glider Pals will now provide a new passive partner skill effect while gliding, but the player must have a glider equipped to actually glide. == Thank you for your continued support of Palworld",1746684398,['patchnotes']
1623730,v0.5.4: Fixed minor bugs,Palworld v0.5.4 has been released. ＝＝＝ ▼Bug Fixes ・Fixed minor bugs ＝＝ Thank you for your continued support of Palworld.,1744779610,['patchnotes']
1623730,v0.5.3: Autosave and server bug fixes,Palworld v0.5.3 has been released. ＝＝＝ ▼Bug Fixes ・Implemented a fix for the PS5 autosave bug ・Fixed a bug where dedicated server save data rolled back under certain settings ・Fixed a memory leak on dedicated servers ・Fixed other minor bugs ＝＝ Thank you for your continued support of Palworld.,1744167986,['patchnotes']
1623730,Update v0.5.2: Console autosave and dedicated server bug fixes,"Update v0.5.2 has been released. (Disclaimer: This patch is primarily for console players, but must be applied to all versions of the game) ＝＝＝ ▼Bug Fixes ・Implemented measures to resolve the autosave error on PS5 ・Fixed a bug that caused chat text on dedicated servers to be displayed incorrectly on Xbox ・Fixed a bug that caused achievements on Xbox/PS5 to not work properly ・Fixed other minor bugs ＝＝ Regarding the autosave issue on PS5, it is possible that it has not yet been fully resolved in some situations, but we will continue to monitor and resolve the issue completely. If the bug persists on your system, please submit a bug report with all the necessary information. We sincerely apologize for any inconvenience caused. Thank you for your continued support of Palworld",1743649442,['patchnotes']
1623730,"Palworld decides it wasn't April fooling after all, is actually making a visual novel dating sim where you can, uh, 'dismember and eat' some of its cast","round this time last year, on the day of the April fool, Palworld made a funny little jest towards the gaming public—what if we do an extremely original joke and say we're making a visual novel? <a href=""https://www.pcgamer.com/games/visual-novel/this-years-inevitable-flood-of-april-fools-day-joke-visual-novels-begins-with-palworld/"">He he, ho ho, wouldn't that be a laugh</a>... <a href=""https://www.pcgamer.com/games/survival-crafting/palworld-decides-it-wasnt-april-fooling-after-all-is-actually-making-a-visual-novel-dating-sim-where-you-can-uh-dismember-and-eat-some-of-its-cast/?utm_source=steam&utm_medium=referral"" target=""_blank"">Read more.</a>",1743439318,
1623730,"Palworld's dating sim ""Pal♡world! ~More Than Just Pals~""! Wishlist now!","･Steam store page is now open! Available to wishlist! https://store.steampowered.com/app/3620480/ Ahead of the release, we have made the Steam store page public. Please add it to your wishlist. ･Latest video: ""Pal♡world! ~More Than Just Pals~ | 2nd trailer"" https://youtu.be/ZUpilXM6638 The second trailer introduces five characters: Chillet’s little sister Chillet Ignis, the clumsy Quivern, the school nurse Saya, the energetic Tarantriss, and the bizarre Yandere Splatterina! Look forward to exciting developments as daily life at Palpagos Private Academy becomes even more lively. ･Lovander Body Pillow Giveaway is Now Underway! To celebrate the release of the Steam store page, a Lovander Body Pillow Giveaway Campaign is being held on Palworld Official X. Please check the applicable post for details on how to apply. https://x.com/Palworld_EN/status/1906688298925633793 {STEAM_CLAN_IMAGE}/40671762/75079d8b51bd193f0203cb3f18998182a1980104.png",1743426462,
1623730,Hotfix v0.5.1: Fixed Pals disappearing from the Dimensional Pal Storage,Palworld v0.5.1 has been released. == ・Fixed a bug where repeatedly using Quick Retrieve on the same Pal in the Dimensional Pal Storage could cause the Pal to disappear == Thank you for your continued support of Palworld,1742958352,['patchnotes']
1623730,"From Palworld movies to Palworld TV shows: 'Everyone under the sun pitched us every idea you can imagine,' says Pocketpair's communications director","Palworld blew up big in 2024, becoming only the second game in Steam history to hit more than 2 million concurrent players (along with PUBG and, later that same year, Black Myth: Wukong). That kind of success put a big target on developer Pocketpair, drawing fraudulent claims of AI use and plagiarism, <a href=""https://www.pcgamer.com/games/survival-crafting/it-was-super-popular-to-hate-palworld-after-launch-says-community-manager-a-lot-of-companies-might-crumble-under-the-threats-under-the-pressure/"">heaps of abuse from gamers</a>, and a <a href=""https://www.pcgamer.com/games/survival-crafting/it-was-a-very-depressing-day-palworld-community-manager-reveals-studios-reaction-to-nintendo-lawsuit/"">patent lawsuit from Nintendo</a>... <a href=""https://www.pcgamer.com/games/survival-crafting/from-palworld-movies-to-palworld-tv-shows-everyone-under-the-sun-pitched-us-every-idea-you-can-imagine-says-pocketpairs-communications-director/?utm_source=steam&utm_medium=referral"" target=""_blank"">Read more.</a>",1742937403,
1623730,Palworld Global Popularity Poll Results are in!,"Hello everyone! {STEAM_CLAN_IMAGE}/40671762/78b67af3dffec7157904fc28cca5f1919fa26c54.png ･About the Palworld Global Popularity Poll To celebrate Palworld’s first anniversary, a Global Popularity Poll was held where players from around the world voted for their favorite characters. The poll included over 180 Pals and the seven leaders of the enemy factions. In the Overall Ranking, the top three spots were claimed by human characters: Zoe, Saya, and Lily. Meanwhile, the Favorite Pal Ranking saw Chillet, Jetragon, and Anubis take the top spots. {STEAM_CLAN_IMAGE}/40671762/0eeb47c103a6f065caa5f9d9f2398ee132f11f30.png You can view the full results, including the rankings up to the 194th place and region-specific rankings, on the event’s dedicated website. Check it out here: https://palworld-vote.com/ ･Zoe will become a Recruitable Ally! Following her victory in the Overall Ranking, Zoe will become a recruitable ally in a future update to Palworld! This update is planned for release within the year. Stay tuned for more details! {STEAM_CLAN_IMAGE}/40671762/0350054ec1c281241b327b9bea1a679684703808.png ･Commemorative Skins for Chillet, Jetragon and Anubis are coming soon! To celebrate their top 3 spots in the Favorite Pal Ranking, special commemorative skins for Chillet, Jetragon and Anubis are in the works! They’re set to be released later this year — stay tuned! {STEAM_CLAN_IMAGE}/40671762/511dd184e7f3ea0bd56c493b32076f98d1a24d5a.png Thank you for your continued support of Palworld. Palworld Development Team",1742518959,
1623730,"Palworld's Crossplay Update does far more than let you play with console buddies, adding photo mode, a drafting table and 'dimensional Pal Storage'","Pocketpair's survival megahit<a href=""https://www.pcgamer.com/palworld/""> Palworld</a> received a new update earlier today. Titled the Crossplay Update, its main addition is, unsurprisingly, the ability to farm and shoot the game's Pokémon-like ""Pals"" with players from all other platforms... <a href=""https://www.pcgamer.com/games/survival-crafting/palworlds-crossplay-update-does-far-more-than-let-you-play-with-console-buddies-adding-photo-mode-a-drafting-table-and-dimensional-pal-storage/?utm_source=steam&utm_medium=referral"" target=""_blank"">Read more.</a>",1742400853,
1623730,"Palworld is back bigger than ever, with crossplay and highly requested features","If you and your friends have been waiting for the perfect time to dive back into <strong>Palworld</strong>, this is it. Pocketpair's flagship title finally has crossplay between platforms, making it easier to play the biggest survival game of 2024 with everyone. That's not all, though, because the Palworld update also comes with a slate of new, highly requested features and bug fixes. Palworld's Steam Early Access journey continues, and there's a lot to see if you jump back in now. <a href=""https://www.pcgamesn.com/palworld/update-crossplay"">Read the rest of the story...</a> RELATED LINKS: <a href=""https://www.pcgamesn.com/palworld/crossplay"">Is Palworld crossplay?</a> <a href=""https://www.pcgamesn.com/palworld/mods"">The 30 best Palworld mods and how to install</a> <a href=""https://www.pcgamesn.com/palworld/bosses"">All Palworld bosses in order and how to beat them</a> ",1742380876,
1623730,Palworld cross-play has arrived along with a new cosmetic system and Pal transfers between worlds,"Pocketpair have released the latest update for their smash-hit monster catching game Palworld, bringing cross-play for all platforms along with other features and bug fixes. Read the full article here: https://www.gamingonlinux.com/2025/03/palworld-cross-play-has-arrived-along-with-a-new-cosmetic-system-and-pal-transfers-between-worlds/ ",1742380092,
1623730,"New Palworld update adds crossplay, Photo Mode, new drafting table feature and cosmetic armour","You've <a href=""https://www.rockpapershotgun.com/palworld-breeding-combos"">crossbred Pokénots</a> in <a href=""https://www.rockpapershotgun.com/palworld-best-pals-ranked"">Palworld</a>, now get ready to crossbreed... players! Pocketpair have taken a break from their packed schedule of <a href=""https://www.rockpapershotgun.com/here-are-the-patents-nintendo-and-the-pokemon-company-are-suing-palworld-about-according-to-pocketpair"">saloon brawls with Mario's lawyers</a> to update their monster-catching <a href=""https://www.rockpapershotgun.com/the-best-survival-games-on-pc"">survival</a> game with a new Crossplay mode, together with new storage options, a Photo Mode, a cosmetic armour system, and a new Drafting Table feature. That and a multitude of smaller tweaks and fixes. Witness the crossplaying in the below trailer, in which a base-vandalising Astegon gets its bell rung by a group of visitors presumably running foreign hardware. That'll learn 'em to step on my Lamballs. <a href=""https://www.rockpapershotgun.com/new-palworld-update-adds-crossplay-photo-mode-new-drafting-table-feature-and-cosmetic-armour"">Read more</a> ",1742379153,
1623730,"Make sure you're sitting down: Palworld's crossplay update is now live, also bringing photo mode and the ability to use chairs like they aren't dodgy public toilets","<a href=""https://www.vg247.com/games/palworld"">Palworld</a> now has crossplay, thanks to a fresh update that's just dropped and brought with it a pretty beefy list of other additions and changes - including a photo mode and the ability to sit down in a way that seemingly won't risk your character ending up floating in mid-air. <a href=""https://www.vg247.com/palworld-crossplay-update-live-photo-mode-and-the-ability-to-use-chairs"">Read more</a> ",1742378637,
1623730,"Crossplay Update v0.5.0: Play across all platforms, Global Palbox and more!","Update v0.5.0 has been released. ＝＝＝ ▼New Content ・Crossplay! ⤷ Cross-play is now available across all platforms. ・Global Palbox ⤷ Store Pal data in the Global Palbox and transfer Pals between worlds! ・Dimensional Pal Storage ⤷ A new storage system with 10 times the capacity of a regular Palbox! Guild members can access it, and it can also be used as a personal storage with private settings. ・Cosmetic Armour System! ⤷ You can now equip armour cosmetically in the Antique Dresser. Change your character’s appearance without affecting armour stats! ・Photo Mode ⤷ Accessible from the Pal Command Wheel. Hide the UI and move the camera around to take stunning screenshots. ・Drafting Table ⤷ Combine low-rarity blueprints to create higher-rarity ones! ・Dedicated Servers for Mac ▼Specification Adjustments ・Buildings can now be placed even if they overlap with a Pal ・When connecting foundations or roofs, the connected pieces will now automatically align in the same direction ・Assigning an Ice Pal to the Flea Market will slow down item decay in storage and sales ・Added torches at the entrances of random dungeons for better visibility ・Players can now sit on chairs and cushions ・Some weapons that dealt ultra-high damage to trees will no longer drop items upon destruction ・Added new NPCs and improved NPC behaviour during conversations ▼Balance Adjustments ・Adjusted elemental chest rewards. Dog Coins will always drop from these chests and they also have a small chance of containing work suitability books. (Existing chests in current worlds will retain old drop tables; new ones will follow the updated table.) ・Increased EXP gained from defeating the Attack Chopper ・Increased the DPS of Flamethrowers ・Adjusted the default attack used by Electric and Dark Pals when all active skills are on cooldown, making them more in line with the other elements ・Some human NPCs now have work suitability and work animations when assigned tasks at a base ・Summoned raid bosses can no longer damage other bases ・Added Water attribute to Dumud ・NPC event rewards have been adjusted. To maintain fairness, all NPC conversation logs have been reset, allowing players to claim rewards again! ▼UI ・Favourites have been categorised into Favourite 1, 2, and 3 groups ・Holding the +/- button in the Pal Soul Enhancement UI will now continuously increase/decrease values ・Added a new sorting option for Pal Box: Sort by Work Suitability Level ・Added a ""Extra Large"" text size option ・Added Fullscreen Mode ▼Achievements ・Added several new achievements ▼ Bug Fixes ・Fixed an issue where players could get launched into space while climbing ・Fixed a bug where getting stunned by an enemy while riding a flying Pal over water would send the player flying into the sky ・Fixed an issue where commanding a summoned Pal to attack would also target the Black Marketeer and Medal Merchant ・Fixed a bug where Bounty Tokens with identical passive effects did not stack properly ・Fixed an issue where players would sometimes get launched upward when dismounting Azurmane ・Fixed an issue on dedicated servers where Pals could get stuck on top of feed boxes ・Fixed an issue where raiding NPCs could attack players through walls if they couldn't reach them ・Fixed a bug on dedicated servers where Bounty Token effects were not applied upon login ・Fixed an issue where attacking some NPCs did not add to the player's crime level ・Various many other minor bug fixes === Thank you for your continued support of Palworld",1742353720,
1623730,"""It changed a lot of things for us"" Palworld community manager says that Nintendo lawsuit was a ""shock"" to Pocketpair, because ""no one even considered"" patent infringement","<a href=""https://www.vg247.com/games/palworld"">Palworld</a> developer Pocketpair didn't see the ongoing legal action between it and the combination of Nintendo and The Pokemon Company coming, according to the game's community manager, who says news of the suit came as a ""shock"" because patent infringement was ""something that no one even considered"". <a href=""https://www.vg247.com/palworld-nintendo-lawsuit-shock-to-pocketpair-no-one-considered-patent-infringement"">Read more</a> ",1742291351,
1623730,"It was 'super popular to hate Palworld' after launch, says community manager: 'A lot of companies might crumble under the threats, under the pressure'","<a href=""https://www.pcgamer.com/palworld/"">Palworld</a>, the survival game often referred to as ""Pokémon with guns""—sometimes affectionately, sometimes derisively—drew mixed reactions from critics when it first launched in January 2024... <a href=""https://www.pcgamer.com/games/survival-crafting/it-was-super-popular-to-hate-palworld-after-launch-says-community-manager-a-lot-of-companies-might-crumble-under-the-threats-under-the-pressure/?utm_source=steam&utm_medium=referral"" target=""_blank"">Read more.</a>",1742260789,
