appid,title,contents,date,tags
1623730,"Palworld is going quiet as Pocketpair takes an iron to its 'quirks and jank,' with full release planned for 2026","It's easy to forget amid the enormous success, <a href=""https://www.pcgamer.com/gaming-industry/nintendo-is-filing-for-the-patents-it-s-suing-palworld-with-in-the-us-as-well-though-some-non-final-rejections-could-complicate-matters/"">Nintendo court cases</a>, and that time its dev <a href=""https://www.pcgamer.com/games/survival-crafting/palworld-developer-blown-away-by-the-response-to-its-new-publishing-arm-which-has-received-150-game-pitches-just-one-week-after-opening/"">started a publisher</a>, but Palworld isn't even really <em>out</em> yet. The game's been in early access since its release almost two years ago—1.0 remaining eternally on the horizon... <a href=""https://www.pcgamer.com/games/survival-crafting/palworld-is-going-quiet-as-pocketpair-takes-an-iron-to-its-quirks-and-jank-with-full-release-planned-for-2026/?utm_source=steam&utm_medium=referral"" target=""_blank"">Read more.</a>",1758019380,
1623730,"Palworld will emerge from early access in 2026, with a ""truly massive"" amount of stuff planned for 1.0 update","<a href=""https://www.rockpapershotgun.com/games/palworld"">Palworld</a> is set to finally emerge from early access in 2026, developers Pocketpair have announced. There's a lot of work the game about not-Pokémon, guns, and maunfacturing will need prior to that point, say the studio who've been busy <a href=""https://www.rockpapershotgun.com/here-are-the-patents-nintendo-and-the-pokemon-company-are-suing-palworld-about-according-to-pocketpair"">staring down Lionel Hutzes who probably know the DK rap off by heart.</a> They've also teased that a bunch of new additions are in the works for the 1.0 update. <a href=""https://www.rockpapershotgun.com/palworld-will-emerge-from-early-access-in-2026-with-a-truly-massive-amount-of-stuff-planned-for-10-update"">Read more</a> ",1758018473,
1623730,Palworld 1.0 arrives next year with a huge update and plans to fix all the jank,"Pocketpair have revealed that Palworld 1.0 will arrive next year, with updates being quieter for the rest of the year while they fix all the quirks and jank. Read the full article here: https://www.gamingonlinux.com/2025/09/palworld-1-0-arrives-next-year-with-a-huge-update-and-plans-to-fix-all-the-jank/ ",1758018119,
1623730,Palworld to exit early access and officially release (Ver 1.0) in 2026!,"Official Release set for 2026! Several surprises planned for 2025! For Palworld, which is currently in early access, the official release version, Ver. 1.0, is set to mark a major milestone. We are planning a massive update to mark this occasion. Of course, we have several surprises in store for you this year, so stay tuned for further updates! Message to our Fans Once again, we would like to express our sincere gratitude to all the fans who continue to support Palworld and Pocketpair. Your support encourages us to continue doing our best, and motivates us to make the game even better! We will continue to do our utmost, communicating more openly with you all, to deliver the best gaming experience possible. We hope you will look forward to the things we are working on for Palworld and Pocketpair. ",1757984415,
1623730,"In what was likely a karmic inevitability, Palworld now has its own shameless imitator on the Switch","While Nintendo might've found a way to <a href=""https://www.pcgamer.com/games/survival-crafting/palworld-devs-disappointed-as-they-patch-out-a-game-mechanic-to-appease-nintendo-but-the-alternative-would-have-led-to-an-even-greater-deterioration/"" target=""_blank"">bring Pocketpair to court over patents</a> it arguably shouldn't have been awarded in the first place, it's telling that even its military-grade legal hit squad didn't try to nail Palworld for its Pokemon knockoffery. But while I'll defend Palworld's legal right to pretend <a href=""https://palworld.fandom.com/wiki/Dinossom"" target=""_blank"">Dinossom</a> isn't just <a href=""https://bulbapedia.bulbagarden.net/wiki/Lilligant_(Pok%C3%A9mon)"" target=""_blank"">Lilligant</a>'s flower and <a href=""https://bulbapedia.bulbagarden.net/wiki/Meganium_(Pok%C3%A9mon)"" target=""_blank"">Meganium</a>'s face stapled to a green <a href=""https://bulbapedia.bulbagarden.net/wiki/Goodra_(Pok%C3%A9mon)"" target=""_blank"">Goodra</a> body, that doesn't make it any less grimy... <a href=""https://www.pcgamer.com/games/survival-crafting/in-what-was-likely-a-karmic-inevitability-palworld-now-has-its-own-shameless-imitator-on-the-switch/?utm_source=steam&utm_medium=referral"" target=""_blank"">Read more.</a>",1755120654,
1623730,v0.6.5：Mission Bug Fixes,\Palworld version v0.6.5 has been released!＝＝＝▼Bug Fixes・Fixed an issue where missions would unintentionally pop up when playing as the host in single player or co-op mode. ＝＝Thank you for your continued support of Palworld.,1754968018,['patchnotes']
1623730,Polish Price Adjustment!,"Hello everyone!We have received a lot of feedback from our fans in Poland about the current state of regional pricing. After investigating the issue, we have decided to adjust the price of the game to something more suitable.Old price: 138,99 złNew price: 99,99 złAs always, thank you for your feedback and support. We will continue to work hard to make a game everyone can enjoy!Thank you for your continued support of Palworld.",1754759846,
1623730,Huge new Palworld update makes Terraria inspired raid boss even more powerful,"There's just something about collectables in videogames that scratches an itch for me. Whether it's monsters, mascots, or mates, I can't help but spend hours unearthing hidden characters or unseen achievements. Pocketpair's popular <strong>Palworld</strong> is just one of many games that's effectively captured the buzz of creature collecting, because there really is no better feeling than farming with your Pals. Except for fighting alongside them, of course, and Palworld's latest patch has just made one boss fight even harder. <a href=""https://www.pcgamesn.com/palworld/patch-raid-boss-update"">Read the rest of the story...</a> RELATED LINKS: <a href=""https://www.pcgamesn.com/palworld/mods"">Best Palworld mods and how to install</a> <a href=""https://www.pcgamesn.com/palworld/best-settings-max-fps"">Best Palworld settings for PC and Steam Deck</a> <a href=""https://www.pcgamesn.com/palworld/system-requirements"">Palworld system requirements</a> ",1753894859,
1623730,v0.6.4：Moon Lord [Master] and bug fixes!,"\Palworld version v0.6.4 has been released!＝＝＝▼New Content・Added a more powerful version of Moon Lord! Moon Lord \!⤷ Gather new Celestial Sigil \ to face this terrifying foe!▼Mechanic Adjustments・Summoned Pals no longer deal damage when bumping into neutral, non-hostile Pals.・Sending an overpowered Pal team on an expedition no longer reduces the expedition time, but instead increases the quantity of rewards.・Summoned Pals are returned to the player's party upon player death.・Enemies will no longer respawn when their bases are cleared (Enemy-built bases – Not static camps).・Death markers on the map will now be displayed above base icons.・The amount of fish shadows at a fishing spot will now persist even if the player leaves.・Additional fishing spots have been added around the world.・Adjusted the UI messaging for when the player can't afford to buy Pals from NPCs.・Adjusted the interaction logic for opening and closing cages in enemy bases, which was sometimes unresponsive depending on the camera angle.・Adjusted the building restriction radius around the expedition station.・Items bought from the Flea Market can no longer exceed one stack per purchase.・Fixed the behavior of the Homing Sphere Launcher.▼Balance Adjustments・Fixed an issue where the partner skill ""Trigger Happy"" had unintendedly high power.・Increased the drop rate of legendary blueprints from the chests at the end of the Terraria dungeon.・Adjusted the selling price of the Terraria monsters.・Added Heat Resistance Lv1 / Cold Resistance Lv1 to Hallowed Plate Mail.・Adjusted the breeding results when using Eye of Cthulhu.・Changed the raid boss reward logic so that players can receive rewards even if they didn't deal direct damage to the boss.・Increased the drop quantity of ""Ancient Civilization Parts"" from certain Alpha Pals.・Increased the amount of Overheat Rifle ammo crafted from 5 to 10.・Increased swimming speed for some Pals.・Adjusted the map placement of certain mission NPCs so that they can be accessed by players at more appropriate levels.▼Major Bug Fixes・Fixed an issue where mission progress was lost or would not progress.・Fixed an issue where Pals in dimensional storage would disappear.・Upon dying inside the Terraria Dungeon, the player's items and Pals are now dropped in front of the dungeon entrance.▼Bug Fixes・Fixed an issue in the Moon Lord raid where Pals would continue to attack already-destroyed body parts.・Fixed a bug where defeating Moon Lord would unlock the wrong achievements.・Fixed a bug where using Herbil's partner skill during a tower boss battle could cause the player to get trapped inside.・Fixed a bug where Herbil's partner skill in combination with certain enemy skills could cause the game to soft lock.・Fixed a crash that occurred when switching input methods while using the chat.・Fixed a bug that prevented players from handing over Pals in missions when using a controller.・Fixed a bug that caused missions to duplicate when logging in to dedicated servers.・Fixed inconsistencies in NPC dialogue and mission dialogue.・Fixed a bug where capturing a target during a mission would incorrectly count it as two kills.・Fixed a bug where detailed info for owned Pals was not being displayed in the Pal delivery mission UI.・Fixed a bug where descriptions for some missions were not being displayed correctly in the mission list.・Fixed a bug where some missions continued to be displayed as in progress even after completion.・Fixed a localization bug where some text was appearing in Japanese even when the game was set to another language.・Fixed a bug that was causing sound effects to play over and over after finishing a mission.・Fixed a bug where the cursor would not appear or scroll when opening the mission menu with a controller.・Fixed a bug where some skills used while mounted would unintentionally go through walls.・Fixed a bug where some skills would target players from the same guild.・Fixed a bug where the fishing minigame would start with a smaller capture gauge under certain conditions.・Fixed a bug where the fishing guide would sometimes stop being displayed.・Fixed a bug where players could fish through walls or floors.・Fixed a bug where fishing and salvaging sound effects could be heard from far away in multiplayer.・Fixed a bug with the fishing pond that was not correctly reducing the fishing time with certain work suitability items etc.・Fixed a bug that prevented Jelliette and Jellroy partner skills from activating.・Fixed a bug where items dropped underwater wouldn't float to the surface.・Fixed an exploit where certain NPC visitors to the base could be captured repeatedly for infinite rewards.・Adjusted Frostplume's behavior so that their partner skill doesn't activate in the arena if they aren't the primary opponent.・""Mercy"" will no longer apply inside the arena.・Fixed spawn location discrepancies for certain Pals.・Fixed missing partner skill icons.・Fixed the sorting order for some food items.・Various other minor bug fixes.＝＝＝Thank you for...",1753848235,
1623730,v0.6.2: Dimensional storage and graphics bug fixes,\Palworld version v0.6.2 has been released!＝＝▼Fixes・Fixed an issue where Pals in a Dimensional Pal Storage would disappear under certain conditions.・Optimised the memory usage to reduce the likelihood of crashes when playing for a long time.＝＝Thank you for your continued support of Palworld.,1752116703,['patchnotes']
1623730,Palworld is now Steam Deck Verified and SteamOS Compatible,"With the latest updates to the popular Palworld, Valve have now bumped it up to Steam Deck Verified and SteamOS Compatible. Read the full article here: https://www.gamingonlinux.com/2025/07/palworld-is-now-steam-deck-verified-and-steamos-compatible/ ",1751907591,
1623730,"Palworld's Terraria update lands it back in Steam's Top 10 with over 120,000 players coming back, but its community manager is just waiting for people to brand it a 'dead game' again","<a href=""https://www.pcgamer.com/games/survival-crafting/palworld-just-got-a-huge-terraria-themed-update-which-as-it-turns-out-is-a-lot-less-ridiculous-than-silent-bob-in-warzone/"" target=""_blank"">Palworld's latest Terraria-themed update</a> brought a ton of new equipment, dungeons, enemies, and even a fishing mini-game for players to check out. So it's not that surprising to see <a href=""https://www.pcgamer.com/uk/palworld/"" target=""_blank"">Palword</a> jump back into Steam's Top 10 most-played games... <a href=""https://www.pcgamer.com/games/survival-crafting/palworlds-terraria-update-lands-it-back-in-steams-top-10-with-over-120-000-players-coming-back-but-its-community-manager-is-just-waiting-for-people-to-brand-it-a-dead-game-again/?utm_source=steam&utm_medium=referral"" target=""_blank"">Read more.</a>",1751473039,
1623730,"Palworld guide—Exploring the Terraria update, breeding combos, and crafting","Palworld starts pretty light-hearted, then throws you into its rather twisted survival-crafting deep end with its grim production stations and Pal breeding. And if you want to dominate the end game, you'll need to do more than just breeze on by some of Palworld's unsettling fundamentals... <a href=""https://www.pcgamer.com/games/survival-crafting/palworld-guide/?utm_source=steam&utm_medium=referral"" target=""_blank"">Read more.</a>",1751395936,
1623730,"Where to find the Terraria dungeon in Palworld, plus the new Pals and items you'll find inside","The <a href=""https://www.pcgamer.com/games/survival-crafting/palworld-guide/"">Palworld</a> crossover with Terraria is finally upon us, but to dive into the update's biggest offerings, you'll first need to map out its new islands. It's not a difficult journey, but if you've been away for a while the map may look a bit different, so Palworld's Terraria dungeon location isn't immediately obvious... <a href=""https://www.pcgamer.com/games/survival-crafting/palworld-terraria-dungeon/?utm_source=steam&utm_medium=referral"" target=""_blank"">Read more.</a>",1751388020,
1623730,"Palworld just got a huge Terraria-themed update, which as it turns out is a lot less ridiculous than Silent Bob in Warzone","You might know <a href=""https://www.pcgamer.com/games/survival-crafting/palworld-guide/"">Palworld</a> for its <a href=""https://www.pcgamer.com/palworld-beats-counter-strike-2-dota-2-and-cyberpunk-2077-with-an-all-time-peak-player-count-of-more-than-18-million/"">jaw-dropping player counts</a>, its uncanny <a href=""https://www.pcgamer.com/palworld-accused-of-copying-pokemon-models-developer-pushes-back-says-artists-are-being-slandered/"">resemblance</a> to the world's biggest media franchise, or its <a href=""https://www.pcgamer.com/gaming-industry/nintendo-is-filing-for-the-patents-it-s-suing-palworld-with-in-the-us-as-well-though-some-non-final-rejections-could-complicate-matters/"">legal battle</a> with Nintendo over that last thing I mentioned. Despite all the hubbub, it's just a <a href=""https://www.pcgamer.com/palworld-isnt-good-enoughor-bad-enoughto-warrant-us-losing-our-collective-minds-over-it/"">pretty alright</a> survival crafting game full of cute monster buddies parodying (or ripping off, depending on how cynical you are) Pokémon. They say imitation is the sincerest form of flattery, I suppose, and now it's doing its best Terraria impression—though it's a collaborative effort this time... <a href=""https://www.pcgamer.com/games/survival-crafting/palworld-just-got-a-huge-terraria-themed-update-which-as-it-turns-out-is-a-lot-less-ridiculous-than-silent-bob-in-warzone/?utm_source=steam&utm_medium=referral"" target=""_blank"">Read more.</a>",1751315640,
1623730,v0.6.1：Pal team preset bug fix,\ Palworld version v0.6.1 has been released! == ▼Bug Fixes・Fixed an issue where an error would occur when overwriting the Pal team presets in the Pal Box and then returning to the title screen when there were blank spaces in the player's Pal team.== Thank you for your continued support of Palworld.,1750993623,['patchnotes']
1623730,New Palworld Terraria update arrives with more than just a simple crossover,"If you stepped away from <strong>Palworld</strong>, now's the time to come back. Pocketpair's creature catcher has been going from strength to strength since it launched last year, and today marks a huge leap forward. The <strong>Palworld Terraria update </strong>has arrived, and it marries the two games in a way I'd never quite expected. The patch also introduces a slew of new mechanics to the base game, giving you more places to explore and even more Pals to catch. <a href=""https://www.pcgamesn.com/palworld/terraria-update-out-now"">Read the rest of the story...</a> RELATED LINKS: <a href=""https://www.pcgamesn.com/palworld/map"">Palworld map - all locations, regions, and points of interest</a> <a href=""https://www.pcgamesn.com/palworld/bosses"">All Palworld bosses in order and how to beat them</a> <a href=""https://www.pcgamesn.com/palworld/terraria-crossover-update"">The Palworld Terraria crossover is already much bigger than a typical update</a> ",1750853945,
1623730,"Palworld - Tides of Terraria crossover update is out with fishing, new islands, a new Pal trust mechanic and more",A huge update for Palworld has arrived with the Tides of Terraria crossover. It's a lot more than just adding bits of Terraria though. Read the full article here: https://www.gamingonlinux.com/2025/06/palworld-tides-of-terraria-crossover-update-is-out-with-fishing-new-islands-a-new-pal-trust-mechanic-and-more/ ,1750851087,
1623730,Palworld v0.6.0: Tides of Terraria has been released!,"\ Update v0.6.0 has been released.＝＝＝ ▼Terraria Collab! ・Terraria Dungeon⤷ A unique dungeon featuring enemies from Terraria has been added! Collect materials in the dungeon to create equipment from the world of Terraria! ・Terraria Equipment ⤷ 6 new weapons and 7 new armour pieces from Terraria have been added! ・The terrifying ""Moon Lord"" raid boss has appeared! ⤷ The Moon Lord has invaded Palworld! Work together with your friends and Pals to defeat the greatest threat the islands have faced! ▼New Content・PS5 Dedicated Servers! ・Fishing!⤷ Craft a fishing rod and bait to catch new Pals! To start fishing, cast your rod in water where you can see fish shadows. ・Salvage System!⤷ Ride on water Pals and use the fishing rod to salvage supplies at sea! Collect new ores salvaged from the ocean floor to strengthen your weapons. ・New Islands!⤷ Three new types of islands have been added to the world: Tropical Islands, Iceberg Island, and Shipwreck Island! Find new Pals that live on each of these new islands! ・Mission System! ⤷ You can now find and accept missions around the Palpagos Islands. Help the islanders and get rewards! ・Zoe's Special Mission! ⤷ By completing missions for Zoe, you can earn her trust and recruit her as an ally! ・Pal Trust Mechanic!⤷ The more time you spend with your Pal, the more trust you will gain, and stats will be increased. The weaker a Pal's original stats are, the greater the trust adjustment will be, so even weaker Pals will be able to shine! ・Sleep together with your Pals!⤷ After a hard day of farming and battling bosses, you and your Pals can take a hard-earned rest together! ・Treasure Maps!⤷ Use treasure maps to find the location of the hidden treasure and obtain valuable items! ・Enemy Bases?!⤷ Enemy factions now build bases just like players! They are on high alert and will defend it with their lives, but if you manage to raid them successfully, you can obtain new blueprints for buildings related to that faction. ・Settlement Overhaul!⤷ We've made the settlements larger and feel more lived-in! There are also many mission NPCs now to meet. ・Player level cap raised from 60 to 65! ・New Buildings!⤷ Pal Surgery Table - By using various implants, you can overwrite your Pal’s passives! You can also change the gender of your Pals here!⤷ Fishing Pond - Relax and catch some fish in the comfort of your base.⤷ Hexolite Quartz Mine - Well, you knew we would add this one eventually! ⤷ Large Incubator - Hatch multiple eggs at the same time! ⤷ Palbox Control Device - A terminal that allows you to access your Pal Box from anywhere in the base. It makes Pal swapping during raid battles more efficient. ・ New Building Material - \⤷ Decorate your base with futuristic floors and walls with this new building set! ・New Mechanic - Turbulence ⤷ Find unusual air turbulence around the world and use it to jump high into the sky! ・New Weapons!⤷ Charge Rifle⤷ Energy Shotgun⤷ Overheat Rifle ⤷ Boost Gun⤷ Pal Recovery Grenade(These two are weapons for tamers who want to support their Pal!) ・New Item Types!⤷ Whistles and Growth Acceleration Bell have been added!⤷ New food recipes. ▼Arena・A single-player challenge mode has been added! ⤷ Raise your rank by facing off against the fierce warriors of Palpagos Island! Get various rewards with the battle tickets you receive when you win! ・You can now set rules in the arena, such as banning certain pals.・A public Pal Box has been added at the entrance to the arena that all players can use. ・An arena spectator function has been added in multiplayer! ▼Mechanic Adjustments・Added equipment durability to the game settings.・When a cooling Pal is assigned to the flea market, food spoilage rate is now reduced.・Lyleen’s ability “Bountiful Protection” now recovers HP for all allies within range. ▼Balance Adjustments ・Some aggressive enemies have been made friendly. ・Pal skill cooldowns will tick down even if they are not summoned. ・The speed and stamina of Pals that can be mounted have been adjusted, and the speed of some Pals that were too slow has been improved. ・The lineup of bounty hunters has been expanded. ・With the implementation of the mission system, the rewards obtained from NPCs have been adjusted. To maintain fairness, conversation logs with all NPCs have been reset so that rewards can be received again. ・Pal Condensation is considered end-game content, so the strength of Axel, Marcus, and Victor on normal difficulty has been reduced to reduce its necessity. ・The power of some active skills, such as Pal Blast, has been increased. ・The probability of getting books that enhance Pal's work aptitude from attribute treasure chests has been increased. ▼Pals・New Skins!! The results of the 1st year anniversary popularity poll have been decided, and three new skins have been added to celebrate these results!(※You must own the Pal to equip the skin) ⤷ Crown Chillet⤷ Cyber Jetragon⤷ Desert King Anubis ・Pals can now swim!⤷ Swimming motions and animations have been added for Pals, and thei...",1750820692,
1623730,Six new languages ​​will be added to Palworld: Tides of Terraria!,"･New LanguagesSix new languages ​​will be added to Palworld: Tides of Terraria in a major update scheduled for release on Wednesday, June 25, 2025.･Spanish - Latin America･Indonesian･Vietnamese･Turkish･Polish･Thai ･About the Palworld “Tides of Terraria” update:""Palworld: Tides of Terraria"" is a major update that introduces a collaboration with the adventure game ""Terraria"", which has sold over 60 million copies worldwide.Trailer:The world of Terraria collides with Palworld!Capture, train, fight, and work monsters from Terraria just like Pals...? A large update that can be enjoyed by fans of Palworld and Terraria! In addition to the collaboration content, further new content will be added, including new Pals and new islands.The contents of the update will be announced across official Palworld social media channels over the next few weeks, so please follow! Palworld is currently on sale at 25% off on Steam and the PS Store. Don't miss this chance to get your hands on it!",1750651229,
