appid,title,contents,date,tags
308600,"1.47: Kill Streaks, Customizable Difficulty Mods, & New Win Condition!","https://i.imgur.com/Pxg7auJ.png Kill Streaks This version raises the stakes by adding kill streaks! If you kill 4 players in a row without dying, the server will announce to everyone that you are, as they say.. ""owning"". It sounds much cooler in game. At 6 kills you are wicked sick, 8 kills unstoppable, 10 kills on a m-m-m-monster kill and 12 kills you are GODLIKE! Additionally on each of these stages you will be rewarded with a randomly generated buff, that lasts until you die. Here is the full list of perks you can randomly get when you hit a kill streak milestone: +1000 cash +100 xp ammo & hp restored +20% skill damage +10% gun damage +15% bullet speed -30% recoil -35% shift cooldown -35% chemical cooldown +50% regen rate 200% civ/cop XP vendor discounts extra jump height 20 global map vision bigger car explosions Finally, the amount of cash and XP you earn now increases with your streak as well. All of this makes you really not want to die and raises the stakes in combat. It also affects how you farm, as the previous strategy of ""charge blindly into battle chasing kills"" now pays out less than the new strategy of ""selectively engage in fights you know you can win, and stay alive at all costs. This is very important because of another major change this version... https://i.imgur.com/dAVhHVs.png New Victory Condition The rules for winning have changed. Previously you needed to reach 100 score and then win the following round. There were 2 issues with this. Firstly, it was confusing. Secondly is that if your score was very far behind, you would feel a bit hopeless, like you could never catch up. But that's all fixed now. Now, to win the game all you need to do is this - win round 4. It doesn't matter what your score is. You can mess about in a casual GTA-style way in the first 3 rounds and still have a chance at victory. Everyone now has hope of winning right up until the final showdown, and players in the lead must stay on their toes or else they'll have their victory snatched from them. The core focus of the game therefore has now changed. The point of the first 3 rounds now is to get as FARMED as you can, with as much cash and XP as possible. When you start round 4 you want to be an OP juggernaut with the highest chances of winning possible. And how to get you get farmed fast? Kill streaks. Focusing on quality engagments and putting your skills to the test. https://i.imgur.com/vsMDSsm.jpg Survival Replayability with Difficulty Modifiers Survival Mode has gained a huge amount of replayabilty with the addition of Difficulty Modifers. When you start a survival run you can enable 1 or more modifiers, which will make the game more challenging in various ways. If you manage to win the game with a modifier enabled, you will complete it, like a challenge. And you will also gain bonus score, XP and kill coins. There are 18 modifiers at the moment and they are designed to get you to play in various ways. Some are much harder than others, and give bonus score and XP to compensate. Here are some example: Minefield: Covers the map in hidden Fission Mines that will detonate shortly after you step on them (protip: use a car). Super Swarm: Spawns 3x as many zombies in the zombie phase (protip: get some AoE skills). Spellcaster: Your weapons deal -25% damage, but skills +50% damage (protip: get Plasma Ball). Explosive Retaliation: When you kill an enemy, they will toss a final nade at you (protip: have some shifts saved up to dodge it). https://i.imgur.com/bgJHP3h.png Other Fun Changes This version improves the graphics with bigger car and player explosions. It also improves performance and netcode stability too. Skills and weapons have been rebalanced. The economy of cash and XP is far steadier - providing more interesting decision making opportunities. There's a new skill called Arcane power, which makes your next shot extra powerful immediately after casting a skill. In survival mode, there is a new sandbox stage after the zombie swarm. This stage lets you free-roam the map with no time pressure, fighting cops in true GTA style. There is also a new staging area before the game starts so all co-op players can ready up before starting. Scoring for the leaderboard has also been streamlined, and is now a measure of who can survive with the most difficulty modifers enabled. Read the changelog for the full list! https://i.imgur.com/TynX4FQ.png Free to Play Update We're getting closer to going F2P. It's looking like early December, but I'll make an official announcement once Valve confirms. I'm very excited to see our playerbase grow! Reminder: Anyone who has already bought the game, or buys the game now, will be given the Deluxe Edition DLC, which is the same price as the game at the moment. So whether you buy now or after going F2P doesn't really matter. But if you want to try the F2P multiplayer first that's fine, just wishlist the game now and hop online in December! 45% Discount Geneshift is 45% off. Hooray! https://i....",1664211650,
308600,"1.45: Customizable Skill Builds, Conquest Mode, & New Dynamic Music!","https://i.imgur.com/taMYKpH.jpg Customizeable Skill Builds Have you ever played Magic: The Gathering? Well my favourite part of the game isn't playing the game, but rather designing my deck. And now you can do that with the skills in Geneshift! This version gives you the ability to create and save skill builds. You can now disable skills from appearing in-game, giving you control over the skill draft. This has huge strategic potential as you can choose to only enable skills that synergize well together, and disable the rest. For example, you might choose to only enable long-ranged skills and create a sniper build. Then in-game you won't have close-range skills appear and diluting the skill draft. There are countless skill combinations to explore, and designing a synergistic build might make the difference between victory or defeat. After designing your build you can easily give it a name and save it. You can have multiple custom-made builds saved and conveniently switch between them via a dropdown menu on the skills page. This not only lets you enjoy the theorycrafting of build creation, but it also makes it quick and easy to toggle between playstyles between matches, increasing variety and replayability! https://i.imgur.com/JtkUxOl.png New Dynamic Music The fast-paced gameplay of Geneshift is ultimately designed to give you one thing above all others - a rush of adrenaline. And nothing affects our feels more powerfully than music. Which is why I've started redoing some of the old tunes, cranking up the beat and the intensity. I'm also designing this new music in a special way. The rounds in Geneshift are exactly 5 minutes long, with supply drops appearing at the 4:00, 2:00 and 0:00 marks. So I have designed the music to sync up perfectly with these key action moments, and crank the intensity just as the supply drops land and the big high-stakes fights break out all across Subvein City. https://i.imgur.com/wCicQBy.png Conquest Mode Conquest mode now works on a ticket system, similar to the Battlefield games. Each team starts with 500 tickets and you win by removing all the enemy team's tickets. There are 2 ways to remove enemy tickets. Kills will reduce their count by 1. But so will holding more control points than the enemy team, which causes their tickets to slowly bleed down as well. This change ensures that each Conquest match lasts a reasonable duration, and doesn't drag on for hours like the old mode allowed. https://i.imgur.com/1peN4RJ.jpg Extremely Easy Revivals - Until Overtime The role of zombie revivals has been rethought and it is now easier than ever to revive. As a zombie you simply need to get just 1 kill vs a survivor to come back to life. Not only that, but there are now THREE heart crates that land when the round timer hits 0:00, tripling your chances of coming back. Due to these changes it is extremely easy to revive during the first 5 minutes of each round. This lets you roam the map freely, take risks, fight cops and generally enjoying the sandboxy GTA vibes without fear of dying. Geneshift is moving in the GTA direction and that means the rules need to support chaos and action and the occassional death. This is now possible with easy revivals. But Geneshift is still a BR right? Yes! For starters, there is a new $5000 reward for players who survive the full round and make it to overtime without dying. Secondly, once overtime begins it becomes very difficult to revive. So the true BR survival experience begins during overtime. At this point you don't want to die, because you won't be able to revive, and the best way to get score is still to place as high as possible in the round. https://i.imgur.com/nECEBTj.png Free to Play Later This Year! In other news, Geneshift will go Free to Play some time later this year! This will do wonders for our playerbase, and make it easier than ever to play with friends. The multiplayer will go F2P, and the Supporter's Edition DLC will continue to exist for those who want to support development. Anyone who has ever spent money on the game (and therefore owns the Supporter's Edition) will continue to keep the DLC. Anyone who buys the game before we go F2P will also get the DLC (as it is included in the base package) for the same price as it'll be after going F2P. It will take a few months to prepare for the launch. I need to make new trailers, completely redo the Steam page, and even slightly change the name of the game! Geneshift has changed a lot over the years! It doesn't look or play anything like it did when it first hit Early Access in 2017, and so it needs a new look to reflect that before it's made available to the F2P audience on Steam. Anyway, exciting times ahead! I'll make an announcement with details closer to the date. Stay tuned and have fun! Big Old Changelist - Added the ability to save and load skill builds, allowing players to theorycraft fun skill combos and instantly apply them between rounds. - This saves the skill choices at levels 2,...",1659970815,
308600,"1.44: Helicopters, Betting and a Brand New Skill Tree!","https://i.imgur.com/1JeFrYC.gif Kill Coins Reworked This version completely reworks the skill tree and the progression system. Kill coins are the main way to unlock content in the game, but they are now only used to unlock skills. This means that all other content that was previously unlocked via coins is now free. All players now have access to every weapon, chemical, and vehicle in the game. Important: Because of this drastic change, I have refunded everyone's kill coins. This way no one will have wasted their coins unlocking weapons which are now given for free. With all your coins refunded, you can start unlocking some of the new skills in the new skill tree! https://i.imgur.com/hgtZFpL.png A New Skill Tree The skills have been rearranged into a groovy new skill tree. This tree not only looks cooler than the old hex grid, but is far more flexible. If you see someone use a certain skill in-game, you are only a few steps away from unlocking it. This is far nicer than the old system, where you simply had to grind through the hex grid until you reached a certain skill. Players now get to decide what skill to get next, and whether they should focus more on damage, healing, or utility. A well diversified selection of skills gives you more versatility in the battle field! Customizable Skill Builds Wanna play with your favorite skill? Well now you can! Up the top of the skills page is a new Skill Builds feature. This lets players force skills appear at specific moments in the skill draft. For example, you can guarantee that the Self Repair skill will show up when you hit level 9 in-game. If you own the Supporter's Edition DLC you can configure a skill to show up at level 3 and level 6 as well. https://i.imgur.com/CNAhiCx.gif Skill Medallions & Progression You may notice in the screenshot above some little badges on the skills. These are skill medallions. They are purely cosmetic, but you can rank them up by completing skill specific challenges. For example, you need to get 5 Plasma Ball kills to rank Plasma up to level 2. When you do your main account will gain experience, and your badge will improve in appearance. These badges go all the way up to level 20 and are visible for other players to see at the end of each match. A great way to show off your skills. 6 Brand New Skills - ILLICIT INCOME: Increases the cash and health you gain from killing enemies. This increases further based on your wanted level. By default, player kills give +50 health. - MANIC MECHANIC: Allows you to shoot out the window of your car while driving (with worse accuracy). Also continuously restores the health of the vehicle and all passengers inside it. - CHEMICAL BOOST: Makes you jump higher when standing in your chemicals. Also makes your chemicals restore charges faster. - CLUSTER BOMB: Spawns grenades that spin around you. These grenades will be randomly tossed at nearby enemies over time. If you have Skill Shot charges you will throw 1 extra grenade per charge, and then lose a charge. - SOUL DROP: Whenever you fall onto the ground near an enemy you will reduce their rate of fire. Enemies killed in this state will drop an extra heart piece on death. - TOXIC BLOOD: Whenever you kill an enemy they will leave a pool of toxic blood on the ground. Any enemies who step in this will become poisoned and take damage over time. https://i.imgur.com/JqTiUcU.jpg Free Level-Based Cosmetics Cosmetics used to be unlocked with kill coins. Now they are given to players for free, but based on your player level. Every 5 levels a new cosmetic will be unlocked. This finally gives your account level a purpose. It actually does something now. It makes you look pretty. There are also new cosmetics. There are 7 head types to choose from. You can stick with the original Dragonball Z style hair, or go for something a little less extreme. Eventually you'll unlock a police helmet and an assassin's hood. There are other cosmetics too. The Supporter's Medallion now changes in appearance as you level up, glowing gold once you reach level 100. https://i.imgur.com/G6AhKkR.gif Helicopters! Geneshift now has helicopters! Why? Because they're damn cool that's why. They also create a much needed ""point of interest"" in the map. They shoot out free bits of loot every few seconds and slowly travel across the map. This creates a natural hot-zone that players flock to. Free loot and a guaranteed place to get some kills. Zombies are coded to spawn next to these helicopters to further increase the action. Rare Loot Spawners Rare loot crates now fall into these things called Loot Spawners. A loot spawner will sit on the ground and display a 60 second countdown. When the timer hits 0, a rare loot crate will fall into it. Destroy the crate and you'll get +3 score, a heart fragment, and some high value loot. A tier2 weapon, chemical, perk, or phase shift. Half of these loot spawners are hidden on rooftops only accessible via parkour puzzlery. The other half are out in the open, mak...",1651489094,
308600,1.42: Infinite Shifting!,"https://i.imgur.com/Hw7yAWo.gif Infinite Shifting This version focuses on making the core gameplay loop as smooth and fun as possible. The biggest change is to shifts. I always found it frustrating to run out of shifts mid-combat. You want to dodge an incoming bazooka shot only to hear a ""brrrrr"" error noise and die instead. Well no more! Players can now spam shift as much as they like. The game will never deny your movement. This helps you escape, chase, jump and dodge, and really makes the game live up to the name GeneSHIFT. To prevent players from just spamming shift non-stop we each have 3 shift charges. If you have a charge available and shift, you'll deal bonus critical damage. But if you try shift without any charges remaining you will lose health instead. You can still move, but it'll cost you. You'll lose 10hp every time you shift while empty. This creates interesting tactical decisions. It's still a wise move to dodge an incoming bazooka shot, but not something you want to spam in combat. https://i.imgur.com/d48tmEF.jpg Homing Bazooka Missiles Bazookas now firing homing missiles that seek towards you. This is fun because the bazooka is now the weapon of choice for cops. 75% of cops will fire a bazooka at you, and I've tweaked the speed to be juuuust right. Fast enough to pose a threat, but slow enough to dodge if you shift at the perfect moment (and you can always shift now!). https://i.imgur.com/B6jZznf.jpg Survival Reworks Survival mode also got plenty of polish this version. There are now only 2 difficulty levels, Standard and Hardcore, and hardcore mode is hard indeed! A lot of playtesting was done to smooth out the difficulty curve, especially in co-op mode. In hardcore lives are rare, bots are more accurate, and you have to survive a bonus 5th round where zombies will swarm you in increasing intensity right up till the final showdown. At the end of each round a special civilian vendor will appear giving you a choice of 3 bonus perks as well. You'll need to choose wisely to survive the onslaught at the end of the match! https://i.imgur.com/uepAxf2.png Quality of Life Changes & an Improved Tutorial Another big focus was making the game easier for new players. I got my gf to try the game and she was.. confused, to say the least. The tutorial now has far better pacing, by letting new players choose when they're ready to proceed instead of automatically throwing them into the next lesson. The HUD now indicates useful information like the time remaining on your wanted level and the number of shifts you have remaining (shown as triangles on your crosshair). https://i.imgur.com/Ri7QMFi.jpg General Gameplay Polish Players hitboxes are smaller so we can now hide properly behind cover. The skill drafting algorithm is now pseudorandom to ensure you see all skill equally over the last few games. Cops drop more loot, cash, score and XP. Vendors won't automatically shoot you if a stray bullet hits them. Blast Cannon has been reworked into a super shotgun, and can now be charged up over 1s to deal 2x damage. Black Hole now has lifesteal, and can be used to farm health off clusters of civilians. Plenty more balance and bug fixes are mentioned in the changelog below! https://i.imgur.com/hp0GggE.gif Full Changelog --- BIGGEST CHANGES --- - Players can shift even once they run out of charges. Your movement is never denied. However if you shift without charges you will lose 5, then 10, then 15hp per shift. - There are now only 2 difficulty levels across the entire game. Standard and Hardcore. This affects the campaign, survival and in pvp mode. Hardcore mode is now extra hard. --- SURVIVAL CHANGES --- - You progress through wanted levels 50% faster in hardcore mode (applies to both survival and pvp) - You start with only 1 bonus life instead of 4 in hardcore mode, and quarter-hearts drop every 3 instead of every 2 kills. - You no longer get +10 placement score per round in survival - Civ missions now give +5 score instead of +3 score in survival mode - Hardcore survival mode now has 5 rounds, and in the 5th round you will be swarmed by zombies - If you become a zombie in coop survival mode you can no longer collect hearts from kills. The only way to rez is to capture a genetic heart (or wait till next round). - Coop zombies in survival are no longer killed off at 0:00, but they cannot respawn after 0:00 - Zombie humans can now fire guns inside the red zone in survival mode (in coop) - Fixed a bug where the entire server of bots would swarm the heart in survival mode - The amount of cash and xp earned from kills now increases with the number of players in coop survival mode. 200/300/400/500 cash and 20/30/40/50xp - The $1000 assassination bounty is now awarded to all players in coop survival mode, to prevent competing over it - Tweaked the AI to make them spread out far more evenly across the map, instead of clustering in one area - The price of blood bags increases by $1000 everytime you buy one. - Reduced max h...",1644901225,
308600,1.41: Exploration and Parkour Puzzles!,"https://i.imgur.com/nGPKDbn.jpg Exploring for Rare Loot This version taps into that fun feeling of discovery and exploration in GTA. You find a random staircase, climb onto a rooftop and discover a cool item as a reward for your efforts. Geneshift now does this with the addition of rare loot crates. These boxes glow in purple and contain extra valuable items such as superweapons, chemicals, $5000 perks, life fragments, etc. The megamap has been updated with over 50 spawn points where these rare loot crates might spawn. Each location has been designed as a puzzle, which requires some form of parkour to get to. In the screenshot below you can see a rare loot crate has spawned in a new balcony area. This balcony is too high up to access via normal jumping, and requires you to parkour your way up there, as shown with the arrows below. The idea with these puzzles is to provide players a change of pace from the fast-paced combat of Geneshift. They also make exploration more fun, and get you using your brain to solve puzzles in completely different ways. https://i.imgur.com/JnD1xM5.jpg Shifting Now Gives Critical Bullets Everytime you shift there is now a brief window of time where your gun will fire critical bullets. You see an enemy, shift towards him, and then have 0.5s to fire off a few rounds with extra damage. This window of time is small, so you better make sure those critical bullets hit! Critical bullets deal +20% damage, which can be increased to +50% damage via looting ammo kits. Previously, critical bullets played a fairly small role in the game as they were only available as the final bullets in your magazine. But now they're relevant to every single fight as long as you have the quick aim and timing to use them effectively. https://i.imgur.com/qRceklA.jpg +50% damage is a lot! It can easily decide the winner of a fight. A well timed shift might give you the extra damage needed to secure the kill. But you might instead choose to save your shift so you can escape to safety at the last minute. By giving shifts both an offensive and defensive use, shifts are far more interesting to use. To offset this huge buff, shifts now regenerate a lot slower (once every 4 seconds). We're also capped at only max 3 shifts at a time - so use them wisely! It is possible to bring that max up to 5 shifts, but only if you find them in the purple rare crates mentioned above. Basically shifts are now a lot more powerful than before, but a lot rarer too - so use them wisely! https://i.imgur.com/lwC9Ekw.gif New Life Mechanics in Survival A big issue with survival mode was how to cater to players of different skill levels. Generally it was too hard for newbies and far too easy for veterans. This has been solved with a whole new economy around lives. For starters, bots are a lot harder. More accurate, bigger guns, more skills, etc. There is also a minimum number of bots you must ""assassinate"" each round, to force players to take action and not hide on a rooftop somewhere. You're now going to be in a lot of tough fights, and are going to lose lives in the process. This keeps things far more engaging for skillful players. https://i.imgur.com/b6vc5oO.jpg To offset this increased difficulty there are new ways to gain back these lives. You can now buy them for $3000 at vendors, and you can find them in the new purple loot crates. Lives are now your main ""resource"" in the game, and you'll need to explore, farm cops, get sick combo kills to earn enough cash to buy the lives necessary to survive. There are additional incentives for skillful players to play their very best as well. If you manage to survive a round without losing a single life, a free supply drop will land next to you which gives bonus score and goodies. You can also SELL your lives for extra XP if you're feeling risky and don't think you'll die anyway. https://i.imgur.com/rPOtpeQ.jpg Zombie Swarm Survival also has a new zombie swarm stage that happens at the end of each round. After you kill all the players, zombies will respawn and swarm you with their meaty fists. This can be quite challenging, but really rewards skillful usage of area of effect skills and chemicals, because the combo-kill potential is insane. https://i.imgur.com/TkmpfYB.gif Full Changelog --- BIGGEST CHANGES --- - For a brief 0.5s after shifting, your gun will fire critical bullets. This gives shifts a new offensive usage and makes them worth saving up for tough encounters. - Added over 50 secret loot areas to the megamap. These loot areas will occassionally spawn a RARE crate with expensive loot. However, they are often hidden or require you to figure out a jumping puzzle to get them. - If you avoid losing a life within a survival round, a bonus supply drop will land next to you at the end of the round - Survival mode is quite a bit harder, but you can now buy extra lives from vendors for $3000 - In survival mode you now have the ability to SELL lives from vendors for 300xp per heart - Bots no longer...",1640206844,
