appid,title,contents,date,tags
308600,"DRIVEBYS, SKILL TAGS & SCAVENGERS","Hey all, this version adds a new class called Scavenger! Scavenger is all about looting. If you collect 50 bits of loot in a row without dying, you will hit the jackpot and suddenly double all of that farm. Scavenger also gets free loot for damaging enemies, and can heal much faster by standing still. This version also changes how the skill upgrades from vendors work. Skill upgrades no longer affect just one individual skill (eg: +20% Firestorm damage), but instead affect ALL skills that apply (eg: +10% to all damage skills). This is cool because we can make synergies. For example Firestorm, Executioner and Radiate all have the +DAMAGE tag, which means buying that upgrade will buff all 3 of them at once! Other neat changes are the ability to shoot while driving cars and some changes to the economy. Enjoy! bencelot ---- - Class icons are no longer shown during the warmup round. - Removed the skill stats tracking system that displayed skill medals. These didn't really do anything and added too much confusion. These will be reintroduced in a different way in a later version. - Daily challenges now give +5000xp instead of +2000 (or +10,000xp if you have Deluxe DLC). - 2x as much loot falls into the centre during showdowns. - Players who join a game halfway through, in R2 or R3 spawn with a tier 1 gun in addition to their USP. Skills are no longer auto-levelled for players. - When zombies get 4 hearts they will now respawn somewhere nearby, so they can continue their existing fight. - Players now gain +10 instead of +5 max hp per level, but level up slower and fewer random health kits exist in the map. - Skill upgrades purchased from vendors now affect ALL skills, allowing for some cool synergies between skills that share the same tag. - There are 6 tags you can upgrade: Cooldown Speed, Skill Damage, Skill Duration, Skill Size, Skill Speed, Skill Healing. - Check the skill tree to see what tags each skill qualifies for. Most skills are affected by multiple tags. - Vendor upgrades are now more expensive, costing $6000, then $8000, then $10000. - You can now fire guns while driving cars! Doing so gives you +15 degrees of inaccuracy. - Vehicles have less health and provide a bit less protection to compensate. - Improved vehicle netcode. It shouldn't rubberband if your car explodes anymore. - More vehicles spawn in the map and bots drive them more frequently. - When we die, instead of losing 10% of our kill reward, we lose 10% of our unspent cash. - Missions no longer give upgrades, instead they give a fixed +$3000 and +300xp per mission. - Getting 5 streak points now gives $5000 instead of 500xp. - Tightened up the levelling curve, slowing down the rate we level up, and giving new skills on levels 1/2/4/5/7 only. - Added the 5th class called Scavenger. Scavenger is all about looting the map, getting dangerously close to enemies, but trying to survive. It's 3 perks are: - Copy Coin: If you collect 50 loot items without dying, you'll duplicate all of them. Dying will halve the amount currently collected. - Pickpocket: Damaging enemies makes them drop random loot, on a 8 second cooldown. The closer you are the more loot they drop. - Static Aid: Your passive regen will recharge and heal +150% faster whenever you stand still. - Heavy's ROF increases by +3% instead of +2% per level. - Heavy's shield will now also activate when standing still. - Caster loses the Skill Lottery perk that gave you a level 1 legendary. Instead, the new skill-based vendor upgrades are +50% more powerful. - All skills have been buffed slightly, by making their level 1 version stronger. For example Vampirism used to give +4/8/12/etc healing. Now it starts at +8/12/16/etc. - USP fire rate is now 360 instead of 300 - Deagle DPS remains the same, but now has 25hp x 240 rpm instead of 20hp x 300 rpm (more impactful) - UZI bullet speed is now 85 instead of 75m/s - SPAS spread is now 20 instead of 22 - AK47 damage is now 10 instead of 11, but fire rare is 515 instead of 450 (feels better). AK47 recoil is worse. - Ruger fire rate is now 80 instead of 72 - Barrett fire rate is now 48 instead of 50 - Tasers fire rate is now 360 instead of 300 - Nailgun fire rate is now 900 instead of 720, with damage at 9 instead of 10. DPS is thus 135 instead of 120 (highest in the game!) But the clip size is only 25 instead of 30. - Seek Rifle rpm is now 400 instead of 360, bringing DPS up to 107 instead of 96 - Minigun clip size is now 50 instead of 40 - Fixed the max wanted steam achievement (for real this time)",1706279345,['patchnotes']
308600,RARE LOOT SHOOTOUTS,"Hey all, hope you had a great new years break. Just a small balance patch. FYI, these balance changes are based on feedback in Discord, but also on data collected from every player and every match. If a skill gets a higher win rate than average it might get a nerf. Same for weak skills getting buffs. Over the last year I've seen that the skills are getting close to a consistent, balanced win-rate. Yay science! The other interesting change this version is that rare loot is now visible on the minimap, and gives more XP too. It will show with a little question mark icon, giving players a new type of objective to fight over. Enjoy! bencelot ---- - The score chart now automatically displays between rounds. - Warmup rounds are a bit faster. - Changed the colour of enemies from red to slightly purplishly red. - Pressing E on regular civilians now makes them follow you. - When a zombie picks up their 4th heart piece, they will remain for another 0.5s before they revive. This gives time to pickup other loot. - Rerolling now costs $2000 for regular drafts and $5000 for boosted drafts. However, if you reroll on a boosted draft you are now guaranteed to get that same rarity after rerolling. - Rare loot crates now give an extra +100xp and show up on the minimap when they're active. - Heart fragments now give +50xp instead of +20xp for survivors. However, they no longer drop on kill for survivors. - Players now get 10 instead of 5 score per level up. - The skill point leveling curve is now 15% slower. - Our second legendary skill appears at level 12 instead of 15. - Bots are less accurate with snipers and M4A1. - Assault no longer has +20% bigger shifts, nor does it reduce combat slowdown. Instead, Assault has a new perk which makes it reload weapons +70% faster. - Sniper's bullets now have +20% range instead of +5m range (+20% works out to +10m range on normal rifles). - Heavy's health kits appear 20% instead of 15% of the time, and will pop out directly behind you if possible, also more consistently. - Caster no longer gains extra cash or XP from kills. Instead skill draft rerolls are 50% cheaper ($1000 instead of $2000, or $2500 instead of $5000 if boosted). - Self Repair takes 2.0 instead of 3.0s to heal - Illicit Income gain per wanted level is +3% instead of +2% per level - Cluster Bomb throws nades 0.1s more frequently - Force Fields bounced bullets deal 10% more damage and steer a bit faster - Blade Fury slashing damage is now 100hp/s instead of 60hp/s - Invis only does reduced damage for 0.7 instead of 1.0s - Rambulance post-vehicle healing duration is now 5s instead of 4s, and regen is +5hp/s for all levels - Shockwave cooldown is 2s faster for all levels - Medical Supplies now fires loot at you from player kills too - Vampirism healing gains 4% instead of 5% per level - Clip Magnet seeking is 2 less per level - Proximity Rounds charging range is now 30 instead of 40m - Bullet Time slows enemy bullets down to 20% instead of 16% speed, and doesn't seek as much at higher levels.",1704988721,['patchnotes']
308600,"GSA 0.70: Classes, Gun Skins & Skill Rerolls!","https://i.imgur.com/8GJY988.gif NEW CLASS SYSTEM Choose your champion! This version adds a long awaited class system. There are currently 4 classes, but more will be added next version. On the loading screen you can choose to play as Assault, Sniper, Heavy or Caster. Each class has 3 powerful perks, which creates a unique playstyle that combos best with the various skills and weapons in the game. Everyone's class icon is shown above their heads, allowing us to see what others are playing and counter them. There is a subtle rock, paper, scissors mechanic amongst the classes too. For example, the Sniper class deal extremely high damage bullets - but only at range. So charge up close to counter them! The Assault class moves extra fast and can close the gap easily, making Assault a natural counter to Sniper. However Assault is countered by Heavy, because Heavy has a shield perk that reduces all enemy bullet damage by 3, which really harms the high ROF guns that the Assault likes to use. Sniper rifles however blast right through this shield, and so Heavy is countered by Sniper. And then there's Caster doing his own thing, spamming active skills all over the place. https://i.imgur.com/5nkZP4J.png 4 NEW CLASSES These classes replace the old Perk system. The old perk system had solid perks in it, but the system itself was too confusing and static. It was too much effort to think up a new combo between matches, and so we mostly just stuck with the same old perks game after game. Classes take the best of the old perks, tweak them a bit, buff them a lot, and make it extremely convenient to change classes between matches. With a single click you can try a whole new playstyle each game! Here are the perks of the new classes. https://i.imgur.com/UbUsznA.jpg ASSAULT PERKS (Movement & Aggression) - Super Shifts: You can fire your weapon while shifting, and your shift distance is +20%. - Run & Gun: Move +15% faster. You also won't slow down as much when firing your guns. - Death Fueled: Gain +10hp/s for 10s whenever you kill an enemy player civ or cop. SNIPER PERKS (High Damage at Range) - Rifle Range: Bullets gain damage the further they travel, dealing up to +25% damage at 70m. Also gives +5m range. - Black Market: You can purchase tier 2 and 3 guns 1 round earlier. - Backup Bomb: Whenever you throw an explosive you'll throw another one for free shortly after. HEAVY PERKS (Huge DPS, but Immobile) - Crisis Cover: Enemy bullets deal -3 damage to you whenever your health goes below 50%. - Final Focus: Gain +30% rate of fire and +30% bullet speed whenever your health goes below 50%. - Beaten Heart: Gives a 15% chance to drop a +20hp health kit whenever you're hit by an enemy bullet. CASTER PERKS (Yer a Wizard Harry!) - Active Healing: Active skills have -30% cooldown time and instantly heal you +30 health when cast. - Skill Lottery: At level 1 you will see 2 Epic skills in the draft. - Flashy Finish: Gain +$500 and +50xp from each kill. This is doubled if you kill with non-bullet damage. https://i.imgur.com/CclWXAF.jpg LEVEL UP CLASSES & GET SKINS We can level up our classes too. Whenever you earn trophies at the end of the match (based on your placement) you'll make progress towards your chosen class. When you get enough trophies you can level it up, which gives you some currency but more importantly unlocks new gun skins. There are 35 new cosmetics added to the game. This includes a ""Silver"" skin for every gun, and a few ""Golden"" skins for the most popular ones. As your total class level increases you'll gain access to new skins, until every gun is shimmering in either silver or gold. Due to the camera angle, characters appear quite small in GSA, and the guns appear even smaller. To solve this, every gun skin has a huge bright glow, simulating the blue moonlight reflecting off the gun's barrel - or the ""sunlight"" if you have a golden skin. https://i.imgur.com/w3nBl9S.jpg REROLLING SKILL DRAFTS Another huge change - there is now a REROLL button in the skill draft. Whenever you level up you'll see 2 new skills. But you now have a 3rd option to spend $1000 to reroll the draft and see 2 other skills instead. You can keep clicking this until you find a skill that works with your build. This gives cash an interesting new use, and if you're trying to create the perfect skill build you might spend MOST of your cash on rerolling. But if you're more versatile and can make any skill work, then you can save your money to buy bigger guns instead. This system subtly rewards players who have mastered all the skills in the game, and are able to adapt to anything they're given. https://i.imgur.com/7pRiT2G.gif NO MORE SKILL DISABLING It is no longer possible to disable skills in the skill tree. This feature had good and bad points. The good: It was fun to be able to create a unique build by disabling skills, and it was also nice to avoid skills that you didn't like. The bad: It was a fairly tedious requirement to do this if you wanted to pla...",1703271142,
308600,Cleaner Showdowns,"Heyo, this is a small patch to make showdowns cleaner. A recent change made it a bit too easy for zombies to respawn, especially if there were a lot of skilled players in the server who knew how to move fast. This made the final showdowns a bit too chaotic and a bit of a coin flip to see who would win. So to make showdowns more clean between the final survivors, zombie respawns are harder. Killing another zombie now only drops 1 heart piece, and they no longer drop the amount they were carrying. We also require 4 instead of 3 hearts to respawn. To compensate for this, we no longer lose our hearts when we die (which was a bit frustrating anyway). Enjoy! bencelot ---- -Zombies no longer lose their heart progress when they die. But they now require 4 hearts to rez instead of 3. -Killing an enemy zombie now drops exactly 1 heart. It doesn't drop extra fragments based on how many they've collected. -Added green bubble visual feedback for all healing skills -During overtime, the poison gas deals increasing damage based on your time inside it, and this rate is now remembered until you die. -Tweaked the order we unlock boosted skills. Instead of getting a legendary on level 5, and rares/epics on 8/11/14/17. We now get our legendary at 6 and get rares/epics at 5/10/15. If you reach level 20 you'll get a second legendary. -Whenever we see a brand new legendary or epic in the draft, we only get 1 draft option (in the next major version, we'll be able to unlock boosters that let us control these) -Fixed a bug where you couldn't reload if you have only fired a single shot of your gun -Your existing skills now show when you are offered new skills - Map spawns 18 instead of 20 vendors - Flare gun now deals 10hp flame damage for 1s -Added 3s extra to the end of each round to collect loot -Radiate impact radius is 20m instead of 16m -Stimpacks can no longer heal you in the poison gas -Flying Dagger now works for zombies. -Flying dagger damage now ranges from 70% to 100% instead of 105% to 135% -Force Fields burst damage is now 30 instead of 20 -Clip Magnet now shows a green seeking halo when you have available bullets",1699908066,['patchnotes']
308600,Power spikes create key milestones juust before round showdowns (with good farm),"This patch tweaks the cash and XP rates to make farming more meaningful, and adds key milestones to aim for just before the rounds 1, 2 and 3 showdowns. Firstly, we all earn a lot more cash and XP. Tier 2 and tier 3 weapons are also $5000 cheaper, so we'll all be more powerful by the final showdown. Also, skills now level up at fixed, predictable levels. We get new skills at levels 1/2/5/8/11/14. If you farm well, you can reach level 5 just before the round 1 showdown. This is important because level 5 now always gives you a LEGENDARY boosted skill, which starts at level 4 and can reach a super OP level 7. Levels 8, 11 and 14 will give everyone EPIC or RARE skills, which also give bonus points and provide key milestones right before the round 2 and 3 showdowns. Enjoy! bencelot ---- - We now always see brand new skills at levels 1 and 2. Then 3 and 4 upgrade them. Then we get boosted skills on level 5/8/11/14/17. - Normal skills can now go up to level 4 instead of level 3. - Boosted skills now come in 3 rarites: Rare, Epic and Legendary. - Legendary skills always appear at level 5. They start at level 4 and go up to level 7. - Epic skills can appear at levels 8, 11, 14 and 17. They start at level 3 and go up to level 6. - Rare skills also appear at levels 8, 11, 14 and 17. They start at level 2 and go up to level 5. - Getting 5 streak points now gives you a flat +500xp, instead of a free level up. - The Kill Reward now gains xp and cash 33% faster. - Supply Drops give an extra +100xp, +$1000 and +3% weapon damage. - Cops give 11/12/13/14/15xp based on your wanted level instead of a flat 10. - Tier2 weapons cost $5000 instead of $10,000 (but are still only available on round 2) - Superweapons cost $15k instead of $25k ($10k instead of $15k to upgrade from your tier 2 gun) - Cops have 50 instead of 40hp health and do 100% instead of 80% damage. - 3 supply drops instead of 1 spawn at the start of a BR match - Supply drops gain armor for each player nearby, shown by an expanding health bar. - Civilians now eject from cars faster, immediately as soon as it starts flaming - Shotguns now deal more damage but have worse range and spread - Updated the default control scheme a bit (for new players). Interacting with HUD is now CTRL, placing chems is now C, slashing knife is now middle mouse - All players, now including F2P people, will show off their account level when they win a round - Your Streak point progress is shown below your health bar. -Radiate cooldown is now 18/17/16/15/14/13/12 instead of fixed at 16s. It does +5 impact damage per level and the radius is 10% larger -Beefcake doesn't increase your hitbox size as much (lvl 7 is +20% instead of +40%) -Falling Inferno now additionally increases your molotov duration by 1 to 7s -Critical Rage chance now ranges from 140 to 380% instead of 133 to 333% -Illicit Income values are halved, but it now increases your XP earned as well -Shrapnel chance of free nade now ranges from 50% to 350% instead of 40% to 280% -Armed Robbery chance of big XP ranges from 25 to 175% instead of 20 to 140% -Medical supplies healing ranges from 10 to 40 instead of 5 to 35 per loot -Hypnotic Army range increased by 5m, and cooldown is now 10 instead of 12s. Max vendors is now 0/0/1/2/3/4/5 -Invisibility duration buffed by 5s per level -Blade Fury slashing damage is now 100 instead of 60 hp/s -The bonus damage duration after spike trap is 4 instead of 3s -Flying Dagger range and speed increased by 10m for all levels -Backtrack duration increased by 1s for all levels -Rambulance damage also increases car mass for collision purposes -Flaming Bullets duration now ranges from 0.5 to 1.1 instead of 0.3 to 1.5s -Regeneration healing ranges from 2 to 14hp/s instead of 2.5 to 17.5 hp.s -Executioner damage ranges from 8% to 56% instead of 10% to 70% -Self Repair takes 2.5 instead of 2.0s to heal you -Stimpacks healing ranges from 3 to 21 instead of 4 to 28 hp per shift -Toxic Blood duration now ranges from 3 to 9s instead of 2 to 14s -Arcane power bullet damage ranges from 7 to 49 instead of 8 to 56hp -Clip Magnet seek speed is now 20 instead of 30 degrees per second -Assassinate bonus damage ranges from +3 to +15% instead of +3 to +21% - Fixed a bug where clip size upgrades weren't showing properly in the HUD. - Fixed Always on Top challenge not working - Fixed a bug that caused cops to stand on top of cars - Fixed a bug where the critical rage sound effect wasn't applied to shotguns",1699635084,['patchnotes']
308600,"GSA 0.67: Critical Rage, Boosted Skills & 13 New Passives!","https://i.imgur.com/wojvz1e.gif CRITICAL RAGE May the best reflexes win. GSA now has a new and extremely OP mechanic called Critical Rage. Whenever you shoot an enemy you have a 3% chance to go crazy and start firing critical bullets. These bullets deal DOUBLE DAMAGE and for the next 2 seconds you will obliterate anything in front of you, so make those bullets count! Why was this added? Because it is just pure dopamine fun and feels incredible when it randomly kicks in. Now, you might think this is some OP RNG BS... and that's what people said in playtesting too! But we fixed that with a very visible 1 second warning animation before you enter this state. If your opponents have good reflexes this is more than enough time for them to shift to safety and wait out your 2 seconds of fury. Of course, we all get these equally, and ultimately the players with the better reflexes win - either shifting to safety or pushing their advantage and landing those sweet, sweeeet crit hits. https://i.imgur.com/STyKtSm.jpg LEVEL SIX BOOSTED SKILLS The skill draft now contains BOOSTED skills. Boosted skills randomly appear in your skill draft and they appear in the most special colour of all - rainbow. Boosted skills give you free skill points when you level them up. The later into the game it is, the more free points you get. If they appear on level 2 they'll give just +1 free point. Not bad. But if this occurs at level 11 then you'll get +4 points instead! This keeps farming relevant right until the end of the match, as every last level might boost you to victory. More importantly however, boosted skills can go all the way up to level SIX, whereas normal skills are capped at level 3. Investing this many skill points into a single skill makes it extremely powerful, and it's been good fun playtesting them all to see how broken they get. You don't have to invest this many points of course, as you have other skills to level as well. But you have the option to take your boosted skill to the max and adapt the rest of your build to support it. Now, hang on a second.. more OP RNG??? Not quite, because everyone gets boosted skills at the same levels. At the start of the match the server will decide which levels will be boosted, and all players get their boost option at the same time. Usually there are just 1 or 2 boosted skills per game.. but very rarely there can be 5 or even 6. For everyone. These rare matches are wild where everyone is extremely OP, potentially with 2x the amount of skill points as we'd normally get. High stakes indeed! https://i.imgur.com/v7wOU2y.gif 13 BRAND NEW SKILLS This version adds 13 new skills. Some of these have been automatically added to your account, others are further out in the skill tree and need to be unlocked. All of these skills are passives, which is what most people seem to prefer, and the extra options really make drafting interesting. A few of these skills were inspired by Vampire Survivors, for example ""Revenge Rockets"" which spins bazookas around you and automatically fires them at enemies whenever you get hit. https://i.imgur.com/B0CYJ4s.png Revenge Rockets: 1/2/3/4/5/6 bazookas spin around you and automatically fire back at enemies whenever they shoot you. Beefcake: Gain +10/20/30/40/50/60 max hp. Executioner: Deal +10/20/30/40/50/60% damage against enemies with less than 50% health remaining. Stimpacks: Restore +4/8/12/16/20/24 hp per shift. Critical Rage: Increases the chance of entering critical rage by +33/67/100/133/167/200%. Shift Supply: Gives +1/2/3/4/5/6 bonus shift charges. Combo Killer: Increases the time you get between multi-kills from 3s to 4.5/6.0/7.5/9.0/10.5/12.0. Falling Inferno: Throws a free molotov whenever you cast a skill for 25/50/75/100/125/150% damage. Medical Supplies: All forms of loot heal you by 5/10/15/20/25/30 hp. Crates throw loot towards you. Flying Dagger: You can throw your knife 10/20/30/40/50/60 meters and for extra damage. Rambulance: Your vehicles drive faster, do more ramming damage, and heal you by 10/20/30/40/50/60 hp/s. Armed Robbery: Killing vendors has a chance to drop rare loot. XP, hearts and upgrades. Chance of upgrade is 5/10/15/20/25/30%. Acid Trail: You leave a trail of acid behind you that deals 10/20/30/40/50/60 hp/s damage to enemies inside it. https://i.imgur.com/uRSd9aE.png TROPHY CHALLENGE To help you earn the coins to unlock some of these new skills, there is a new system called Trophy Challenge. All 54 skills in the game have their own challenge, which is to finish a match with at least 6 trophies while using the skill. This can only be attempted for one skill at a time, which is determined by whatever skill you choose to guarantee shows up at the start of the match. This system does a few things. If you don't feel like playing ranked mode but still want to have a meaningful goal to achieve, you can attempt a new trophy challenge. Just select a different skill between matches and try win 6 trophies! This system also encourages p...",1698609060,
