appid,title,contents,date,tags
308600,HARDER COPS & KILL STREAKS,"Hey all! Mostly a small balance patch. The most important things are cops are quite a bit harder now. And killing enemies is more rewarding. You get 2x as much XP per player kill, and also there's a new kill streak shown under the health bar. You get more cash per kill in the streak $100, then $200, then $300, up to a 10x streak of $1000 per kill. Stay alive! Also, big thanks to everyone who's particpated in the survey so far! It's super useful. Especially to hear what the quiet majority of players enjoy or not. I'm posting screenshots of the results in discord if you're curious what others have voted for. Have fun! bencelot ---- Holding the space bar when opening flasks in a queue will pause the timer, letting you see what you got Added a cool new victory screen cosmetic for the Legendary pack, and a visual in the flask animation page that shows how it affects your rarities At wanted level 5, a helicopter now shows up to shoot missiles at you Cops are now more accurate and are more aggressive Normal cops now have 50 instead of 40 health, and special forces have 100 instead of 50 health The time between wanted level 1 and wanted level 2 is 50% (aka you hit wanted 2 much sooner) XP fills slightly slower in XP Pools, because.. Killing enemy players now gives 100xp instead of 50xp The kill streak mechanic is now shown below you health bar. It now goes up to 10x isntead of 5x. The cash you get from a kill is $100 x killstreak (so the first one gives $100, then $200, up to a max of $1,000) Health Stimulant chemical now restores +20 hp/s instead of +10 hp/s Supply Beacon chemical now can carry 2 charges instead of 1 XRay Vision can now reveal enemy invisible targets Bouncing Bullet's mutation seeking is reduced a bit, and the skill does slightly less damage Invis has a 1.0s low damage penalty instead of 0.5s Blade Fury has reduced slashing damage Phase Drifting does a bit less damage at max speed Assassinate gives slightly more farm per kill Skill Shots gets slightly more move speed from the mutation per charge Criminal's gang now gets 2 instead of 3 followers (to compensate for the cops being stronger) Criminal has a 3% instead of 2% chance to spawn a gangster Assassin gains +10% upgrade power per kill instead of +15% Assault now gets +20% bullet speed instead of +30%",1763724750,['patchnotes']
308600,BALANCE UPDATE,"Hey all! Just a bit of a balance patch this version. I've been working on marketing this last month, getting more players to download the game via youtube and tiktok videos. This is long overdue, but working well so far. Already got +50% more downloads per day than last month. I'll keep doing this for a while longer then add more big content patches after that. Have fun! bencelot ---- - F2P players can now complete the final 60 challenges in each grid (but still need the DLC to claim them). The final wave of heart drops (that land at -2:00) have 2 crates instead of 1. So you don't have to run so far across the map There is a 20s instead of 10s delay between finishing a mission and seeing the next arrow Gangster's have a shorter shooting range Overtime circle is a bit bigger to reduce density Car explosions are bigger and cars launch further Medkits now heal +30 instead of +40 health Assault's medkits now heal 50 health (other classes get 30) Assault's weapons have +50% instead of +100% reload speed Heavy's shield charges faster and more efficiently in XP Pools Heavy gains +3% ROF per level regardless of health (it's no longer +1% above 50% health) Caster's active skills heal by +30 instead of +20 hp on cast Caster's vendor upgrades are -33% for weapons (same as before), but now -50% for skill upgrades. Scavenger's healing rate is +150% instead of +100% when standing still Scavenger's shift recharge rate is +150% instead of +100% when standing still Criminal's cops kills only restore +20 instead of +30 health Scientist's explosive bombs are now 75% instead of 50% likely to show in the shop Frenzy cooldown is now 2s faster Firestorm has higher blast jumping power to push you up against walls Stimpacks and Blade Mail are indirectly nerfed due to medkits only giving +30 health Gunslinger's mutation gives 2/4/6/8 instead of 1/2/3/4 extra grenade carry capacity Falling Inferno's mutation gives +4/8/12/16 molotov duration instead of +3/6/9/12s Shrapnel's damage is now +50% higher Charged Shot has a larger hitbox on the charged bullet Phase Drifting is a tad faster, but has a ministun when you hit a wall Combo Killer's infinite shift duration is now 3/6/9/12 instead of 2/4/6/8s Invisiblity low damage penalty is 1.0s instead of 0.5s, but cooldown is 2s faster Beefcake mutation now gives +3/6/9/12 instead of +2/4/6/8 max hp per purchase",1762169208,['patchnotes']
308600,SMALL TWEAKS,"Hey all, just small miscellaneous changes this version. Have fun! bencelot ---- - Players who hadn't caught up to their true xp level have now been instantly granted all that XP. The whole ""earn XP 5x faster while catching up"" grind is removed. - Rare DNA Flasks now cost 500 instead of 750 acid. - The top rank in the game is now called ""Skill Slayer"" instead of ""Genetic God"", and the ""Super Soldier"" rank is now called ""Predator"" - Sniper class is now called Striker - Hovering over the class in the leaderboards now shows class info - If anyone in the server reaches max wanted level, all civilians will appear in a red shirt and deal extra damage - Gangsters can now appear in non-BR game modes - The explosive gangster always carries a minigun - Mission civs and vendors now spawn immediately at the start of the round, not one every second, causing the arrow to flicker back and forth - Cars have a slower base max speed, but a higher boost multiplier (same speed while boosting, but easier to steer without boosting) - In survival mode, you start with at least wanted level 1, 2, 3, 4 based on the round number - Survival mode is harder when playing coop - more zombies spawn at the end of survival rounds - Zombies spawn in the middle of survival rounds, including in standard difficulty",1760181136,['patchnotes']
308600,Making Max Level Skills Meaningful!,"Hey all, this version makes max level skills more fun. In the old version, it didn't feel that interesting to take a skill from level 6 to 7, or 7 to 8. You barely felt the difference as the increase was so small. And the game often ended before you could even reach that high. That's a wasted opportunity, because working towards and achieving a max level skill should be a fun thing to do! To fix this, skills now max out at level 7 instead of 8, which means you can actually reach them before the game ends. And to compensate and make it exciting, the last 2 skill levels now have values that jump up 2x as much. So it's now worth it to choose a skill to focus on, as the core of your build, and try max it out ASAP to take advantage of those final levels. Have fun! bencelot ---- - Slightly more max health kits drop into the map (to account for the power boost above and minimise burst damage skills) - Photon Beam now works better for blasting with Scientist's bullets - Skills go back to max 7 levels, instead of 8 - Skills now have a 2/3/4/5/6/8/10 pattern instead of a 2/3/4/5/6/7/8/9 pattern - Boots of travel is a bit slower, and no longer works with the Speed vendor upgrade. The mutation jump height is increased. - Force Field mutation does a bit less damage - Bullet Time's cooldown is 2s slower, and it doesn't slow enemy bullets quite as much as before - Blade Fury's cooldown is 2s slower, and the slashing size of the mutation is smaller - Firestorm's cooldown is 2s slower - Shockwave's cooldown is 2s slower - Frenzy no longer works with the speed vendor upgrade - Phase Drifting's cooldown is now 2s slower, and it no longer works with the Speed vendor upgrade - Charged Shot now only gains 50% damage and healing from Cluster Bomb - Charged Shot's mutation healing is now 15/30/45/60 instead of 20/40/60/80 - Energy Vortex cooldown is now 2s slower - Rambulance armor and healing values are a bit stronger ",1759503139,['patchnotes']
308600,RISKY REWARDS,"Hey all, small tweaks this version around the ideas of RISK & REWARD. There are things you can do in this game which are risky. Like fighting gangsters. You risk dying, and you also risk wasting your time, but there's a nice reward if you pull it off. This version aims to add a few more mechanics like this! Cops do more damage, vendors are now harder to kill but always drop Double Damage loot, gangsters camps will now sometimes drop a tier 2 gun, and Kill Frenzy missions now reward you with 30s of Frenzy if you complete it! Have fun! bencelot ---- - Vendors now always drop a double damage drop when killed, but they deal more damage - The ""Damage Drops"" modifier is changed to make double damage last 4s longer - Cops now deal +50% more damage - Capturing gangster loot now has a chance to drop a bonus crate containing a tier 2 weapon - Completing a KILL FRENZY mission now also gives you 30 seconds of Frenzy at +50% ROF - Molotovs now deal 30 instead of 20 impact damage - Assassinate gives a bit more cash and XP - Charged Shot now does more damage after throwing a grenade, the same amount as casting a skill - Mirror Image clones have slightly more health - Combo Killer drops slightly more loot - Illicit Income's mutation gives slightly more ROF per wanted level - Phase Drifting accelerates to top speed a bit faster - Teleportation's cooldowns are a bit faster - Manic Mechanic's murations gives slightly more ROF (50 instead of 40%) - Flying Dagger goes back to a simple form of damage, no longer doing the above/below 50% thing. Ranging from 100% to 135% damage - Armed Robbery no longer drops extra damage from vendors, but has a cooldown time of 40s instead of 60s",1758709789,['patchnotes']
308600,SYRINGES NOW COME FROM OVERTIME,"Hey all, this version has a simple but important change: - We now get +1 syringe per round when overtime begins (0:00), instead of every 10 score. The reasons for this are: - New players and vets are more balanced. Before, newbies sometimes only got 2 syringes, and vets sometimes knew how to earn 4 or even 5. Now we'll all have 3, making the game less snowbally and giving more balanced fights. - 3 mutations is a more fun amount. When veterans got 4 or 5 syringes per match, the decision making was lost. You were merely deciding the ORDER you unlocked your mutations. Now, with only 3, you have to really CHOOSE which skills you want to mutate. - Less veteran advantage. If vets only get 3 mutations instead of 4, then having a bunch of legendaries makes them less powerful. More fair for new players. - Less confusing. Score is a complex system for new players to understand. Mutations are a core part of the game and shouldn't depend on a complex system. Now you earn them in a very straightforward way. - Fun pacing milestone when overtime begins, and even pacing of unlocks across all 3 rounds. Have fun! bencelot ---- - We now get +1 syringe per round when overtime begins (0:00), instead of every 10 score. - The winner of each round gets +1000xp - The build skills now appear at levels 4 and 5, instead of 5 and 6 - The camera is zoomed out more to give more strategic vision of the map - Blast cannon has a bit of a bigger explosion radius - Made it easier to dodge bazookas when shifting - Modifier level ups now give 5 shards instead of 50 acid - The DLC now also boosts class level ups, going from 100 to 300 acid (shards stay at 50) - Fixed a bug with Marksman challenge",1758527742,['patchnotes']
308600,Polishing Points,"Just some QoL and bug fixing this week! Joining in R1 will give you 100% of average xp, not 80% Fixed a bug with the wrong synergy challenge getting completed Improved the loading time when hoping into a new map Made the options menu save settings more reliably Classes unlock a bit slower, every 10th instead of 5th level. This prevents early DNA flasks being too diluted across all 8 classes, and lets new players get more drops on simple ones like Assault. Added more play flasks to the start of the progresssion system to give noobs more control and choice. Left clicking while random class mode is enabled will no longer affect the random class selction. It's right click only as the description says Every skill's description now has an extra line that describes how the mutation works (shown in the main menu, not in-game) Items in the rotationg show can now go up to 3x value (instead of 2x value). Generally things that cost 800u or more are 3x value, and 400 to 800 range are 2.5x value. Your mute list is now saved between play sessions (type /mute bencelot to mute someone. Type /unmute bencelot to unmute). ",1757349120,['patchnotes']
308600,Synergy Challenges!,"SYNERGY CHALLENGESThis version adds a bunch of new challenges that not only test your player skills, but also teaches you how to use the skills in the game too! Each challenge has the following format: 1) You must play a specific class 2) You must use a specific skill (specially chosen to combo with that class) 3) You must win at least 9 trophies in the match (basically come 1st or 2nd) If you win while using the required class/skill combo you'll complete the challenge and see numbers go up. You can also claim the reward, which is either ACID, Magnets, or the premium currency Uranium.JUICY REWARDS (48 daily challenges worth of ACID)There are 24 challenges available for free, and 80 if you have the Deluxe DLC. But even for free to play players, these rewards are quite nice. It will take a long time to win all of these challenges so I wanted the grind to be worth it. Just in the 24 free challenges you can claim: +400 uranium +4 magnets +2400 acidYou can convert that 400 uranium into 12,000 acid, or 14400 acid total, which is what you'd get from completing 48 daily challenges (or 10 full days of grinding the 5 dailys per day). Hopefully this is a good incentive for people to grind these challenges, because...THE REAL REWARDS ARE THE LESSONS YOU LEARN ALONG THE WAYI mostly added this system to teach new players some of the many synergies in Skillshot City. This is a complex game and it's a bit overwhelming for a new player. Where to start? How to make a good build? What should I equip? These challenges now provide a guide. Each challenge has been chosen to require you to win with a strong synergy, and also has a useful tip explaining how to use it. You can read through these challenges, even the ones in the DLC section, and get ideas on how to improve your builds. Look for your favorite class and see what skills are suggested to combo with it, and then read the tip for how to pull off the combo.The challenge grid starts with some basic and obvious synergies, but also includes more advanced ones too. There are even challenges which require 2 skills instead of a class and a skill. Some examples:Self Repair (skill) + Mirror Image (skills) TIP: Cast Self Repair first, then immediately cast Mirror Image after. Your clone will spawn with Self Repair activated, allowing you to get double healing. Sniper (class) + Shrapnel (skill): TIP: Sniper throws an extra grenade, and Shrapnel makes grenades deal extra damage.Scavenger (class) + Medical Supplies (skills): TIP: Scavenger drops a bunch of loot once you collect 50 pieces of it. Medical Supplies heals your for each bit of loot you pick up, making your nearly invulnernable when the 50 bits of loot drop out of you.Assault (class) + Hypnotic Army (skill) TIP: Hypnotic Army lets you bring civs into a fight with you. When they die Assault's perk makes each one of them drop a free health kit. OTHER RECENT CHANGESI've made a few hotfixes to the game over the last month. I've updated the in-game changelog feature but not offically posted about them here on Steam. Here are some of the bigger changes if you haven't played in the last few weeks: \All players have been given a starter flask for each class that gives 4 rares, 2 epics and 1 legendary skill that was specifically chosen to synergize with that class (and indeed appears in this new synergy challenge grid).Added QoL features like a ""CLAIM ALL"" button on modifiers level ups, and made the flask opening animation instant (unless you're about to get a legendary).Fixed various bugs and crashes for Chinese peeps.If you join a game mid-match, the auto skill picker will now try prioritize skills you like, instead of pure random.Clicking JOIN GAME on someone's name via the friends page will try to put you into their squad, instead of merely just joining their server.Servers that have lots of high level players in them now give out slightly more trophies at the end of the matchRandom skills mode now lets you equip the top 2 slots of your build. The bottom 6 slots are still randomized. So you still have SOME control over your build, but not as much as constructed mode.Added 20 new gun skins. Rainbow gun skins! These are added after the silver and golden ones, ranging from 105 to 200 combined class levels. Basically you can adjust the colour of the gun and the glow with a slider.Streamlined magnets. They now give exactly 500 DNA every time, and never hit rarities. The exception for this is Magnetic Flask, which always hits rarities. This works out to slightly more DNA given per magnet on average, and is far more reliable.Warmup round is now throwing knives only!The free login bonus in the shop now gives 2x more acidThere are now 5 instead of 4 free daily challenges. And each one gives 300 instead of 250 acid (900 instead of 750 for DLC).The 6th bonus daily challenge now gives 3x values instead of 2x value. 3,000 acid for 100 uranium, instead of 4,000 for 200.We can now spend our syringes directly and instantly on any skill you want ...",1756904150,
308600,BUYING MUTATIONS IN THE DRAFT,"Hey all, pretty spicy change here: - We can now INSTANTLY spend our syringes as soon as we earn them, simply by holding ALT and clicking the button in the skill draft. You no longer need to shop around at vendors. Note, I put out a patch yesterday which was a bit broken. This version fixes it. I'm reposting yesterday's changelog here, with a few tweaks. Have fun!bencelot ---- \Vendors no longer sell mutations. Instead we spend our syringes in the skill draft.Mutating now always costs 1 syringe instead of 1/2/2/2/2.Instead of getting 1 syringe on score 5/10/15/20/25/30/35/40/45/50/55/etc you get 1 syringe at score 10/20/30/40/50/60/etc.A new indicator is shown next to your syringes up the top right saying ""Next Syringe: X/20 Score""Syringe Supply modifier now drops 1 instead of 2 syringes. Drug Stash modifier has a 20% instead of 50% chance of syringes.Slowed down the levelling curve. 7500xp now reaches level 10 instead of level 12.Level 10 is now when scoring stops, not level 12. This makes for cleaner maths.We now get +3 score per level instead of +2, capped at 30 (enough for your 3rd syringe mutation).Level 10 is now when you get your 5th skill, not level 12. Cleaner milestone.In constructed build mode (not using random skills), the 3rd skill slot no longer appears when you hit levels 5 and 6.Instead, you can reroll on these levels so you can see another skill from your build. This costs money, but is instant.Rerolling on levels 5 and 6 now costs $3000 instead of $1000 (it's still $1000 if you do random class mode).\There are now 5 instead of 4 free daily challenges. And each one gives 300 instead of 250 acid (900 instead of 750 for DLC).The 6th bonus daily challenge now gives 3x values instead of 2x value. 3,000 acid for 100 uranium, instead of 4,000 for 200.Weekly challenges now require 4/8/12/16/20 dailys to complete instead of 3/6/9/12/15 (as we have 1 extra per day)\Heart crates once again fall every 30s instead of every 60sHeart crates stop landing after -2:00 into overtimeFixed a bug with heart crates not being destroyed on the clientRandom Class modes gives 5% less cash and XP for all amountsRemoved the infinitely explorable overtime thing in survival mode between roundsVendor upgrade costs now scaled based on the total amount purchased: 6/9/15/18/21/24/27/30k/etc\Caster's skill upgrades are now -33% instead of -50% the cost, but apply to all upgrades, not just skill-ones",1753884522,['patchnotes']
308600,SAVE YOUR SHIELDS,"Hey all, small patch this week. The biggest change is this: Zombies no longer lose their max shield when they revive. This makes kills earned as a zombie matter far more now, because when you kill enemies and they drop shield drops, you get to keep them after reviving. You now only lose shield when you die, not when you revive. Have fun! bencelot ---- Max shield is now 60% instead of 40% (3 kills instead of 2) Zombies no longer lose their collected max shield when they revive When zombies revive, they respawn with exactly 50% health and shield The heart drops during overtime now land at -0:30, -1:30, -2:30, -3:30 Players move 5% faster Skill Healing vendor upgrades now give +10/20/30% instead of +15/30/45% Skill duration/size/speed vendor upgrades now give +15/30/45% instead of +20/40/60% Chemicals now cost $8000 instead of $6000 Added a new chemical called Supply Beacon. Supply beacon lets you summon a supply drop to your location with a 30s timer. The passive gives you +20% cash from loot on the ground Beefcake's mutation now gives +2/4/6/8 isntead of +3/6/9/12 max hp per upgrade purchased. Raw max hp ranges from 16 to 72 instead of 20 to 90 max hp. Manic Mechanic's mutation now gives +40% instead of +50% rate of fire Automatic Armor cooldown now ranges from 15s to 8s (instead of fixed at 10s). Duration is 1.5 instead of 2.0s. Revenge Rockets now fire back at gangsters and cops. The mutation gives 40/80/120/160% new rockets instead of 25/50/75/100% Rambulance healing now ranges from 3 to 13.5 instead of 4 to 18 hp/s Proximity Rounds trigger range vs gangsters reduced to 35/70/105/140 instead of 50/100/150/200m Regeneration healing begins 1.5s after combat instead of 1s. Boots of Travel speed begins after 1.5s instead of 1.0s. Move speed is now +16% to +72% instead of +14% to +63% Stimpacks healing now ranges from 3 to 10 instead of 3 to 13.5. Stimpacks mutation health kit chance ranges from 8 to 32% isntead of 7 to 28% Mana Shield duration is now 2s instead of 2.5s after casting a skill Charged Shot mutation healing is now 20/40/60/80 instead of 15/30/45/60 Energy Vortex cooldown is now 2s faster Hypnotic Army cooldown is now 2s faster, and max followers is +1 larger Assassinate no longer prioritizes players with higher bounties, allowing it to instead focus on closer enemies",1753701132,['patchnotes']
308600,MINOR BALANCING,"Hey all, a fairly small patch today but with some interesting changes from observing new people play: 1) Heavy class no longer drops health kits, but instead can recharge its shield to 100% in XP Pools. This makes it actually act like a heavy tanky boi, instead of more of an ""agility"" character where you need to grab the kits. Easier for new players to understand, and interesting mechanics of holding space near XP Pools. 2) In squads mode, players missions are now shared with allies. Have fun! bencelot ---- - Civilian mission progression is now shared with allies in squads mode. The requirements are higher with more people - There is +1 extra heart drop at each minute before overtime. - It once again requires 3 kills instead of 2 to get the 3rd skill at levels 5 and 6 - Damage health kits now give +30 instead of +20 hp - Assault reload speed is now +100% instead of +70% - Sniper range is now +15% instead of +10% - Heavy's first perk is changed. It now is called ""Over Shield"": Standing in XP Pools will overheal your shield up to 100% of max health. Your normal max shield is also +20% larger. - Frenzy's ally buff radius is 50% larger - Shift Supply's mutation speed boost now lasts 2s instead of 1s - Armed Robbery will always drop at least one cash pile (if nothing else drops and not on cooldown) - Mirror Image clone health reduced by 4% - The Risky Traders modifier has been removed, and now replaced with Heavy's old medkits perk.",1752505386,['patchnotes']
