appid,title,contents,date,tags
72850,This Skyrim mod adds a new mechanic that Elder Scrolls 6 sorely needs,"The best <strong>Skyrim mods</strong> completely revamp Bethesda's RPG. The modding community has been making changes big and small for over a decade, with each drawing us back to Tamriel to reexamine how we interact with its world. This brand new mod does just that simply by adding one menu, introducing a feature I'm now convinced Elder Scrolls 6 can't be without. <a href=""https://www.pcgamesn.com/skyrim/mod-bestiary"">Read the rest of the story...</a> RELATED LINKS: <a href=""https://www.pcgamesn.com/best-dragon-games"">The best dragon games on PC 2024</a> <a href=""https://www.pcgamesn.com/skyrim/mod-lordbound"">Huge 60-hour Skyrim mod that's like a new expansion sets launch date</a> <a href=""https://www.pcgamesn.com/the-elder-scrolls-v-skyrim/skyrim-console-commands-and-cheats"">A list of all Skyrim console commands and cheats</a> ",1720981635,
72850,Huge 60-hour Skyrim mod that's like a new expansion sets launch date,"13 years after launch, <strong>Skyrim</strong> has lost some of its magnetism. We're all so intimately familiar with the snow-capped mountains, the cobbles in Whiterun's well-worn streets, and the umpteenth bandit camp filled with gold coins and iron armor that it's beginning to feel like Bethesda's RPG is finally coming to a close. Skyrim itself might not be enough to keep us busy while we wait for Elder Scrolls 6. But now that it has a launch date, the DLC-sized Lordbound mod might be enough to draw us back to coolest region of Tamriel. <a href=""https://www.pcgamesn.com/skyrim/mod-lordbound"">Read the rest of the story...</a> RELATED LINKS: <a href=""https://www.pcgamesn.com/the-elder-scrolls-v-skyrim/skyrim-console-commands-and-cheats"">A list of all Skyrim console commands and cheats</a> <a href=""https://www.pcgamesn.com/elder-scrolls-v-skyrim/100-best-skyrim-mods"">Best Skyrim mods 2024</a> <a href=""https://www.pcgamesn.com/skyrim/todd-howard-support"">Todd Howard regrets not supporting Skyrim and Fallout 4 for ten years</a> ",1719945540,
72850,"Starfield modding project to create a whole Elder Scrolls-themed planet ""has been canceled"", but the poster behind it says it wasn't just trolling","Just days after a lengthy Reddit post outlining plans for it garnered a fair amount of attention, a very ambitious <a href=""https://www.vg247.com/starfield-guide-quest-walkthroughs-item-locations-and-more"">Starfield</a> modding project that aimed to create an entire Elder Scrolls-themed planet featuring recreations of the worldspaces from <a href=""https://www.vg247.com/games/the-elder-scrolls-v-skyrim"">Skyrim</a>, <a href=""https://www.vg247.com/games/the-elder-scrolls-iv-oblivion"">Oblivion</a>, and <a href=""https://www.vg247.com/games/the-elder-scrolls-iii-morrowind"">Morrowind</a> ""has been cancelled"". Though, the poster behind it denies that it was, as many commenters had assumed, never properly in the works to begin with. Dubbed ""Project Tamriel"", <a href=""https://www.reddit.com/r/Starfield/comments/1dqb9t6/project_tamriel_a_creation_kit_project/"">that initial post about the initative on June 28</a> by Reddit user New-Star-340 claimed that it was ""an ambitious and groundbreaking modding endeavor that aims to bring the entirety of Tamriel from The Elder Scrolls series into the expansive universe of Starfield"". They specified that this would be accomplished by populating a single planet with ""iconic items, detailed maps, and beloved quests"" from Skyrim, Oblivion, and Morrowind. Naturally, given how lofty a goal this is and the titanic effort it'd surely take, the post was met by a mixture of excitement and cynicism. VG247 has since reached out to New-Star-340 in an effort to learn more about Project Tamriel, with the poster responding that ""the project has been canceled"", with this being cited as the reason behind the absence of links to a website or Discord server for it that initial post, despite one section of that featuring a bracketed space for one. <a href=""https://www.vg247.com/starfield-modding-project-elder-scrolls-themed-planet-canceled-poster-says-not-trolling"">Read more</a> ",1719922758,
72850,This Skyrim mod makes tableware so gloriously beautiful I can't stop staring at it,"In all my hours of Skyrim I&apos;m not sure I&apos;ve ever really sat down at a table for a meal. I usually eat on the go&#x2014;while running around, riding a horse, or in the middle of the battle with a dragon. What better time to scarf down an entire wheel of cheese then when you&apos;re about to be turned to cinders by an ancient flying lizard, right?.. <a href=""https://www.pcgamer.com/games/rpg/this-skyrim-mod-makes-tableware-so-gloriously-beautiful-i-cant-stop-staring-at-it?utm_source=steam&utm_medium=referral"" target=""_blank"">Read more.</a>",1719615313,
72850,Todd Howard regrets not supporting Skyrim and Fallout 4 for ten years,"Despite being two of the best-selling videogames ever, <strong>Skyrim </strong>and Fallout 4 don't get much in the way of support from Bethesda anymore. This is something game director Todd Howard is acutely aware of, as in a new podcast interview he explains that he regrets not giving players even more to experience over the years. Howard then promises that games like Starfield, Fallout 5, and Elder Scrolls 6 are all looking to have decades-long plans, with even more DLC to enjoy over the years. <a href=""https://www.pcgamesn.com/skyrim/todd-howard-support"">Read the rest of the story...</a> RELATED LINKS: <a href=""https://www.pcgamesn.com/best-dragon-games"">The best dragon games on PC 2024</a> <a href=""https://www.pcgamesn.com/skyrim/mod-dark-brotherhood"">New Skyrim mod gives its best side quest the expansion it deserves</a> <a href=""https://www.pcgamesn.com/the-elder-scrolls-v-skyrim/games-like-skyrim"">Best games like Skyrim 2024</a> ",1718625322,
72850,"""I do think we're gonna take a look at that"" - Todd Howard addresses Starfield's creation club controversy","The recent release of a creation club for <a href=""https://www.vg247.com/starfield-guide-quest-walkthroughs-item-locations-and-more"">Starfield</a> - delivering content from Bethesda and modders for purchasable credits as the studio's previously done with <a href=""https://www.vg247.com/games/the-elder-scrolls-v-skyrim"">Skyrim</a> and <a href=""https://www.vg247.com/games/fallout-4"">Fallout 4</a> - drew a lot of backlash from players. Bethesda's Todd Howard has now addressed the controversy and indicated that the studio could be looking at making some changes to the initiative going forwards. If you're out of the loop, the big sticking point with this iteration of <a href=""https://www.vg247.com/skyrim-paid-mods-creations-debate-interview"">Bethesda's ever-polarising attempts to intergrate some form of add-on system that allows for 'paid mods'</a> was the pricing, especially <a href=""https://www.vg247.com/starfield-update-creation-club-bounty-hunting-quest"">when it came to one Trackers Alliance quest</a>. With that second quest based around the faction being behind the paywall, while the first Trackers Alliance mission was given out for free, some players were annoyed that it looked like they'd be paying a lot more for this and upcoming Trackers Alliance content than they might otherwise do if it was all released as one DLC pack. In an <a href=""https://www.youtube.com/watch?v=2ew8LQFGNWU"">interview with YouTuber MrMattyPlays</a>, game director Todd Howard was asked about this controversy, and responded by suggesting the studio will be looking into potentially revising how it proces and packages creation club content in light of the backlash. <a href=""https://www.vg247.com/starfield-todd-howard-creation-club-pricing"">Read more</a> ",1718620388,
72850,"Skyrim player killing Nazeem every single day until The Elder Scrolls 6 is released has now done it 1,000 times, celebrates with a Nazeem-only battle royale","What do you do to kill time while waiting for a new game to be released? Post about it on the forums? Obsessively check for a release date? Play some other games that might scratch the same itch? Commit an unending stream of brutal murders in a different game?.. <a href=""https://www.pcgamer.com/games/rpg/skyrim-player-killing-nazeem-every-day-until-the-elder-scrolls-6-is-released-has-now-done-it-1000-times-celebrates-with-a-nazeem-only-battle-royale?utm_source=steam&utm_medium=referral"" target=""_blank"">Read more.</a>",1718394538,
72850,The voice of Skyrim's Sheogorath stars in a huge Fallout 4 mod you can play right now - and it was made in one weekend,"The Fallout community is good at coming together to create cool things, with the least of these being a huge <a href=""https://www.vg247.com/games/fallout-4"">Fallout 4</a> mod built in just one weekend to help raise money for a charity drive by legendary Fallout, Elder Scrolls, and Starfield voice actor Wes Johnson - who also stars in it. If you're out of the loop, for the past couple of years now a group of high-profile Fallout and Elder Scrolls modders have been coming together to build a big mod with features voted on by fans over the course of a single weekend - game jam style. It's just one of the many things organised by Johnson and <a href=""https://www.vg247.com/c3-skyrim-fallout-starfield-modding-event-interview-how-came-to-be"">charity initiative Fallout For Hope</a> to help raise money for the Alzheimer's Association during a yearly drive called <a href=""https://voiceapalooza.com/"">Wes Johnson's Voiceapalooza</a>. This year, the mod that was created - by a crew including the team behind the massive Fallout 4 Sim Settlements mod, <a href=""https://www.vg247.com/fallout-4-best-enclave-quest-mod-creator-reveals-how-it-came-to-be"">America Rising creator Thomas 'Otellino' Mitchell</a>, and <a href=""https://www.vg247.com/starfield-bethesda-hired-modder"">Emmi 'Elianora' Junkkari</a> - is '<a href=""https://www.nexusmods.com/fallout4/mods/84389"">Shady Motives</a>'. <a href=""https://www.vg247.com/fallout-4-mod-sheogorath-actor-charity-2024"">Read more</a> ",1718192180,
72850,New Skyrim mod gives its best side quest the expansion it deserves,"If <strong>Skyrim </strong>is great at anything, it's the incredible side stories. Between the Companions, College of Winterhold, and the war between the Stormcloaks and Imperials there's an entire world to get lost in, never mind Alduin's impending threat. Every time I revisit Skyrim my mind always goes back to the Dark Brotherhood, though, with the note of a handprint and the words ""we know"" one of the coolest mysteries in the entire game. Now, one of Skyrim's biggest modders has revamped the Dark Brotherhood, giving us all a reason to visit them again. <a href=""https://www.pcgamesn.com/skyrim/mod-dark-brotherhood"">Read the rest of the story...</a> RELATED LINKS: <a href=""https://www.pcgamesn.com/the-elder-scrolls-v-skyrim/games-like-skyrim"">Best games like Skyrim 2024</a> <a href=""https://www.pcgamesn.com/the-elder-scrolls-v-skyrim/skyrim-console-commands-and-cheats"">A list of all Skyrim console commands and cheats</a> <a href=""https://www.pcgamesn.com/skyrim/mod-new-region"">Skyrim mod adds a whole-new region one third the size of the base game</a> ",1717260768,
72850,Skyrim mod adds a whole-new region one third the size of the base game,"I love a <strong>Skyrim </strong>mod that's basically a piece of DLC, giving us all more reasons to lose countless hours to the RPG. Just when you thought Starfield or Fallout 4's next gen update could bring you back to a different Bethesda game, the dedicated modding community has done it again. With a whole new region, hundreds of quests, NPCs, locations, and entirely new lore to get engrossed in, welcome to the region of Shumer. <a href=""https://www.pcgamesn.com/skyrim/mod-new-region"">Read the rest of the story...</a> RELATED LINKS: <a href=""https://www.pcgamesn.com/skyrim/mod-wait-mechanic"">New Skyrim mod makes a terrific change inspired by Cyberpunk 2077</a> <a href=""https://www.pcgamesn.com/skyrim/mod-skyblivion-lockpicking"">New Skyrim mod fixes the one thing it ruined from Oblivion</a> <a href=""https://www.pcgamesn.com/the-elder-scrolls-v-skyrim/skywind-2024-update-video"">Ambitious Skyrim mod celebrates 22 years of Morrowind with new video</a> ",1715616536,
72850,New Skyrim mod makes a terrific change inspired by Cyberpunk 2077,"For every 'TurboChadd's UltraPleasure 7.0,' there's a <strong>Skyrim</strong> mod actually worth downloading. The most popular creations are still texture overhauls and UI improvements all these years later, with players responding well to minor, unobtrusive, and quality-driven changes. That's why it's my mission to separate the wheat from the chaff; the useful from the inane. To that end, I've found yet another small but impactful Skyrim creation, and this one's inspired by the work of CD Projekt Red on The Witcher 3 and Cyberpunk 2077. <a href=""https://www.pcgamesn.com/skyrim/mod-wait-mechanic"">Read the rest of the story...</a> RELATED LINKS: <a href=""https://www.pcgamesn.com/skyrim/mod-new-region"">Skyrim mod adds a whole-new region one third the size of the base game</a> <a href=""https://www.pcgamesn.com/skyrim/mod-skyblivion-lockpicking"">New Skyrim mod fixes the one thing it ruined from Oblivion</a> <a href=""https://www.pcgamesn.com/the-elder-scrolls-v-skyrim/skywind-2024-update-video"">Ambitious Skyrim mod celebrates 22 years of Morrowind with new video</a> ",1715528144,
72850,New Skyrim mod fixes the one thing it ruined from Oblivion,"<strong>Skyrim</strong> is a timeless RPG for good reason. The sense of exploration, the ability to freely level and build your character, and the endless supply of excellent mods all make for an experience that rightfully lives on over a decade later. Why do you think I keep writing about it after all these years? That said, the jump from Oblivion to Skyrim saw Bethesda change one feature for the worse, but this mod just changed it back while making it even better. <a href=""https://www.pcgamesn.com/skyrim/mod-skyblivion-lockpicking"">Read the rest of the story...</a> RELATED LINKS: <a href=""https://www.pcgamesn.com/the-elder-scrolls-v-skyrim/skywind-2024-update-video"">Ambitious Skyrim mod celebrates 22 years of Morrowind with new video</a> <a href=""https://www.pcgamesn.com/the-elder-scrolls-v-skyrim/mod-combat-overhaul"">New Skyrim mod gives combat a major dynamic overhaul</a> <a href=""https://www.pcgamesn.com/best-dragon-games"">The best dragon games on PC 2024</a> ",1714843252,
72850,Insanely ambitious Elder Scrolls remake Skyblivion shows off another reason it's not releasing until 2025: refreshed dungeons with unique appearances for each region,"Every time the volunteer team behind Skyblivion, a fan-made remake of The Elder Scrolls 4: Oblivion, comes out with a new dev update, I make the same mistake. I figure, ""I know what they&apos;re all about, I&apos;ve played Oblivion for a million hours, nothing here can surprise me."" Well color me surprised, the team&apos;s <a href=""https://www.youtube.com/watch?v=ZZ2w3ciSVEQ&ab_channel=Rebelzize"" target=""_blank"">latest development diary</a> really got me going. Skyblivion is going to do things with Cyrodiil&apos;s Ayleid ruins and Skyrim&apos;s UI that have me giddy as a longtime Oblivion sicko... <a href=""https://www.pcgamer.com/games/rpg/insanely-ambitious-elder-scrolls-remake-skyblivion-shows-off-another-reason-its-not-releasing-until-2025-refreshed-dungeons-with-unique-appearances-for-each-region?utm_source=steam&utm_medium=referral"" target=""_blank"">Read more.</a>",1714778095,
72850,Modder adds the one thing Skyrim has always been missing: Crippling psychological stress,"Skyrim bills itself as a fantasy RPG: A sprawling adventure in which you treat with gods and write your name into myth and legend. But it&apos;s not that, really. For most of us, it&apos;s a life sim. A way to live out a new existence as some kind of itinerant lizardman. Sure, you probably still rack up a kill count in the thousands, but I think the majority of players like Skyrim because it provides a space to exist in and explore, rather than for the grandeur of its main plot... <a href=""https://www.pcgamer.com/games/the-elder-scrolls/modder-adds-the-one-thing-skyrim-has-always-been-missing-crippling-psychological-stress?utm_source=steam&utm_medium=referral"" target=""_blank"">Read more.</a>",1714754362,
72850,Ambitious Skyrim mod celebrates 22 years of Morrowind with new video,"Some mods aren't just ambitious, they're almost akin to making an entire game from scratch. Skywind, the huge upcoming <strong>Skyrim</strong> mod which will incorporate all of Morrowind, definitely fits that bill. In development for over a decade, the team behind the mod has just released a brand new video to celebrate 22 years of Morrowind, giving the first major update on the project for a while. <a href=""https://www.pcgamesn.com/the-elder-scrolls-v-skyrim/skywind-2024-update-video"">Read the rest of the story...</a> RELATED LINKS: <a href=""https://www.pcgamesn.com/the-elder-scrolls-iii-morrowind-game-of-the-year-edition/tamriel-rebuilt-art"">This massive Morrowind mod shares its brilliant behind-the-scenes art</a> <a href=""https://www.pcgamesn.com/the-elder-scrolls-v-skyrim/skywind-halloween"">Morrowind in Skyrim mod Skywind is looking horrifyingly good</a> <a href=""https://www.pcgamesn.com/morrowind/tamriel-rebuilt-andaram"">Colossal Morrowind mod now boasts more quests than Bethesda's game</a> ",1714605131,
72850,"Streamer lets viewers add custom voice lines to Skyrim NPCs, immediately realises their mistake: 'I formally apologise and regret my life choices'","I has had a pretty controversial role across the gaming industry as of the past couple of years including&#x2014;but certainly not limited to&#x2014;designing NPCs. Recently, Ubisoft debuted uncanny AI-powered <a href=""https://www.pcgamer.com/software/ai/ubisoft-shows-off-ai-powered-neo-npcs-at-gdc-it-could-be-the-start-of-a-fantastic-paradigm-shift-but-lets-be-honest-it-probably-wont/"">""neo NPCs""</a>, and to say I&apos;m sceptical of the tech&apos;s actual uses is an understatement. <a href=""https://www.twitch.tv/blurbs"" target=""_blank"">Streamer Blurbs</a>, however, has finally gotten me on board with at least one: letting his chat inject the most cursed custom voice lines into the denizens of Skyrim like a bunch of smutty skinwalkers... <a href=""https://www.pcgamer.com/games/the-elder-scrolls/streamer-lets-viewers-add-custom-voice-lines-to-skyrim-npcs-immediately-realises-their-mistake-i-formally-apologise-and-regret-my-life-choices?utm_source=steam&utm_medium=referral"" target=""_blank"">Read more.</a>",1714474392,
72850,New Skyrim mod gives combat a major dynamic overhaul,"Almost 13 years since it launched, <strong>Skyrim</strong> is still a marvel, but the overall combat experience hasn't aged too well. Bethesda's latest single-player take on Tamriel has an astounding atmosphere, a sense of discovery, and a diverse skill-based leveling system that keeps me coming back, but fights can feel stale. This is where modders come in, and one of the best to ever do it has just added a dynamic storytelling system to the game's combat. <a href=""https://www.pcgamesn.com/the-elder-scrolls-v-skyrim/mod-combat-overhaul"">Read the rest of the story...</a> RELATED LINKS: <a href=""https://www.pcgamesn.com/best-dragon-games"">The best dragon games on PC 2024</a> <a href=""https://www.pcgamesn.com/elder-scrolls-v-skyrim/100-best-skyrim-mods"">Best Skyrim mods 2024</a> <a href=""https://www.pcgamesn.com/skyrim/mod-underwhelming-quest"">New Skyrim mod vastly improves the game's most underwhelming quest</a> ",1714412714,
72850,"After spending $15k on their Skyrim VR setup, one streamer has added a haptic suit just to feel pain","A <strong>Skyrim VR</strong> streamer who spent $15,000 on a VR setup just for the <strong>Bethesda</strong> game has added a new element into the mix: actual pain. You ever feel like video games don't feel real enough to you? Sure, you can put on a headset and experience games in first-person thanks to VR tech, but you can't feel anything exactly. There's always putting on a haptic feedback suit, but even then, something's missing… The true way to experience a game is to feel the very pain your character is feeling, something that Skyrim VR and Fallout VR streamer Gingas has decided to put themselves through for the sake of entertainment (thanks, <a href=""https://www.gamesradar.com/games/rpg/skyrim-vr-player-who-spent-dollar15k-on-the-most-immersive-setup-adds-a-second-haptic-suit-to-simulate-real-pain/"">GamesRadar</a>). GingasVR has already done a bit of work to make Skyrim VR a bit more of an immersive experience, which she <a href=""https://www.gamesradar.com/meet-the-vr-enthusiast-who-spent-dollar15000-to-make-skyrim-as-immersive-as-possible/"">put around $15,000 into</a>, alongside some mods for things like physics and more accurate body movements via three Vive trackers. She also uses a fan to simulate wind and weather, and she does have a haptic vest to feel all sorts of things. Now, as she shared in a video earlier this week, she's added another vest on top of that - one that electrocutes her anytime she feels pain. <a href=""https://www.vg247.com/skyrim-vr-streamer-takes-the-next-step-adds-haptic-suit-to-feel-pain?utm_source=feed&utm_medium=rss&utm_campaign=steam"">Read more</a> ",1714317513,
72850,"Amid Fallout TV show fever, Nexus Mods says it's been dishing out as much data as downloading Skyrim ""twice per second"" would involve","While <a href=""https://www.vg247.com/games/fallout-4"">Fallout 4's</a> next-gen update <a href=""https://www.vg247.com/fallout-4-next-gen-update""> hasn't even dropped yet</a>, Amazon's <a href=""https://www.vg247.com/tv-shows/fallout"">Fallout TV show</a> has already been driving droves of players back to the series. Naturally, a lot these returning wastelanders have been grabbing mods to spice up their experiences - about two Skyrim's per second worth, actually. Yup, as they fill the void of not having a second season to immediately binge - <a href=""https://www.vg247.com/fallout-tv-show-season-two-officially-confirmed"">though one is very much on the way</a> - people have been busy downloading plenty of overhauls, <a href=""https://www.vg247.com/fallout-4-mod-fallout-tv-show-lucy-pistol"">weapons</a>, and even <a href=""https://www.vg247.com/fallout-4-mod-walton-goggins-fallout-show-billboards"">Walton Goggins billboards</a>. As outlined in a <a href=""https://www.nexusmods.com/news/14958"">new post</a> by community manager Demorphic, modding site Nexus Mods has basically been struggling to keep up with that demand for the past little bit. <a href=""https://www.vg247.com/fallout-fever-nexus-mods-two-skyrim-worth-of-data?utm_source=feed&utm_medium=rss&utm_campaign=steam"">Read more</a> ",1713864111,
72850,"Bethesda would ""probably say no"" to an Elder Scrolls show or movie","With the Fallout live-action show now out and honestly far better than I was expecting, are Bethesda also brewing an adaptation of their other big RPG series, The Elder Scrolls? Not at present, according to Bethesda executive producer Todd Howard, and he says he'd ""probably say no"" if approached. Mind you, that was the stance he had until Fallout finally fell into place. <a href=""https://www.rockpapershotgun.com/bethesda-would-probably-say-no-to-an-elder-scrolls-show-or-movie?utm_source=feed&utm_medium=rss&utm_campaign=steam"">Read more</a> ",1712923430,
72850,Is an Elder Scrolls TV show going to follow Fallout? Bethesda doesn't seem to be in any rush,"Amazon's <a href=""https://www.vg247.com/tv-shows/fallout"">Fallout TV Show</a> is here now, but before it was, the show had a swanky Hollywood premiere that I'm sure my invite for got lost in the post. At that premiere, snazzily dressed Todd Howard said some things, and some of these things were about the potential idea of an Elder Scrolls adaptation. When it comes to such a thing, it sounds like Howard's plan is - simply put - to keep on being picky. Yup, picky, but in what should be a good way. After all, if someone's going to turn the Lusty Argonian Maid into the blockbuster hit of summer 2034, we need to make sure they understand what the political climate of Morrowind was like when Crassius Curio wrote the damn thing. Speaking to <a href=""https://www.ign.com/articles/todd-howard-on-other-bethesda-adaptations-after-fallout-ill-probably-say-no-but-you-never-know"">IGN</a> on the red carpet, Howard was asked about the idea of other Bethesda IPs potentially getting the adaptation treatment, be that a TV show like Fallout or something else. ""I don't know. There's nothing in the works,"" the BGS big cheese said. <a href=""https://www.vg247.com/elder-scrolls-show-fallout-bethesda-happy-wait?utm_source=feed&utm_medium=rss&utm_campaign=steam"">Read more</a> ",1712846430,
