appid,title,contents,date,tags
72850,"Lead Skyrim designer argues that Bethesda's primeval Creation Engine is 'perfectly tuned' to the studio's needs, so an Unreal switcheroo probably isn't in the cards","In an interview with <a href=""https://www.videogamer.com/features/skyrim-lead-designer-bethesda-unreal-tech-debt/"" target=""_blank"">VideoGamer</a>, ex-Bethesda developer Bruce Nesmith defended the studio's continued use of its proprietary Creation Engine and predicted that the RPG giant would likely stick with the tech in the future, even as more big name devs like BioWare, CD Projekt, and Halo Studios (formerly 343 Industries) trade in their bespoke engines for Epic Games' ubiquitous Unreal... <a href=""https://www.pcgamer.com/games/the-elder-scrolls/lead-skyrim-designer-argues-that-bethesdas-primeval-creation-engine-is-perfectly-tuned-to-the-studios-needs-so-an-unreal-swaparoo-probably-isnt-in-the-cards?utm_source=steam&utm_medium=referral"" target=""_blank"">Read more.</a>",1728763831,
72850,The biggest Skyrim mod just got the modern overhaul it deserves,"It's hard to overstate just how vital great UI is to a game. Every single setting, mechanic, and feature is unified under one style and presented to the player in a way that should, hopefully, enhance the overall experience. Sometimes UI becomes the soul of the presentation, with Persona 5's bold red, white, and black combinations defining so much of your time in-game. Elsewhere UI is diegetic, with Dead Space's holograms existing within the game itself, pulling you right into the worst day of Isaac Clarke's life. The importance of the <strong>Skyrim</strong> UI is no different, but that's why this brand-new mod is worth checking out. <a href=""https://www.pcgamesn.com/skyrim/mod-ui"">Read the rest of the story...</a> RELATED LINKS: <a href=""https://www.pcgamesn.com/the-elder-scrolls-v-skyrim/new-vampire-mod"">Huge new Skyrim mod plunges you into the middle of a vampire war</a> <a href=""https://www.pcgamesn.com/the-elder-scrolls-v-skyrim/skyrim-console-commands-and-cheats"">All Skyrim console commands and cheats</a> <a href=""https://www.pcgamesn.com/skyrim/grandma-retires"">Beloved Skyrim Grandma retiring from gaming videos after nine years</a> ",1728481422,
72850,Huge new Skyrim mod plunges you into the middle of a vampire war,"If you ever needed an example of why modding is so important for the longevity of a game, look no further than <strong>Skyrim</strong>. It's been out 13 years and is still going strong, in part due to the base game and the sheer joy of spending time in it, but partially due to how well supported it is from a modding standpoint. A massive, vampiric new mod has just arrived and it's a big one with tons of content to explore, and what's more it has Bethesda's official blessing. <a href=""https://www.pcgamesn.com/the-elder-scrolls-v-skyrim/new-vampire-mod"">Read the rest of the story...</a> RELATED LINKS: <a href=""https://www.pcgamesn.com/skyrim/mod-ui"">The biggest Skyrim mod just got the modern overhaul it deserves</a> <a href=""https://www.pcgamesn.com/the-elder-scrolls-v-skyrim/skyrim-console-commands-and-cheats"">All Skyrim console commands and cheats</a> <a href=""https://www.pcgamesn.com/skyrim/grandma-retires"">Beloved Skyrim Grandma retiring from gaming videos after nine years</a> ",1728412965,
72850,This cursed Skyrim mod flips the entire game horizontally like Mario Kart's mirror mode and it's weirdly very upsetting,"Mirroring an image is one of life&apos;s secret horrors. Ever flipped a photo of yourself to see how you look to everyone else, had an existential crisis, then done everything in your power to scrub the image from your brain bank? No, just me? Okay, what about flipping the entire world of Skyrim like it&apos;s Mario Kart&apos;s mirror mode? If that doesn&apos;t give you the heebie-jeebies, I don&apos;t know what will... <a href=""https://www.pcgamer.com/games/rpg/this-cursed-skyrim-mod-flips-the-entire-game-horizontally-like-mario-karts-mirror-mode-and-its-weirdly-very-upsetting?utm_source=steam&utm_medium=referral"" target=""_blank"">Read more.</a>",1728046657,
72850,"Activision said 'no' to Skyrim modders 3 years into remaking a semi-obscure vampire RPG it published a lifetime ago, so now those modders are reworking it into a new story","The modding team behind <a href=""https://www.youtube.com/watch?v=K8cO6HrgEuM&ab_channel=Galejro"" target=""_blank"">Vampire: The Masquerade - Redemption Reawakened</a> was in a weird spot. Hoping to avoid the DMCA/C&D death punch so many fan projects receive, they took their in-progress Skyrim remake of the 2000 RPG to Activision and Paradox, each of which owns the rights to part of the game. With a ""yes"" from Paradox and a ""no"" from Activision, the crew is now revising the mod into a ""reinterpretation"" of the original VtM: Redemption, cutting out everything Activision could sue them for and making it into more of a new story... <a href=""https://www.pcgamer.com/games/rpg/activision-said-no-to-skyrim-modders-3-years-into-remaking-a-semi-obscure-vampire-rpg-it-published-a-lifetime-ago-so-now-those-modders-are-reworking-it-into-a-new-story?utm_source=steam&utm_medium=referral"" target=""_blank"">Read more.</a>",1727732584,
72850,"'I'm just doing it for fun, and it isn't fun anymore': Skyrim Grandma Shirley Curry is hanging up her gauntlets and retiring from making gaming videos","fter nine years of traversing northern Tamriel and amassing over one million subscribers on YouTube, Skyrim Grandma Shirley Curry is done with making gaming videos... <a href=""https://www.pcgamer.com/games/rpg/im-just-doing-it-for-fun-and-it-isnt-fun-anymore-skyrim-grandma-shirley-curry-is-hanging-up-her-gauntlets-and-retiring-from-making-more-gaming-videos?utm_source=steam&utm_medium=referral"" target=""_blank"">Read more.</a>",1727094458,
72850,Beloved Skyrim Grandma retiring from gaming videos after nine years,"Videogames can be a toxic space. Opinions, spirited debates, and hate can make it hard to find joy in the medium we all love so much. There a pockets of delight to be found though, and for almost a decade the YouTuber '<strong>Skyrim</strong> Grandma' has been fostering one. Known by Bethesda, fans, and the wider YouTube community as someone who just loves playing Skyrim for the thrill of the game, she affectionately calls her audience her ""grandkids."" The Skyrim Grandma's time with videogames has abruptly come to an end though, before Elder Scrolls 6, as she's announced that she's done with gaming videos. <a href=""https://www.pcgamesn.com/skyrim/grandma-retires"">Read the rest of the story...</a> RELATED LINKS: <a href=""https://www.pcgamesn.com/the-elder-scrolls-v-skyrim/skyrim-console-commands-and-cheats"">All Skyrim console commands and cheats</a> <a href=""https://www.pcgamesn.com/the-elder-scrolls-v-skyrim/mod-achievements"">New Skyrim mod gives you a big reason to play more community creations</a> <a href=""https://www.pcgamesn.com/elder-scrolls-v-skyrim/100-best-skyrim-mods"">Best Skyrim mods 2024</a> ",1727092947,
72850,"Skyrim grandma Shirley Curry has announced she's retiring from YouTube let's plays because ""it isn't fun anymore""","She's been making gaming videos for almost a decade now, but <a href=""https://www.vg247.com/games/the-elder-scrolls-v-skyrim"">Skyrim</a> Grandma Shirley Curry has announced she's semi-retiring. <a href=""https://www.vg247.com/skyrim-grandma-shirley-curry-is-retiring-from-youtube-lets-plays"">Read more</a> ",1727088801,
72850,New Skyrim mod gives you a big reason to play more community creations,"<strong>Skyrim</strong> mods come in all shapes and sizes: for every DLC-scale quest mod we also get tiny, mechanical shifts in how we play the RPG. Even unassuming mods can prove to be the most popular. A simple change to the UI has over 17 million downloads, for example. To me, this is the beauty of the still-thriving community as even after 11 years, we're finding ways to rewrite our experience across Tamriel. Today, another small creation with huge ambition grabbed my attention, and if utilized properly it could change how we interact with Skyrim mods forever. <a href=""https://www.pcgamesn.com/the-elder-scrolls-v-skyrim/mod-achievements"">Read the rest of the story...</a> RELATED LINKS: <a href=""https://www.pcgamesn.com/the-elder-scrolls-v-skyrim/skyrim-console-commands-and-cheats"">All Skyrim console commands and cheats</a> <a href=""https://www.pcgamesn.com/skyrim/grandma-retires"">Beloved Skyrim Grandma retiring from gaming videos after nine years</a> <a href=""https://www.pcgamesn.com/elder-scrolls-v-skyrim/100-best-skyrim-mods"">Best Skyrim mods 2024</a> ",1727022157,
72850,Grab $121 worth of classic Elder Scrolls games for 84% off,"RPG fans will be happy to hear that there's a new <strong>Elder Scrolls</strong> bundle over on Fanatical. From more recent entries like The Elder Scrolls Online and Skyrim to classics like Morrowind and Oblivion, this bundle gets you a vast chunk of the series' history in one affordable $22.49 / £20.99 package. <a href=""https://www.pcgamesn.com/the-elder-scrolls-v-skyrim/fanatical-bundle"">Read the rest of the story...</a> RELATED LINKS: <a href=""https://www.pcgamesn.com/gravastar/mercury-k1-pro-gaming-keyboard"">This new gaming keyboard looks like it could walk off your desk</a> <a href=""https://www.pcgamesn.com/steam-deck/beta-update-3-6-12"">This new Steam Deck update fixes the big issues from the last one</a> <a href=""https://www.pcgamesn.com/lenovo/legion-go-charging-connector"">This Legion Go add on makes it the most comfortable Steam Deck rival</a> ",1725555764,
72850,The Elder Scrolls V: Skyrim - Game Launcher Update,The Skyrim game launcher was updated to improve data file handling and support streaming platforms. Game Launcher Update Version: 1.3.23.0,1725551911,['patchnotes']
72850,"Thanks to mods, a Skyrim streamer is now basically vlogging their playthrough live from Tamriel as a Dragonborn influencer","Ever natter to yourself while you're playing <a href=""https://www.vg247.com/games/the-elder-scrolls-v-skyrim"">Skyrim</a>? It's ok, we all do it, even if it's just yelling expletives whenever we're playing on legendary difficulty and get ambushed by a dragon while overcumbered. Now, though, a Twitch streamer's taken this kind of thing to the next level, by turning their broadcasts into a live vlog from Tamriel thanks to a mod that lets them voice the Dragonborn in real time. Add in the fact that their Twitch chat's able to voice NPCs in the game, and you've got a recipie for a fun playthrough, if not a very lore-friendly one. The streamer in question, Blurbs, had already drawn a lot of attention when they managed to perfect having random stream watchers insult them and generally talk bollocks through the mouths of everyone from <a href=""https://www.twitch.tv/blurbs/clip/RichTsundereGoshawkUncleNox-vXIv9emIqGLBwDfj?filter=clips&range=all&sort=time"">Dark Brotherhood assassins</a> to <a href=""https://www.twitch.tv/blurbs/clip/AltruisticPricklySnoodFutureMan-lTH66R1_LwllV9DJ?filter=clips&range=all&sort=time"">children</a> eariler this year, and now they're back with a mod which lets them voice the Dragonborn live as they play, simply by talking into their mic. <a href=""https://www.vg247.com/skyrim-streamer-dragonborn-vlogging-voice-mod"">Read more</a> ",1724845146,
72850,Skyrim's massive Skywind mod gets impressive map tour and new features,"Bethesda's games have become legendary for their ambitious modding scenes, and no title is a better example of that than <strong>Skyrim</strong>, the most-modded game of all time. Arguably the <em>most</em> ambitious mod on the way for Bethesda's nearly 14-year-old RPG, however, is Skywind. In a massive two-hour development update stream, the mod creators have toured its impressive map and even revealed new features that take the mod project to new heights. <a href=""https://www.pcgamesn.com/the-elder-scrolls-v-skyrim/skywind-developer-update-map-tour"">Read the rest of the story...</a> RELATED LINKS: <a href=""https://www.pcgamesn.com/the-elder-scrolls-v-skyrim/skyrim-console-commands-and-cheats"">All Skyrim console commands and cheats</a> <a href=""https://www.pcgamesn.com/elder-scrolls-v-skyrim/100-best-skyrim-mods"">Best Skyrim mods 2024</a> <a href=""https://www.pcgamesn.com/the-elder-scrolls-iv-oblivion/remake-skyrim-mod-skyblivion"">Huge Oblivion remake built in Skyrim is enough to make Bethesda blush</a> ",1724604184,
72850,"Skyblivion, the massive mod remaking Oblivion in Skyrim's engine, looks pretty great as devs show off some fresh quest gameplay ahead of 2025 release","The team behind <a href=""https://www.vg247.com/topics/skyblivion"">Skyblivion</a>, the massive modding project that’s remaking <a href=""https://www.vg247.com/games/the-elder-scrolls-iv-oblivion"">The Elder Scrolls IV</a> - yep, the one where everyone’s faces look a bit hilarious - in <a href=""https://www.vg247.com/games/the-elder-scrolls-v-skyrim"">Skyrim</a>’s engine, has just shared some fresh quest gameplay. There’s a bit of Mages Guild, a bit of a scuffle on a farm, and all of it looks pretty great, aside from the odd bug. Right off the bat in this latest showcase, the Skyblivion devs provided an update on how development is progressing, with the video’s narrator revealing that things are still on track for the 2025 release date the group has previously set. So, what’ve we gotten a look at this time around? Well, two classic Oblivion quests, in the form of Fingers of the Mountain and The Killing Field, with the latter looking to have been renamed to Killing Fields. <a href=""https://www.vg247.com/skyblivion-skyrim-oblivion-remake-mod-side-quest-gameplay-showcase"">Read more</a> ",1723730978,
72850,Huge Oblivion remake built in Skyrim is enough to make Bethesda blush,"Between Starfield Shattered Space and, presumably, The Elder Scrolls 6, Bethesda has a lot to do right now. But that doesn't mean its apocalyptic and fantasy worlds lie dormant. Fallout London is a wonderful fan-built spinoff to everyone's favorite post-nuclear shooter, and now <strong>Skyblivion</strong>, a total Oblivion remake built inside the Skyrim engine, is inbound for 2025 - and just got some sweeping new gameplay footage. Showcasing side quests, perhaps the most important part of any Elder Scrolls game, while Bethesda dev work hard on the official sequels, this should be enough to make them proud. <a href=""https://www.pcgamesn.com/the-elder-scrolls-iv-oblivion/remake-skyrim-mod-skyblivion"">Read the rest of the story...</a> RELATED LINKS: <a href=""https://www.pcgamesn.com/quakecon-2023-sale"">QuakeCon sale gives you up to 85% off these essential FPS games</a> <a href=""https://www.pcgamesn.com/the-elder-scrolls-v-skyrim/skyblivion-death-threats"">Elder Scrolls Oblivion remake dev talks ""death threats"" and ""stalking""</a> <a href=""https://www.pcgamesn.com/oblivion-skyrim-remake"">Oblivion's remake in Skyrim shows off ten minutes of new footage</a> ",1723725003,
72850,"""We had ridiculous scenes happening"" Fallout: London's devs had to ditch rideable horses and bikes because they wouldn't stop flying up buildings","<a href=""https://www.vg247.com/games/fallout-london"">Fallout: London</a>’s massive, but naturally there’s still some stuff that didn’t quite make it into the <a data-keyword=""true"" href=""https://www.vg247.com/games/fallout-4"">Fallout 4</a> mod. For example, in addition to the <a href=""https://www.vg247.com/fallout-london-mod-cut-new-vegas-style-wild-card-main-quest-future-update"">whole cut Wild Card questline that’ll be arriving in a future update</a>, the team had a go at making rideable horses and bikes. Yep, if you’ve not run into Fallout: London’s Sleipnir - eight-legged post-apocalyptic horses which look just as terrifying and goofy as they sound - there were once plans to let you clip clop about the capital on one of them. Sadly, the mutated broncos shared a bit too much DNA with their Elder Scrolls cousins to make them worth keeping in. <a href=""https://www.vg247.com/we-had-ridiculous-scenes-happening-fallout-londons-devs-had-to-ditch-rideable-horses-and-bikes-because-they-wouldnt-stop-flying-up-buildings"">Read more</a> ",1723479460,
72850,"Are Skyrim and Baldur's Gate 3 immersive sims? If you're asking one of the guys that created Dishonored, yes","The infinite debate about what is and isn't an immersive sim continues to rage on, as one of the co-creators of <a href=""https://www.vg247.com/games/dishonored"">Dishonored</a> says he thinks <a href=""https://www.vg247.com/games/the-elder-scrolls-v-skyrim"">Skyrim</a> is one. Immersive sim, as a genre, is a really hard one to define. I'm not even going to try to define it in any meaningful way for you, I just know that games like Thief, Dishonored, and Deus Ex fit within that genre. It's a type of game that has major qualities of lots of other genres, which is why it can be hard to define. But in a recent interview with <a href=""https://www.pcgamer.com/games/rpg/arkane-founder-says-skyrim-is-an-immersive-sim-and-baldurs-gate-3-is-immersive-sim-adjacent/?utm_campaign=socialflow&utm_source=twitter.com&utm_medium=social"">PC Gamer</a>, Dishonored co-creator and <a href=""https://www.vg247.com/companies/arkane-lyon"">Arkane</a> founder Raphael Colantonio has shared the bold opinion that he thinks Skyrim is an immersive sim (and that <a href=""https://www.vg247.com/games/baldurs-gate-iii"">Baldur's Gate 3</a> is ""immersive-sim adjacent""). Explaining himself, Colantonio said ""If you really think about it, Bethesda games - or Obsidian games - are very, very immersive sim. The overlap between first-person RPG and immersive sim, it's very blurry. I would say they are less physical than Arkane games, and they're more on the stats, but at the end of the day they totally rely on simulation. Doing things such as fooling a merchant by putting a bucket on its head is definitely an immersive same thing, right?"" <a href=""https://www.vg247.com/are-skyrim-baldurs-gate-3-immersive-sims-dishonored-co-creator-says-yes"">Read more</a> ",1723461172,
72850,"Arkane founder says Skyrim is an immersive sim, and Baldur's Gate 3 is 'immersive sim-adjacent'","WolfEye, the studio founded by Dishonored co-creator Raphael Colantonio, has a new game coming out. It&apos;s apparently a <a href=""https://www.pcgamer.com/games/the-next-game-from-dishonored-co-creator-raphael-colantonio-is-a-first-person-immersive-sim-with-a-structure-between-prey-and-fallout-new-vegaswere-going-for-density-over-size/"">first-person immersive sim with a structure between Prey and Fallout: New Vegas</a>, and that&apos;s exactly the kind of thing we at PC Gamer HQ need to hear to rev up the hype engines... <a href=""https://www.pcgamer.com/games/rpg/arkane-founder-says-skyrim-is-an-immersive-sim-and-baldurs-gate-3-is-immersive-sim-adjacent?utm_source=steam&utm_medium=referral"" target=""_blank"">Read more.</a>",1723344575,
72850,New Skyrim mod overhauls the aging combat with realistic dismemberment,"<strong>Skyrim</strong>'s combat has not aged well. Weapons and magic are the weakest part of Bethesda's crowning RPG, and after a decade each is more akin to hacking at a tree stump or clapping your hands together. Bethesda did a great job modernizing its shooting mechanics in Fallout 4 and Starfield, but we're still waiting on the team to do the same with Elder Scrolls 6's combat. Until then, this new Skyrim mod does something truly astounding and adds a dense dismemberment system to the game, making fights feel new again. <a href=""https://www.pcgamesn.com/the-elder-scrolls-v-skyrim/mod"">Read the rest of the story...</a> RELATED LINKS: <a href=""https://www.pcgamesn.com/the-elder-scrolls-v-skyrim/bards-college-dlc"">Unofficial new Skyrim DLC feels like it was actually made by Bethesda</a> <a href=""https://www.pcgamesn.com/best-dragon-games"">The best dragon games on PC 2024</a> <a href=""https://www.pcgamesn.com/the-elder-scrolls-v-skyrim/skyrim-console-commands-and-cheats"">All Skyrim console commands and cheats</a> ",1723314072,
72850,Unofficial new Skyrim DLC feels like it was actually made by Bethesda,"13 years since <strong>Skyrim</strong> first arrived, and with Bethesda's attention currently turned towards Starfield and Shattered Space, the days of official new material for the fantasy RPG are almost certainly behind us. But The Elder Scrolls 5 is eternal. From the maker of superlative Fallout 4 mod Sim Settlements, Bards College, a new, unofficial Skyrim expansion, is so professional, so polished, and so big that it feels like it's come directly from the House of Howard. The Elder Scrolls 6 may be a while away, but we now have a new quest line, expanded shouts, music and singing mechanics, and, essentially, a fresh full faction to rival the Thieves Guild and the Blades. Oh, and the whole thing is out right now. <a href=""https://www.pcgamesn.com/the-elder-scrolls-v-skyrim/bards-college-dlc"">Read the rest of the story...</a> RELATED LINKS: <a href=""https://www.pcgamesn.com/the-elder-scrolls-v-skyrim/mod"">New Skyrim mod overhauls the aging combat with realistic dismemberment</a> <a href=""https://www.pcgamesn.com/best-dragon-games"">The best dragon games on PC 2024</a> <a href=""https://www.pcgamesn.com/the-elder-scrolls-v-skyrim/skyrim-console-commands-and-cheats"">All Skyrim console commands and cheats</a> ",1723220385,
72850,"""Who lets you into the cool kids club?"" Fallout: London's project lead on Bethesda's Creations and the ever-controversial issue of paying for mods","Paying for mods. If you’ve ever said those three words to anyone who plays games or makes mods for them, odds are you got a pretty strongly held opinion in response, or at least an acknowledgment that - as many Facebook relationship statuses say - it’s complicated. With Bethesda’s latest attempt at creating a system designed to facilitate such a thing having <a href=""https://www.vg247.com/skyrim-paid-mods-creations-debate-interview"">proven pretty much as polarising as its predecessors</a>, we recently asked Dean ‘Prilladog’ Carter, project manager of the massive and free <a href=""https://www.vg247.com/games/fallout-4"">Fallout 4</a> mod <a href=""https://www.vg247.com/games/fallout-london"">Fallout: London</a>, how he views the current state of play when it comes to whether mods are paid, or remain free to play. &ldquo;I wish they would just choose something,&rdquo; Carter said when I brought up Bethesda’s Creations in the interview, which also featured chat about <a href=""https://www.vg247.com/fallout-london-mod-cut-new-vegas-style-wild-card-main-quest-future-update"">the cut quest line that’ll be arriving in a future update</a> and <a href=""https://www.vg247.com/fallout-london-project-lead-on-how-john-bercow-neil-newbon-cameos-came-about"">how both John Bercow and Neil Newbon ended up starring in it</a>. <a href=""https://www.vg247.com/fallout-london-project-lead-on-bethesda-creations-paid-mods"">Read more</a> ",1723194425,
72850,"After half a year of layoffs and closures, more than 240 Bethesda workers come together to unionise","It's a big day for the labour movement in the games industry, as 241 <a href=""https://www.vg247.com/companies/bethesda"">Bethesda</a> staffers have formed a union. Yesterday evening, Bethesda Game Studios workers announced it had formed a union under the Communication Workers of America (CWA), making it the first studio to fully do so since being acquired by <a href=""https://www.vg247.com/companies/microsoft"">Microsoft</a>. Bethesda Montreal filed for unionisation <a href=""https://www.gamesindustry.biz/bethesda-montreal-files-for-unionisation"">last month</a>, and QA workers at Zenimax, Bethesda's parent company, <a href=""https://www.gamesindustry.biz/zenimax-qa-workers-form-union"">did the same in 2023</a>, but with the Dallas, Rockville, and Austin sites forming this union, the entirety of US-based Bethesda studios have now unionised. It's also the first ""wall-to-wall"" union at a Microsoft video game studio, as of the 241 workers that have unionised, there are members ""including artists, engineers, programmers and designers have either signed a union authorization card or indicated that they wanted union representation."" In a <a href=""https://code-cwa.org/stories/workers-bethesda-game-studios-achieve-union"">statement</a>, senior system designer and member of the CWA Mandi Parker said, ""We are so excited to announce our union at Bethesda Game Studio and join the movement sweeping across the video game industry. It is clear that every worker can benefit from bringing democracy into the workplace and securing a protected voice on the job. We’re thrilled to get down to brass tacks and win a fair contract, proving that our unity is a source of real power to positively shape our working conditions, our lives, and the company as a whole."" <a href=""https://www.vg247.com/bethesda-game-studios-workers-form-a-union"">Read more</a> ",1721466837,
