appid,title,contents,date,tags
72850,"Don't assume Skyblivion is getting spellcrafting, as its team say UI lead was consulted on delay video despite post suggesting otherwise","""As far as concerns that our UI Lead, Fallen, wasn't included in contributing to the delay announcement, that would be inaccurate,"" Flatt continued. ""He did not have a direct role in the video production, including filming and editing, but he did help review the script for accuracy (as did all department leads). After chatting with him, the confusion on his end was due to the time interval between us finishing the script and the video being finished, in which he forgot he had worked on the script."" Original story follows: <a href=""https://www.rockpapershotgun.com/games/skyblivion"">Skyblivion</a>, the massive modding project reinterpreting The Elder Scrolls 4 via <a href=""https://www.rockpapershotgun.com/games/the-elder-scrolls-v-skyrim"">Skyrim</a>'s engine, had its release officially <a href=""https://www.rockpapershotgun.com/skyblivions-release-has-been-delayed-to-2026-but-you-can-check-out-an-interactive-version-of-its-map"">delayed to 2026</a> earlier this week. The delay followed an ex-Skyblivion level and world designer Dee Keyes alleging that the mod's previous <a href=""https://www.rockpapershotgun.com/skyblivions-2025-release-goal-is-pointless-and-unachievable-claims-longtime-dev-accuses-two-leads-of-rushing-the-mod-out"">2025 release goal was ""unachievable""</a> earlier this year, in a post which also accused Skyblivion project lead Kyle 'Rebelzize' Rebel and implementation lead Heavy Burns of mismanaging communication within the mod's team. In response, Heavy Burns asserted that ""many"" of the claims in the ex-dev's post were ""either misrepresented or just untrue"". Now, in a Discord discussion emphasising that players shouldn't assume the spellcrafting mechanic the modders have had to cut from the initial release will be put back in down the line, Skyblivion's UI department lead has suggested they weren't consulted about what was said in the YouTube video announcing the mod's delay to next year. That'd be the delay announcement video which features a section specifically dedicated to the current status of Skyblivion's UI and mechanics. <a href=""https://www.rockpapershotgun.com/dont-assume-skyblivion-is-getting-spellcrafting-says-ui-lead-who-claims-they-werent-consulted-on-delay-video"">Read more</a> ",1764940917,
72850,"Skyblivion is 'in the best state it's ever been' but, you guessed it, it's also been delayed into 2026, and the dev team is once again asking for help to get it finished","There was a spot of <em>skycontroversy </em>earlier this year when former Skyblivion world designer Dee Keyes <a href=""https://www.pcgamer.com/games/the-elder-scrolls/ex-skyblivion-dev-says-it-was-never-in-the-state-that-the-videos-would-show-off-as-they-claim-its-crunching-on-a-pointless-and-unachievable-2025-release-goal-but-remaining-devs-seem-optimistic/"">took issue with the mega-mod's planned launch in 2025</a>. Keyes was critical of project management over ""crunching"" in pursuit of what he called ""a pointless and unachievable release date."" And it turns out he was right, at least about the 2025 release target being unachievable, because the launch has now been pushed to sometime in 2026... <a href=""https://www.pcgamer.com/games/rpg/skyblivion-is-in-the-best-state-its-ever-been-but-you-guessed-it-its-also-been-delayed-into-2026-and-the-dev-team-is-once-again-asking-for-help-to-get-it-finished/?utm_source=steam&utm_medium=referral"" target=""_blank"">Read more.</a>",1764802977,
72850,"Skyblivion's release has been delayed to 2026, but you can check out an interactive version of its map","<a href=""https://www.rockpapershotgun.com/games/skyblivion"">Skyblivion</a>, the massive mod remake of Oblivion in <a href=""https://www.rockpapershotgun.com/games/the-elder-scrolls-v-skyrim"">Skyrim</a>'s engine, won't be making its previously announced 2025 release goal, the team behind it have confirmed. Instead, the mod'll be coming out at some point in 2026, giving the team behind it extra time to overcome the final few hurdles and get it polished up. This news comes a few months after ex-Skyblivion level and world designer Dee Keyes called the 2025 release goal the mod's team set in 2023 <a href=""https://www.rockpapershotgun.com/skyblivions-2025-release-goal-is-pointless-and-unachievable-claims-longtime-dev-accuses-two-leads-of-rushing-the-mod-out"">""pointless and unachievable""</a>. Keyes also accused Skyblivion project lead Kyle 'Rebelzize' Rebel and implementation lead Heavy Burns of rushing the project out the door and mismanaging communication within the team, subsequently sharing more of his perspective on the project in a <a href=""https://www.rockpapershotgun.com/march-2026-would-be-a-fitting-skyblivion-release-window-says-former-dev-who-called-making-2025-unachievable"">video interview with RPS sister site Eurogamer</a>. In a response to Keyes' original claims, Heavy Burns asserted that ""many of the statements in his post are either misrepresented or just untrue"". <a href=""https://www.rockpapershotgun.com/skyblivions-release-has-been-delayed-to-2026-but-you-can-check-out-an-interactive-version-of-its-map"">Read more</a> ",1764780181,
72850,'A big document of stealth' requested by Todd Howard from a designer of one of the best stealth games of all time was the blueprint for Skyrim's most beloved playstyle,"I love stealth games, and I love playing a sneaky guy in bigger RPGs: Fallout, The Elder Scrolls, Cyberpunk. You best believe that, when given the option, I'm crouch walking for 80 hours straight. I'm not alone in that preference either: The Stealth Archer in Skyrim, which plays exactly how it sounds, is a memetic, fan-favorite playstyle in Bethesda's smash hit RPG, with <a href=""https://www.youtube.com/watch?v=yN1kZHv5l0U&list=WL&index=108&t=1387s"" target=""_blank"">guides</a>, <a href=""https://www.youtube.com/watch?v=SOKASxwYNcI&t=6s"" target=""_blank"">analysis</a>, and love letters galore on YouTube and Reddit... <a href=""https://www.pcgamer.com/games/the-elder-scrolls/we-owe-skyrims-beloved-stealth-archer-to-one-of-the-designers-of-an-all-time-classic-pc-stealth-game-who-wrote-todd-howard-a-big-document-of-stealth-in-20-different-games/?utm_source=steam&utm_medium=referral"" target=""_blank"">Read more.</a>",1763845051,
72850,Skyrim's hardest quest is raising my Fat Idiot Son,"When my 11-year-old son took a guard's arrow to the dome, it occurred to me I had failed as a parent. Rufus is—was, before the arm of the state converted him into a needlebook—my <a href=""https://www.nexusmods.com/skyrimspecialedition/mods/47941"" target=""_blank"">Fat Idiot Son</a>, a mod for Skyrim that promises ""a new level of realism, depth and challenge"" via the introduction of ""your useless, fat, stupid disappointment of a son."".. <a href=""https://www.pcgamer.com/games/the-elder-scrolls/skyrims-hardest-quest-is-raising-my-fat-idiot-son/?utm_source=steam&utm_medium=referral"" target=""_blank"">Read more.</a>",1763834400,
72850,"Skyrim's lead designer reckons open world games are 'almost a cliché statement' these days, and that Skyrim owes its continued popularity to a focus on player agency: 'We didn't put anything off limits'","Few games enjoy such a long stay in the conversation as <a href=""https://www.pcgamer.com/the-elder-scrolls-v-skyrim-review/"">The Elder Scrolls V: Skyrim</a>, one of the biggest and most celebrated fantasy RPGs ever released. And release it did, <a href=""https://www.pcgamer.com/skyrim-anniversary-edition-is-an-insubstantial-update-that-i-will-play-for-a-substantial-number-of-hours/"">again</a> and <a href=""https://www.pcgamer.com/how-skyrim-special-edition-works-and-doesnt-with-your-existing-saved-games-and-mods/"">again</a>—but it's hard to blame Bethesda for all those re-releases. The game's community is so enthusiastic that modders are practically making <a href=""https://www.pcgamer.com/games/rpg/after-a-decade-in-development-this-massive-skyrim-mod-adds-a-whole-new-region-50-new-dungeons-and-the-biggest-main-quest-youve-ever-played-in-skyrim/"">entire games</a> in the snowiest slice of Tamriel, and there's no sign they'll slow down any time soon... <a href=""https://www.pcgamer.com/games/the-elder-scrolls/skyrims-lead-designer-reckons-open-world-games-are-almost-a-cliche-statement-these-days-and-that-skyrim-owes-its-continued-popularity-to-a-focus-on-player-agency-we-didnt-put-anything-off-limits/?utm_source=steam&utm_medium=referral"" target=""_blank"">Read more.</a>",1760391299,
72850,"Massive Skyrim mod Lordbound soft launches, with lots of choice-heavy questing in a war-torn valley bigger than Solstheim","I dunno about you, but I usually dig a big <a href=""https://www.rockpapershotgun.com/games/the-elder-scrolls-v-skyrim"">Skyrim</a> <a href=""https://www.rockpapershotgun.com/best-skyrim-mods"">mod</a> that threatens to make my number of hours spent padding around Tamriel even more ludicrous. Lordbound is the latest danger to the free time of poor folks like me, having just soft launched after ten years of development spent creating a fresh region bigger than the Dragonborn DLC's Solstheim and filling it with stuff to do. <a href=""https://www.rockpapershotgun.com/massive-skyrim-mod-lordbound-soft-launches-with-lots-of-choice-heavy-questing-in-a-war-torn-valley-bigger-than-solstheim"">Read more</a> ",1759771696,
72850,"After a decade in development, this massive Skyrim mod adds a whole new region, 50 new dungeons and 'the biggest main quest you've ever played in Skyrim'","2025 continues to be the year that gives Elder Scrolls fans everything they could possibly want—except for<a href=""https://www.pcgamer.com/the-elder-scrolls-vi/""> The Elder Scrolls 6</a>. We've already had one<a href=""https://www.pcgamer.com/uk/oblivion-remastered/""> Oblivion remaster</a> with<a href=""https://www.pcgamer.com/games/the-elder-scrolls/skyblivions-first-major-dev-update-since-oblivion-remastered-makes-its-case-as-more-of-a-full-remake-including-a-mega-dungeon-based-off-a-legendary-bit-of-cut-content/""> a second potentially on the way</a>, while Morrowind's premiere modding team delivered a<a href=""https://www.pcgamer.com/games/the-elder-scrolls/oblivion-isnt-enough-morrowind-just-got-a-whole-lot-bigger-as-community-mega-mod-tamriel-rebuilt-adds-the-sprawling-metropolis-of-narsis/""> massive new chunk</a> of the province the vanilla game only explored a fraction of. Now the Skyrim modding community has gotten in on the action with the release of a truly massive unofficial expansion that has been in development for more than 10 years... <a href=""https://www.pcgamer.com/games/rpg/after-a-decade-in-development-this-massive-skyrim-mod-adds-a-whole-new-region-50-new-dungeons-and-the-biggest-main-quest-youve-ever-played-in-skyrim/?utm_source=steam&utm_medium=referral"" target=""_blank"">Read more.</a>",1759586400,
72850,"Almost 90 years old, Skyrim Grandma Shirley Curry says she's retiring from the adventuring life: 'I'm tired, I'm not having fun anymore'","fter a decade of uploads, Skyrim Grandma Shirley Curry is stepping back from the adventurers' life. In a new video, Curry—who's amassed over a million followers and gotten <a href=""https://www.pcgamer.com/skyrim-grandma-shirley-curry-will-be-in-the-elder-scrolls-6/"">her own character</a> in <a href=""https://www.pcgamer.com/elder-scrolls-6-what-we-know/"">The Elder Scrolls 6</a> (whenever that happens)—said she's just grown tired of it all, and ""I am no longer going to be uploading Skyrim ."".. <a href=""https://www.pcgamer.com/games/the-elder-scrolls/almost-90-years-old-skyrim-grandma-shirley-curry-says-shes-retiring-from-the-adventuring-life-im-tired-im-not-having-fun-anymore/?utm_source=steam&utm_medium=referral"" target=""_blank"">Read more.</a>",1759155160,
72850,Ex-Skyblivion dev says it 'was never in the state that the videos would show off' as they claim it's crunching on a 'pointless and unachievable' 2025 release goal—but remaining devs seem optimistic,"Mega-mod Skyblivion—the one that remakes The Elder Scrolls 4: Oblivion in the swish new Skyrim: Special Edition engine—is set to release in a matter of months after over a decade of work. The news around this has been, on the whole, quite positive. <a href=""https://www.pcgamer.com/games/rpg/skyblivion-shows-off-some-gorgeous-oblivion-locations-and-some-boring-oblivion-quests-in-its-latest-trailer/"">The trailers look good</a>, its <a href=""https://www.pcgamer.com/games/the-elder-scrolls/oblivions-dungeons-suck-skyblivion-is-making-them-better-thats-where-the-power-of-a-proper-remake-comes-from/"">dungeons are meant to be better</a>, and Bethesda even gave the whole team <a href=""https://www.pcgamer.com/games/rpg/bethesda-gave-oblivion-remastered-game-keys-to-the-entire-skyblivion-development-team-and-made-it-clear-that-they-have-no-intention-of-shutting-down-our-project/"">keys for the official Oblivion Remaster</a> back when that released... <a href=""https://www.pcgamer.com/games/the-elder-scrolls/ex-skyblivion-dev-says-it-was-never-in-the-state-that-the-videos-would-show-off-as-they-claim-its-crunching-on-a-pointless-and-unachievable-2025-release-goal-but-remaining-devs-seem-optimistic/?utm_source=steam&utm_medium=referral"" target=""_blank"">Read more.</a>",1756914823,
72850,Another Skyblivion dev diary shows off the new dungeons and expanded cities Oblivion Remastered never bothered with,"August 2025 now has as many <a href=""https://www.rockpapershotgun.com/games/skyblivion"">Skyblivion</a> developer diaries as there are modern <a href=""https://www.rockpapershotgun.com/games/the-elder-scrolls-iv-oblivion"">The Elder Scrolls IV: Oblivion</a> reimaginings: two, which in both cases remains a weirdly high number. But while last week’s <a href=""https://www.rockpapershotgun.com/finishing-skyblivion-is-a-new-dev-diary-series-about-the-last-leg-of-the-oblivion-remake-mods-run-to-release"">Finishing Skyblivion</a> focused on one volunteer’s attempts at getting the ambitious Cyrodiil-in-<a href=""https://www.rockpapershotgun.com/games/the-elder-scrolls-v-skyrim"">Skyrim</a> mod over the line, this other vid makes a very specific pitch to those whose interest may have been diverted by Bethesda’s official <a href=""https://www.rockpapershotgun.com/games/the-elder-scrolls-4-oblivion-remake"">Oblivion Remastered</a>, showcasing how Skyblivion looks to more aggressively expand and rework the original RPG. <a href=""https://www.rockpapershotgun.com/another-skyblivion-dev-diary-shows-off-the-new-dungeons-and-expanded-cities-oblivion-remastered-never-bothered-with"">Read more</a> ",1754310077,
72850,"Skyblivion devs used their Bethesda visit to fight the good fight, asking Todd and co to bring back Skyrim-style official modding tutorials","While the prospect <a href=""https://www.rockpapershotgun.com/games/the-elder-scrolls-4-oblivion-remake"">The Elder Scrolls IV: Oblivion Remastered</a> turning out to be a real thing had folks wondering what that might mean for Oblivion remake mod <a href=""https://www.rockpapershotgun.com/games/skyblivion"">Skyblivion</a>'s <a href=""https://www.rockpapershotgun.com/skyblivion-project-lead-and-gog-chat-about-partnering-up-to-release-the-massive-elder-scrolls-mod-following-fallout-londons-troubled-success"">release</a>, Bethesda were quick quell fears of a shutdown. Both sides have been <a href=""https://www.rockpapershotgun.com/you-get-twice-the-amount-of-oblivion-this-year-says-skyblivion-modder-undeterred-by-official-remaster"">openly chummy</a> since that point, with the studio behind The Elder Scrolls even having the team of modders pop by for a visit around the time their project was being <a href=""https://www.rockpapershotgun.com/bethesda-are-so-chill-about-skyblivion-that-theyre-promoting-it-in-oblivion-remastered-videos"">shouted out on the official channels</a>. We've now learned a bit more about how that social call went and what the two sides chatted about. <a href=""https://www.rockpapershotgun.com/skyblivion-devs-used-their-bethesda-visit-to-fight-the-good-fight-asking-todd-and-co-to-bring-back-skyrim-style-official-modding-tutorials"">Read more</a> ",1750436618,
72850,"Nexus Mods announce ownership change, but the folks taking over remain a bit mysterious","Massive modding site Nexus Mods have announced a change in ownership, with founder Robin 'Dark0ne' Scott set to step back. As to who the new owners are, a couple of first names and modding profiles have been provided, as well as an assertion that these new overlords understand what makes Nexus Mods tick. <a href=""https://www.rockpapershotgun.com/nexus-mods-on-paid-mods"">Scott</a> - who founded the site as the Elder Scrolls-focused TES Nexus in 2001, and has owned it via his company Black Tree Gaming since 2007 - announced the news via <a href=""https://www.nexusmods.com/news/15301"">a post</a> on Nexus Mods. <a href=""https://www.rockpapershotgun.com/nexus-mods-announce-ownership-change-but-the-folks-taking-over-remain-a-bit-mysterious"">Read more</a> ",1750090292,
72850,Skyrim's version of Radiant AI was developed from a drawing Todd Howard made on a napkin,"With Oblivion Remastered sucking up everyone's time, there's a whole new generation of people getting to enjoy Cyrodiil's weird NPCs—and for us Oblivion vets, it's a chance to reconnect with some old pals. There was so much to love about Bethesda's gargantuan RPG back in 2006, but the vast array of eccentric characters wandering around the world, doing their own thing, really set it apart from the previous Elder Scrolls... <a href=""https://www.pcgamer.com/games/the-elder-scrolls/skyrims-version-of-radiant-ai-was-developed-from-a-drawing-todd-howard-made-on-a-napkin/?utm_source=steam&utm_medium=referral"" target=""_blank"">Read more.</a>",1749052929,
72850,"Oblivion Remastered just got a full Skyrim-style smithing system thanks to a modder, in case you've missed making stuff by getting very good at banging hot things","Right, so. <a href=""https://www.vg247.com/games/the-elder-scrolls-4-oblivion-remake"">Oblivion Remastered</a> modders continue to find ways to pull off really cool stuff despite not having any official tools. The latest interesting new mod to drop adds a whole Skyrim-style smithing system and skill to the game, and it's by someone who'd already blown us away with their faction overhauls. <a href=""https://www.vg247.com/oblivion-remastered-skyrim-style-smithing-system-mod"">Read more</a> ",1748602931,
72850,"Someone found Skyrim's most relatable NPC: A dude with no possessions who just sleeps all day, every day","Skyrim player has discovered what some are calling the most boring NPC in the game, but some might call him a hero. YouTuber Mike, who also goes by The Gaming Dad, happened across the character at the East Empire Company Warehouse in Solitude... <a href=""https://www.pcgamer.com/games/the-elder-scrolls/someone-found-skyrims-most-relatable-npc-a-dude-with-no-possessions-who-just-sleeps-all-day-every-day/?utm_source=steam&utm_medium=referral"" target=""_blank"">Read more.</a>",1748455266,
72850,"This year's Oblivion remasters got you desperate for a more modern Morrowind? Then come Nerevar, Skywind's just put out a fresh gameplay showcase","Sure, <a href=""https://www.vg247.com/games/the-elder-scrolls-iv-oblivion"">Elder Scrolls IV: Oblivion Remastered</a> and <a href=""https://www.vg247.com/games/skyblivion"">Skyblivion</a> either already have dropped this year or are set to arrive before 2025 is done. But the people crave more revamps of classic TES games, and the modders behind Skywind - a remake of Morrowind in Skyrim's engine - have just dropped a fresh gameplay showcase. <a href=""https://www.vg247.com/skywind-morrrowind-remake-skyrim-mod-gameplay-showcase-may-2025"">Read more</a> ",1748343034,
72850,'Morrowind in Skyrim' fan project Skywind demos underwater combat and new spells,"It's a good time to be a fan of The Elder Scrolls. Oblivion Remastered has brought the classic Bethesda RPG back into the mainstream, and we've recently seen a major update for the Tamriel Rebuilt mod. Now comes another big reveal - a new 20-minute gameplay demo for giant fan project <strong>Skywind</strong>, which aims to recreate Morrowind in the Skyrim engine. It's been two years since we last got a full showcase of this nature, and it's looking very impressive, demonstrating the likes of underwater combat and new spells. In even better news, the team tells PCGamesN it's seen a ""significant"" rise in interest lately as more people offer their support. <a href=""https://www.pcgamesn.com/the-elder-scrolls-v-skyrim/skywind-gameplay-demo-underwater-combat"">Read the rest of the story...</a> RELATED LINKS: <a href=""https://www.pcgamesn.com/the-elder-scrolls-iii-morrowind-game-of-the-year-edition/tamriel-rebuilt-mod-new-expansion"">Enormous Morrowind mod Tamriel Rebuilt just got even bigger with new expansion</a> <a href=""https://www.pcgamesn.com/the-elder-scrolls-iii-morrowind/tamriel-rebuilt-grasping-fortune"">Huge Morrowind mod project Tamriel Rebuilt dates new expansion with 270 quests</a> <a href=""https://www.pcgamesn.com/morrowind/project-cyrodiil-mod"">New Morrowind mod adds a DLC-sized portion of Oblivion with over 160 quests</a> ",1748199686,
72850,"Even with The Elder Scrolls 6 just a twinkle in Todd Howard's eye, it's boom times for Elder Scrolls fans: The project to remake Morrowind in Skyrim just put out a 20-minute trailer and progress update","The team behind Skywind, the massive project to <a href=""https://tesrskywind.com/"" target=""_blank"">remake/reimagine The Elder Scrolls 3: Morrowind</a> in The Elder Scrolls 5: Skyrim, has just unveiled <a href=""https://www.youtube.com/watch?v=8wWpMR5mo-w&ab_channel=TESRSkywind"">20 minutes of new gameplay</a> on YouTube, as well as a development progress update... <a href=""https://www.pcgamer.com/games/the-elder-scrolls/even-with-the-elder-scrolls-6-just-a-twinkle-in-todd-howards-eye-its-boom-times-for-elder-scrolls-fans-the-project-to-remake-morrowind-in-skyrim-just-put-out-a-20-minute-trailer-and-progress-update/?utm_source=steam&utm_medium=referral"" target=""_blank"">Read more.</a>",1748195460,
72850,"Skyrim lead designer makes it sound like there's gonna be loading screens in Bethesda games for years to come yet, bucko: 'We just didn’t have a choice, really'","dd together all the minutes of my life I've spent in loading screens and you could, well, send me into quite a grim depressive spiral, probably. And since I'm someone with several hundred hours invested across various Bethesda games, how many of those minutes were spent twiddling Daedric artifacts in Skyrim's load screens or looking at cool Netch concept art in Morrowind?.. <a href=""https://www.pcgamer.com/games/the-elder-scrolls/skyrim-lead-designer-makes-it-sound-like-theres-gonna-be-loading-screens-in-bethesda-games-for-years-to-come-yet-bucko-we-just-didnt-have-a-choice-really/?utm_source=steam&utm_medium=referral"" target=""_blank"">Read more.</a>",1746115738,
72850,"Oblivion Remastered's version of Skyrim's essential Unofficial Patch mod has arrived in uber-quick fashion, but it currently only looks to fix OG Oblivion bugs","It was inevitable that <a href=""https://www.vg247.com/games/the-elder-scrolls-4-oblivion-remake"">Oblivion Remastered</a> would get some kind of big fan-made patch mod, and it's only taken just a week for that prophecy to come true. Enter the Unofficial Oblivion Remastered Patch - UORP for short - which is out now, but looks to come with some quirks you'll want to be aware of before you grab it. <a href=""https://www.vg247.com/oblivion-remastered-unofficial-patch-drops-teething-issues"">Read more</a> ",1746004651,
72850,"Someone has killed the Adoring Fan 1143 times so far while waiting for Skyblivion to drop, and their first Oblivion Remastered murder is worthy of a Grand boxing Champion","Ok, so we've all been chatting a lot about <a href=""https://www.vg247.com/games/the-elder-scrolls-iv-oblivion"">Elder Scrolls IV: Oblivion Remastered</a> and <a href=""https://www.vg247.com/games/skyblivion"">Skyblivion</a> lately, but here's another weird link between them. <a href=""https://www.vg247.com/skyblivion-fan-1143-daily-adoring-fan-kills-oblivion-remastered"">Read more</a> ",1745426134,
72850,"Skyrim realism mod fixes your vampire girlfriend, giving her a voice and look more suited to someone who just got out of a coffin after 2,000 years","Skyrim is not an enormously realistic game. Yes, I'm brave enough to say it. Magic? Not real. Dragons? Largely undocumented. Guys who get hit repeatedly by arrows before returning to their usual patrol routes? This only rarely happens... <a href=""https://www.pcgamer.com/games/the-elder-scrolls/skyrim-realism-mod-fixes-your-vampire-girlfriend-giving-her-a-voice-and-look-more-suited-to-someone-who-just-got-out-of-a-coffin-after-2-000-years/?utm_source=steam&utm_medium=referral"" target=""_blank"">Read more.</a>",1742838649,
