appid,title,contents,date,tags
72850,"A bizarre mod that adds human poop to Skyrim led me on an enlightening journey into Viking sanitation: 'Your world will certainly be more immersive, but it will also certainly smell worse'","I've played a few <a href=""https://www.pcgamer.com/best-skyrim-mods/"" target=""_blank"">Skyrim mods</a> that stank in my time, but none quite like this.<a href=""https://www.nexusmods.com/skyrim/mods/119854"" target=""_blank""> Everyone Poops­—Mihail's Shards of Immersion</a> adds actual piles of excrement into Bethesda's perennial fantasy RPG... <a href=""https://www.pcgamer.com/games/rpg/a-bizarre-mod-that-adds-human-poop-to-skyrim-led-me-on-an-enlightening-journey-into-viking-sanitation-your-world-will-certainly-be-more-immersive-but-it-will-also-certainly-smell-worse/?utm_source=steam&utm_medium=referral"" target=""_blank"">Read more.</a>",1742648400,
72850,Massive Oblivion remake mod Skyblivion shows off the final region its devs have just finished laying the foundations of in new gameplay at C3,"<a href=""https://www.vg247.com/topics/skyblivion"">Skyblivion</a>, the massive modding project that’s remaking <a href=""https://www.vg247.com/games/the-elder-scrolls-iv-oblivion"">The Elder Scrolls IV</a> in <a href=""https://www.vg247.com/games/the-elder-scrolls-v-skyrim"">Skyrim</a>’s engine, has just shown off some fresh quest gameplay at C3 (Community Creations Con) ahead of its 2025 release. <a href=""https://www.vg247.com/oblivion-remake-mod-skyblivion-shows-off-final-region-new-gameplay-c3"">Read more</a> ",1740259445,
72850,"Skyrim was 'personally rebalanced' by producer Jeff Gardiner just 2 weeks before launch: 'Well, I hope this is good'","Skyrim was getting ready to launch—it was mere weeks away—but former Bethesda producer Jeff Gardiner and the designers were in the midst of a disagreement over balance. This led Gardiner, who also had years of creative and design experience, to take matters into his own hands... <a href=""https://www.pcgamer.com/games/the-elder-scrolls/skyrim-was-personally-rebalanced-by-producer-jeff-gardiner-just-2-weeks-before-launch-well-i-hope-this-is-good/?utm_source=steam&utm_medium=referral"" target=""_blank"">Read more.</a>",1740238200,
72850,A Skyrim dev broke the game before launch when they made thousands of tiny ants cast individual shadows: 'Why is the game running so slow?',"Bethesda RPGs are typically jam-packed with tiny details that most players will never notice, but which all contribute to the sense that you're existing in this reactive, believable world. ""It's not just that I kill someone with a sword and there's a reaction to the crime,"" says former Bethesda producer Jeff Gardiner. ""It's the sense that there's this living world around you and things happen."".. <a href=""https://www.pcgamer.com/games/the-elder-scrolls/a-skyrim-dev-broke-the-game-before-launch-when-they-made-thousands-of-tiny-ants-cast-individual-shadows-why-is-the-game-running-so-slow/?utm_source=steam&utm_medium=referral"" target=""_blank"">Read more.</a>",1740222000,
72850,"Skyblivion devs reveal the final region they had to build in the huge Oblivion remake mod is now complete, but there's still stuff to sort ahead of release","The developers behind <a href=""https://www.vg247.com/topics/skyblivion"">Skyblivion</a>, the massive modding project that’s remaking <a href=""https://www.vg247.com/games/the-elder-scrolls-iv-oblivion"">The Elder Scrolls IV</a> in <a href=""https://www.vg247.com/games/the-elder-scrolls-v-skyrim"">Skyrim</a>’s engine, have now revealed that they've finished landscaping every region of their map of Cyrodiil. <a href=""https://www.vg247.com/skyblivion-modders-reveal-final-region-now-complete"">Read more</a> ",1740075599,
72850,"Avowed isn't technically even out yet, and someone's already nicked its underpants","<a href=""https://www.vg247.com/games/avowed"">Avowed</a> is, as you've probably heard, the latest game to be out before it's actually out for those who're prepared to pay for an extra special edition. Naturally, this has meant plenty of folks spending the weekend just gone <a href=""https://www.vg247.com/avowed-review"">kicking off their adventure</a>, or, in the case of one, managing to put out a nude mod for the game before its proper release date has even arrived. <a href=""https://www.vg247.com/avowed-isnt-technically-out-yet-and-someone-already-nicked-underpants"">Read more</a> ",1739791889,
72850,"There's now a Witcher 3 mod that lets you ride around on a full-size dragon Skyrim-style, just in case you don't fancy a piggyback from an alchemist","In possibly the most visually interesting case of someone combining another thing I like with <a href=""https://www.vg247.com/games/the-witcher-3-wild-hunt"">The Witcher 3</a> via a mod since someone slapped <a href=""https://www.nexusmods.com/witcher3/mods/3270"">Kazuma Kiryu's back tat</a> on big Gerry, there's now one that'll let you ride on a dragon a bit like <a href=""https://www.vg247.com/games/the-elder-scrolls-v-skyrim"">Skyrim</a>'s Dragonborn can after visiting Solstheim. <a href=""https://www.vg247.com/witcher-3-mod-rideable-draconid-mount-skyrim-style"">Read more</a> ",1738946164,
72850,Elder Scrolls voice actor Wes Johnson shares message of thanks after waking from coma to $175K GoFundMe: 'I love you all. I'm not going anywhere',"Wes Johnson, the actor whose voice permeates Bethesda's RPGs like<a href=""https://www.pcgamer.com/games/the-elder-scrolls/the-elder-scrolls-iv-oblivion-review/"" target=""_blank""> The Elder Scrolls IV: Oblivion</a>,<a href=""https://www.pcgamer.com/uk/fallout-3/"" target=""_blank""> Fallout 3</a> and<a href=""https://www.pcgamer.com/uk/search/?searchTerm=skyrim"" target=""_blank""> Skyrim</a>, has addressed fans and friends as he recovers from being <a href=""https://www.pcgamer.com/games/the-elder-scrolls/beloved-bethesda-rpg-voice-actor-wes-johnson-is-in-critical-condition-after-being-found-unconscious-and-barely-alive-and-his-family-is-asking-for-help-from-fans/"" target=""_blank"">found ""barely alive""</a> in his hotel room last week... <a href=""https://www.pcgamer.com/gaming-industry/elder-scrolls-voice-actor-wes-johnson-shares-message-of-thanks-after-waking-from-coma-to-usd175k-gofundme-i-love-you-all-im-not-going-anywhere/?utm_source=steam&utm_medium=referral"" target=""_blank"">Read more.</a>",1738353745,
72850,"""There's a lot of love in this world"" Elder Scrolls and Fallout voice actor Wes Johnson provides video update following medical emergency","Some unfortune news emerged regarding voice actor Wes Johnson, known for playing notable roles across various Bethesda titles including <a data-keyword=""true"" href=""https://www.vg247.com/games/fallout-4"">Fallout 4</a>, <a href=""https://www.vg247.com/games/the-elder-scrolls-v-skyrim"">Skyrim</a>, and <a data-keyword=""true"" href=""https://www.vg247.com/games/starfield"">Starfield</a>, earlier this week. The VA suffered a medical emergency while travelling for an appearance and <a href=""https://www.vg247.com/elder-scrolls-fallout-voice-actor-wes-johnson-apparent-medical-emergency-fundraiser"">a GoFundMe campaign</a> started by friends revealed that he was recieving treatment in an intensive care unit. <a href=""https://www.vg247.com/elder-scrolls-fallout-actor-wes-johnson-video-update-after-medical-emergency"">Read more</a> ",1738316522,
72850,"UPDATE: Iconic Elder Scrolls and Fallout voice actor Wes Johnson suffers medical emergency, fundraiser to ""help his family"" raises over $130,000 in a day","UPDATE (28/01/25, 9:00 AM GMT): Bill Glasser, the organiser of the fundraiser, has responded to VG247 with a statement confirming its legitimacy. $138,026, over double the original goal of $50,000, has been raised in around 24 hours by the GoFundMe. <a href=""https://www.vg247.com/elder-scrolls-fallout-voice-actor-wes-johnson-apparent-medical-emergency-fundraiser"">Read more</a> ",1737998719,
72850,This Skyrim mod uncovers the 'truth' - birds aren't real,"There's a subreddit with just under 290k members called '<a href=""https://www.reddit.com/r/BirdsArentReal/"">Birds Aren't Real</a>', which is dedicated to humorous stories and images trying to 'prove' birds aren't the lovely, feathery, nest-building vertebrates we all know and love - they're actually a conspiracy. Of some sort. Now, that very 'theory' has come to Tamriel's frostiest region, thanks to a new <a href=""https://www.pcgamesn.com/the-elder-scrolls-v-skyrim"">Skyrim</a> mod of the same title. Birds Aren't Real by creator SkylerModder unveils a troubling 'fact' to your Dovahkiin - ""The Aedra have been lying to you. The Daedra have been lying to you. Mortals have been lying to you. M'aiq has been lying to you. This mod will show you the truth. Birds aren't real."" Gulp. 'But how?' you might be wondering. Well, the mod simply tinkers with all of Skyrim's chickens and hawks, altering their sounds effects, ""racial settings, and loot"" to reveal they're actually just robots. That's right - go take a peep at a fallen bird's loot and you'll discover they're just made up of things like bent Dwemer scrap metal, Dwarven oil, and soul gems. So, pretty much like those horrible Dwarven Spider automatons that populate Dwemer mines and ruins. Eek. <a href=""https://www.pcgamesn.com/the-elder-scrolls-v-skyrim/mod-chicken"">Read the rest of the story...</a> RELATED LINKS: <a href=""https://www.pcgamesn.com/the-elder-scrolls-v-skyrim/all-achievements"">Skyrim achievement guide - checklist all updated for 2025</a> <a href=""https://www.pcgamesn.com/the-elder-scrolls-v-skyrim/games-like-skyrim"">Best games like Skyrim 2025</a> <a href=""https://www.pcgamesn.com/games-like-starfield"">The best games like Starfield 2025</a> ",1737125349,
72850,Skyrim's Carved Brink mod takes you to a new - and beautiful - plane of Oblivion,"Personally, I always I preferred The Elder Scrolls series great outdoors to its dungeons, portals, and planes of Oblivion, but if you were looking to take on some of Tamriel's biggest baddies (giants and mammoths aside) the chances were that those were exactly the kinds of places you'd be heading. Which is why <a href=""https://www.nexusmods.com/skyrimspecialedition/mods/24351"" target=""_blank"" rel=""noopener noreferrer"">Carved Brink</a>, a new mod from the team behind last year's massive Project AHO, could be exactly your cup of tea. The mod introduces two brand-new areas to the fantasy RPG - the deadric plane of Peyrite, and the Faceted Stones, a previously unknown part of Oblivion. The Faceted Stones were previously inhabited by the Snow Elves/Falmer (who were a pretty major part of why I hated all those dungeons), but the floating stone islands are now mostly inhabited by a race of goblins. As well as the new areas, the mod comes with plenty of fully voice-acted characters, as well as new items, a custom soundtrack, and a unique teleportation spell to help you maneuver between stones. <a href=""https://www.pcgamesn.com/the-elder-scrolls-v-skyrim/skyrim-carved-brink-mod"">Read the rest of the story...</a> RELATED LINKS: <a href=""https://www.pcgamesn.com/the-elder-scrolls-v-skyrim/all-achievements"">Skyrim achievement guide - checklist all updated for 2025</a> <a href=""https://www.pcgamesn.com/the-elder-scrolls-v-skyrim/games-like-skyrim"">Best games like Skyrim 2025</a> <a href=""https://www.pcgamesn.com/games-like-starfield"">The best games like Starfield 2025</a> ",1737125317,
72850,Massive Skyrim mod inspired by The Witcher 3's Hearts of Stone gets an extra 20 hours added to its questline about the Dragonborn fighting a full-on plague,"There are plenty of absolutely huge <a href=""https://www.vg247.com/games/the-elder-scrolls-v-skyrim"">Skyrim</a> quest mods out there, and one that already had an entire plague that spreads like a real epidemic in it has just gotten a whole lot bigger, thanks to a new addition-filled overhaul. It's called Death Consumes All, and it's inspired by <a data-keyword=""true"" href=""https://www.vg247.com/games/the-witcher-3-wild-hunt"">The Witcher 3</a>'s brilliant Hearts of Stone DLC. <a href=""https://www.vg247.com/skyrim-mod-witcher-3-inspired-death-consumes-all-version-2"">Read more</a> ",1736875541,
72850,Skyrim achievement guide - checklist all updated for 2025,"<strong>What are all the Skyrim achievements?</strong> There are many reasons for wanting to explore a game's achievements. The most obvious, perhaps, is the pride of attaining full completion and showing off your prowess to others. In a game like Skyrim though, some achievements might guide your journey or help you make important decisions. As a sprawling open-world <a href=""https://www.pcgamesn.com/15-best-rpgs-pc"">RPG game</a>, <a href=""https://www.pcgamesn.com/the-elder-scrolls-v-skyrim"">Skyrim</a> invites you to make decisions on your character's behalf. Which faction do you choose to join? Do you play lawfully or break the rules? Where should you build a house? If you aren't sure how you want to play through the <a href=""https://www.pcgamesn.com/best-action-adventure-games"">action-adventure game</a>, some of these achievements may guide you one way or the other. Or, if you simply want to know how to complete every single achievement in the game, we've got the full list of Skyrim achievements right here. <a href=""https://www.pcgamesn.com/the-elder-scrolls-v-skyrim/all-achievements"">Read the rest of the story...</a> RELATED LINKS: <a href=""https://www.pcgamesn.com/the-elder-scrolls-v-skyrim/games-like-skyrim"">Best games like Skyrim 2025</a> <a href=""https://www.pcgamesn.com/games-like-starfield"">The best games like Starfield 2025</a> <a href=""https://www.pcgamesn.com/the-elder-scrolls-v-skyrim/skyrim-console-commands-and-cheats"">Skyrim commands and cheats - updated for 2025</a> ",1736526433,
72850,"Good news culture lovers, a Minecraft YouTuber is hopping on Classic FM to blast banging choons from Skyrim, Street Fighter, and more","Do you like classical music? Is your life set to a beautiful symphony invoving violins, pianos, and the occasional tuba? Do you yearn for the surreal event that will be tunes from the Elder Scrolls being played on a radio station that your grandparents might listen to? <a href=""https://www.vg247.com/minecraft-youtuber-classic-fm-banging-choons-from-skyrim-street-fighter-more"">Read more</a> ",1736347325,
72850,"Skyblivion, the huge Oblivion remake mod in Skyrim's engine, is now in its release year and its devs only have one region of Cyrodiil left to complete","<a href=""https://www.vg247.com/topics/skyblivion"">Skyblivion</a>, the massive modding project that’s remaking <a href=""https://www.vg247.com/games/the-elder-scrolls-iv-oblivion"">The Elder Scrolls IV</a> in <a href=""https://www.vg247.com/games/the-elder-scrolls-v-skyrim"">Skyrim</a>’s engine, is now in its currently scheduled release year - 2025. <a href=""https://www.vg247.com/skyblivion-new-year-2025-roadmap-update-one-region-left"">Read more</a> ",1735817672,
72850,"With the next Elder Scrolls and Fallout games still years away, here are 6 upcoming total conversion mods for Skyrim and Fallout 4 to get excited about","""total conversion"" is one of the most coveted and difficult modding projects one could undertake⁠: Making a new, bespoke campaign using the mod tools of a pre-existing game, with the end result unable to be monetized due to copyright (unless you're working with the beautifully open source Doom engine). At a certain point, you'd probably be better off just making your own indie game, and that only makes these Moby Dickian efforts all the more enticing... <a href=""https://www.pcgamer.com/games/rpg/with-the-next-elder-scrolls-and-fallout-games-still-years-away-here-are-6-upcoming-bethesda-total-conversion-mods-for-skyrim-and-fallout-4-to-get-excited-about/?utm_source=steam&utm_medium=referral"" target=""_blank"">Read more.</a>",1735744938,
72850,Skyrim finally playable as modder invents 'coffins so comfy you'll wish you were dead',"What <em>do</em> they do with you when you die in Skyrim? The draugr would suggest you get interred in some kind of big tomb to murder future adventurers, but aren't those all Nords? What if you're playing a Dunmer, or a Breton, or some other non-native culture in Skyrim's snow-capped peaks?.. <a href=""https://www.pcgamer.com/games/the-elder-scrolls/skyrim-finally-playable-as-modder-invents-coffins-so-comfy-youll-wish-you-were-dead?utm_source=steam&utm_medium=referral"" target=""_blank"">Read more.</a>",1732797143,
72850,"Nexus Mods says folks ""should be pressuring"" paid mod platforms to ""do better"" if they're frustrated by its new policy on the ever-controversial topic","Popular modding site Nexus Mods recently announced an <a href=""https://www.vg247.com/nexus-mods-updates-policy-on-paid-mods-post-verified-creators"">update to its policies on paid mods</a>, and, as ever with the topic that seems very much to be a <a href=""https://www.vg247.com/skyrim-paid-mods-creations-debate-interview"">never ending source of controversy</a>, the response from players and modders was a bit complicated. <a href=""https://www.vg247.com/nexus-mods-folks-should-be-pressuring-paid-mod-platforms-do-better"">Read more</a> ",1730374676,
72850,"Nexus Mods updates its stance on paid mods for the first time since Bethesda's latest attempt at them, says it believes ""modding should be a pursuit of passion first and foremost""","Paid mods are always controversial. Just look at Bethesda’s latest attempt at creating a system designed to facilitate such a thing having <a href=""https://www.vg247.com/skyrim-paid-mods-creations-debate-interview"">proven pretty much as polarising as its predecessors</a>, even if things have died down a bit since that bit of <a href=""https://www.vg247.com/starfield-guide-quest-walkthroughs-item-locations-and-more"">Starfield</a> <a href=""https://www.vg247.com/starfield-todd-howard-creation-club-pricing"">Trackers Alliance mission controversy</a> back in June. <a href=""https://www.vg247.com/nexus-mods-updates-policy-on-paid-mods-post-verified-creators"">Read more</a> ",1730301970,
72850,"Beyond Skyrim: Cyrodiil is gearing up to let you decide who rules the Imperial City long after Oblivion, and it’ll feature something any world definitely needs: unhinged tabloid journalism","There always are a lot of cool-looking modding projects in the works for any Bethesda game at any point in time, so there's a chance that if you don't eat, sleep and breathe mods for work like I do, there's a chance Beyond Skyrim: Cyrodiil is one that's flown under your radar. <a href=""https://www.vg247.com/beyond-skyrim-cyrodiil-mod-will-have-tabloid-journalism-ama"">Read more</a> ",1730132295,
72850,Skyrim mod lets you shank NPCs as Agent 47 in a Hitman Contracts-style assassination mode,"The great thing about Skyrim is that, if you don't like Skyrim, by this point you can make it into pretty much anything else. The game now has a decent claim to be the most-modded of all time, with over 170,000 mods listed across the basic and Special Edition on Nexus Mods. Whether you fancy <a href=""https://www.pcgamer.com/games/the-elder-scrolls/i-played-the-banned-skyrim-mod-that-turns-it-into-world-war-2-and-no-kidding-its-honestly-kind-of-incredible/"" target=""_blank""> recreating World War 2 in Tamriel </a>, <a href=""https://www.pcgamer.com/games/the-elder-scrolls/theres-an-entire-skyrim-mod-dedicated-to-making-you-feel-bad-and-weird-about-killing-anybody-adding-over-200-handwritten-letters-detailing-their-rich-inner-lives/"" target=""_blank""> guilt-tripping yourself over NPC deaths </a>, or just <a href=""https://www.pcgamer.com/this-skyrim-mod-lets-you-relax-while-it-plays-the-game/"" target=""_blank""> chilling while the game plays itself </a>, there's a good chance someone's way ahead of you... <a href=""https://www.pcgamer.com/games/rpg/skyrim-mod-lets-you-shank-npcs-as-agent-47-in-a-hitman-contracts-style-assassination-mode?utm_source=steam&utm_medium=referral"" target=""_blank"">Read more.</a>",1730129298,
72850,"I played the banned Skyrim mod that turns it into World War 2 and, no kidding, it's honestly kind of incredible","I never quite <em>got</em> Skyrim. I'm a Morrowind nerd, yeah, sure, we're all very certain of that, but it's not my pining for the old days that meant the game never sat right with me. What was it? The slightly floaty combat? The streamlined skill system?.. <a href=""https://www.pcgamer.com/games/the-elder-scrolls/i-played-the-banned-skyrim-mod-that-turns-it-into-world-war-2-and-no-kidding-its-honestly-kind-of-incredible?utm_source=steam&utm_medium=referral"" target=""_blank"">Read more.</a>",1729700773,
72850,Incredible new Skyrim mod is like an RPG version of World of Tanks,"Using the Dovahkiin shouts to yank dragons out of the sky and then decapitating them with your axe is pretty cool - but it's not the same as blowing them up with a tank. 13 years since <strong>The Elder Scrolls Skyrim</strong> first arrived, and we've explored every inch of the Bethesda RPG - from Whiterun to Solitude, Riften to Windhelm - time and time again. But we've never used the plains of Tamriel for a full-scale, all-out tank and artillery battle. The Elder Scrolls 6 might be a while away. Fallout 5, equally so. But a groundbreaking new Skyrim mod makes the entire game feel like a fantasy remake of fellow PC classic World of Tanks. Imagine Skyrim during the height of World War II, and instead of the Dragonborn, you're a tank commander. <a href=""https://www.pcgamesn.com/the-elder-scrolls-v-skyrim/world-of-tanks"">Read the rest of the story...</a> RELATED LINKS: <a href=""https://www.pcgamesn.com/the-elder-scrolls-v-skyrim/skyrim-console-commands-and-cheats"">All Skyrim console commands and cheats</a> <a href=""https://www.pcgamesn.com/best-dragon-games"">The best dragon games on PC 2024</a> <a href=""https://www.pcgamesn.com/elder-scrolls-v-skyrim/100-best-skyrim-mods"">Best Skyrim mods 2024</a> ",1729601260,
72850,"After a minor calendar mix-up, Helldivers 2's next big patch drops soon and it's already inspired jokes about Skyrim being ported to some bullets","<a href=""https://www.vg247.com/games/helldivers-2"">Helldivers 2</a>'s next big patch is now set to drop tomorrow, October 15, because Arrowhead forgot to factor weekends into its plans when it <a href=""https://www.vg247.com/helldivers-2-arrowhead-addresses-escalation-of-freedom-update-backlash-60-day-plan"">announced that 60 day plan</a> during the summer. The good news is that the studio's made up for this minor oversight via a cheeky video teasing what's coming in the patch, including one inclusion that's seen Johan Pilestedt get in on the jokes. <a href=""https://www.vg247.com/helldivers-2-patch-arriving-day-63-skyrim-jokes"">Read more</a> ",1728913964,
72850,New Skyrim mod empowers the weak and spongy NPCs to fight back,"I've said it before and I'll say it again, <strong>Skyrim</strong>'s combat is by far its weakest element. Over a decade later, fights are more like hitting a giant sponge with a hammer than actual bandits. I don't think what Bethesda made in 2011 was bad - Skyrim's a huge game that works in so many ways it's a miracle - but fighting hasn't aged well. With so many Skyrim mods aiming to fix that, I've got a new creation that completely changes how NPCs act around you. It's a real treat. <a href=""https://www.pcgamesn.com/skyrim/mod-combat-overhaul"">Read the rest of the story...</a> RELATED LINKS: <a href=""https://www.pcgamesn.com/skyrim/mod-ui"">The biggest Skyrim mod just got the modern overhaul it deserves</a> <a href=""https://www.pcgamesn.com/the-elder-scrolls-v-skyrim/new-vampire-mod"">Huge new Skyrim mod plunges you into the middle of a vampire war</a> <a href=""https://www.pcgamesn.com/the-elder-scrolls-v-skyrim/skyrim-console-commands-and-cheats"">All Skyrim console commands and cheats</a> ",1728828486,
72850,New Skyrim mod overhauls the aging combat with realistic dismemberment,"<strong>Skyrim</strong>'s combat has not aged well. Weapons and magic are the weakest part of Bethesda's crowning RPG, and after a decade each is more akin to hacking at a tree stump or clapping your hands together. Bethesda did a great job modernizing its shooting mechanics in Fallout 4 and Starfield, but we're still waiting on the team to do the same with Elder Scrolls 6's combat. Until then, this new Skyrim mod does something truly astounding and adds a dense dismemberment system to the game, making fights feel new again. <a href=""https://www.pcgamesn.com/the-elder-scrolls-v-skyrim/mod-dismemberment"">Read the rest of the story...</a> RELATED LINKS: <a href=""https://www.pcgamesn.com/skyrim/mod-combat-overhaul"">New Skyrim mod empowers the weak and spongy NPCs to fight back</a> <a href=""https://www.pcgamesn.com/skyrim/mod-ui"">The biggest Skyrim mod just got the modern overhaul it deserves</a> <a href=""https://www.pcgamesn.com/the-elder-scrolls-v-skyrim/new-vampire-mod"">Huge new Skyrim mod plunges you into the middle of a vampire war</a> ",1728824694,
